id,index,content,proofed
122445,1,尊敬的陆德先生和所有的占有,
122446,2,你们好,
122447,3,啊好了路在想上,
122448,4,这个在咱们群里的我看到这篇文章的说的我正在做一个,
122449,5,听证会上,
122450,6,我正在回答这个律师的问题,
122451,7,关于那个政权呢,
122452,8,被罚款,
122453,9,600人民币再加上181的这个库,
122454,10,股票呢,
122455,11,是781的是我要做证,
122456,12,有关部门那他们现在正在一个关于我们这个事情的一个小组,
122457,13,这个他们要让我做证所以说怎么回事,
122458,14,当我看到这个手机上的受不了我不知道这个包只是到底是二零一七年还是2018,
122459,15,但是我看到了咱们这个群里所有的战友们在激烈的讨论着,
122460,16,有各种,
122461,17,非常非常好的意见,
122462,18,啊而且在这个讨论当中的,
122463,19,我发现了有一些大家对这个报纸当中所说的,
122464,20,所有的这个中国现在,
122465,21,贫富悬殊这个人民日报要解决的问题,
122466,22,也就是杀富济贫吧,
122467,23,所以我说我我当时我是打字的因为我不能说话,
122468,24,后来这个我说算了就直拨一下表达一下我的观点算了,
122469,25,谢谢陆德香给我的机会谢谢,
122470,26,好谢谢路的想让我去,
122471,27,我讲的谈下我的观点,我简单谈一下我的观
122472,28,这个我简单的看一下那个我没有全部看完啊,"KI**


我简单谈一下我的观点，我觉得最重要"
122473,29,我觉得这个里面最重要的事情大家要好好看一下,我觉得最重要的是，大家要看一下，就是法国大革命
122474,30,就是法国大革命,就是法国大革命
122475,31,昨天这个下午的时候弱这个半农先生的他,昨天下午的时候班农先生去了中东
122476,32,刚吃了中东,生去了中东
122477,33,把重中东这个飞机回来直接就到了我这个办公室,班农先生去了中东，从中东飞 机回来之后就直
122478,34,然后我们俩在这讨论的问题那就是法国大革命,之后就直接来到了我的办公室，我们谈论了法国
122479,35,把这个我们俩在法国大革命的问题上取得了高度的一致,办公室，我们谈论了法国大革命，其他的话题我们可能有分歧，但是
122480,36,在很多方面我们俩是有争论的啊,在法国大革命的问题上我们高度一致
122481,37,这个问题我们俩是这个高度一致,致，谈到了沙特最近发生的问题，还有
122482,38,那么谈到了沙特最近发生的问题和中东的问题,致，谈到了沙特最近发生的问题，还有中东的
122483,39,还有一个他刚刚接触到了一些中共的官员,还有他刚刚接触到了一些中共的官员
122484,40,还有一些刚刚,还有一些刚刚
122485,41,从中国回来,从中国回来
122486,42,阿迪欧洲官员何谈到了有关中国的问题,的欧洲官员，和他谈论了有关中国的问题，包
122487,43,包括他们特别的关心,包括他们特别的关心
122488,44,查下最近哪这个马化腾啊,特别的关心，最近马化腾
122489,45,腾讯那,腾讯
122490,46,还有中国的丽富豪来相马云事件呢,，腾讯，中国富豪，马云事件，肖建华
122491,47,包括这个肖建华事件的,包括他们听说的我现在
122492,48,包括他们说听说了现在我不方便讲的中国某某某老板的这个是怎么回事啊,包括他们听说的我现在不方便讲的，中国某某某老板是怎么回事，包括我的很
122493,49,包括我的很多好朋友,包括我的很多好朋友
122494,50,他们听到了在家里发生了什么情况,他们听到了在监狱里发生了什么情况
122495,51,就这些问题上,就这些问题上
122496,52,他们认为现在中国的政治形势,他们认为中国的政治形势，和经济
122497,53,和经济环境,和经济环境
122498,54,和经济未来的走向,和经济环境和未来的
122499,55,喝整个社会的整个环境和当年的法国大革命是一样的,和整个社会的环境和当年法国大革命是一样的，而
122500,56,那么而且他认为现在中共,一样的，而且他们认为中共
122501,57,正在,正在
122502,58,大家觉得法国大革命,在解决着法国大革命
122503,59,以前说出那个问题,以前所存在的问
122504,60,那么他们的问题是,他们的问题是
122505,61,中国会不会发生相当时的,中国会不会发生像法国大革
122506,62,教法国大革命的时间我给他们的回答是不会的,像法国大革命的事件，我给他们的回答是不会的
122507,63,我说你们理解法国大革命了,我说你们理解法国大革命的
122508,64,你们的理解的角度和事实是不一样的,你们理解法国大革命的角度和事实是
122509,65,我但是我要告诉你,但是我要告诉你
122510,66,你的结果,你们结果
122511,67,比法国大革命,比法国大革命
122512,68,来的还要快,来的还要快
122513,69,阿来的,来的
122514,70,结果了还有彻底,结果还要彻底
122515,71,为什么,个（人民
122516,72,今天我看到你们这个,今天我正在参
122517,73,我在正在听都会让我看你们的群里讲这事我就一下子就来感觉了因为昨天回来讨论了半天,我正在参加听证会，看你们群里正在讲这个（人民日报内容）我一下就来感觉了，因为昨天讨论了半天，就
122518,74,就是从法国大革命的讨论的我昨天给了几个人的伴奏先生在纸上我画了这个两张图,"就是从法国大革命讨论的。

昨天我给班农和几个人画了两张图，我说你看看，我们今天的形势，和"
122519,75,和,和
122520,76,我说你看了这两张图啊我们,我说你看看，我们今天的形势，和法
122521,77,今天中国的形式,今天的形势，和法国
122522,78,和法国大革命知那个时期的有什么不同,和法国大革命的时期有什么不同
122523,79,无论你看看要你要好好看一下托克维尔讲的话,我说你看看，我们今天的形势，和法国大
122524,80,法国的旧制度与大革命,的法国旧制度与大革命
122525,81,那是这里不是喝酒不同是什么呢当时法国大革命的时候法国制,革命，这里的核心不同是什么呢？当时法国大革命的时候，法国
122526,82,经过了这个人类上的求发展的,经过了人类地球发展的，从封建
122527,83,话从这个封建社会,么呢？当时法国大革命的时候
122528,84,打倒资本主义社会,到资本主义，到民主
122529,85,到然后那个到了这个民主主义社会的,到民主主义社会的，他有几个过程
122530,86,他有几个过程,他有几个过程
122531,87,如果我们这个中国的共产党ccp,个过程，那么我们中国共产党CCP
122532,88,看没有到这个过程,有到了这个过程
122533,89,他给人们许多了一个虚假的未来就是叫乌托邦共产主义,他给人民许诺了一个虚假的未来，就是乌托邦，共产主义
122534,90,今天资本主义这个过程他没有,今天资本主义的过程他还没有
122535,91,他直接就跨到了人类的千年以后了到了这个也就是乌托邦共产主义,他还没有，直接跨到了人类千年以后，也就是乌托邦，共产主
122536,92,那么这两个制度的这个,那么这个制度的真正
122537,93,真正的,真正的
122538,94,统治者,统治者
122539,95,和这两个制度的拥有者可以这么说,者，和两个制度的拥有者，完全是
122540,96,玩转世博,完全是不
122541,97,我说当然是法国大革命是严那个制度还有那个黄泉特别是当时那景,完全是不同的，当时法国大革命时沿着制度，皇权，特别是当时几个元老
122542,98,几个钟元老会呀,几个元老会，他
122543,99,他是1%的人拥有了法国百分之,他是百分之一的人，拥有法国百
122544,100,99财富,财富
122545,101,而且还不拿说,而且还不纳税
122546,102,把那就是富贵阶层分了三个阶层,"那就是富贵阶层。

（法国）分了三个结"
122547,103,阿宗教阶层,宗教阶层
122548,104,什么文人阶层的什么贵族阶层的,什么文人阶层，贵族阶层。我说我们
122549,105,我说我们中国现在是社会制度是什么,我说我们中国呢？他是抢来的权利，没
122550,106,来自权利,来的权利
122551,107,他没有像法国的一样,利，没有像法国那样
122552,108,是按照人类的发展文明发展到了那个阶段了,那样，按照人类文明的发展，到了那个阶段了，他必
122553,109,他必须要面对的社会必须要解决问题,他必须面对社会要解决的问题——贫富
122554,110,那就小贫富悬殊,要解决的问题——贫富悬殊
122555,111,贫富悬殊是一个,贫富悬殊是一个
122556,112,真正的在表面上要面对的问题,真正表面上要面对的问题，但
122557,113,根本问题还是要解决制度的问题,根本还是制度问题，说白了，就
122558,114,那就是说白了人类文明已经发展到了一个以人为本,问题，说白了，就是人类文明已经发展到了以人为本，已
122559,115,阿姨手上了一个工业文明时代,本，已走向工业文明时代
122560,116,从过去的,从过去
122561,117,小状元小庄主和地主,小庄园，小庄主，地主，这
122562,118,和那个胆生的这种积极性,，这种阶级性，整个社
122563,119,大整个社会上的这种阶级制度,地主，这种阶级性，整个社会的
122564,120,他必须被打破否则人类无法面对,度，必须被打破，否则人类无法面对即
122565,121,即将到来黑的,即将到来和已
122566,122,已经到来的工业文明,已经到来的工业文明
122567,123,得了工业革命也是人类的最伟大的的时代之一,的工业文明，工业革命，也是人类历史上最伟大的
122568,124,这个时候,这个时候
122569,125,大家挑战的不仅仅是贫富悬殊那个舒适应法国社会的这个经济跟他们都是非常,大家挑战的不仅仅是贫富悬殊，那个时候其实法国的经济非常好，是那个制度，百分
122570,126,养好的是那个制度1%的人99个月的事情,更重要的是，挑战你的封建制度，你的
122571,127,这挑战你的封建制度是王犬,重要的是，挑战你的封建制度，你
122572,128,来迎接人类的文明,来迎接人类的文明
122573,129,那我们今天中国人面对的不是这样子的,的文明，但我们中国面对的不是这样
122574,130,我们面对的是一个卡,我们面对的是一个
122575,131,想到他根本没有经过所谓的,强盗，根本没有所谓的
122576,132,这个人类的必需的制度的发展,的人类的必经的发展，形成了
122577,133,形成的自然社会环境,形成了自然社会环境
122578,134,中国现在没有阶级,中国现在没有阶级
122579,135,只有一个岛哪有什么阶级,只有一个党，他哪里有什么阶
122580,136,中国人心态最强副总统彭斯讲的,中国人现在只有两个层次，一个就是
122581,137,中国人现在只有两个就两个层次,中国人现在只有两个层次，一个就
122582,138,那叫什么一个就是黄的,哪里有什么阶级啊？就像
122583,139,现在就是中央的几个领导啊,现在只有一个党，他哪里有什
122584,140,芝麻鸡类型脸型,必经的发展，形
122585,141,这弄剩下全身无力,展，形成了自然社会环
122586,142,根本不存在阶级,成了自然社会环境
122587,143,今天这个老百姓误解为中国现在有什么中产阶级,经的发展，形成了自然社会环境，中国现在没有阶级
122588,144,还有这个私人企业家你的都是胡说过道的那是啊不是胡说八道,中国现在没有阶级。中国现在只有一个党，他哪里有什
122589,145,中国所有的私人企业主的基本特征根本没有,中国现在只有一个党，他哪里有什么阶
122590,146,私人企业主的首先,个层次，一个就是皇
122591,147,私人财产不,下全是努
122592,148,对受到保护,都是胡说九道
122593,149,不是还有一个没有权,没有。私人企业主首先
122594,150,他就私人财产中国从来没有,私人财产拥有权，中国从来没
122595,151,武力都是国家都是党的,有，连土地都是党的。法国
122596,152,法国大革命的是什么法国已经把土地和国家,的。法国大革命时什么，法国已经把土地和国家
122597,153,柯克里斯傻他日,分开了，还
122598,154,分开了,分开了
122599,155,还有教会,还有教会
122600,156,所以他这个资产的划分和积极性,会。他们资产的划分和阶级性
122601,157,他是事实存在,是事实存在
122602,158,法律上在,法律上
122603,159,法律本性上是存在的,法律上本性上是存在的
122604,160,那个导致法国大革命,能导致法国大革命
122605,161,我说这个饭桶先生你们俩还有美国才能不能几位朋友,我说班农先生，还有几位美国财政部的朋友，你们觉得中国
122606,162,你们觉得中国家有这个他没有,你们觉得中国有这些吗？他们说
122607,163,无论课本,友，你们
122608,164,市场不同那是一个人类文明到来必须将打破的封建制度,上的不同，那是一个人类文明即将到来必须打破的封建制度
122609,165,和阶级存在的那个矛盾性导致的贫富悬殊最后,和阶级存在的矛盾，导致的贫富悬殊，最终利
122610,166,利用贫富解决贫富悬殊最终改变的是这种,利用贫富解决贫富悬殊，最终改变的是制
122611,167,我今天中国过来打恰恰相反,制度。今天共产党恰恰相反
122612,168,他要保持的是共产党的那个统治制度,他要保持共产党统治制度，那能一
122613,169,这怎么可能一样的他说有道理,制度，那能一样吗？他们说这有道理
122614,170,是啊这是有道理吧,"说这有道理！

他（报"
122615,171,这个群里刚才大家讲说这个挑战屏幕传输他挑战贫富悬殊解决,"制度，那能一样吗？他们说这有道理！

他（报纸）说挑战贫富悬殊，解决贫富"
122616,172,听不清楚是共产党到底国家这个权利,天就说的话，从城市开始搞革命，最
122617,173,统治中国70年前就说的话,统治中国七十年，第一天就说
122618,174,中盛日,中国七
122619,175,啊开始搞革命,开始搞革命
122620,176,最后城市不行了最后是搞什么农村包围城市,最后城市不行了，搞农村包围城市，推翻地主
122621,177,推翻的鲁大家都有说地主的女儿都会身体乳的老婆大家都城地主了,推翻地主，大家都可以睡地主的女儿老婆，大家都成地主，最后全中国的地
122622,178,最后是全中国的帝都不一个人了都会这么大,最后全中国的地都归一个党了，那么今天
122623,179,那么今天过来哪有解决贫富悬殊的手相,那么今天共产党要解决贫富悬殊，他不去解决制
122624,180,不去解决这个问题,不去解决制度问
122625,181,都不解决这个财富的属性问题怎么可能平复整数,度问题，不解决财富的属性问题，怎么可能解决贫富
122626,182,所以我昨天的那个美国的几位朋友她有半农先生问你去想一想,所以昨天我跟美国几位朋友还有班农先生，我说你们想想
122627,183,现在我说我给你们举个例子是比较粗鲁的但是这个大的好记录,现在给你们举的例子比较粗鲁，大家都好记，我这个文明
122628,184,我说的文明成都听太多了,我这个文明词听太多了
122629,185,我是很简单,我说很简单
122630,186,日本,一帮
122631,187,强盗把你家财富给抢走了,强盗把你家财富抢走了，结
122632,188,结果你的其他哥哥兄弟姐妹拿着多了一点,结果你的其他各个姐妹拿的多了一点，现在
122633,189,现在强盗来了说爱对不起啊,现在强盗来了说对不起
122634,190,这个且这个钱分的不公,这个钱我分的不公
122635,191,我要重新,我要重新
122636,192,重新分配,重新分
122637,193,我带着你不要忘了这个本子,。但是你不要忘了，这个本质
122638,194,给你分配财富的人他就是到你家来抢劫的人,给你分配的财富的人，就是来你家抢劫的人
122639,195,而且对你家人,而且对你家的
122640,196,才不有绝对支配权,财富具有绝对支配权
122641,197,我请问你们这个才这个强盗,我请问强盗分配你财富的时候
122642,198,来分配你财富的时候他会公平吗,盗分配你财富的时候会公平吗
122643,199,儿子你的才不是这个属性它是属于人民和社会因个人的吗不是的,而且这个财富的属性，他会属于社会属于人民个人的吗？不是的。你和
122644,200,无论你在跟墙倒塌,你和强盗谈贫
122645,201,谈这个,唐吗
122646,202,军情妇,谈贫富
122647,203,这个解决这个分配的问题你不慌他不爱都有道理,"解决分配的问题，这不荒唐吗？

中国人民被"
122648,204,我中国人你就是一个被抢劫了被共产党这几个流氓,"问题，这不荒唐吗？

中国人民被共产党的几个流氓，说来"
122649,205,说来说就有几个流氓,说来说去就是这几个流氓
122650,206,利用来所谓的贫富悬殊,利用贫富悬殊，我为什
122651,207,利用皮肤下注为什么我要说这个问题6得先生,利用贫富悬殊，我为什么要说这个问题，路德先生，你
122652,208,你要记住这个我的关键你们其中一个是共产党,"你要记住我的观点里面就是：

一，共产党强烈"
122653,209,强烈的利用了阶级矛盾它不存在阶级然后自己只有一集没有接,强烈的利用了阶级矛盾，他不存在阶级，然后变成了只有一级，而没有阶级
122654,210,第2个参数,阶级，然后
122655,211,不是这个价的引进人类的文明现在信息时代,不是迎接人类文明，并没有迎接信息时代
122656,212,他娘的这个工业文明时代他竟然说万人类文明的三个观点是,"他现在是反人类文明。

第三个观点，今天共产党分配解决"
122657,213,大家不要忘了,差距，今天导致了
122658,214,今天共产党的分配所谓的,今天导致了绝对的贫富悬
122659,215,解决贫富悬殊但是放狗屁他的骗你,解决贫富悬殊的真正目的是什
122660,216,他中的一点就解决贫富悬殊今天导致了绝对的贫富悬殊真正的目的是什么,天导致了绝对的贫富悬殊。解决贫富悬殊的真正目的是什么？他所谓的解
122661,217,会所为了解决屏幕全都是为了你越多你,么？他所谓的解决贫富悬殊，是为了掠夺所有的资产
122662,218,所有的资产他把全书问题变成他绝对控制,所有的资产，把悬殊问题变成绝对控制
122663,219,这是他的真心目的,这是他的真心目的
122664,220,所以本质上的四个问题,所以本质上，你不面对
122665,221,你不去面对制度的问题就是,你不面对制度问题，不是一个
122666,222,不是一个公平的分配制度,不是一个公平的分配制度
122667,223,可大家都绝大多数人接受的分配的人,度，和大家都绝对接受的分配的人，你
122668,224,你想来搞贫富悬殊来分屏映射,你想搞解决贫富悬殊来分配利益，那绝
122669,225,那绝对是胡说八道的这是谎言,那绝对是胡说八道，这是谎言
122670,226,这是再一次的乌托邦黄艳,这是在一次的乌托邦谎言
122671,227,那么另外一个我要给大家说的非常关键的问题,"言。

另外一个，我要给大家说的非常关键的问题"
122672,228,今天的共产党所谓的贫富解决贫富悬殊,今天的共产党，所谓的解决贫富悬殊
122673,229,他事业解决了他面临了两个核心的问题,他是为了解决他所面临的两个核心问题
122674,230,核心的问题就是什么世界的人类文明到了,核心问题。世界的人类文明，到了以人为本
122675,231,以人为本,以人为本
122676,232,大信息和科技的事,信息和科技的时
122677,233,什么都讲究真,什么都讲究真
122678,234,啊什么都讲究尊重,什么都讲究真，尊
122679,235,讲究法讲究自然,讲究真，尊重，法，自然
122680,236,站在地球的角度来考虑人类不要污染,站在地球的角度来考虑人类，不要污染
122681,237,不要环境污染,不要环境污染
122682,238,要信仰宗教自由,要信仰宗教自由
122683,239,让人们有选择的自由,让人们有选择的自由
122684,240,共产党今天要达到什么让中国14亿人民闭上眼睛,共产党要达到的是什么？中国十四亿人民要闭上眼睛
122685,241,不要面对这个伟大的人类文明的科技时代和信息时代那就不能了解真相,不要面临这个伟大的信息时代，科技时代，就不能了解真相，不能站在
122686,242,不能站在地球角度谈问题,不能站在地球角度谈问题
122687,243,你必须跪在,你必须跪在
122688,244,一上来一样试着共产党,跪在地上，仰视共产党
122689,245,来看问题,来看问题
122690,246,这是本质不同人的地球外卖发展与后人类宗教信仰就把高科技文明,"这是本质不同。

人家都从地球外面，发展宇宙宗教信仰去了，搞科技文明"
122691,247,现在搞YY搞全球这个这个卫星WiFi,信仰去了，搞科技文明，搞卫星wifi
122692,248,工业时代,公司，根
122693,249,那就像那个石头他夹几位美国朋友从沙特回来说是沙子都是个大公司但是根本不,时代。就像班农几位朋友从沙特回来，说沙特就是个大公司，根本不是一个国家，所
122694,250,非常的做出那么荒唐的事情,说能做出这么荒唐的事情
122695,251,在够来拿了他是一个经营了比较成熟的公司,共产党是一个比较成熟的公司，也不是个国家
122696,252,也不是个国家他说过来拿杀人最起码到法国家沙,也不是个国家，人家杀人最起码到法国杀人，让你自杀
122697,253,就你自杀死,你自杀死
122698,254,这个山头是用那个电锯给你去了太粗鲁了他但是,国杀人，让你自杀死，沙特使用电锯给你据了，太粗鲁
122699,255,本质都是一样的,本质都是一样的
122700,256,都是矩阵人类文明都是拒绝,都是拒绝人类文明，拒绝对人的尊
122701,257,对人的尊重,对人的尊重
122702,258,追这两个角度你可以看他让人跪下来养殖了他听他的,以这两个角度你可以看，它让人跪下来，仰视，听它的，和
122703,259,和人类整个人类文明再迎接到现在了,和人类整个文明，在迎接现在真正的
122704,260,真正的信息时代生活时代,真正的信息时代，生物时代
122705,261,通信时代,通讯时代
122706,262,人类所有属性和享受着现在的文明这两个是不同的,人类现在俯视和享受着现代的文明，这两个是不同的
122707,263,这个问题的本质就是制度的问题,质就是制度问题，和人的问题
122708,264,恨人的问题,和人的问题
122709,265,人民日报那个简直是荒唐,人民日报今天的文章简直荒
122710,266,真是荒唐事大吉,简直荒唐至极
122711,267,你简直是疯狂自己啊,极，疯狂至极，你说现在
122712,268,你说这个现在什么时候你还在,你说现在什么时候了，还说个体
122713,269,说那个,说个
122714,270,个体户私人企业上来,个体户，私人企业影
122715,271,影响人民的安全他们能是你这个皮肤宣是跟远吗,影响人们的安全。他们能是你贫富悬殊的根源吗
122716,272,大家想一想,大家想想
122717,273,中国过去30年的改革开放,中央领导人的讲话
122718,274,去看了邓小平的讲话看到任何一个重要领导人的讲话,看看邓小平的讲话，看看任何一个中央领导人的讲话，本
122719,275,大家看着你们的本质是什么,导人的讲话，本质是什么
122720,276,中国的过去申请,中国的私人企业主
122721,277,给中国过去30年的改革提供了将近60%的,给过去中国的三十年的改革提供了奖金
122722,278,就业率,就业率
122723,279,70%的,70的
122724,280,财富,财富
122725,281,特别是海外财富,特别是海外财富
122726,282,到现在,"富。

现在"
122727,283,结果导出为什么私营企业主,党说什么？私人企业主，影
122728,284,影响了,影响了
122729,285,这个人民的贫富悬如这简直是个天下最大的骗子,主，影响了人民的贫富，简直是天下最大的骗子
122730,286,你这个话的人他就是愚蠢自己,"任何相信这个都愚蠢至极。

街"
122731,287,中国大街上现在卖的跟老伯就最信息相关的东西,"这个都愚蠢至极。

街上卖老百姓的最息息相关的东"
122732,288,生活,生活
122733,289,超市,超市
122734,290,余姚最好的诠释孙奇不是国营企业,疗，最好的全是私人企业，不是国营企
122735,291,无论企业全是垄断和不科学的就要中国的油价,营企业全是垄断和剥削，就像中国油价
122736,292,把从过去的110美金我曾经参与过,从过去的一百一十美金，我曾经参与过
122737,293,大概几十个合作的签署,大概几十个合同的签署
122738,294,把110美金签的合同钱买油,美金，我曾经参与过大概几
122739,295,到最后变成40米进来由中国的优点1至11上上,到最后四十美金买油，中国的油价一直持续上升
122740,296,什么问题呀,什么问题
122741,297,因为被另写几个家族几个官僚和共产党的制度给剥削了,什么问题？因为被几个家族几个官僚和共产党的制度剥削了。
122742,298,老百姓的干上身上都查了管子,老百姓的肝上，肾上都插了管
122743,299,拉住你的经济拉住你的血脉,拉走你的经期血脉，这个不解
