id,index,content,proofed
145337,297,说着这一个人就是这六件,黑，然后黑配金，是这么做
145338,298,其他人都是一件,漂亮！时间
145339,299,这样的话就这次20万件,绝对值得大家收藏，战
145340,300,现在的使用的那个臭的,系好的跟上次发帽子渠
145341,301,臭的啊嘿嘿嘿,中的，还是
145342,302,白配黑,外的跟
145343,303,然后黑皮筋,然后呢国外
145344,304,是这么做的真漂亮真漂亮,后呢国外的跟Sara联系，或直接跟我
145345,305,时间是很慢很弱但是绝对值得大家收藏散装真棒,是用那个同路的，还是那几个人，大家要知道。然后呢国外的跟S
145346,306,这是过站桩,中的，还是用那
145347,307,说现在所有要站桩的战友们那大陆的,大家要知道。然后呢国外的跟Sara联系，或直
145348,308,跟我这个联系好了上次发帽子渠道,跟我联系好不好？或直接跟我联
145349,309,一如既往一如既往打不开不玩那个空中玩这个还是用,"以了。


（跟网友互动）什么叫开不了口啊？你拿我当外人就"
145350,310,那个那个那个同住的还是那几个人,什么？你们见到郭战装的本面
145351,311,大家知道,啊！）对啊！这又
145352,312,然后呢国外的,到郭战装的
145353,313,跟他联系或直接跟我联系好不好,的本面貌，比帽子高多少倍，很厉害
145354,314,和直接联系,少倍，很厉害
145355,315,早上就可以了,子高多少倍，很
145356,316,什么叫东西8088什么是开不了口啊你拿我当外人就开不了口袋,什么？你们见到郭战装的本面貌，比帽子高多少倍，很厉害
145357,317,121期中我对呀,装的本面
145358,318,这又不是什么,这又不是什么
145359,319,这个是你们见了过站桩的本面貌,这又不是什么？你们见到郭战装的本面
145360,320,阿帕比帽子高多少很多倍,貌，比帽子高多少倍，很
145361,321,很厉害,很厉害
145362,322,这个我身上穿的这个repo win,这个人个了不得。Rick Owens 呢常
145363,323,这个人了不得,这个人个了不
145364,324,Michael wiener常驻巴黎,了不得。Rick Owens 呢常驻巴黎
145365,325,一共设计设计团的六个人每一件衣服他自己设计,一共6个人，每一件都他自己设计。他在意大利的一座山
145366,326,他的意大利有在一个山上有一个他厂的,他在意大利的一座山上有厂子，本来
145367,327,本来是他给我们生产这个厂子纸盒给breakaway生产,本来是他给我们生产的。这个厂子只给Rick Owens 生产
145368,328,大家看看我这个衣服你看了,大家看看啊，我这个衣服，他这
145369,329,他这个书生,他这个收身
145370,330,刚才看到了吧,家看看啊，我这
145371,331,这个地方你看我给你讲了,这个地方我给剪了，他原来
145372,332,我给假了看了没有,我给剪了，他原来
145373,333,原来是,原来都是
145374,334,人家都是模特身穿了吧,原来都是模特身穿的，100%
145375,335,100% 70分的,100%贴身的
145376,336,这是那个是加棉的这个料的是他的研究出来的,这个料子丝加棉的，他研究出来的。那么呢，我一
145377,337,那么那我1点我如果买了时间,那么呢，我一剪，我买了10件，一件是30
145378,338,一键是3000美金把这样的剑,一件是3000美金吧这样的
145379,339,如果是棉的大概在800美金3000美金见我买了时间就咖啡碱为运动输出来,如果是棉的大概在800美金，3000美金一件我买了10件我就咔嚓一剪，我运动时候
145380,340,结果呢driver先生看到我讲了突然天我去处他给我,结果呢，RickOwens先生看到我剪了，头两天我去的时
145381,341,做短款了我做了一堆个人那个国家我给你做的短会然后呢,做了一堆短款的，搁在那。他说：“郭先生，我给你做的短款
145382,342,不然你们看我穿那个高领的Power沙太漂亮年的,，你们会看到我穿高领的Polo衫，，啊呀，太漂亮了
145383,343,他因为他看到我穿的我自己定制的,他因为看到我，我自己定制的polo衫
145384,344,Person recognition去哪看到他为了我转了半天没了半天说一句话你说,polo衫，RickOwen先生去年看到的，围着我看了半天，摸了半天，一句话也没说，回去
145385,345,回去做给我做了一些东西,回去就给我做了那些东西
145386,346,哎哟哦特别把我买了10件,哎呦，特别棒，我买了10件
145387,347,但是大很贵都是大概1500 1800一家,但是那很贵，都是在大概1500-1800
145388,348,你想美美金价而且只有我有,美元）一件。而且只有我有
145389,349,我就问他我让你给我在我们加工加工,我就问他，你给我战友们加工加工，最
145390,350,最便宜的多少钱一条最便宜的是我成本就300个美金,最便宜的多少钱一件？他说最便宜我成本就300多一
145391,351,不让爱马仕,像爱马仕
145392,352,40倍加1万前加40他说我这个就是小小说法儿见不搞的,本，1块钱加40倍。他说我这个就是小作坊，而且不搞大
145393,353,他的这些款的我们都可以用,他的这些款我们都可以用
145394,354,但是拿这个成本了太高了太高了,但是成本太高了，太高了。你说花个
145395,355,What what你说,问题。但是你说
145396,356,花个几千万美元给给张勇的没问题一夜80000美元也没问题,花个几千万美元给战友们没问题，一人8万美元也没问题
145397,357,当你说你要了解一下抱歉啊,太高了。你说花个几千万美元给战友
145398,358,说什么穿那么贵炫富炫啊啊啊我正在干啥,说花个几千万美元给战友们
145399,359,我昨天我跟我律师的极楼律师让我这个最近不喝酒了串时候出去出来多了会我保健医生,"问题。但是你说每人要给1亿美元2亿美元，我真做不到。抱歉啊！


（回应网友）我什么穿那么贵"
145400,360,我日你看,我昨天
145401,361,我每天工作16到18小时,啥？我昨天跟我律师都急
145402,362,酒不让我喝烟不让我抽又不去夜总会也不上哪也不按摩,回应网友）我什么穿那么贵炫富？炫啥富啊！我这算啥？我昨
145403,363,穿的衣服你们现在好打我,穿那么贵炫富？炫啥富啊！我这
145404,364,最晚那晚我说让我活得干嘛我是说他们不高兴,"到。抱歉啊！


（回应网友）我什么穿那么贵炫"
145405,365,所以说,算啥？我
145406,366,亲爱的我今天大家回报倍数,去吃太多了，又派给我保健医生
145407,367,过战俘过淡妆还有一个就是,不去夜总会，也不桑拿，也不按摩，就穿
145408,368,国内用的担心我不会被欺负,夜总会，也不桑拿，也不按摩，就
145409,369,请在什么放心文贵绝对不是他们想象中的披着羊皮的狼啊,去夜总会，也不桑拿，也不按摩，就穿点衣服，你们现在好家伙，这也管那
145410,370,装神弄鬼为君子来干坏事了肯定不是事实证明,总会，也不桑拿，也不按摩，就穿点衣服，你们现在好家伙，这也管
145411,371,但闻不也绝对不是披着狼皮的羊那么懦弱叫你吓唬我就把皮,"们也不高兴了，哈哈。


所以说，亲爱的战友们，我今天向大家汇"
145412,372,我给你讲一下随便你吃那是不可能的,友们放心。文贵绝对不是他们想象
145413,373,文慧就是来面,文贵绝对不是他们
145414,374,灭共,们放
145415,375,灭到我嘴了,们担心我
145416,376,记住我的话战友们,家汇报，郭战服、郭战
145417,377,一切都非常好请你们不要担心,以说，亲爱的战友们，我今天向大
145418,378,昨天和前天你们那些那些信息我都收到了,友们放心。文贵绝对不是他们想象中的
145419,379,有些话我给你的回来我一下我们比我怕没法回好不好,贵也绝不是披着狼皮的羊，那么懦弱，叫你一吓唬
145420,380,我在这再说一遍,那么懦弱，叫你一吓唬
145421,381,国内的战友们一切安全第1,国贼来了。战友们，文贵一
145422,382,你们任何证据,是不可能的！文贵
145423,383,都是徒劳的没有任何差异那就根本不配跟文伟大概有,盗国贼来了。战友们，文贵一切都非常好，请你们不
145424,384,你的自己都保护不了怎么保护别人了,到了。有些话我给你们回了，有些
145425,385,保护好自己好不好不要做傻事,好不好？我在这再说一遍。国
145426,386,更不要和任何地方,跟文贵当战
145427,387,他们,么能
145428,388,那一阵的李白,那一阵营里
145429,389,兔子这个老鼠拿手榴弹,里边，老鼠拿手榴弹
145430,390,在我里面搞恐怖但早晚一天炸死自己的脏的生日我的收手了一个就不就炸了,在窝里边搞恐怖，但早晚一天会炸死自己，因为早晚得松手啊！松手那一刻“叭” 就炸了
145431,391,你别去惹他就你这个干吗,你别惹他去，你惹他干嘛？他手
145432,392,首蛋法的两下地干吗了别这样好吧骗子战友们,"手上的手榴弹砸你去啊？别这样好吧？


亲爱的战友们"
145433,393,祝你们一切顺利家人平安,祝你们一切顺利家人平安
145434,394,我们在市委,我们在此为
145435,395,所有员工14余人民,所有员工十四亿人民
145436,396,祈祷有信仰自由中叫的空间,祈祷有信仰自由、宗教的空间
145437,397,让大家都平安,让大家都平安
145438,398,战友们,战友们
145439,399,文贵以生命一切,文贵以生命并一
145440,400,向上天保证祝福,向上天保证，祝福
145441,401,所有的战友的家人,所有的战友们家人
145442,402,多一份安全多一份,多一份安全多一份
145443,403,欢喜与乐,欢喜愉悦
145444,404,远离,远离
145445,405,假日,假恶
145446,406,清境真善,亲近真善
145447,407,孝敬老人疼爱妻儿子女兄弟姐妹,孝敬老人，疼爱妻儿子女兄弟姐妹
145448,408,一切都是刚刚开始千山语谢谢,一切都是刚刚开始！亲爱的战友
