id,index,content,proofed
145041,1,尊敬的战友们好,尊敬的战友们好
145042,2,因为见识了吗,们健身了吗
145043,3,今天是8月16号,今天是8月16号
145044,4,温胃健身报平安直播,文贵健身报平安直播
145045,5,千万别忘了健身的别忘了锻炼了,千万别忘了健身呐， 别忘了锻
145046,6,我的每天,儿每天
145047,7,累得半死了但还是得锻炼不锻炼不行不在那么也不做,累得半死的， 但还是得锻炼， 不锻炼不行， 不锻炼不
145048,8,别傻了啊战友们不锻炼可了不的你们的健身了吗,底傻了。 战友们， 不锻炼可了不滴啊！ 你们都健身了吗
145049,9,二战有啊凡人起来了,的战友们， 今天
145050,10,贝克汉来了,健身了吗
145051,11,2017,月1
145052,12,945,（
145053,13,先生了有睡觉了,健身了吗？ 啊战友们
145054,14,42巴巴,不滴啊
145055,15,安徽1197太好太好太好了亲爱的战友吗,"名字）


亲爱的战友们， 今天是8月16号"
145056,16,今天8月16号啊,今天是8月16号
145057,17,这个,战
145058,18,文文献大家报平安直播祝所有的战友们家人平安身体健康,文贵向大家报平安直播。 祝所有的战友们家人平安， 身体健康
145059,19,哎呀昨天跟你们,康。 昨天给你们
145060,20,一是那个不跟你们聊了半天打不开,以试网络的为名跟你们聊了半天
145061,21,考完以后出来,侃完了以后出来， 
145062,22,他那没有一个说话语音谁都不说不支持,团队没有一个说话的， 谁都不说， 不吱声
145063,23,看了笑啊,看我笑
145064,24,你辛苦了过夜,您辛苦了， 郭
145065,25,你非常辛苦啊,你非常辛苦啊
145066,26,然后呢回到无效安全屋的歌然后发现我的手机全部给拿走了,然后呢， 回到我们的小安全屋的时候， 发现我的手机全部给拿走
145067,27,一个人没了,一个也没了
145068,28,但是我现在不错睡了大概四个小时,但是昨晚睡得还不错， 睡了大概4个多小时
145069,29,然后呢这个,然后呢， 起
145070,30,起来跟这个,起来跟我的
145071,31,我的鸡鸡呀通了大概两个小时的,我的基金通了大概2个小时的Fa
145072,32,FaceTime,FaceTime
145073,33,这个不同的人不同的地方,这个不同的人， 不同的地方
145074,34,所有的时候都不见你太累了你要休息好,所有人都说， 郭先生你太累了， 你要休
145075,35,但是我说现在大敌当前了,但是我说现在大敌当前
145076,36,怎么休息才好啊,怎么休息得了啊
145077,37,不能休息呀,不能休息啊
145078,38,我是有课间10分钟课间10分钟吧这孩子在上课便上盖好别上了久违了几个,为啥我要直播呢？ 昨天晚上， 这个咱们国内的另外一个大群里边很多战友加
145079,39,这是什么家华家辉家辉,这个今天还是直播直
145080,40,是28号来自吉林的森林将是吧,密语音告诉我希望我这个今天还是直播
145081,41,好好好好,好， 然后还
145082,42,郭先生好啊机器猫机器猫机器猫,昨天直播他没看见， 然后呢昨天
145083,43,我简单地说啊这个今天报平安为啥我这只不过呢,我希望我这个今天还是直播直播。因为昨天直播他没看见
145084,44,昨天晚上这个,昨天直播他没看
145085,45,咱们国内的另外一个大群里面,到你们来了， 我就不念你们的名
145086,46,很多战友加密语音告诉我,"友留言）


亲爱的战友们， 我"
145087,47,这个希望我这个今天还是直播直播因为昨天直播都没看见,真的很生气， 你们傻乎乎地给人家乱捐钱。 你捐1美金也好
145088,48,然后再说的直播的效果也不好,你们傻乎乎地给人家乱捐
145089,49,法老海上直播直播,很生气， 你们傻乎
145090,50,我看到一个来了啊我看了你打了我就不见你赢了了啊怎么就不见了,乎乎地给人家乱捐钱。 你捐1美金也好， 10 美金， 50美金…… 你去
145091,51,1974 2,10 美金， 5
145092,52,好多人都是个人联播联中很多人背后谢谢非常感谢兄弟姐妹们,乎地给人家乱捐钱。 你捐1美金也好， 10 美金， 50美金…… 你去想想， 这些人他能跟你伸
145093,53,老乡老乡啊老花小花小花小花老乡老乡,手要钱， 他拿你的钱去干啥了？ 拿完你的钱就骂你这个傻瓜
145094,54,给你把部分好给你妈问好好小孩啊,何频啊， 唐柏桥， 夏业良啊， 是
145095,55,放心这个放心老乡,傻瓜。 你问问， 你给他捐
145096,56,不会让他失望的啊,那个李红款啊，韦屎啊
145097,57,交给我然后再弄明白啊,， 他还记得你给他捐过钱吗
145098,58,树上,捐过
145099,59,有明镜,一样， 家
145100,60,世上本无物,屎啊， 屎诺啊……你问
145101,61,明镜亦非台,还记得你给他
145102,62,就是,就像
145103,63,就是吧,就像
145104,64,文贵先生真帅,韦屎啊， 屎诺啊……你问问
145105,65,那可不是真跌,红款啊，韦屎
145106,66,我一点都不帅,韦屎啊， 屎诺啊
145107,67,一点都不帅呀,乱伦彪啊， 还有
145108,68,你看我帅我就喝咖啡了,屎诺啊……你问问他， 他还记得
145109,69,但是我咖啡我不想你们不要打叉,伦彪啊， 还有那个李红款啊，韦
145110,70,亲爱的战友们,啊， 屎诺啊……你问
145111,71,我真的很生你们请你们傻呼呼的准备乱捐钱,还有那个李红款啊，韦屎啊， 屎诺啊……你问问他， 他还记得你给他捐过钱
145112,72,你可以叫你美好时每斤50美金,袋子一袋子的钱， 从不记得任何人
145113,73,你去想一想这些人看能给你伸手要钱他拿你钱去干啥去,那个贪官一样， 家里边一袋子一袋子的钱， 从不记得任何人给他送
145114,74,拿问一下你吗你个傻瓜,那个贪官一样， 家里
145115,75,你问问你有专过小有本事你个明镜何频呢,你问问他， 他还记得你给他捐过钱吗？ 就像那个贪
145116,76,唐柏桥夏业良啊,贪官一样， 家里边
145117,77,是不是啊乱*彪啊,就像那个贪官
145118,78,李洪宽啊为什啊行了你,李红款啊，韦屎啊， 屎诺
145119,79,你问问他,你问问他
145120,80,他记得你了赚过钱吗,得你给他捐过钱吗
145121,81,就下的贪官一样嫁给了意大利贷的钱从不计的,就像那个贪官一样， 家里边一袋子一袋子的
145122,82,不记得任何人给你送的,不记得任何人给他送
145123,83,大概觉得气的谁没给他送,但是他绝对记得谁没给他送
145124,84,所以呢昨天占有啊,所以呢昨天战友
145125,85,就是这个说啊,就说这个家
145126,86,说这个家人可不高兴说谁都敢欺负我这个国家人都敢欺负,说这个家里人特别不高兴，说谁都敢欺负郭先生，都敢欺负
145127,87,他就看了过期过过苏老师,他们就看着欺负郭叔老实
145128,88,我今天的一条啊,我今天第一条啊
145129,89,正是少了你现在可以直播昨天直播直播我形象这么差这个太坏了还有,政事小哥你现在可以直播，昨天直播我形象那么差，这个太坏了，还有这
145130,90,还有这个路德,还有这个路德
145131,91,你咋这么年轻在欺负我们就试试吧,年轻呗，欺负我呗就是，是吧？今天这
145132,92,今天的题目咱们统一一下啊统一下,今天这个题目咱们统一一下啊，统一一下
145133,93,就是我刚才要说题目,就是我刚才要说的题目
145134,94,就是昨天,就是昨天
145135,95,这么多战友啊很多人说这个他们看到这些海外的伪类们骗不了圈骗不了钱,"这么多战友啊，很多人说他们看到这些海外的伪类们，他们骗不了捐，骗不了钱，


拿着"
145136,96,拿着过书就当着这个老实人欺负乱码无辱,拿着郭叔就当老实人欺负、乱骂、污辱
145137,97,然后呢动部队受过输这不是那说他们瞎了狗眼了过书做了那么多事情都说那么多选择留言,然后呢动不动说郭叔这郭叔那，他说他们瞎了狗眼了，他们说郭叔做了那么多事情，郭叔有那么
145138,98,孙立军,孙立军
145139,99,还有这些梦建筑共产党做了那么多事情是从来没有过,还有这些孟建柱，共产党做了那么多事情从来没有过
145140,100,谢谢啦谢谢啦,谢谢了谢谢了啊
145141,101,谢谢我这615舞啊谢谢了谢谢了啊,谢谢了啊，谢谢我知道6155，谢谢了
145142,102,我知道你背后有很多人啊谢谢啊,我知道你背后有很多人，谢谢
145143,103,我现在就回答你们所有的问题啊,我现在就回答你们所有的问题啊
145144,104,这个昨天晚上我收到的,这个昨天晚上我收到的
145145,105,这个就因为你想上的募捐骗捐啊那个黄河边好喝的烂人你放心,这个昨天晚上我收到的，就因为影响了他们募捐、骗捐，那个黄河边那
145146,106,我要给张远不说的事情一个都不会放过什么成就认什么的一刻都不会放过,我要给战友们说的事情，一个都不会放过，什么陈军啊什么的，一个都不会放过
145147,107,他们家一起那个财产,他们加一起那些财产
145148,108,都不够你过书,都不够你郭叔
145149,109,喝咖啡的钱啊,喝咖啡的钱，他
145150,110,他们家一起来那些那些能力加一起来,他们加一起来那些能力，加一起来
145151,111,都不你过叔叔起床了放出来个屁一下那啥他都不是,都不如你郭叔叔痔疮上放出那个屁去，他啥他都不是
145152,112,啥都不是,啥他都不是
145153,113,Playground卤味,来都不如你
145154,114,7集123第1次看直播谢谢3 5 7 9,J123，第一次看直播，谢谢
145155,115,那么我回复占有的事情就是今天的题目,那么我回复战友的事情，就是今天的题目
145156,116,郭书,郭叔
145157,117,郭文贵,郭文贵
145158,118,绝对不是一开始那些其名为何盗国贼,绝对不是一开始那些欺民贼盗和国贼
145159,119,爱国贼们想象中的我是一个,爱国贼们想象中的：我是一个
145160,120,披着羊皮的狼,披着羊皮的狼
145161,121,你想气个欺负,你想欺负就
145162,122,羊皮的狼可怜我是微博时又很坏,羊皮的狼，我在那儿装可怜，我实际我很坏
145163,123,我这人外表看上去很憨厚,我这个人外表看上去很憨
145164,124,人很好时就会是个什么,人很好，实际我是个什么
145165,125,出来维稳的,出来维稳的
145166,126,打击海外什么狗屁民运的,打击海外什么狗屁民运的
145167,127,然后是共产党的盗国贼我是情报机构,然后是共产党的盗国贼、我是情报机构
145168,128,谁说我外表是否里面试了,所以说我外表是皮，里边是
145169,129,我绝对不是事实未经证明了你不承认那是你脑子有问题脑子进了狗屎了,我绝对不是，事实我已经证明了，你不承认，那是你脑子有问题，脑子进了狗屎了，而
145170,130,而且还是一个,而且还是一个
145171,131,这个印度的狗的狗屎,个印度的狗的狗屎
145172,132,不是一般的狗屎,不是一般的狗屎
145173,133,那么另外一个我要告诉你你欺负过我现在不会是骗钱什么夏业良郭宝石,那么另外一个我也告诉你，你欺负郭文贵，想在郭文贵身上骗钱，什么夏叶
145174,134,我上了骗钱的还有什么成就是啊还是什么袁建斌那还有什么国内的正大连那是,郭宝盛啊，骗钱的还有什么陈军啊、还有什么袁建斌啊、还有什么国内的大连的什
145175,135,以为我好欺负的,以为我好欺负的
145176,136,我告诉你,我告诉你
145177,137,我再给你第2句话你要庆祝,我再给你第二句话，你要清楚
145178,138,我既不是披着羊皮的狼,我既不是披着羊皮的狼
145179,139,我也不是,我也不是
145180,140,穿着狼皮的羊,穿着狼皮的羊
145181,141,就是今天的主题啊小哥路德,就是今天的主题。小哥路德
145182,142,郭文贵不是披着羊皮的狼不为过任没有任何组织不会跟上干事情但我也不是,郭文贵不是披羊皮的狼，没有任何组织，不为共产党干事情，但我也不是披着
145183,143,披着狼皮的羊吓唬你的,披着狼皮的羊，吓唬你的
145184,144,我不是披着狼皮的羊,我不是披着狼皮的羊
145185,145,我是李恩郎家杨都能吃的猪,我是连狼加羊都能吃的主
145186,146,啊我今天的主题就是郭文贵不是披着羊皮的狼不为任何组织不为任何人只为,我今天的主题就是郭文贵不是披着羊皮的狼，不为任何组织，不为任何人，只为
145187,147,全职位找人,人，只为穷人、只
145188,148,为正义为中国喜马拉雅,为正义、为中国喜马拉雅
145189,149,但也绝对不是,但也绝对不是
145190,150,穿着狼皮的羊你以为我的下次你那大家咋呼呢,穿着狼皮的羊，你以为我在那儿吓唬你呢，在
145191,151,披着狼皮的牙19我很懦弱你想怎么去绝对不是,披着狼皮的羊，实际我很懦弱，你想怎么欺负
145192,152,超过了,超过
145193,153,连老娘都吃着就今天题目,"连羊都吃，


这就是今天的题"
145194,154,小格鲁特先生能不能用这个听吗,小哥、路德先生能不能用这个题目啊
145195,155,小戈老师版的题目岛的巴士时候拉的然后都打点击率,小哥老是把那题目搞得吧，慎人呼啦地，然后都他点击率
145196,156,小哥一个月我听说现在麻将近70000美元点击率会,小哥一个月我听说现在拿将近几万美元点击率
145197,157,61个月现在拿六七万,个月现在拿六七万
145198,158,你一点都不分给你过书都不给我点点杯咖啡,你一点都不分给你郭叔，都不给我点杯咖啡
145199,159,What can I do只有花钱买了,我这咖啡都自己花钱买的
145200,160,我都没钱了六队啊,我都没钱了路德、小
145201,161,小哥啊,小哥
145202,162,你还就不长痘,你还金屋藏逗
145203,163,你过说多可怜你看那个,你郭叔多可怜，你看
145204,164,都说没钱了,都说没钱了
145205,165,你看我问你们是香港背怎么扣了,你看我女儿香港被他们扣了十
145206,166,15 1港币都去要钱这了,港币，都去要钱去了
145207,167,太搞笑了我要15港币好像我就没钱了,太搞笑了，我要十五亿港币好像我就没钱了
145208,168,你说这帮王八蛋啊有多黑啊,你说这帮王八蛋有多黑
145209,169,我是51我不要了你们为什么150万150美金的问爸妈给卖了我有事问和平,我十五亿我不要了？你们为了一百五十美金能把妈给卖了，我有一次问何频，我那时
145210,170,怎么这么傻,为什么海
145211,171,我想喝新鲜为什么海外这些民运那就为了1000 2000美金都骂娘了个打起来,我说何频先生为什么海外这些民运们就为了一千两千美金
145212,172,10000美元,美元？何
145213,173,和平,何频
145214,174,真是高人真是高人,真是高人，真是高人
145215,175,汽油机有WiFi挺过砸过的都是靠过司法的,高人。7171，哇噻，挺郭砸郭的都是靠郭吃
145216,176,我也不是不差钱那XX个几十万1美元还是去了几10美元打官司吃饭,我也不是不差钱儿，那差差个几十万亿美元还是缺的。几十万（亿）美元
145217,177,坐游艇了坐飞机,坐游艇，坐飞机
145218,178,做好来这边需要钱买衣服在国在华1000年也画不玩了这是肯定的,坐（住）豪宅，这一辈子需要的钱，买衣服，再花一千年也花不完了，这是肯定的啊
145219,179,这是肯定的,这是肯定的
145220,180,肯定了要每次拿下的那开玩笑了我的老婆孩子,肯定的，要没这两下子，那开玩笑呢。我的老婆孩
145221,181,哇这么多员工我的律师,我这么多员工，我那律师
145222,182,那就多少钱啊,师费多少钱
145223,183,是不是啊,是不是啊
145224,184,水马站有卖啊,是啊！所以吗，战
145225,185,我不需要打她肥料啊不这样喝了梨子,我不需要打（赏）咖啡了呀（郭先生
145226,186,打了咖啡,打着咖啡
145227,187,拿给你看看的无间你这个烂货这个烂人还有什么李一平,。然后你看看吴建民这个烂货，这个烂人。还有什么李一平，所
145228,188,还有吗的共产党下载全有微信啊,还有什么李一平，所有骂着共产党，下
145229,189,一个大傻你是什么东西的都是你说什么东西的都一个个,打赏。你说什么东西这都是，什么东西这都一个儿个
145230,190,刚才那个主意说话了啊,刚才这个主题说完了啊
145231,191,这个狼和羊的问题,这个狼和羊的问题
145232,192,第2个今天主题啊小哥,第二个今天主题啊。小哥
145233,193,路德先生别来多少个傻*,路德先生，别在这儿给我
145234,194,我现在说第2个问题,我现在说第二个问题
145235,195,关于过账服和帽子,关于郭战服和㡌子
145236,196,这个所有的帽子,这个所有的帽子
145237,197,说实在话我不太惊讶了,说实在话，我太惊呀了
145238,198,我不能说,我不能说
145239,199,我们在靠近大路边上的,我们在靠近大陆边儿上
145240,200,这些寄过去的战友,这些寄过去的战友
145241,201,真的让我太惊讶了,真的让我太惊讶了
145242,202,80%我们都寄回了大陆了,80%我们都寄回了大陆了
145243,203,但是到大陆以后就没想到这么快的时间抓他就没了,但是到了大陆以后，就没想到，就这么快的时间，刷
145244,204,发了这是有问题了发了拿走了这个国外进来大概80%,"。


Sara这是有问题的，Sara拿走了这个国外寄过来的"
145245,205,3D发完了,发完呢
145246,206,A survey发完了,ara没发完呢
145247,207,Helena holdren are the solid郭文贵阳,"ld着呢。Sara, 这郭文慧呀，怪不得人"
145248,208,怪不得人家说你是郭文贵的妹妹郭文慧你真相我小气没把玩,怪不得人家说你是郭文贵的妹妹郭文慧，你真像，这么小气，没发完
145249,209,我只买了我这已经没了太多人想要了,我这儿没了，我这儿已经没了，太多人想要
145250,210,我告诉大家的事情,我告诉大家的事情
145251,211,记住那个帽子是越南做的,记住那个帽子是越南做的
145252,212,从越南寄到了德国是在德国家的logo和极限,从越南寄到了德国，是在德国加了那个Logo和金
145253,213,金丝线,金丝线
145254,214,那么这一次发现,那么这次发现
145255,215,帽子最想要的是黑猫就刚刚,帽子最想要的是黑帽子。就刚刚
145256,216,刚刚这个上午家楼上来,刚刚，这个上我家楼上来
145257,217,这个来换班的这个警卫,这个来换班来这个警卫
145258,218,一进屋说不想让这个航母下跟你说我儿子要你10顶帽子黑王子10顶,一进屋说，郭先生，我先跟你说，我儿子要你十顶帽子，黑帽子，十顶
145259,219,好好好好结果我们家里面另外一个人没了,好好好，结果我们家里另外一个人说，咱没了
145260,220,现在多,现在多
145261,221,今天我这会还会到上大概30项吗还30项,今天我这还会到上大概30箱吧，还30箱
145262,222,但是已经取出去很多了啊现在说32那有一些早上要,但是已经许出去很多了啊，现在说Sara那有一些，找
145263,223,哦那我再告诉你什么,后呢我再告诉你什么
145264,224,过站装的帽子,郭战装的帽子
145265,225,家现在已经在改款,帽子现在已经在改款，已
145266,226,你在干这个有反应很多的意见啊,再改款， 这次有反映很多的意见，非
145267,227,非常非常感激,非常非常感激
145268,228,在改款,在改款
145269,229,改革更加漂亮,改的更加漂亮
145270,230,接下来,接下来
145271,231,又定20万只,又定20万只
145272,232,20万只啊20万只在16万至1亚洲和大陆为准2万只到这边来这是干嘛,定20万只。20万只。20万只的十六万只以亚洲和大陆为主。二（四）万只到这边
145273,233,战俘我给大家说的是本来,战服，我给大家说的是，本来
145274,234,两周前两周,两周前，两周
145275,235,之前,止，将
145276,236,战斧哪里让我失了,战服拿来让我试了
145277,237,说实话我不满意,说实话，我不满意
145278,238,但是我想接受因为我着急呀我大学了快乐吗,但是我想接受，因为我着急呀，我给大家许了，快
145279,239,但是我的团队是国家的也绝对不行,但是我那个团队说，郭先生，这绝对
145280,240,绝对不行,绝对不行
145281,241,为什么就是我们那个,为什么呢？就是我们
145282,242,拉链人那个拉链那个就这会瘦身,拉链那个，拉链那个，这块儿收身（郭先
145283,243,周深感为什么好,这块儿收身（郭先
145284,244,周我们这材料非常非常特别记住我今天事情说的话,我们的这个材料非常非常特别，记住我今天视频说的话
145285,245,当战友穿的那站桩有这个衣服多识别这是那个柔韧皮安娜做毛衣服做的,"当战友穿上那个战装你就知道那个衣服多特别。


这是Loro Piana做毛衣服做的"
145286,246,最好的,最好的
145287,247,让我家那个那个那个面的做最好的他特别的重要的这个叫地址,然后加那个那个棉的，做的最好的。特别的一种料子。这个料
145288,248,只有这大用,只有这一家
145289,249,不卖给我们了他卖个为什么呢,不卖给我们了，它卖给…，为什么呢
145290,250,本来过说好了我说我定你10万个多少钱呢很便宜26美金建材,本来给我说好了，我说我定你十万件，多少钱呢？很便宜，二十
145291,251,材料给我,材料给我
145292,252,我的好我再加上印书啊那个Logo啊在家里就是27吧美金不超过,我说那好啊，我再加上运输呀，那个Logo呀，也就是二十七，八美金，不超
145293,253,把30美金会下这个很好,八美金，不超过三十美
145294,254,不说了30美金大家算上我订上,不超过三十美金，大家算算我订
145295,255,20万强,万件
145296,256,我也就是说我送我送出去也就是6000000美元吧,我也就是说我送出去也就是五六百万美元
145297,257,但是最后一分钟人家这个设计师廖子的设计师不愿意了,但是最后一分钟，人家这个设计师，料子的设计师不愿意了
145298,258,要是设计时的场子有两家一个在土耳其一个在意大利,愿意了。料子设计师的厂子有两家，一个在土耳其，一个在
145299,259,说所有这个材料不允许任何人有,说所有这个材料不允许任何人用
145300,260,你说这这么混蛋吗你说的材料不然用给我选了一个吊车要多少钱呢,你说这个这不是混蛋么你说，这材料不让用。那给我选了一个料儿，说料
145301,261,6美金看上去一模一样,美金。看上去一模一样
145302,262,我一样,一样
145303,263,在哪产的,在哪儿产
145304,264,咱们广东东莞找的,咱们广东东莞造的
145305,265,东莞了,东莞的
145306,266,我说这样不行我说我这这不行,我说这不行，我说我这，这不
145307,267,这就看到了上次那个衣服吧不用把衣物洗给洗成那么短了,这就看到了上次那个衣服呀被我们阿姨误洗，给洗成那么短
145308,268,那一会绝对不能洗的掉的,那衣服是绝对不能洗的，那
145309,269,没办法了就跟这个人商量我只要你20万件剩下以后我不要了我们自己,没办法了，就跟这个人商量，我只要你二十万件。剩下以后我不要了，我们自
145310,270,你想要生产类似了,想办法生产类似的
145311,271,就这个了怎么杀了也不行,就这哥们儿最后怎么商
145312,272,最后购买要呀要多少钱了,最后跟我们要价要多少钱呢
145313,273,要300美金就少一下不行,要三百美金一件，少一件不行
145314,274,300米金数10的话就太贵了又成本下来就350了,美金说实在话就太贵了，（成本下来就
145315,275,20万件的话可能就7000000美元了,20万件的话可能就700万美元了
145316,276,然后我们定下定200万件的话那你先算上多少钱就是6几个叫你气千万美元,然后我们要定200万件的话，那你算算多少钱？那就是将近7000万美元。但是
145317,277,但是我不能忘记这就是文贵,但是，我不能放弃！这就是文贵
145318,278,最后我找到办法在这不说啊,最后我找到了个办法，在这不说
145319,279,我保证是的一模一样的了我的样板都留着呢大家想将军说的要把你寄过去,我保证是一模一样的料子。样板我都留着呢，大家想鉴定的时候我把样板给
145320,280,就是要那个料子,就是那个料子
145321,281,这个料子那已经生产出来这位看我满意了,料子呢已经生产出来了，这回一看我满意了
145322,282,而且我试了一下的,昨天我试了一下
145323,283,我那是这么做的现在茂山,"我呢是这么做的现在：


咱"
145324,284,咱们这个,咱们长
145325,285,最多长期听过了美人男的,长期挺郭的，每人，男的
145326,286,一个帽衫,一个帽衫
145327,287,一个就是怕这是T恤,一个拉链衫，这是
145328,288,I am a teacher,系的，帽衫、T
145329,289,然后呢我们这个群里面长联系的帽衫T恤,然后呢我们群里边常联系的，帽衫、T恤
145330,290,再加一个拉链是这是男士的女的,再加一个拉链衫，这是男士的
145331,291,茂山,帽衫
145332,292,只有你的有白的真你就白了那个白的,只有女的有白的），那个白的拉链衫
145333,293,8点10,6件
145334,294,然后,人就
145335,295,白子涨价格提醒,话这次20万件。现
145336,296,这这个只有你这个白的,黑配金，是这么做的。哇，真
