id,index,content,proofed
156947,1079,我怎么人那么夸你说你的海口李嘉诚孩子的称呼是海南的皇帝,能说呀，有些话不能说呀。我答应好的这东西都不能说。先搁这儿吧
156948,1080,当地当时的世纪委书记跟我很熟我说的几个数的值范纪委书记很深沉,该说的话，我不能说呀，有些话不能说呀。我答应好的这东西都不能说。先搁这儿
156949,1081,我问了我们这是什么这么夸怎么这么这个呀就这个过失手是文贵,这有些不该说的话，我不能说呀，有些话不能说呀。我答应好的这
156950,1082,别塔在哪人,些话不能
156951,1083,我什么意思我这两人了不得,我这有些不该说的话，我不能
156952,1084,三惹不起,些不该
156953,1085,海南的这个属于权力很大的药有唯亭镇加厉害呀然后呢安全不能动,好了。所以亲爱的战友们，这个，咱今天这个忒兴奋。再往下说我这有些不该说的话
156954,1086,海口安全是很重要的很重要的,好了。所以亲爱的战友们，这个，咱今天
156955,1087,你们的还有潜水艇基地有个潜力老地产的必要经过他没有雁过拔毛,"几根毛，弄点DNA去啊。


太好了。所以亲爱的战友们，这个，咱今天"
156956,1088,所以,所以
156957,1089,这个王建先给我留下一下非常不好后来几次我们按他本来见面我都解决了,这个，咱今天这个忒兴奋。再往下说我这有些不该说的话，我不
156958,1090,我跟王老先生为一两次将点谁会说话在北京私人机场,所以亲爱的战友们，这个，咱今天这个忒兴奋。再往下说我这有些不该说
156959,1091,你我们随机吗如果专用骑楼每次到了以后有个大VIP厅就是每次都给我,有些不该说的话，我不能说呀，有些话不能说呀。我答应好的这东西
156960,1092,就是不给我用了说旁边有人,该说的话，我不能说呀，有些
156961,1093,高亮度前好听,该说的话，我不能
156962,1094,我怎么也不在乎了,我这有些不
156963,1095,我下个礼拜就是说了,有些不该说的
156964,1096,王健,往下
156965,1097,也要坐飞机种,友们，这个，咱今天
156966,1098,这个是这是很早很早的了这个海南的海航的王健,战友们，这个，咱今天这个忒兴奋。再往下说我这有些不该说的话，我
156967,1099,王就是这么重要很牛啊他说但是这就跟王健有一个人,往下说我这有些不该说的话，我不能说呀，有些话不能说呀。我答应
156968,1100,有一位常委的妇人,有些话不能
156969,1101,当时常会想想是谁,天这个忒兴奋。再往下说我这
156970,1102,下午是谁怕谁呀说长春的夫人,下说我这有些不该说的话，我不能说
156971,1103,阿怪我的妈妈赶快多了咱惹不起所以当时你看得还好他不整,些话不能说呀。我答应好的这东西都不能说。先
156972,1104,整个共产党的是很多人都变成拿下了,答应好的这东西都不能说。先搁这儿吧
156973,1105,然后有一次,说呀，有些
156974,1106,我的又是飞机回来旁边停的飞机,些话不能说呀。我答应好的这
156975,1107,海航的飞机从上面下了任谁呢邓发,答应好的这东西都不能说。先搁这儿吧
156976,1108,啊做完了没有台,的话，我不能说呀
156977,1109,我的听的动画,我答应好的这东
156978,1110,我们那个车呢我们上个摆渡车,答应好的这东西都不能说
156979,1111,不接我的人们都是在机场他都是一帮人都互相机一样都是自己的朋友我说这么慢,不能说呀，有些话不能说呀。我答应好的这东西都不能说。先搁这儿吧
156980,1112,他每次用海航飞机他都么说海航的那你们谈那么多钱过拍那么烂,能说呀，有些话不能说呀。我答应好的这东西都不能说。先搁
156981,1113,我那也不对你有人就给你还骂人家对不对呀后来知道更加不能用到飞机了,我不能说呀，有些话不能说呀。我答应好的这东西都不能说。先搁这儿吧
156982,1114,因为有了安邦,有些话不能
156983,1115,Lambung,我不能
156984,1116,买了两家,奋。再往下
156985,1117,打说,下说
156986,1118,一个是这个S7,应好的这
156987,1119,还有喝打那个买了还是八两电子提一下一次吧,呀，有些话不能说呀。我答应好的这东西
156988,1120,当然是人家就是打飞机用了就不用你还好是给中央领导联络,不能说呀，有些话不能说呀。我答应好的这东西都不能说。先
156989,1121,最关键作用安全不出门派森飞机全是排好的,呀，有些话不能说呀。我答应好的这东西都不能说。先
156990,1122,这个是王建是很牛的,不能说。先搁这儿吧
156991,1123,然后,应好
156992,1124,这是我们的就是这个王建中变首都贵,说呀。我答应好的这东西都不能说。先搁这
156993,1125,还有一次就是,呀，有些话
156994,1126,我是亲眼目睹妖精,能说呀。我答应好的
156995,1127,姚明珊他上飞机了,天这个忒兴奋。再
156996,1128,这个是王岐山已经回到北京了,这个忒兴奋。再往下说我这
156997,1129,哇我一看到王剑工作呀,呀。我答应好的这东西都不能
156998,1130,都这样,都不能
156999,1131,我说这是听说两人关系好陈峰市的秘书我没想到这么,些话不能说呀。我答应好的这东西都不能说。先搁这儿
157000,1132,为什么乘风在后面工作要跟着,应好的这东西都不能说。先搁这
157001,1133,那一幕让我看见了啥叫太监,呀，有些话不能说呀。我答应好
157002,1134,中国的太强文化到今天只有发扬公大从来没小时候,能说呀，有些话不能说呀。我答应好的这东西都不能说。先搁
157003,1135,这是我们没有计量的民族的根本说一下,这东西都不能说。先搁这儿吧
157004,1136,所以,说
157005,1137,这个这个是我亲姐你说今天看到海航今天走到这个程度,些话不能说呀。我答应好的这东西都不能说。先搁这儿
157006,1138,我从开始了解认识组织,我答应好的这东西都
157007,1139,到最后我们出我们从没有将面倒下来看我他没有成为世界是世界上这样的罪,的话，我不能说呀，有些话不能说呀。我答应好的这东西都不能说。先搁这儿
157008,1140,这样的人物,些话不能
157009,1141,现在又成了我们的我的对手啊我的对手,下说我这有些不该说的话，我不能说
157010,1142,然后又看了现在又最后要分赃,说呀，有些话不能说呀。我答应好
157011,1143,哎呀真有意思,再往下说
157012,1144,你为什么不告诉我,些不该说的话，我
157013,1145,OK,我不
157014,1146,所以,说呀
157015,1147,我这昨天喝这两天就看到这个海航的一幕一幕,咱今天这个忒兴奋。再往下说我这有些不该说的话
157016,1148,包括海航内部很多人现在跟我联系要爆料都要爆料啊我通通的我都我都说,往下说我这有些不该说的话，我不能说呀，有些话不能说呀。我答应好的这东西都
157017,1149,等等,的这东
157018,1150,一概不收,些不该说
157019,1151,的我怕这个海航派出来的看法不一位为甲亮,爱的战友们，这个，咱今天这个忒兴奋。再往下说我
157020,1152,第二我不想还行感觉得我这么卑鄙,的这东西都不能说。先搁这儿吧
157021,1153,就像我在北京我搞房地产的时候我公司不接受任何,，有些话不能说呀。我答应好的这东西都不能说。先搁这儿
157022,1154,房地产公司员工到这来,能说呀。我答应好的这东西
157023,1155,我不怕任何人和强调,能说呀。我答应好
157024,1156,我现在我也不做这种事,往下说我这有些不该说
157025,1157,咱清楚大道在大叔的绅士水平出来不敢的事,咱今天这个忒兴奋。再往下说我这有些不该说的话
157026,1158,过一段再说,有些不该说
157027,1159,桂冠,有些话
157028,1160,又尝给我料的经过验证后我愿意,有些话不能说呀。我答应好的这东西都
157029,1161,还行的员工们你们这么多人给我发的信息我都收到了,些话不能说呀。我答应好的这东西都不能说。先搁这儿
157030,1162,只要你要钱你敢担保这料是真的你敢让我验证你的身份,有些话不能说呀。我答应好的这东西都不能说。先搁这儿
157031,1163,我拿钱买白给了我不要,些话不能说呀。我答应好
157032,1164,我在松山啊你们发的信息我都收到了但是你不无偿的给料我不要,我这有些不该说的话，我不能说呀，有些话不能说呀。我答应好的这东西
157033,1165,你要想,呀。我答应
157034,1166,你都看了我过去的一年我答应让人的钱没有一个不负的包裹里有任命书为料骗了我20万个给他,个忒兴奋。再往下说我这有些不该说的话，我不能说呀，有些话不能说呀。我答应好的这东西都不能
157035,1167,名字,应
157036,1168,深圳的好几个都骗了钱我都给了我一点不后悔,说呀。我答应好的这东西都不能说。先搁这儿
157037,1169,哪有买票都买成真的那不就买凉了是不是那就买辆吗,该说的话，我不能说呀，有些话不能说呀。我答应好
157038,1170,我叫做买卖了,说呀。我答应好
157039,1171,我很政治上的较量也是这一张勇气的较量也是我讨厌我的,我这有些不该说的话，我不能说呀，有些话不能说呀。我答应好的这
157040,1172,爆料革命的动能用,我答应好的这东西都不能
157041,1173,我愿意接受,我不能说呀
157042,1174,但是你要是说白给我我不要,的话，我不能说呀，有些话不能说呀。我
157043,1175,你要敢保证你是真的我验证你的身份改变量不愿出大价钱,个忒兴奋。再往下说我这有些不该说的话，我不能说呀，有些话
157044,1176,特别是最近王健先生的死亡的真实内幕还有春风一下让这场大牌大计划,忒兴奋。再往下说我这有些不该说的话，我不能说呀，有些话不能说呀。我答应好的这东西都不能说。先
157045,1177,还有这个渤海金控的下一步的,话，我不能说呀，有些话不能
157046,1178,整个所谓的,这有些
157047,1179,就是这个依法惩处,今天这个忒兴
157048,1180,还有上市公司重组资产重组的信息,我答应好的这东西都不能说。先搁这
157049,1181,我愿意出百万美元千万美元智商1美元我都愿意,我不能说呀，有些话不能说呀。我答应好的这东西都不能说。先
157050,1182,如果你愿意可以给我发信息可以给我联系,有些话不能说呀。我答应好的这东西
157051,1183,各种渠道,这东西都
157052,1184,你也可以直接,先搁这儿
157053,1185,你这直接你可以跟我律师联系,的话，我不能说呀，有些话不能
157054,1186,我未来我把我的律师联络方式我发上去,再往下说我这有些不该说的话，我不能
157055,1187,直接通过滤出来的,这有些不该说的
157056,1188,我非常乐意,我这有些不该
157057,1189,我也想参与差异海行的资产重组吧,有些话不能说呀。我答应好的这东西
157058,1190,看看能把老百姓的钱中的,话不能说呀。我答应好的这东西
157059,1191,看望你太厉害了厉害了厉害了爱死你了你太厉害了爱你爱你爱你啊,再往下说我这有些不该说的话，我不能说呀，有些话不能说呀
157060,1192,周立波上海指挥部周立波成了不起呀昨天聊,奋。再往下说我这有些不该说的话，我不能说呀，有些话不
157061,1193,我再次重申所有海航员工愿意,我不能说呀，有些话不能说呀。我答应好
157062,1194,跟我律师联系的证明身份的愿意被签证5月出大家去买你的,能说呀，有些话不能说呀。我答应好的这东西都不能说。先搁这儿
157063,1195,海航的钱是老百姓的钱最后必须还给老百姓,些话不能说呀。我答应好的这东西都不能说。先
157064,1196,你忘记什么贱如想拿走那不可能的,些话不能说呀。我答应好的这东西都不能
157065,1197,还说你给我说哪个项链好以后定点爆破除掉信息吧,话，我不能说呀，有些话不能说呀。我答应好的这东西都不
157066,1198,哎呀这不能做广告啊,西都不能说。先搁这儿吧
157067,1199,你们就喝这个差不多想必买法国的当不一样这可以喝法国的当兵,些话不能说呀。我答应好的这东西都不能说。先搁这儿吧
157068,1200,OK,我答
157069,1201,我今天,我不能
157070,1202,心情大好了太激动了但是没睡好觉的几天那就聊到这吧行不行,咱今天这个忒兴奋。再往下说我这有些不该说的话，我不能
157071,1203,现在大家表决吧表决的话那么看啊咱们结束啊,答应好的这东西都不能说。先搁这儿吧
157072,1204,要丢了好不好,呀，有些话不
157073,1205,真的好的好的,好的这东
157074,1206,Thank,往
157075,1207,看来需要放视频啦过一段阿芳芳老王老孟的视频拉到过得,"A去啊。


太好了。所以亲爱的战友们，这个，咱今天这个忒兴奋。再往下说"
157076,1208,放王刘成杰冠军,忒兴奋。再往下说
157077,1209,吃饭说话的识别了,该说的话，我不能说
157078,1210,要放视频了,我答应好的
157079,1211,陈峰先生,能说。先搁这儿
157080,1212,播放视频那可就是你的大计划中,些话不能说呀。我答应好的这东西
157081,1213,抱抱面那一刻你记住我说的话,呀，有些话不能说呀。我答应好
157082,1214,怎么减,这儿吧
157083,1215,只要专柜抱住你那个核心的量说你所有计划最棒鸡,些话不能说呀。我答应好的这东西都不能说。先搁这
157084,1216,我在等着你的一课,呀。我答应好的这
157085,1217,咱俩,。先
157086,1218,手递手的时候带给你不要被拍照死啊你得活着我给肖你好活着,说我这有些不该说的话，我不能说呀，有些话不能说呀。我答应好的
157087,1219,我一定会面对面的我告诉你你先出手我让你三张,些话不能说呀。我答应好的这东西都不能说。先
157088,1220,你出完手我就出去找,我不能说呀，有些话不
157089,1221,这就是国外的这些牵着会不如意着觉呀,这有些不该说的话，我不能说呀，有些话
157090,1222,我就等着这个时候你能不懂吗你等到移动我等几个月,我不能说呀，有些话不能说呀。我答应好的这东西都不能说。先搁这儿
157091,1223,运筹帷幄念经打坐,话不能说呀。我答应好的
157092,1224,听见华探情报刊信息,天这个忒兴奋。再往下
157093,1225,王岐山给你的聊聊天那么两下王岐山啊你旅行动,"
太好了。所以亲爱的战友们，这个，咱今天这个忒兴奋。再往下"
157094,1226,我就等你这武功高手就是对方的动一动就是我的力量这是我的一个你不动,该说的话，我不能说呀，有些话不能说呀。我答应好的这东西都不能
157095,1227,我傻了现在你终于懂了你想停也停不下来,些话不能说呀。我答应好的这东西都不能说。先搁
157096,1228,我一定会给你面对面的教授,我答应好的这东西都不能说
157097,1229,让你先出35让你才能年龄比我大吗,能说呀，有些话不能说呀。我答应好
157098,1230,好不好,说的话，我
157099,1231,王健身1961年成峰是,们，这个，咱今天这个忒兴奋
157100,1232,195价,几根毛
157101,1233,大家,得拔几
157102,1234,世界视频,亲爱的战
157103,1235,谢谢大家啦谢谢让我百分百安全文五毛毛毛,"就更有意思了啊。咱们得拔几根毛，弄点DNA去啊。


太好了"
157104,1236,谢谢了今天佑咱们过媒体运行,所以亲爱的战友们，这个，咱今天这个忒兴
157105,1237,草酸钠,我不能
157106,1238,大家说这个纪念视频和音频效果如何呀,今天这个忒兴奋。再往下说我这有些不该说
157107,1239,大家一定记住文贵要不给你们放几个小视频短片,所以亲爱的战友们，这个，咱今天这个忒兴奋。再往下说
157108,1240,到时候你就关柜实现不了喜马拉雅,该说的话，我不能说呀，有些
157109,1241,这个本人说那天如果不跟你放一个猛烈的短片你们就过目就打片了,这个，咱今天这个忒兴奋。再往下说我这有些不该说的话，我不能说呀，有些话不能
157110,1242,我就应该被背叛绕死了,我答应好的这东西
157111,1243,慢慢来啊,兴奋。再
157112,1244,慢慢来,咱今天
157113,1245,吉林技术,能说
157114,1246,引而不发这武器有作用,有些话不能说呀。我
157115,1247,该发不发他也是废物开发而已你妈恰当的时候查找时间发出来,兴奋。再往下说我这有些不该说的话，我不能说呀
157116,1248,外媒体越来越好了哈你一天十几二十几次攻击战斗,今天这个忒兴奋。再往下说我这有些不该说的话
157117,1249,我这就不容易了别忘了咱是最康的是一个,今天这个忒兴奋。再往下说我这有些不该
157118,1250,到过北京玩哪,都不能说。先搁
157119,1251,视频有点爱音频很强大,能说呀。我答应好的
157120,1252,你看他,。先
157121,1253,有点暗,有些话
157122,1254,你往这movies like and girls they cry,个忒兴奋。再往下说我这有
157123,1255,刘霞你是道德人我还真不知道但是我相信留下你是一定会回出的出国的,咱今天这个忒兴奋。再往下说我这有些不该说的话，我不能说呀，有些
157124,1256,因为欧洲我见过所有国欧洲政府他们什么最重要为什么要见达赖喇嘛,有些不该说的话，我不能说呀，有些话不能说呀。我答应好的这东西都不能
157125,1257,救赎刘霞,不该说的话
157126,1258,最近很多人都是都是,的这东西都不能说
157127,1259,将我的政府官员都问我什么日子的重要中国我说现在,能说呀，有些话不能说呀。我答应好的这东西都不能说。先搁
157128,1260,见达赖喇嘛,呀。我答应
157129,1261,救赎刘霞还有一个你们要关心细节新疆事件,咱今天这个忒兴奋。再往下说我这有些不该
157130,1262,关注轻有时间,些话不能说呀
157131,1263,关注那些被刑讯逼供关压的官员和架子,个忒兴奋。再往下说我这有些不该说的话，我不能说呀
157132,1264,大家千万记住过媒体今天是网站,咱今天这个忒兴奋。再往下说我这
157133,1265,是网站,亲爱的战
157134,1266,很容易攻击基本上属于逻辑状态啊逻辑状态我们等到住我们有一个,个，咱今天这个忒兴奋。再往下说我这有些不该说的话，我不能说呀，有
157135,1267,加密的,应好的
157136,1268,App是说App的说那才会不一样大家现在记录基本上咱们现在是,些话不能说呀。我答应好的这东西都不能说。先搁这
157137,1269,玩这个是78期的和用的是拖拉机的材料,"。我答应好的这东西都不能说。先搁这儿吧。

"
157138,1270,然后驾驶员基本上都是开拖拉机出生的啊,该说的话，我不能说呀，有些话不能说呀。我答应好
157139,1271,最多是开拉打了所以大家都原谅多包容这个表现多媒体技术不是,再往下说我这有些不该说的话，我不能说呀，有些话不能说呀。我答应
157140,1272,不是我的所长但是打的暴露的目的这是我的这是我的所长最初把我说的话输入起就可以,再往下说我这有些不该说的话，我不能说呀，有些话不能说呀。我答应好的这东西都
157141,1273,习近平是你好不好听大家做包含目的是榜样不是做生意咱们,不能说呀，有些话不能说呀。我答应好的这东西都不能说。先搁这儿吧
157142,1274,明镜一样照出日志,答应好的这东西都
157143,1275,靠爆料弄钱的不是蓝的目的不想愿红屏无响国宝石,不能说呀，有些话不能说呀。我答应好的这东西都不能说。先搁
157144,1276,也不想来讲听也不想读宁保钓中心,呀。我答应好的这东西都不能说。先搁这儿吧
157145,1277,把钱那个小钱不丢人了,不能说。先搁这儿吧
157146,1278,中中中中中,答应好的这东西都不能
157147,1279,今天大家都开心了开心了,应好的这东西都不能说。先
157148,1280,好啊今天是原来我们的开拖拉机的,呀，有些话不能说呀。我答应好的
157149,1281,打下你们展示波音787飞机,兴奋。再往下说我这有些不该
157150,1282,这个技术也没长工好事,这有些不该说的话，我不能说
157151,1283,这个视频也没有好一点没好,这有些不该说的话，我不能说呀
157152,1284,大家知道我们所有的这些团队没有问题为什么我们最重要的靠近我的人的安全性,友们，这个，咱今天这个忒兴奋。再往下说我这有些不该说的话，我不能说呀，有些
157153,1285,第1的,好的
157154,1286,在家了砸了与我的英文水平也不这么差人意都是讲英文的所以说希望大家都理解,些不该说的话，我不能说呀，有些话不能说呀。我答应好的这东西都不能说。先搁这儿
157155,1287,一切都会拥有的一切都会好了,呀，有些话不能说呀。我答应好的这东西
157156,1288,亲爱的战友们,好的这东西都不能
157157,1289,这个希望所有的战友们,这东西都不能说。先搁这
157158,1290,同时船舶文贵爆料发布求你们穿郭文贵爆料,不该说的话，我不能说呀，有些话不能说呀。我答应好
157159,1291,睁大眼睛不要被国半生缘无名来捡这些坏人给李永不要被人利用,我不能说呀，有些话不能说呀。我答应好的这东西都不能说。先搁这儿
157160,1292,不要随着人家的脚步跳探戈要随着我们的喜马拉雅脚步车他说,有些话不能说呀。我答应好的这东西都不能说。先搁这儿吧
157161,1293,看清真相这场报道革命是开启智慧,些话不能说呀。我答应好的这东西都不能说。先搁这
157162,1294,几大得,先搁
157163,1295,啊这个寻找光明正义和尊严,些话不能说呀。我答应好的这东
157164,1296,公平的智力好运动,应好的这东西都不能
157165,1297,要把属于我们中国人,呀，有些话不能说呀。我答应
157166,1298,所有的财富从这个坏人手里到过手怎么打不来反对以太晚餐法,说的话，我不能说呀，有些话不能说呀。我答应好的这东
157167,1299,反对已经治国反对以黑治国,兴奋。再往下说我这有些不该说
157168,1300,这是我们要追求的,这有些不该说的
157169,1301,那么我们喜马拉雅就是建立一个法治中国,咱今天这个忒兴奋。再往下说我这有些
157170,1302,民主中国,应好的这东
157171,1303,我们一定会赢一定会成功但是没有占用的只是成功人生赢了文故,我不能说呀，有些话不能说呀。我答应好的这东西都不能说。先搁这儿
157172,1304,我待在美国就,我答应好的
157173,1305,已经拥有了喜马拉雅的一切了,兴奋。再往下说我这有些
157174,1306,但是,咱今
157175,1307,我希望我们大家所有人看到是让我们14亿中国人,我不能说呀，有些话不能说呀。我答应好的这东西都不能
157176,1308,动物拥有今天我们在海外享受这种,能说呀。我答应好的这东西都不能说。先
157177,1309,法制民主自由安全快乐,呀，有些话不能说呀。我答应
157178,1310,这种是没有好的生活,这有些不该说的话，我不能说
157179,1311,每当我醒来时候看到蓝天白云把这种祥和的空间人与人之间的和谐我真的就,们，这个，咱今天这个忒兴奋。再往下说我这有些不该说的话，我不能说呀，有些话
157180,1312,希望我们的同胞14的人都有这样的生活而不是天然开朗的射像刘霞女士,些不该说的话，我不能说呀，有些话不能说呀。我答应好的这东西都不能说。先搁这儿吧
157181,1313,这样被虐待刘晓波先生看了709律师高智晟的家人高智晟李文足,话，我不能说呀，有些话不能说呀。我答应好的这东西都不能说。先搁这儿
157182,1314,这样嫁人的虐待,应好的这东西
157183,1315,包括的也在街上卖菜的被城管乐大,话不能说呀。我答应好的这东西都不能
157184,1316,阅读,有些话
157185,1317,包括向家赶来你是这样的时间,兴奋。再往下说我这有些不该说
157186,1318,每天喝日每个月或每年都会发生,今天这个忒兴奋。再往下说我这有些不该说的
157187,1319,我们更愿看到北京长按键全是特单车老百姓单骑自行车全系都没有,亲爱的战友们，这个，咱今天这个忒兴奋。再往下说我这有些不该说的
157188,1320,我们更不愿意看到被警察还在弹冠的,话不能说呀。我答应好的这东西都不能
157189,1321,可以玩到这个人的女儿和老婆更不愿意看到这些老兵现致青春以后,"能说呀，有些话不能说呀。我答应好的这东西都不能说。先搁这儿吧。


"
157190,1322,有人管没人问,不能说。先搁这儿
157191,1323,看不到未来做了78 75000 650万5073的到处飞,呀，有些话不能说呀。我答应好的这东西
157192,1324,我们各位要个梦见路线生,我答应好的这东西都不能说。先搁
157193,1325,这个旁边是这个店的六块肌肉领导的公检法穿着最严重的人民相信的站,该说的话，我不能说呀，有些话不能说呀。我答应好的这东西都不能说。先搁这儿
157194,1326,公检法的丈夫却干这baby go桌的事,呀，有些话不能说呀。我答应好的这东
