id,index,content,proofed
156435,567,我100%是真的,我100%是真的
156436,568,今天我看书你要玩什么系人身份先生,今天我看出了你要玩什么心眼了，陈峰先
156437,569,你要玩真是经常脱水啊你是死个老子说你呀,你要玩的这是金蝉脱壳啊，你是屎壳郎脱壳啊，你
156438,570,你不是经常做法,你不是金蝉脱壳
156439,571,你这喂你给我演讲见啥了,你要玩的这是金蝉脱壳啊，你
156440,572,法国巴黎,法国巴黎
156441,573,普罗旺斯,普罗旺斯
156442,574,瑞士,瑞士
156443,575,还有你身边这些人还有你们的787,还有你身边这些人，还有你们的787
156444,576,还有你们的多架飞机叫他的微信还有这回你的绑架了我就叫你家族,还有你们的多架飞机交叉的飞行，还有这回你们绑架了我们调
156445,577,暴露你们喝的目标,暴露你们的核心目标
156446,578,王家只是一个阴谋,王健的死是一个阴谋
156447,579,王者之死是还行送葬,王健的死是海航送葬
156448,580,依法分章的开始,，依法分赃的开始
156449,581,同时要干掉习近平,同时要干掉习近平
156450,582,也可能习近平先生一点时差,也可能习近平先生也是参
156451,583,也是有可能啊,也是有可能
156452,584,有点兴奋有点兴奋相当兴啊相当兴奋,有点兴奋，相当兴奋，（给我来点冰的
156453,585,过来听的水喝,点冰的水喝
156454,586,我跟他聊聊吧留言呢,我给大家来聊聊 吧，留言呢
156455,587,我在看哪,我来点
156456,588,What is commerce,者啊！也是有可
156457,589,喂喂喂喂喂,我给大家来聊
156458,590,他们家,跟大家
156459,591,我的家聊聊,我跟大家聊聊
156460,592,该睡觉的睡觉啊咱们现在开始就是聊天时间啊,"该睡觉的睡觉去, 咱们现在开始正式聊天时"
156461,593,留言好啊,留言好啊
156462,594,你干吗跑那么远干吗啊,你干嘛跑那么远干嘛啊
156463,595,我想看你呀,都想看你啊
156464,596,为什么大美女不敢出境,真是，大美女不敢出镜
156465,597,还在考虑把这个好最好,好这个好，有冰块吗？来一点
156466,598,冰块来点,冰块吗？来一
156467,599,哎呀我看看啊,哎呀我看看啊
156468,600,该睡觉的睡觉了该睡觉的睡觉啊这个这个,该睡觉的睡觉了，该睡觉的睡觉啊，这个这个
156469,601,东瑶琼还不是清的很快就要上说看疯了,董瑶琼，啊不是琼瑶啊，看琼瑶小说看疯了
156470,602,穿紫衣的女人,穿紫衣的女人
156471,603,日落夕阳天,日落夕阳天
156472,604,亲爱的兄弟姐妹们天赐良机呀,亲爱的兄弟姐妹们，天赐良机啊
156473,605,郭是我要过站服啊最后要过量服了才能说大事了在友们要过站,郭叔，我要郭战服”哎呀这会要郭战服了，咱这说大事了，战友们要郭
156474,606,Yes good,这说大
156475,607,I can see,虽然没怎
156476,608,别,真
156477,609,Why you,事有
156478,610,You don't prepare before,参与动作吧，我没
156479,611,哎呀这在那今天我是真兴奋了虽然没怎么睡觉我是真兴奋了,啊？我说你们美国人就希望这事发生，结果发生了现在
156480,612,这个,这事
156481,613,我这两天就看这是有意思了有意思了这场大戏他们出,就希望这事发生，结果发生了现在，发生在普罗
156482,614,出场了,发生了
156483,615,还没出场我没有机会了,你啊？我说你们美国人就
156484,616,他老婆是什么不采用动作吧我没机会,他说中共咋不派几个大动作来搞你啊？我
156485,617,看见这个美国的几位朋友过说中共几个大动作来搞你,这个美国的几位朋友跟我说，他说中共咋不派几个大动作来搞你
156486,618,他是哪国人最希望这次发生结果发生了现在发生在破了王子,他说中共咋不派几个大动作来搞你啊？我说你们美国人就希望这事发
156487,619,柚子的份上最后一定能阻止不了啊他分不长他们缘分,止他们分赃”，最后一定能阻止得了啊，他分不成，他们越分赃分得越快
156488,620,三分的越快越猛烈他们最后结果一定是分赃不均,"赃分得越快越猛烈，


他们最后结果一定是分赃不均"
156489,621,海航内部会出现&公贵,海航内部会出现N个郭
156490,622,一定的,一定的
156491,623,然后这件事情最后就是洗碗大厦,然后这件事情最后就是习王大战
156492,624,席梦大战,习孟大战
156493,625,西江大战吸增大战,习江大战、习曾大战
156494,626,把家老爷的绝对是高手那是真正的,江老爷子绝对是高手，那是真正的
156495,627,现在也就是黄蓉吧黄蓉也就是今天黄蓉啊梅超风啊这,现在也就是黄蓉嘛，黄蓉也就是今天黄蓉啊梅超风啊这
156496,628,东邪西毒啊,东邪西毒啊
156497,629,啊中国龙啊孩子还是睡觉也是好的啊,啊，周伯通啊那人物，还是属于江老爷子这号
156498,630,最后你放心王岐山就是刘伯温的下场,最后，你放心，王岐山就是刘伯温的下场
156499,631,看啥还能有什么,咔嚓还能有什么
156500,632,东厂西路灯厂信号那个叫王什么呀,东厂西毒东厂西厂那个叫王什么呀
156501,633,也是干掉啊,也是干掉~啊
156502,634,梦的权力还大了很难,孟的权力还大得很呢，你
156503,635,你看看,你看看
156504,636,刘特佐为什么的住在香港为什么在澳门和上海转,刘特佐为什么他住在香港，为什么在澳门和上海转
156505,637,全世界都要抓动不了他孙俪主管子乐高班主任的,全世界都要抓，动不了他，孙力军管着呢，港澳办主任
156506,638,坐在这和新的,主任啊，这才是核
156507,639,对吧,对吧
156508,640,喜梅想开始打王喜喜本来呀想染问王是王要打集,习没想开始打王，习本来想安稳王，是王要打习
156509,641,Do you please,多，路德先生
156510,642,澳洲6元,啊，你说我昨天
156511,643,我来访谈正在直播中太好了,兰访谈正在直播中太好了
156512,644,你说我昨天不能视频吗才2万多路德先生把四五万,你说我昨天播个视频吧才两万多，路德先生吧四五万
156513,645,人家卡利息呀还有照明你们两个都比我多你看看,人家卡丽熙、昭明你们这都比我多，你看看这多好
156514,646,这多好我特别看到这种情况所以亲爱的战友们,这多好，我特别爱看到这种情况，所以亲爱的战友们
156515,647,咱们这个爆料革命的时候,咱们这个爆料革命的收
156516,648,有意思了,有意思了
156517,649,东京爆料中心愿拜访拜访严白一片,东京爆料中心袁白风~袁白衣噼噼
156518,650,还有国宝是个大骗子来剪指甲律师恶心骗子,还有郭宝胜这骗子大骗子！赖建平假律师
156519,651,一堆烂人还还是为明其名为爱国人们把不说话了呀,一堆烂人！还有伪民运欺民贼爱国贼们，咋不说话了呀，现
156520,652,解说呀有点行动吗还是不要去你个烂哦运,在说啊，有点行动啊，还有这个博讯，你个烂
156521,653,这个培训的这钱我又忘了那两个州的账号,这个博讯的钱我又忘了，那两个州的账号
156522,654,对了你们的战什么说要就发个宝的定义,对了，你们这个战友们说要求法国保留DN
156523,655,我告诉你,我告诉你
156524,656,医院里面连一个字的检查记录都没有,医院里边连一个字的检查记录都没有
156525,657,笨说的毛都没有,甭说DNA连根毛都没有
156526,658,我们只会说实话,我们跟你说实话
156527,659,我就是冲过去,我叫人冲过去
156528,660,就是要王建的病危,就是要王健的DNA，因为
156529,661,因为我们有一个网站定义的所有的信息,因为我们有王健的DNA的所有的信息，只
156530,662,只要我找个样就可以我开了价格应该是这个100000美元,只要我找到一样就可以，我开的价格一开始十万美元，最
156531,663,最后一个男的给你500000美元,最后一看难我说给你五十万美
156532,664,周五算了我的1000000美元,后五十万我说一百万
156533,665,我要你一个猫爪,我可以向全中国
156534,666,我让全可以上全中国同胞保证在那个医院里面没有王建先生刘家的,我可以向全中国同胞保证，在那个医院里边没有王健先生留下的一根毛
156535,667,一根毛,一根毛
156536,668,厉害吧砸死了呀,厉害吧？！咋死的啊
156537,669,欧洲如果政府背兰电话唯一最可能就是法国法国人要钱不要脸的我告诉你,欧洲如果政府被蓝金黄唯一最可能就是法国啊，法国是要钱不要脸的我告
156538,670,很多人太清记中共了,很多人太亲近中共了
156539,671,他的留言挺好不是你的菜系,挺好啊”…“真的假不了假的真不
156540,672,过波波说,告诉你，很多
156541,673,真的假不了假的真不了国家人记住我是KFC KFC我记住了,真的假不了假的真不了”“郭先生记住我是KMC”，KMC我记住了
156542,674,Campeche记录了,C”，KMC我记住了
156543,675,神探柯南炸死吧,神探柯南“诈死吧
156544,676,清洁中国恐怖叫我要过战俘我是独立的外交政策,钱不要脸的就是法国我告诉你，非常不要脸的，而
156545,677,我要不让福,我告诉你，非
156546,678,到底什么意思,到底死没死
156547,679,欧洲国家怎么最要钱不要脸的就是这是法国这是非常不要脸,欧洲国家里边最要钱不要脸的就是法国我告诉你，非常不要
156548,680,每天的那个鼻子的儿子游山玩,每天硬着个鼻子“嗷嗷嗷”自由什
156549,681,非常糟糕的,非常糟糕的
156550,682,他们是最大的一个民主下的现在我告诉你,他们是最大的一个民主骗子现在我告诉
156551,683,我经历太多了,我经历的太多
156552,684,正式小子怀1万件大事有可能有可能了,政事小哥怀疑王健诈死”，有可能的有可
156553,685,这个是有点想我了就是现在,这个事有点悬乎了，就是现在一个
156554,686,一个就是把王健搞子这帮人,一个就是把王健搞死的这帮人
156555,687,那只有完结了梦见就能当做到这个全世界封杀,那只有王岐山孟建柱能做到这个全世界封杀
156556,688,然后转移视线,然后转移视线
156557,689,然后告诉我们的教室外的说为那些社交媒体的假假,然后搞泼墨门，然后叫海外这些所谓社交媒体的假的
156558,690,假假的一部分乱来然后替他办事,假的那部分乱来，然后替他们办事
156559,691,那么另外一个就是只有王健本人,那么另外一个就是只有王健本人
156560,692,黑盒眼睛细长眼这么好,合演这个戏才能演这么好
156561,693,大,演
156562,694,这这这是有意思了太有意思了太不正常了我再这个英国现在,这事有意思了太有意思了，太不正常了，我在这个英国现
156563,695,刚刚几个小时间我会去几个人啊,刚刚几个小时前，我派去几个人
156564,696,我让人去了看啥结果吧我提前给你爆料倒过来吧陈锋先让我的英国哪里去了,我让英国人去了，看啥结果吧，我提前给你们爆料，盗国贼们陈峰先生，我的英
156565,697,你有本事你把他们家人抓了我就不信我整不出你这样出来,你有本事你把他们家人给抓了，呵，我就不信我整不出你真
156566,698,有意思啊有意思了,有意思了有意思
156567,699,有意思了我要整治这样不拉倒,有意思了，我整不出真相不拉倒
156568,700,我也知道你的派出了三波人马又来了又到美国来搞我来了我清楚,我也知道你们派出了三拨人马又来了，又到美国来搞我来了，我清楚
156569,701,咱先不说他过两天我再抱你的料你看我咋陪你玩这场戏叫这个魔鬼的,咱先不说透，过两天我再爆你们的料，你看我咋陪你玩这场戏，跳这个魔鬼
156570,702,Tiger tiger,跳魔鬼的探戈
156571,703,给我玩那个,跟我玩这
156572,704,就你的人造阴劲,就你那个糙性劲
156573,705,陈先生你在中国你领海南岛铃铛东邪西毒0你给我,陈峰先生你在中国你灵，海南岛灵，当东邪西毒
156574,706,老玩这个正正道李政道主义,灵，你跟我玩这个正道主义玩国际
156575,707,国际化你太远了,国际化你差远了
156576,708,金蝉脱壳阿文件错了错了但是朝鲜是不说了吗,金蝉脱壳我念错了”，是错了，但是曹长青老先生不
156577,709,中国的这部都是都是那咱们老祖宗有点故意的就是坑我们老百姓吗,"中国的字不都是咱们老祖宗故意坑我们老百姓吗？


**50-60 小皮匠"
156578,710,那就给你经常坐车就不一样啊这个要注意说了没意思吗,是错了，但是曹长青老先生不是说了嘛，中国那字儿不都
156579,711,他们最近加大了对文贵的暗杀,的坑咱们老百姓嘛？就金蝉
156580,712,威胁下海新的一波来了,啊？就那绕嘴舌的，没啥意思嘛
156581,713,我幸福了,我兴奋
156582,714,最近有点平静有点平静啊相当平静在平行的会有点,最近有点平静，有点平静，相当平静啊，他平静的我有点
156583,715,不舒服了,不舒服啦
156584,716,现在让我感觉有战斗的感觉,现在让我感觉有战斗的感觉
156585,717,哎呀很好哎呀,哎呀，很好！哎呀
156586,718,这个有意思了这个有意思了,这个有意思了，这个有意思了
156587,719,咬文嚼字过去,咬文嚼字？郭
156588,720,这在什么原厂最61分,这个字啊，说他什么袁长
156589,721,他这个神经病他这个疯子,他是个神经病！他是个疯子！我
156590,722,我是在说的是骗子和个晚上都对不起个骗男孩子流氓家骗子一级片,我就在，说他是骗子，和郭宝胜，都对不起这骗子那俩字。流氓➕骗子，低级骗
156591,723,郭宝上海人那么深真的是不要脸到了极点,郭宝胜害人家那么深，真的是不要脸到了极点
156592,724,一定会给大家记住我一定要国宝上给你骗了你的钱我一定给你拿回去,一定会，给大家记住，我一定会让郭宝胜给你们骗的你们的钱，我一定给你拿
156593,725,我准备正常的朋友稍息我问你收到了没有啊,我给那杯骗钱的朋友捎信儿，我不知道你收到了没
156594,726,加拿大的朋友,加拿大的朋友
156595,727,郭宝胜骗你的钱如果是就你指定它,郭宝胜骗你的钱，如果是就你指定他
156596,728,是因为她挺文贵爆料你给我钱这钱你给我账号,他，因为他挺文贵、爆料，你给的钱，这钱，你给我账号
156597,729,你可以跟6怎么加上联系啊绿得下来我把钱还给你,你可以跟路德先生联系，我把钱还给你，我替他还了
156598,730,我替他完了,我替他还了
156599,731,我一定让托宝盛买了钱给出出来他帮我买了房子他买了棺材我的外观在买了,我一定让郭宝胜把这钱给吐出来。他不能说买了房子，他就是买了棺材我也
156600,732,局部一起打中文贵的名义去骗钱,"绝不允许他打着郭文贵的名义去骗钱。

"
156601,733,这就是我从头到尾一直说的任何人打着过为你看见我绝不允许,这就是我从头到尾一直说的，任何人打着郭文贵的名义骗钱，我绝不
156602,734,绝不允许,绝不允许
156603,735,我发个一个我要给你起诉你一个,我发现一个，我要给你起诉你一个
156604,736,过完让你记住我说的话你记住我说的话给我保证,郭宝胜你记住我说的话，你记住我说的话郭宝胜，啊
156605,737,还有这个原长风你这个神经病你这个就是烂人烂到家了我先一清北京说的缘,还有这个袁肠风儿，你这个神经病，你这个烂人烂到家了。我一听北京说的袁红
156606,738,要不明这个烂人家只是烂到家了对我人生适合物乳,袁红冰这个烂人简直是烂到家了！对我人生是个侮辱
156607,739,亲爱的我那个郭文贵,对我人生是个侮辱！竟
156608,740,你说我跟他道个人站在正汉子的题你们怎么无聊啊你说,你说我跟这盗国贼战得正酣之际，提你们，多无聊啊
156609,741,突然让我从几万米的高峰感觉突然间落到地上来了还占了医生,突然间我从几万米的高空感觉突然间落到地上来了，还沾了一身
156610,742,泥巴,泥巴
156611,743,把沾了一身屎不给你的了,巴，啊，沾了一身屎。不提你
156612,744,所以说啊现在用的这个这个世界真是太有意思了就是他,所以说啊，亲爱的战友们，这个事件真是太有意思了。就是他们
156613,745,他们跑到法国玩对吧,他们跑到法国玩这一把
156614,746,炸死呀好,诈死也好
156615,747,啊这个真实也好这毛啥呀好他走开启了,个真死也好，真谋杀也好，它都开启了海
156616,748,海航,海航
156617,749,不可逆转的,不可逆转的
156618,750,依法审查那个反打印后他们的黑发一黑之鬼警出来,以“法”分赃，这个法字打引号啊，他们的黑法，以黑治国、以警
156619,751,语法分章的计划他想求停不下来了,以“法”分赃的计划，他想停都停不下来了。股
156620,752,股票的回复的了吗,股票，能恢复得了
156621,753,王健你想的那个杀字出来我又回来了能吗不可能他装死了也得去,王健，明天能拿着扇子出来：我又回来了，能吗？不可能！他装死也得
156622,754,贞子他就真死了,真死他就真死了
156623,755,真是难得一战,真死他内战
156624,756,假使他不敢出来假戏真做但这个心里吓到我的钱是要要找到爱情,假死他不敢出来，假戏得真做，但这个戏得演，盗国贼这钱是要要的。盗国贼爱钱
156625,757,钱币爱的他妈的厉害,钱比爱他爹他妈都厉
156626,758,你要钱要自杀给他们必然分赃不均是必然,要资产。所以他们内斗是必然，分赃不均是必然
156627,759,最后导致上和那都是必然对我大打出手是必然,最后导致上层内斗是必然，最后大打出手是必然
156628,760,认识这个好这就是我要追求的定点爆破其中一个功能,必然，这多好，我就是我要追求的，定点爆破的其中一个功
156629,761,让他们内斗,让他们内斗
156630,762,好,好
156631,763,太好了,太好了
156632,764,哎呀我和凌波蝴蝶,就是我要追求的
156633,765,五毛不得好死,最后导致
156634,766,德国也是,斗是必
156635,767,德国也是德国人靠不住完全好处,导致上层内斗是必然，最后大打出
156636,768,高空的文贵坦软膏哈哈哈哈谢谢,个功能，让他们内斗！好，太好
156637,769,你看差什么远程不是那个长不是那个长是长子嫡长,"住，完全靠不住。


高空的文贵探戈，哈哈哈，谢谢。


袁长风儿，什"
156638,770,实体运会美国了又是明星鲜知道的大家明镜会成了美国财经杂志,尸体运回美国了，又是明镜先知道的，好家伙，明镜快成了美国财新杂志
156639,771,古典音乐吧,联姻了吧
156640,772,运到美国的更有意思了,运到美国就更有意思了
156641,773,三个礼拜几个毛那个丁一起啊,思了啊。咱们得拔几根毛
156642,774,太好了,太好了
156643,775,所以亲爱的战友们,所以亲爱的战友们
156644,776,这个在今天在太兴奋我在网上所有一些不该说话我我不能,这个，咱今天这个忒兴奋。再往下说我这有些不该说的话，我不能说
156645,777,能说话不能说下我打印好了这东西都不能说啊,能说呀，有些话不能说呀。我答应好的这东西都不
156646,778,想哥哥,先搁这
156647,779,这个图啊大家看一看,说呀。我答应好
156648,780,我给大家看一看他的看着像除了,我答应好的这东西都不能说。先搁
156649,781,这个教堂的上边是一个斜坡,这东西都不能说。先搁这儿吧
156650,782,这个鞋子是法国每年上很多人有很多这个自行车赛,有些话不能说呀。我答应好的这东西都不能说。先搁这儿
156651,783,喝这个奥林匹克自行车赛都在这个上面鞋子下来,些话不能说呀。我答应好的这东西都不能说。先搁这儿吧
156652,784,那个不是很高一下了以后这个后面是一个最大的那个薰衣草的一个一个一个种植,的话，我不能说呀，有些话不能说呀。我答应好的这东西都不能说。先搁这儿
156653,785,还有名,我答应
156654,786,这个教堂大家从这个只是从山上找到12个他那个房子付房的侧面,些不该说的话，我不能说呀，有些话不能说呀。我答应好的这东西都不能
156655,787,他的室友一圈都市圈图,能说呀，有些话不能说呀。
156656,788,然后他跳的那个地方啊,不能说呀。我答应好的
156657,789,这是胡扯这个这个我们人呢去看的时候说不好他说跳的地方旁边是说,这有些不该说的话，我不能说呀，有些话不能说呀。我答应好的
156658,790,这个人被几个中文拦着不让拍照,。我答应好的这东西都不能说。先搁这儿吧
156659,791,不让靠近他说你为他们玩游戏了你们都干嘛呢要结束了,些话不能说呀。我答应好的这东西都不能说。先搁这
156660,792,所以呀,说呀
156661,793,大家记住,今天这
156662,794,他这个道就是vaucluse这个地方,个忒兴奋。再往下说我这有些不该说
156663,795,所有的这些,说我这有些
156664,796,发生的事情,答应好的这东
156665,797,当地人比我们现在还有兴趣要知道原来没有现在都知道了想知道,兴奋。再往下说我这有些不该说的话，我不能说呀，有些话不能说呀。我答应好
156666,798,医院现在也被那么多人一车的医院也想到清楚咋回事了,呀，有些话不能说呀。我答应好的这东西都不能说。先搁这儿
156667,799,哎呀弄了参加巴黎,我答应好的这东西
156668,800,高尔夫巡回赛的人也很想知道,些话不能说呀。我答应好的这东西
156669,801,这个穿戴胸罩如果两个最好的根本去的,这有些不该说的话，我不能说呀，有些话不能说呀。我答应好的
156670,802,我不好意思说着中国安全部的绝对的最专业的长期的家族,我不能说呀，有些话不能说呀。我答应好的这东西都不能说
156671,803,一个上市公司这个公司的钱自信,应好的这东西都不能说。先搁这
156672,804,大个子带孩子,答应好的这
156673,805,腌大白子海南的公司他们在木兰岛,应好的这东西都不能说。先
156674,806,海南和南岛有个高尔夫球场,些话不能说呀。我答应好的这东
156675,807,中信很高的然后呢后来跟海好友合作可以说是海航强5号家族吧,再往下说我这有些不该说的话，我不能说呀，有些话不能说呀。我答应好
156676,808,做多年哥们他们也在,天这个忒兴奋。再往
156677,809,我这个是搞明白了这一下我搞明白原来这个,天这个忒兴奋。再往下说我这有些不该
156678,810,这个看全部十二局的局长,这东西都不能说。先搁这儿吧
156679,811,陶局长就是海南安全厅的厅长到了12局他去十二局以前是,呀，有些话不能说呀。我答应好的这东西都不能说。先搁这儿吧
156680,812,是谁那是林的我们林强就让哥哥林的是安全全局安全部的12句句长,能说呀，有些话不能说呀。我答应好的这东西都不能说。先搁
156681,813,安全部的十二局号称企业局也叫40年局专门联络马云的,不能说呀，有些话不能说呀。我答应好的这东西都不能
156682,814,中国企业家什么的我们盘古的这个项目就是被他给,能说呀。我答应好的这东西都不能说。先搁这儿
156683,815,找贷款,呀。我答应
156684,816,所谓的社会的社联人事,好的这东西都不能说。先搁这儿
156685,817,宙飞安全部的正式成员石家的宝石冠一世界杯的绑架的人,说呀，有些话不能说呀。我答应好的这东西都不能说。先搁这儿吧
156686,818,叫十二局于12日语,些不该说的话
156687,819,你你后来到了五局长去了,好了。所以亲爱的战友
156688,820,大保密局这是每天给抓领导搞民健保局,"得拔几根毛，弄点DNA去啊。


太好了。所以亲爱的战"
156689,821,本来就要当这个安全部的部长助理那后来呢这个他的这个因为他小舅子,爱的战友们，这个，咱今天这个忒兴奋。再往下说我这有些不该说的话
156690,822,他太太叫蔡蔡小红那么差小差是蔡司法部长蔡诚的你,们，这个，咱今天这个忒兴奋。再往下说我这有些不该说的话
156691,823,因为他的小舅子在香港菜要兰发生了这个间谍案就是住,以亲爱的战友们，这个，咱今天这个忒兴奋。再往下说
156692,824,祝英英国驻港的间发生见面就被抓了谁,战友们，这个，咱今天这个忒兴奋。再往下说我这有些不该说
156693,825,我的领导麻将怎么这给抓的好生领导带给我们的给抓的,爱的战友们，这个，咱今天这个忒兴奋。再往下说我这有些不该
156694,826,各位先生还有半瓶抓的所以他的灵力将复仇,个，咱今天这个忒兴奋。再往下说我这有些不该说的话
156695,827,结果临湘有就是没当中部长马强先生到了部长马建先生到了这个IP,今天这个忒兴奋。再往下说我这有些不该说的话，我不能说呀，有些话不能说呀。我答应好的这东西
156696,828,朱部长助理然后当副部长,话不能说呀。我答应好的这东
