id,index,content,proofed
155869,1,10号啊,10号
155870,2,尊敬的战友们好,尊敬的战友们好
155871,3,现在是美国纽约时间7月10号上午11点整,现在是美国纽约时间7月10号上午11点整
155872,4,文贵在国媒体,文贵在郭媒体
155873,5,跟大家聊天啊今天要聊得很轻松很轻松我不知道现在声音,"跟大家聊天。今天聊得很轻松，很轻松。


我今天轻松聊"
155874,6,怎么样啊声音怎么样,得很轻松，很轻
155875,7,画面怎么样了还没事,昨天跟大家聊天
155876,8,昨天我的衬衣给搞我的问题,昨天到现在发生好多事
155877,9,我秀直播没问题我现在说我领带有问题没有OK,开心。聊得特别开心。从昨天到现在发生好多事
155878,10,怎么你说完美国采取的不完美在用的怎么样声音怎么样声音小,普罗旺斯，还有巴黎，去了解一下王健先生拍照死，整个这一行程
155879,11,没事我大家,，我没跟大家
155880,12,我今天轻松聊天啊,多事情啊，经过了解，发
155881,13,声音大小没问题好的好的现在想啊,是昨天晚上到现在，发生的事有意思
155882,14,好好好收到了收到了啊现在想给你好好好,但是昨天晚上到现在，发生的事有
155883,15,还是右边升到大于左边声道,很有意思。但是昨天晚上到
155884,16,Rush,多事
155885,17,Draftsight,但是
155886,18,这是什么呀,很多事情啊
155887,19,Yes,意思
155888,20,跟你的balance,跟大家
155889,21,事情效果怎么样啊,事情啊，经过了解，发
155890,22,这个好,生的事
155891,23,现在怎么样现在怎么样呢,组人员去采访当时王健先
155892,24,我统领带着鞋,王健先生
155893,25,没有啊,的事有
155894,26,你看我看看叶吗,昨天晚上到
155895,27,你不要看我你看试一下,有意思。但是昨天晚上
155896,28,大好时令,多事情
155897,29,OK好,过了
155898,30,这样了昨天给大家聊天聊得特别开心你要聊天的开心,过了解，发现很有意思。但是昨天晚上到现在，发生的事
155899,31,这个是昨天都在发生好多事啊呀很热闹我先给大家报告一下,组人员去采访当时王健先生到达法国以后所见过的人。包
155900,32,两三天钱我送去了两组人员到法国普罗旺斯,两组人员去采访当时王健先生到达法国以后所
155901,33,还有巴黎,还有他
155902,34,去了解一下王健先生拍照是整个这一形成的这个,"了我在内部得到的信息是准确的。


就是王健先生在这"
155903,35,更多的细节,部得到的信息
155904,36,在这个昨天我播节目之前我们跟他讲很多事情啊我们经过了,在这一年多时间出国都必须经过国家特殊部门，包括安全部中纪委
155905,37,了解发现了很有意思,先生在这一年多时
155906,38,但是他昨天晚上到现在发生是有意思了就是我们去的两组人员器材,"到的信息是准确的。


就是王健先生在这一年多时间出国"
155907,39,采访当时王建先生到达这个法国以后说见过的人,陈峰先生。还有他们的现在几个核心官员，核
155908,40,包括在7月1号啊还有这个6月30号这个法,都是有人跟着的。包括陈峰先生。还有他
155909,41,法国巴黎这个高尔夫公开赛跟他接触的人还有他的活动,有人跟着的。包括陈峰先生。还有他们的现在几
155910,42,我们掌握了一个核心的信息证实了我的内部得到的信息是准确的旧王剑仙,委批准，都是有人跟着的。包括陈峰先生。还有他们的现在几个核心官
155911,43,先生在这一年多时间出国都必须经过国家特殊部门包括安全部中纪委批准,现在几个核心官员，核心领导吧，不叫官员，都是出国要经过申请，要有安全部和中纪委
155912,44,都是有人跟着的包括陈锋先生还有他们的现在几个核心观园,都是出国要经过申请，要有安全部和中纪委指定人员陪同。也
155913,45,核心领导干部的官员都是出国要经过申请要有安全部和,领导吧，不叫官员，都是出国要经过申请，要有安全部和中
155914,46,我和中纪委指定10元配种,和中纪委指定人员陪同
155915,47,也就是过去的爆料的一年多来他们所有到海外都有国家行,也就是过去这爆料的一年多来，他们所有到海外，都有国家情报
155916,48,情报人员监理人员跟谁,情报人员，间谍人员跟随
155917,49,也就是他们24小时他们和家人都是被监控状态这是经验可以说,也就是他们24小时他们和家人都是被监控状态，今天可以说这是
155918,50,我这是100%的,这是百分
155919,51,那么这件事情有意思了,那么这件事情有意思了
155920,52,当我们的人去查那个巴黎的团队阿信文艺小组件查的时候在基本上,当我们的人去查，巴黎的团队，其中一小组去查的时侯，在基本上了解了
155921,53,小姐了一些信息以后突然间,了解了一些信息以后，突然间
155922,54,决定的继续采访所有当然全部取消,决定了继续采访的所有当事人全部取消
155923,55,当事人有两个人打电话给我们的这个采访的人和了解事情人打电话威胁,当事人有两个人打电话给我们采访的人，或了解事情的人，打电话威胁
155924,56,如果你敢把我们的采访输入气如何如何如何按照法国法律如何如何,如果你敢把我们的采访说出去，如何如何如何，按照法国法律如何如何
155925,57,二姐不大如此,而且不但如此
155926,58,我们在采访中发现了被跟踪,我们的采访人发现了被跟踪
155927,59,在昨天晚上就发生了就是纽约时间昨天晚上的时候发生了,在纽约时间昨天晚上的时候发生了非常有意思的事情。在普罗旺
155928,60,非常有意思的事情在普罗旺斯马尼拉咱们就奔牛村我们两个好,非常有意思的事情。在普罗旺斯奔牛村，我们在那儿块旁边了
155929,61,他们了解的人跟所有的聊斋的分小组了解的人和了解到的,边了解的人，跟所有的在那小组了解的人和了解到的
155930,62,这个信息和我们看的报道完全不对卫视,的信息，和我们看到的报道，完全不是一回
155931,63,这个在有人看到王剑先生在下车前就打,回事。有人看到王健先生在下车前就大发脾气
155932,64,巴黎打电话,报道，完全
155933,65,R狂吗然后他会长离开旁边就去的话说他们有几个人,狂骂。然后他想离开去旁边去接电话的时候，旁
155934,66,视图跟着他有女的有男的但是还要往前走的时候这个还要跟着,试图跟着他，有女的有男的。当他要往前走的时候，这个人还要跟
155935,67,他要单独讲话,他要单独讲话
155936,68,而建王建先生的出门啊正是很大说这次正式并没那么大车辆,独讲话。而且王健先生出门阵势很大，这次阵势并没那么大。车
155937,69,车队也没那么好玩,车队也没那么豪华
155938,70,人很憔悴所有人见到她的人说从巴黎从这个普罗旺斯教堂,人很憔悴。所有人见到他的人说，从巴黎，从普罗旺斯见到
155939,71,把我的建了一个飞机运行公司的一个就是40个运输公司的老总还在,包括他见了一个飞机运行公司的，私人飞机运行公司的老总，还有个
155940,72,这个总裁,这个公司在
155941,73,啊这是个法国人这个公司的瑞士,这也是个法国人，这个公司在瑞士。他们
155942,74,他们也搞得很不开心很憔悴旁边人正时他情绪不好,他们也搞得很不开心，很憔悴。旁边人证实，他情绪不好
155943,75,身体状态不好而且好像大中午的就像喝多一样,身体状态不好。而且好像大中午的就像喝多一样
155944,76,那么这个我们采访的人同样的是在昨天打电话,"一样。


我们采访的人同样在昨天打电话，说"
155945,77,说说有你给我打电话信息都不能对二使用,说，我所有打电话的信息都不能对外使用
155946,78,要使用如何如何,要使用如何如何
155947,79,更重要的事情我们这位朋友香港来的他有家人在大陆,更重要的事情，我们这位朋友香港来的，他有家人在大陆
155948,80,昨天,昨天
155949,81,在跟我通电话的10分钟后,在跟我通电话的十分钟后
155950,82,他又给我打回来说刚才给你通电话期间我另外一个手机想在大陆的家人和亲人全被抓了,他又给我打回来，说刚才跟你通电话期间，我另外一个手机响。在大陆的家人和亲人全被抓了
155951,83,一个表情在海南的也被抓了,一个表亲在海南的，也被抓了
155952,84,在广州的家人被抓了,在广州的家人被抓了
155953,85,在被抓以后在被抓期间啊这个班牙中的给我打电话,在被抓以后被抓期间，关押状态，给他打电话
155954,86,让他不要掺和这种事情,让他不要掺乎这种事情
155955,87,说不要被郭文贵索利用,说不要被郭文贵所利用
155956,88,不要被海外势力所利华有意思了他们怎么知道事工,不要被海外势力所利用。有意思了。他们怎么知道是郭文
155957,89,我咋就成了海外敌对势力了呢,我咋就成了海外敌对势力了呢
155958,90,王建先生的事情杂志死难道不应该,王健先生的事情，他这死难道不应该
155959,91,这个是真相怕你知道吗,这个真相怕人知道吗
155960,92,不应该让你知道吗,不应该让人家知道
155961,93,所以呀,所以啊
155962,94,这个昨天晚上我就这个市啊大了这个是大了,这个昨天晚上我觉得这个事大了，这个事大
155963,95,那么据我们所了解其他的媒体,那么据我们所了解，其他的媒体
155964,96,其他的媒体也要去采访了同样的是被子植被威胁不敢来报道了,其他的媒体也有去采访的，同样的是被制止，被威胁，不敢再报道
155965,97,所以说什么叫媒体大家搞清楚,所以说什么叫“媒体”啊，大家搞清楚
155966,98,啥叫媒体呀中国这个媒体呀那个女字加一个木偶把这是什吗,啥叫“媒体”啊，中国这个媒体啊，那个女字加一个某，就是什么
155967,99,就是八卦的意思,就是八卦的意思
155968,100,这就媒体如果用不好就是倒霉的霉倒霉的霉一个火一个木,那叫“媒体”。如果用不好，就是倒煤的“煤”，一个火一个某，媒体
155969,101,媒体倒霉了,媒体“倒煤”了
155970,102,一个与这是一个媒体倒霉的媒体,一个雨字一个母，“霉体”，倒霉的“霉体
155971,103,啥叫政治媒体呀就是,啥叫政治媒体啊？就是
155972,104,为利益权利服务的叫政治媒体啊就财新胡舒立正好完全,为利益权利服务的叫政治媒体，就是财新胡舒立这号的。完全
155973,105,你知道的报导弹完全假象,第一知道，第一报道，完全假象。
155974,106,根本不存在医院的什么脚疼啊说我脚疼到了月经了医院是绝对没有这回事,根本不存在医院里脚疼啊，说我脚疼。到了医院去问了，医院说绝对没有这回事
155975,107,恰恰相反,恰恰相反
155976,108,说人,说，人
155977,109,这个是整个面部,整个面部，还
155978,110,啊还有这个身体状他们认为根本不是网件,部，还有身体状态，他们认为根本不是王健
155979,111,所以昨天有人都说他是是不是摔死的不是王建的,所以昨天有人就跟我说，他说是不是摔死了，不是王健
155980,112,因为当时认为有看说他们认为跟照片上的人不是一个人,因为当时有看到的人说，他们认为跟照片上的人不是一个人
155981,113,啊很有意思说可能就不是一个人说太不像了,很有意思，说可能就不是一个人。说太不像了
155982,114,啊而且都是谁是皇上说有一个中年男子,了。而且都是神色慌张。说有一个中年男子
155983,115,微博,微
155984,116,指挥到,指挥着
155985,117,根本不用管不让我,根本不让管不让
155986,118,而且是身体冰凉,而且是身体冰凉
155987,119,后面大山的雪姬,后边大滩血迹
155988,120,后面大山雪霁,后边大滩血迹
155989,121,啊,大滩
155990,122,我凭直观我感觉他好像是被动技术上,我凭直观我感觉好像是被钝器所伤，还
155991,123,还有演戏的说这个学校真的没血身上就没血,还有演戏的说这下边根本没血，身上根本没血。就
155992,124,这上面有水晶,上边有血迹。所以
155993,125,所以更开心的报导什么到了医院了我腿疼根本不穿就不可能说话人都凉了还说什么,所以跟财新的报道说到了医院了我腿疼，根本不可能说话，人都凉了还说什么话啊。而且
155994,126,说什么话呀,说什么话啊
155995,127,我就说这个香港有帮忙的人他培训是不让碰,而且说现场有帮忙的人，他们训斥不让碰
155996,128,你叫大吗,叫，大骂
155997,129,我的男人要穿越剧为啥你就不让旧呢,我就纳闷了，人要摔下去，为啥救都不让救呢
155998,130,上亿的手机没有,场一滴血迹没有
155999,131,为什么只有上面有血压还是破的一个修士之阿,为什么只有上边有血啊？还是泼的西红柿汁啊
156000,132,为什么不让你看呢,为什么不让人看呢
156001,133,为什么开心的事知道了,为什么财新第一时间
156002,134,什么是知道的呀,什么时候知道的啊
156003,135,7月1号的上午忙呢还在吧里呢,7月1号的上午王健还在巴黎呢
156004,136,2号干嘛去了,2号干嘛去了
156005,137,这谁家那去瑞士银行签是什么文件呢,？跟谁见了？去瑞士银行签的什么文件啊
156006,138,去瑞士四季酒店里面跟谁家里面呢,去瑞士四季酒店里面跟谁见的面
156007,139,为什么这旁边这几个人这么样的就把房间给挟持一般不允许间接触然后,为什么这旁边这几个人这样的就把王健给挟持一般，不允许别人接触，然后
156008,140,王建跟江江的时候旁边有人这个这个,王健跟人见面的时候旁边有人，别
156009,141,不要说打电话了你也看了不让看站着躺着去还是什么时候接了,别说打电话了，连看都不让看，站着挡着，去完成什么手续去了？是
156010,142,这不多什么时候休息了,着，去完成什么手续
156011,143,这样中间给德国人家里面,中间跟德国人见了面，还
156012,144,还有俄罗斯人,还有俄罗斯人
156013,145,几个了三家里面,几个俄罗斯人见了面
156014,146,而且这中间有最起码两个三次,而且这中间有最起码两到三次
156015,147,就在见面的时候,就在见面的时候
156016,148,中间,中间
156017,149,就在这个四季酒店旁边那个酒吧里面就有喝药的这个这个过程,就在四季酒店旁边那个酒吧里面就有喝药的过程。他得了什么病喝
156018,150,太得了什么病还要呢,。他得了什么病喝药啊
156019,151,这些都成秘密了,这些都成秘密啦
156020,152,能听明白吗在中国的城为秘密在西方不可能,能成秘密吗？在中国他成为秘密，在西方不可能
156021,153,那为什么我们的人去,那为什么我们的人去
156022,154,茶具要抓进来呀,查去要抓起来啊
156023,155,啊,啊
156024,156,怕工绘制了光棍能知道这个大家怎么能知道你怕什么呀,"怕郭文贵知道？郭文贵能知道那大家都能知道，你怕什么呀？


这个"
156025,157,这个事情从现在来看,这个事情从现在来看
156026,158,那绝对不是所谓的,他绝对不是所谓的
156027,159,拍照死,拍照死
156028,160,绝对不是的所谓的这个冲上外墙从来强摔到了围墙,绝对不是所谓的冲上矮墙，从矮墙摔到了围墙，从围
156029,161,冲围墙到帅的烦死了手机你根本不可能,围墙，从围墙摔下去了十几米，根本不可能
156030,162,绝对不可能,绝对不可能
156031,163,二宿根据目前王建军人一年多了出门全有国宝安全人员的这,而且根据目前王健先生这一年多来出门全有国保，安全人员
156032,164,这个随从那事情就更不简单了那就随时,随从，那事情就更不简单了，那就随时
156033,165,可以让你的四个种方式锁,可以让你死，各种方式死
156034,166,他为啥不选择美国,他为啥不选择在美国
156035,167,为什么不选择西雅图案的,为什么不选择在西雅图
156036,168,为什么哑巴黎赛跑了破了王子不然你,为什么在巴黎死，而跑到了普罗旺斯
156037,169,这个叫他们太熟了就能爬上全是薰衣草特别漂亮,这个教堂我太熟了，教堂旁边全是薰衣草，特别漂亮。据
156038,170,治疗点就那个区从来没有人说穿墙子跳过围墙,漂亮。据了解就那个区，从来没有人跳过围墙死。王
156039,171,梦见自杀的可能性根本没有,先生自杀的可能性根本没有
156040,172,不可能,不可能
156041,173,他的妻子和他的弟弟,他的妻子和他的弟弟
156042,174,啊这个区到这个法国的时候全部都是有人跟踪的全部有人跟踪的十几个人,的妻子和他的弟弟，去到法国的时候全部都是有人跟踪的。全部都有人跟踪，十几个
156043,175,说最起码一般是国家政府派出来的,人。最起码一半的人是国家政府派出
156044,176,为什么王健先生之子享受了党和国家领导人待遇是被挟持状态,为什么王健之死享受了党和国家领导人待遇，是被挟持状态。这里面
156045,177,这里玩的文章可大了去了,这里面的文章可大了去了
156046,178,那么我们在家上海可没女孩,那么我们再结合一下上海
156047,179,说拿的没屁啊,说，拿着墨，啪
156048,180,苦了你了我恨你,近平的，我恨你
156049,181,啊这不知道这个这个是习近平自我恨你们脑控我,我恨你”，“海航是习近平的，我恨你们脑控我
156050,182,儿子闹空了这个这个女孩被脑控了较懂什么琼瑶等琼瑶啊,控我”。是脑控了，这个女孩儿被脑控了，叫董琼瑶，不是董琼瑶啊
156051,183,不是董琼瑶啊,不是董琼瑶啊
156052,184,干什么呀,什么瑶
156053,185,不上去,上去
156054,186,没人如入无人之地那个时候还行的大男士被关闭状态她怎么进去的,上去，如入无人之地。那个时候海航大门还是被关闭状态，她怎么进去的？这个
156055,187,这个不知道他是被脑控被脑控谁脑复他那那是肯定共产党,这个不知道。她是被脑控，被脑控，谁脑控她呢？那肯定共产
156056,188,中国没有国民党,中国没有国民党
156057,189,有没有民主党,有民主党，那
156058,190,那是国家安全部人或者二部的人,那是国家安全部的人或者二部的人
156059,191,这叫人脑控他让他就破习近平能不能老公他,这些人脑控她，让她去泼习近平，能不能脑控她
156060,192,在指定的时间指定的地点说指定的话呢,在指定的时间，指定的地点，说指定的话呢
156061,193,他竟然被脑控了再说的话我们能信吗,她既然被脑控了，她说的话我们还能信吗
156062,194,老公权力机构习近平今年在中国有超过50年,国家权力机构，习近平今天在中国已经超过50
156063,195,他怎么让人脑控这个洞琼瑶和她自己的漠然后吧,他怎么让人脑控这个董瑶琼泼他自己的墨，然后把
156064,196,太好说他自己的,说成是他自己的
156065,197,有意思啊那说明党内心的很多人要反习近平,有意思。那说明党内现在很多人要反习近平
156066,198,这个海航是不是习近平的我最有资格说,这个海航是不是习近平的，我最有资格说
156067,199,这咋就没有王岐山的说了呢,这咋就没有王岐山的事了呢
156068,200,咋就没有这个姚明珊的智能咋就这个脑控不能脑控呀,咋就没有姚明珊的事了呢？咋就不能脑控不能脑控一下
156069,201,要说出刘呈杰的爹是谁呢,说出刘呈杰他爹是谁呢
156070,202,咱就不能照顾一下说说,咋就不能脑控一下说出
156071,203,这冠军的爹是谁呢,呈杰他爹是谁呢
156072,204,还有意思啊老婆为啥不老公让她老公一样王健,呢？哎有意思啊。那脑控为啥不脑控一下王健
156073,205,陈峰,陈峰
156074,206,他孩子,他孩子
156075,207,王伟,王伟
156076,208,谭向东,谭向东
156077,209,阳光大海外的这儿钱给遥控遥控一下不就完了吗就老婆这个小女孩,杨光，把海外的账号的钱给脑控一下不就完了吗？就脑控这个小女孩儿
156078,210,让他来说出这个海航是习近平的儿子是在习近平的政府范围内他,让她来说出这个海航是习近平的。而且是在习近平的政府范围内，她
156079,211,法国冰岛会是习近平淡的在上海,法国被脑控是习近平干的。在上海
156080,212,被关掉的大门上海海行的总部在王建死的同时指出海航事,被关掉的大门，上海海航的总部，在王健死的同时，指出海航是习
156081,213,习近平的这有意思了王岐山的本事和梦见日本是超出了我的想想,习近平的，这有意思了。王岐山的本事和孟建柱的本事超出了我的想象
156082,214,这就像多年来海外华喜铺天盖地没有人骂王岐山更美,这就是多年来海外骂习铺天盖地，没有人骂王岐山，更没
156083,215,没有人骂孟建柱谁都知道709律师是谁抓的孟建柱抓的,没有人骂孟建柱。谁都知道709律师谁抓的？孟建柱抓的
156084,216,百万贪官被抓的最近买一份被仰望的吧或者是一大多半是被虐待吗,百万贪官被抓的最起码一半是被冤枉的吧，或者是一大多半是被虐待
156085,217,蛇大作战是被酷刑的吧谁干的王岐山干的,一大多半是被酷刑了吧，谁干的，王岐山干
156086,218,当然数一者是由习近平了,当然受益者是有习近平了
156087,219,整个问老师说呀,整个共产党都受益
156088,220,斗破人数格式为什么没有人说王岐山孟建柱那傅政华也没人说所以就是说,盗国贼受益。可是为什么没人说王岐山孟建柱呢？傅政华也没人说，孙立军也
156089,221,今天有的10本书,孙立军也没人说
156090,222,高智晟去都已经丢失了多少多长时间了修吃了王全璋,高智晟都已经丢失多长时间了，消失了。王全璋消失了
156091,223,没人问,没人问
156092,224,为啥不脑空一下呢,为啥不脑控一下呢
156093,225,干嘛呢老公的就完了吗给习近平和王岐山,干嘛消失啊，脑控他不就完了嘛。歌颂习近平
156094,226,这女孩老哭了习近平啊什么逻辑呀,这女孩儿她就脑控了泼习近平了，什
156095,227,什么逻辑呀,什么逻辑啊
156096,228,这么能老公老公家川普总统的跟中国外贸易做个交易吗,"这么能脑控，脑控一下川普总统嘛，跟中国贸易做个交易嘛。

"
156097,229,昨天我跟班同学生我们是吃午饭我们吃了五六个小时国际形势正在发生,昨天我跟班农先生吃午饭，吃了五六个小时。国际形势正在发生
156098,230,巨大变化英国现在要现在导弹和要把这个妹啊总理我感觉好,巨大变化，英国现在要弹劾，要把这个梅，总理要干掉。日本
156099,231,日本要弹劾,日本也要弹
156100,232,川普总统治来发动这个半龙虾能跟川普中的发动场巨大的事,川普总统正在发动一场巨大的世界级的革命。那为啥不能脑控
156101,233,世界级的革命,世界级的革命
156102,234,为啥不能老婆加班农先生呢,为啥不能脑控一下班农先生呢
156103,235,脑空白头和川普先生把这个贸易战情不就完了吗把美金都会说的,脑控班农和川普总统把这个贸易战停了不就完了吗，把美金都
156104,236,中国人就这么倒霉吧,中国人去，送给盗国贼
156105,237,由于这件事情,由于这件事情
156106,238,跟昨天一结合,跟昨天一结合
156107,239,我跟几个朋友聊聊天,我跟几个朋友聊了聊天
156108,240,大型的一下,打听了一下
156109,241,我茅塞顿开呀,我茅塞顿开啊
156110,242,中国要出大圣我们好日子来了,中国要出大事，我们好日子来了
156111,243,为什么说明习近平根本控制不了中国的所有权利不像他显上的样他都控制,为什么？说明习近平根本控制不了中国的所有权力，不像他想象的那样，他都
156112,244,这一系列的时间证明党内的斗争正在感染网,这一系列的事件证明，党内的斗争正在白热
156113,245,这一学生证明中国的情报机构,这一系列的事情证明，中国的情报机构
156114,246,海外的,海外的
156115,247,所有的间谍系统,所有的间谍系统
156116,248,海外的所谓的这个承诺的力量,海外的所谓的沉默的力量，不在
156117,249,不在习近平100%控制制度,不在习近平百分之百控制
156118,250,特别是旧社交媒体沙就是社交媒体社交啊另外一个社,特别是社交媒体，啥叫社交媒体呀，“射交”啊，另外一个“射
156119,251,社交媒体,社交媒体
156120,252,社交媒体基本上是广告媒体排毒一个就真相,射交媒体基本上是广告媒体，还有一个就
156121,253,这叫真相媒体,就叫真相媒
156122,254,不是政治媒体,不是政治媒体
156123,255,不是专门为政治利益服务的,不是专门为政治利益服务的
156124,256,叫社交媒体,叫社交媒体
156125,257,为政治利益服务的政治媒体,为政治利益服务的那叫政治媒
156126,258,所以呀,所以啊
