id,index,content,proofed
156127,259,这个有意思了这个有意思了啊这回咱这真看到希望了也就是说他们,这个有意思了，这个有意思了。这回咱可真看到希望了。也就是说他们
156128,260,那你来好了,架去才好呢
156129,261,全中国的木耳都会配合习近平,全中国的墨都泼给习近平才
156130,262,还好呢,才好呢
156131,263,如果有人感觉不过我拿钱你不知道没什么报销了我愿意,如果有人敢去泼墨我拿钱，你泼多少墨上我这儿报销来，我愿意
156132,264,但我从来没有今天那么幸福啊我昨天在法国发生的事情,但我从来没像今天这么兴奋啊。昨天在法国发生的事
156133,265,我感受到海航事件要鲍菇,我感受到，海航事件要爆锅
156134,266,这个锅爆炸了不是咱不过是抱箍,这个锅要爆炸了，不是砸锅是爆锅
156135,267,要出大事,要出大事
156136,268,海航事件真相又出来了,海航事件真相要出来了
156137,269,估计流程你的爹不用我说就是说了,估计刘呈杰他爹不用我说都有
156138,270,这个有意思了,这个有意思了
156139,271,这说明什么问题呀战友们,这说明了什么问题啊，战友们
156140,272,我们的爆料革命将要开花结果,我们的爆料革命将要开花结果
156141,273,我们的爆料革命比我们想象的知道的还厉害,我们的爆料革命比我们想象的，知道的还厉害
156142,274,就到这倒霉的位置,就对盗国贼的威慑
156143,275,对乌托邦的共产党的,对乌托邦，对共产党的
156144,276,带来的影响超出了王力下降,带来的影响，超出了我们的想象
156145,277,就我们个人,就我们个人
156146,278,国家那么多媒体都被干掉了不敢说不敢采访记者采访,国际上那么多媒体都被干掉了，不敢说，不敢采访，拒绝采访
156147,279,但是我们还有两个信息几个小毛孩子的一份是,但是我们派去了几个小毛孩子可以说是，竟然是大动
156148,280,竟然是大动干戈海男篮圈听广东安全听出吗,竟然是大动干戈，海航安全厅，广东安全厅出马
156149,281,Bus,不
156150,282,房间镜头抓了作为绑票,房亲戚都抓了，作为绑票
156151,283,不允许让贵爆料,不允许让郭文贵爆
156152,284,提醒了什么事情,提醒了什么事情
156153,285,这里面有大问题有大毛呢有大故事,这里面有大问题，有大猫腻，有大故事，更
156154,286,都有真相,有真相
156155,287,所以呀王建先生死就像我两天前和几天前在群里说的,所以呀，王建先生的死，就像我两天前和几天前在群里说的
156156,288,是爆料革命一个新的开始,是爆料革命一个新的开始
156157,289,报料革命的新纪元,爆料革命的新纪元
156158,290,将提早结束到国贼到国的,将提早结束盗国贼盗国的
156159,291,这个计划,这个计划
156160,292,会稽简述核爆料跟着的果实,会提前收割爆料革命的果实
156161,293,大乐透明来点苹果你不要来了想了一下啊,赖建平，郭宝胜，你们不要来了啊，相林先
156162,294,东京爆料中心鲍学中心你们就变成了这事实证明美你们是啊你们的都拿走了,东京爆料中心，爆协中心，你们就别收了。这事实证明没你们的事啊。你们要拿走也
156163,295,那种,中
156164,296,你们两个老总的不着,你们连个毛都摸不着
156165,297,你是在网就估计啊你说赶快的,你去采访去，估计呀，人家就说，快
156166,298,知道你们是干啥的,知道你们是干啥的
156167,299,100000美元的把酷宝上就给买菜了是吧没什么就是个骗子吗,"的。十万美元就把郭宝胜给买下了。


郭宝胜不就是个骗子"
156168,300,姚明不就是个骗子来证明不就是个大骗子吗你们这帮骗子,袁红兵不就是个骗子吗？赖建平不就是个大骗子吗？你们这
156169,301,你们这边拉不说话了爆料吧王家怎么死报不报啊,你们这帮人咋不说话啦，爆料啊，王建怎么死的，爆啊！不爆
156170,302,你去巴黎呀你买了机票过年,你去巴黎呀你，你买得起机票吗你
156171,303,你去不了啊,你去巴黎呀
156172,304,教育场所以,居在哪儿了呢！所以
156173,305,这一次王建先生的非正常死亡拍照,以这次王建先生的非正常死亡，拍照
156174,306,对海内外谁真正的反斗乐得,对海内外谁真正的反盗国
156175,307,谁是盗国贼谁是到过这个帮凶,谁是盗国贼，谁是盗国贼的帮凶
156176,308,大家都会看到真相了,大家都会看到真相的
156177,309,从这个所有的社交媒体真相媒体真相媒体技能,从这个所有的社交媒体，真相媒体，真相媒体既能
156178,310,找到反斗破里的景象也能找到帮到我这个景象,找到反盗国贼的真相，也能看到帮盗国贼的真相
156179,311,从这个是想大家看的很清楚,从这个事情上，大家看得很清楚
156180,312,这么大的事情,这么大的事件
156181,313,多少人不说,多少人不说
156182,314,啊,大的
156183,315,这个不管是还在哪家包括的宁静我是好久都忘了你已经了昨天晚上我上你们,这个不管是海外哪家，包括那个明镜。我都好久，我都忘了明镜了。昨天晚上
156184,316,明镜看了看停产的证明天我看几乎们看了啊不是看说的这是都是云里雾里,明镜看了看，挺惨的哈，这明镜几乎没人看了哈。没人看了，说的这事都是云里雾里
156185,317,大云林布里边,云里雾里边
156186,318,头两天有人过说的明星的是我还有点不信但这个还行的事情我还真是有点,头两天有人跟我说点儿明镜的事，我还有点儿不信，但是这个海航的事情，我还
156187,319,喂看那个报道这个这个是有意思了,我一看这个报道，这个事有意思啦
156188,320,明镜没有把这个事情的重点也不想说重点更不要追求真相,明镜没有把这个事情的重点，也不想说重点，更不要追求真相
156189,321,我们的小斑马先生现在,我们的小斑马先生，现在
156190,322,也要不要不去我妈妈有点变了变我想变成小包子了啊,有点儿变了，小斑马变了，想变成小豹子了，好家
156191,323,所以呀大家进来看明白了,所以呀，大家现在看明白了
156192,324,王建先生的事情要打我,王建先生的事情要爆
156193,325,王健林先生的事件,王建先生的事件
156194,326,要不行,要爆棚
156195,327,爆料,爆料
156196,328,王建先生的世界,王建先生的事件
156197,329,拍照死的世界将是中国所有的人都感到恐惧和害怕,拍照死的事件，将使中国所有的人都感到恐惧和害
156198,330,我们是羊的民族吗,我们是羊的民族吗
156199,331,但是以讲有说个真感到他的血是真害怕,但是羊有时候真感到看到血的时候，真害
156200,332,不管这种吃草了,不光低头吃草了
156201,333,王建拍照死事件绝对是一个分水岭,王建拍照死事件绝对是一个分水岭
156202,334,中国的私营企业家,中国的私营企业家
156203,335,看到了自己的未来,看到了自己的未来
156204,336,我相信从王家祥的拍照,我相信，从王建先生拍照
156205,337,大笑马云娜,道王建拍
156206,338,许家印的王健林呢,许家印，王健林
156207,339,不知道王健拍照死了王林VS了现在就是加几个王先生,被癌死了。现在就剩加起来王健林先生。还有什
156208,340,还有什么同志讲讲人啊是吧这么多人,还有什么卢志强先生啊？这么多人
156209,341,这么多大老板,这么多大老板
156210,342,未来谁敢去普罗旺斯,未来谁还敢去普罗旺斯
156211,343,谁是去法国呀谁敢出门了更壮的事情据我最近才了解到,谁还敢去随便出门呀。更重要的事情，据我最近才了解到，所
156212,344,自所有巨额贷款的老板,所有巨额贷款的老板
156213,345,刚跟我说点老板家人,刚才我说的这老板，家人
156214,346,和他本人不允许随便出国,和他本人不允许随便出国
156215,347,所有事我都要有国家指定人员陪同,所有出国都要有国家指定人员陪同
156216,348,儿歌不允许全家同时出国,不允许全家同时出国
156217,349,哎哟这个有意思了这个有意思了这不叫文化大革命,哎呦，这可有意思啦，这可有意思啦。这不叫文化大革命，这是
156218,350,这是新一种形势下的中国的,这是新一种形式下的中国的
156219,351,自由社会主义特色的,具有社会主义特色的
156220,352,绑架革命,绑架革命
156221,353,有意思,有意思
156222,354,啊这个文贵这个情报工作没做好,这个，文贵这个情报工作没做好
156223,355,哎呀这几天我才了解到原来是所有这些人再过几年里出国全部都有纸,哎呦，这几天我才了解到，原来所有这些人在过去一年里出国，全部都由指
156224,356,指定的国宝,指定的国宝
156225,357,和国家指定部门人或者当地大使馆派出的著的情报人员配种,国家指定部门的人，或者当地大使馆派出的驻地情报人员陪同
156226,358,二姐家人不能共同出国必须一半留在国内,而且家人不能共同出国，必须一半儿人留在国
156227,359,实际上已经抓了什么过去的历史当中叫什么制止,实际上已经过去的历史当中叫什么质子，把自
156228,360,大侄子把自己的王子拍到最后就放过去这个质押的王子表达我对你,当中叫什么质子，把自己的王子派到对方国去做一个质押的王子，表达我对
156229,361,你的和平和对你的善意和我的承诺,你的和平，和对你的善意，和我的承诺
156230,362,现在已经什么所有的野富豪的家人全变成质子了,现在已经什么，所有的这些富豪家人全变成质子了
156231,363,前面的人质了,墙死，这里边
156232,364,那王健先生在这种情况下,那王建先生，在这种情况下
156233,365,能这个牌照条围墙死这里吧有意思了是,能这个拍照死，跳围墙死，这里边儿有意
156234,366,共产党派出人们这是执着呢,共产党派出的人们失职呢
156235,367,孩子能给杀掉了呢还是做掉了呢还是陈峰先生要灭掉这个,还是人们给杀掉了呢？还是给做掉了呢？还是陈峰先生要灭掉
156236,368,最近的半年内核在已经是四核的脸在海航内部大打出手,最近这半年内和他已经撕破了脸，在海航内部大打出手
156237,369,中董事长媳为争股权你死我活,争董事长席位，争股权，你死我活
156238,370,还是他买通了内部人员或者是王岐山认为他的秘书成分更可欣,还是他买通了内部人员。或者是王岐山认为他的秘书陈峰更可信
156239,371,把他干掉了呢还是王健健身过去帮助的这样的这世界是生子,把他干掉了呢？还是王建先生过去帮助的养的这些私生子和
156240,372,后面这些盗国贼,后面的这些盗国贼
156241,373,力与不平衡导致的结果呢而杀人灭口,利益不平衡导致的结果呢？而杀人灭口
156242,374,更重要的事情是为什么不要把这个股权都转回香港完成之后的几,更重要的事情，为什么要把这个股权都转回香港完成之后的几
156243,375,几天内他就死了,几天内他就死了
156244,376,而且是7月3号,而且是7月3号
156245,377,这种带有惩罚警告威胁性的这种,这种带有惩罚，警告，威胁性的这种
156246,378,必杀,必杀
156247,379,秒杀,秒杀
156248,380,这宣道是的,种宣告式的
156249,381,谁有这本事只有王岐山和孟建柱,谁有这个本事，只有王岐山和孟建柱
156250,382,王岐山孟建柱傅政华孙立军,王岐山，孟建柱，傅政华，孙立军
156251,383,阿完全部都没有这号人性的安全部不存在这号人,全部都没有这号人现在，安全部不存在这号人
156252,384,这就是这样故事现在太有意思了,这就是这件故事现在。太有意思了。
156253,385,在永乐,在这
156254,386,想想这有意思啊,想想这有意思啊
156255,387,Goyard,要的
156256,388,大家看到,大家也要看
156257,389,海航的所有的贷款,海航的所有的贷款
156258,390,和最近人民银行中国银行的发布的,和最近人民银行，中国银行给他发布的
156259,391,要限期交回,要限期交回
156260,392,大环伟,贷款，和
156261,393,多米音乐器的款项,多笔已逾期的款项
156262,394,这是昨天我知道了,这是昨天我知道的
156263,395,这在一个月以前发的,这是在一个月以前发的
156264,396,并且,并且
156265,397,太行的多个在香港间结合操纵的控股的股票都是暴跌,航的多个在香港间接和操纵的和控股的股票都是暴跌
156266,398,就像我昨天说的这个几个盗国贼是橙子的原来的账号,就像我昨天说的，这几个盗国贼和私生子的原来帐号
156267,399,海外账号钱全部转走了,海外帐号的钱全部转走了
156268,400,包括在对面的房子的资产,包括在对面这个房子的资产
156269,401,我这这两天查我才发现房产的控股公司也变了,我这两天才查，我才发现房产的控股公司也变了
156270,402,原来在这个60 61集,原来在这个61街
156271,403,买了一个2亿多美金的房子,买了一个二亿多美金的房子
156272,404,这个房子也转完了,这个房子也转完了
156273,405,转给别人,转给别人
156274,406,但是,但是
156275,407,据我了解海航和给人民航,据我了解海航给人民银
156276,408,啊,安
156277,409,给这个贷款行给安全不给中办,给贷款航，给安全部，给中办
156278,410,写得害国家安全委写的关于海航资产处理的方案和最近处理方案,中办和国家安全委写的关于海航资产处理的方案和最近处理方案的
156279,411,进程这个报告中完全媒体电视,进程这个报告中完全没提这些事
156280,412,太不可能的,他也不可能
156281,413,那说明了什么,那说明了什么
156282,414,再次在昨天在今天证明,再次在昨天在今天证明
156283,415,王健先生,王建先生
156284,416,很可能是因为,很可能是因为
156285,417,他知道的太多,他知道的太多
156286,418,以及河海航陈峰先生和王岐山的这个有亲有劲它属于远过,以及和海航陈峰先生和王岐山的有亲有近他属于外边
156287,419,他的大运的,他的代孕的
156288,420,功能已经完毕孩子该生下来了该剪脐带了,功能已经完毕，孩子该生下来了，该剪脐带了
156289,421,他完成了他的工作同时在这都是威胁,他完成了他的工作。同时带的都是威胁
156290,422,二觉叫他灭口,而且叫他灭口
156291,423,可以,可以
156292,424,简晚政治势制止,减缓，甚至是制止
156293,425,美国及欧洲即将展开对他们的仪器人调查,美国及欧洲即将展开对他们一系列的调查
156294,426,国内,国内
156295,427,他们的政治最里面,他们的政治对立面
156296,428,我相信是习近平先生要针对海行全面调查,我相信是习近平先生，要针对海航全面调
156297,429,会抓老鼠的这是一个最好的,，派专案小组的，这是一个最好的
156298,430,一个质子,一个制止
156299,431,止血,止血
156300,432,我上星期才知道,我上星期才知道
156301,433,习近平先生这是第5次签署了最海航,习近平先生这是第5次签署了对海航
156302,434,即进行全面调查的这个,进行全面调查的这个
156303,435,只是,指示
156304,436,就在签署这个只是之后,就在他签署这个指示之后
156305,437,海航,海航
156306,438,这个王这些是拍照时关见证人操盘手,这个王健先生拍照死。关键证人操盘手
156307,439,现在乘风先生安全了,现在陈峰先生安全了
156308,440,他瓦王岐山先生成了,他和王岐山先生成了海
156309,441,海航,海航
156310,442,为国家海外情报工作海外一带一路工程所做巨大,为国家海外情报工作，海外一带一路工程，所做巨大
156311,443,中心可可心,忠心和可信
156312,444,什么坏事都是王建行干,什么坏事都是王健先
156313,445,另外一个,另外一个
156314,446,王建先生的拍照,王健先生的拍照
156315,447,教海外的很多职场的处理,将海外的很多资产的处理
156316,448,加速滑,加速化
156317,449,二就是,而且失
156318,450,失控的责任不在乘风,失控的责任不在陈峰
156319,451,夜不再现在活动的车还行结这个人试音王健,也不在现在活着的海航的任何人之一。是因王健
156320,452,突然而死,突然而死
156321,453,导致的乱句,导致的乱局
156322,454,最后是什么是因为你习近平的批示,最后是什么，是因为你习近平的批示
156323,455,导致了海航的猝然死亡,导致了海航的猝然死亡
156324,456,王建的拍照和,王健的拍照
156325,457,导致了在国际上的信誉度降低,导致了在国际上的信用度降低
156326,458,雅虎中国政府的内部调查导致了海航的兽性这个资金链的推断,后中国政府的内部调查导致了海航的授信，这个资金链的脆断
156327,459,最后海航集团也处死了,最后海航集团也猝死了
156328,460,还好一处死这几万一不用还了,海航一猝死，这几万亿不用还了
156329,461,狗啊,高啊
156330,462,狗,高啊
156331,463,盗国贼,盗国贼
156332,464,我小看你们了,我小看你们了
156333,465,你不是读博什的,你们是盗国神
156334,466,王岐山见什么都想下载,王岐山先生，我能想现在
156335,467,你的手啊,你们是盗
156336,468,你这样我的专制还是这样,能想现在，举着手这样
156337,469,等我三亚,样摸三下
156338,470,三亚然后再拿一下就其,三下，然后再拉一下，叫七三
156339,471,3D量下你说跟我斗,说：“丫挺的，你想跟我斗
156340,472,高兴啊高兴,高兴啊，得高兴
156341,473,我能想到梦见路线生说当当当当当抢着现在肌肉少了肌肉已经,我能想到孟建柱先生，当当当当，这样敲着桌子，现在肌肉少了
156342,474,也少了想谁分跟我都谁在哪个力量可以用,了。谁谁谁，想跟我斗，哪个力量可以用，好啊，王
156343,475,好啊,好啊
156344,476,王静安先生希望你身体健健康康的,王岐山先生希望你的身体健健康康
156345,477,能加入先生你身体健的刚刚的棒棒的,先生，你身体健健康康的，身体棒棒的
156346,478,傅政华现在旁边多了好几个警卫,傅政华先生现在身边多了好几个警
156347,479,多了几个拿枪的所以你就是现在天天带着香港,多了几个拿枪的。孙立军现在天天待在香港
156348,480,保护刘特佐了,保护刘特佐呢
156349,481,孙立军,孙立军
156350,482,帮助,帮助
156351,483,孟建柱养了的是生死流厕所在香港澳门上海,孟建柱的私生子刘特佐在香港，澳门，上海
156352,484,大家都看到爸爸了吧,大家都看到报道了
156353,485,王岐山和孟建柱大家所有的行为看到了,王岐山和孟建柱大家所有的行为看到了
156354,486,海航的世界将然处死现在的房间太热死将导致海航,海航的事件，将要猝死。现在的王健拍照死，将导致海航
156355,487,行到处死,将要猝死
156356,488,海航到处是就是烂账滥造就是一塌糊涂糊涂了浑水不但,海航的猝死，海航的猝死就是烂账。烂账就是一塌糊涂，糊涂了不但浑
156357,489,很多金鱼,能摸鲸鱼
156358,490,不要多走的全都是老百姓的才天才,剥夺走的全都是老百姓的钱财！海
156359,491,太行厕所了一个马桶盖了都能买100个亚特兰的家,的一个厕所里的马桶卖了，能买100个杨改兰的家
156360,492,哈哈,海航
156361,493,一个车不会见了都是你们国内的这些中产阶级的全部的家产,一个车轱辘卸下来，就是你们国内的中产阶级的全部的家产。那
156362,494,787附近一个小时是你一辈子的工作的时间转移资产,787飞机飞行一个小时，是你工作一辈子时间所赚的资产
156363,495,但是这会都要给你别的话了,但是这次都要给你折腾光的
156364,496,分了看了吗,腾光的
156365,497,最短,脆断
156366,498,最后我有话,最后就是
156367,499,最后守卫资产剥离啥叫资产剥离资产和名词就是分赃,最后就是资产剥离，什么叫做资产剥离，资产剥离的代名
156368,500,房地产,房地产
156369,501,姚庆拿着搞这个养老产业,姚庆拿走，搞这个养老产
156370,502,金融板块,金融板块
156371,503,王岐山拿走,王岐山拿走
156372,504,给其他几个人刘成杰贯君分了,给其他几个人，刘呈杰，贯军分了
156373,505,把飞机给国航南航,把飞机给南航国航
156374,506,海航的优良地块,海航的优良地块
156375,507,冠军打老是搞地产,贯军拿走，搞房地产
156376,508,厉害了,厉害了
156377,509,然后海外市场绝大多数下认几个常委,然后海外资产绝大多数现任几个常委
156378,510,还有公交把这个拿走,还有公检法几个拿走
156379,511,大厉害了真厉害,厉害了，真厉害
156380,512,看着网,看着我
156381,513,所谓的海航资产重组的时代风味精的把话撂了这,所谓的海航资产重组的时代，郭文贵今天把话撂到这
156382,514,即将到来,即将到来
156383,515,海行的资产重组就是海外分账,海航资产重组，就是海外分脏，就是资产分
156384,516,就是资产分钟就到过那个分章语法分了还得习近平下,就是资产分脏。盗国贼的分赃，依法分脏！还得习近平
156385,517,同意,同意
156386,518,经中共中央,经中共中央
156387,519,国资委,国资委
156388,520,还有中国人民银行银监会,还有中国人民银行，银监会
156389,521,中国这个证监会核准,中国这个证监会核准
156390,522,这个上市公司给谁的一单给谁这个这个服务板块给谁看完了,核准，上市公司给谁，地产给谁，这个这个服务版块给谁，全分完了
156391,523,瞒天过海,瞒天过海
156392,524,遮天蔽日啊可两个就是我们的草根我们的百姓了,遮天蔽日啊，可怜了就是我们这些草根，我们这些百姓
156393,525,我一看昨天的前面发生的事这原来是一般大气压,我一看昨天，前天这发生的事，原来是一盘大棋啊
156394,526,灭掉王间给所有的纷争,灭掉王健给所有的分赃
156395,527,带来了一切可能,带来了一切可能
156396,528,是盗国贼到我成功的面料口口子,是盗国贼盗国成功的灭掉口
156397,529,口正,口证
156398,530,最好的我真的现在怀疑王间史密斯,最好的，我真的现在怀疑王健死没死
156399,531,我真的怀疑,我深刻怀疑
156400,532,我现在可能是真被你弄死了他肯定不正常死亡,一种可能是真的被弄死了，他肯定不是正常死亡
156401,533,100%什么弄死了他的实话在有可能没死,亡，100%被弄死了，他要是死的话。再一个，有可能没
156402,534,因为这个太奇巧了,因为这个太蹊跷了
156403,535,在法国任何国家竟然是连找高尔夫的人都会闭嘴,在法国这样的国家，竟然是连搞高尔夫的人都被闭嘴
156404,536,两个高尔夫球场服务员都没闭嘴,连个高尔夫球场的服务员都被闭嘴
156405,537,在暴怒的分钟村教堂旁边的一个路旁观者都可以闭嘴,在奔牛村教堂路旁观者都被闭嘴，医院就更不用
156406,538,医院就更不用说了扯淡的事然后我出来唱戏的又是财新胡舒立,医院就更不用说了，扯淡的事。然后出来唱戏的又是财新胡舒立
156407,539,这所有的迹象表明这是一场大戏,这所有的迹象表明，这是一场大戏
156408,540,设计好的大戏,设计好的大戏
156409,541,说的就是爹海号送帐,所有的大戏就是给海航送
156410,542,不是,不是
156411,543,赵王建智商委员会就是海航智商委员会,是叫王健治丧委员会，是海航治丧委员
156412,544,只有两种可能做掉房间,只有两种可能，做掉王健
156413,545,八海行送葬,把海航送葬
156414,546,上海行政教分赃,送葬海航就叫分赃
156415,547,依法文章,依法分赃
156416,548,第2个王建夹死,第二个，王健假死
156417,549,炸死,诈死
156418,550,长假,王健
156419,551,也造就一个海航班长,也造就一个海航分赃
156420,552,现在这个所有的苦是所有的子弟他们这种办法通通的玩,现在这个所有的股市，所有的地产板块，金融板块统统
156421,553,然后所有的海外的现在变成国际调查全部结束,然后所有在海外的，现在面临的国际调查全部结束
156422,554,最终保护了海航的背后的盗国贼的私生子女,最终保护了海航的最后的盗国贼的私生子女
156423,555,和倒角的国家万亿财富,和盗取的国家的万亿财富
156424,556,和秩序控制几十万亿资产,和继续控制几十万亿资产
156425,557,牛,牛
156426,558,牛啊,牛啊
156427,559,你有,牛啊！我
156428,560,我兴奋,我兴奋
156429,561,我非常兴奋,我非常兴奋
156430,562,你们遇到了一个你们想象的就是郭文贵你们看不起我吧,你们遇到了一个你们想想不到的郭文贵，你们看不起我吧，陈
156431,563,陈峰先生郭文贵在这给你说话了,陈峰先生，郭文贵在这给你说话了
156432,564,一年前你在香港办公室对这里面技术说的100%,一年前，你在香港办公室，对着人家记者说
156433,565,假的,假的
156434,566,一年后证明全世界证明你说的是假的我这么多我说真的我没有百分,一年后证明，全世界证明你说的是假的，我说是真的，我没有百分
