id,index,content,proofed
2252,1,虎啸东方,
2253,2,我需要东方的啊,
2254,3,Austudy儿文苗13,
2255,4,厨房的色啊,
2256,5,盘古文贵的任王,
2257,6,郁金的陆CMCC pd7玫瑰地方,
2258,7,听见在喜马拉雅的9cm这个还是msrd 12,
2259,8,战神的猫,
2260,9,已经已经黎明之前黎明之前来了123,
2261,10,好好好哎呀哎呀呀呀呀,
2262,11,王老大刚好那刚刚刚上的呀,
2263,12,哎呀亲爱的假如你们哈哈哈,
2264,13,还是这个角度比较好啊,
2265,14,亲爱的战友们好今天是4月24号你们健身了吗,亲爱的战友们，你们好，今天是4月24号，你们健身了
2266,15,加上有吧,家报告
2267,16,啊啊啊好啊时间跟我差点给我发射天弓射天宫阿德拉拉,"往身上泼水了吗？


亲爱的战友们，这个向大家报告一"
2268,17,凡现在,向大家
2269,18,亲爱的有的啊这个啊,亲爱的战友们，这个
2270,19,这个向大家报告一下报告一下这个昨天到今天的情况,这个向大家报告一下，昨天到今天的情况。特别是某个宗
2271,20,特别是啊,特别是
2272,21,这个貌个宗教的教堂要教会他家他教temple,某个宗教的教堂，叫教会，他们叫temple
2273,22,咱们就发一张妙人家叫做会堂,咱们翻译成庙，人家叫会堂。在
2274,23,再会和最顶端的,在会堂最顶端的
2275,24,最顶端的最顶端的地方,最顶端的地方，那里面
2276,25,那个里面叫21个长了好长的翻译的长老会,那里面叫21个长老，咱们翻译叫长老会
2277,26,在长老会上,在长老会上
2278,27,我们大家,我们大家
2279,28,这是约了很久了,这是约了很久了
2280,29,这是过去两年这是第4次跟他们见面,这是过去两年，这是第四次跟他们见面
2281,30,感触颇深,感触颇深
2282,31,怎么前两次,"深。


前两次"
2283,32,基本上我说话那个眼神,基本上我说话，那个眼神
2284,33,那个身体语言,那个身体语言
2285,34,还有一个就是,还有一个就是
2286,35,这个人的看法,这个人的看法
2287,36,那真的是,那个真地是
2288,37,亲爱的战友们以为没到我这个环境或者说没精油这是,亲爱的战友们，你们没有到过这个环境，或者说没经历过这个事
2289,38,真的只是没办法用言语能力传达给大家的,真的是没有办法用言语传达给大家的。那
2290,39,那那那那么在第5大道最有可以说是全世界最,那在第五大道可以说在全世界最牛的
2291,40,最牛的宗教组织这一罪是神庙神秘的主意,最牛的宗教组织之一，最神秘的之一，世界上
2292,41,世界上最神秘的组织者,世界上最神秘的组织之
2293,42,当我告诉人家说顾然党如何如何的手,当我告诉人家，说共产党如何如何的
2294,43,人家所有人都在投资,人家所有人都在那里
2295,44,他们一说话就是中国不提共产党中国人,他们一说话就是中国，不提共产党，中国人
2296,45,所以当时我就提醒了,所以我当时就提醒
2297,46,你把中国人,你把中国人
2298,47,你把中国你把关岛必须分开,你把中国，你把共产党必须分开
2299,48,直到以后上一次钱就是第3次他们真的是很注意的做法分开了,直到上一次，就是说第三次他们真的很注意说话了，分开了
2300,49,但是,但是
2301,50,对过去两年来爆料和命产生的影响人家都有自己的信息,对过去两年来爆料革命产生的影响，人家都有自己的信息
2302,51,人家有大量的投资,人家有大量的投资
2303,52,最近特别是当委会,最近特别是当委会
2304,53,分别有说这些查老下的各个分支机构,分别游说这些长老下面的各个分
2305,54,这些分支机构大了去了各种人的结果,这些分支机构大了去了，各种分支机构
2306,55,也就是星期四,也就是星期四
2307,56,在曼哈顿,在曼哈顿
2308,57,有一个单位会的一次会议,有一个当委会的一次会议
2309,58,这次很多媒体都参加人数不一样我可以想大家偷了个秘密,"这次很多媒体都参加 ，人数不一样。


我可以向大家透露个秘密"
2310,59,很多人,很多人
2311,60,都是秘密不要会的人还有执行两都来参加,都是秘密委员会的人，还有执行委员会的，都 来参加
2312,61,有的人可是做了最后面,有的人可是坐在最后
2313,62,最凉但它可能是最有能量的人,最低调，但他可能最有能量 的人
2314,63,体重就是了21位,其中就有21位这
2315,64,这些长老之一,这些长老之一
2316,65,昨天给他们解决,昨天跟他们见
2317,66,我想问他,我先问他
2318,67,我给你们那么牛,我说你们那么牛
2319,68,那么厉害,那么厉害
2320,69,这么大的影响力,这么大的影响力
2321,70,琉璃屋的流给万1美元你们控制的,厉害，这么大的影响力，你们这一屋
2322,71,我想此时此刻,我说此时此刻
2323,72,就这个吧9点中中国正在发生什么,这个八，九点钟，中国正在发生着什
2324,73,Ccp住在干什么,CCP正在干什么
2325,74,没人说话,没人说话
2326,75,我说这个,我说这个
2327,76,大家记住各种基金会,大家记住各种基金会
2328,77,各种基金会和各种水中校服是最牛的两个职务,各种基金会，和各种所谓宗教组织最牛的两个职务
2329,78,第1个原来我说脚office就是你签名那个人,第一个我原来说过叫officer，就是你签名的那个
2330,79,比如说纺织基金,比如说法治基金，那个
2331,80,那个officer是非常重要的项,那个officer是非常重要的，他向
2332,81,爆你菊花29爆水,报税机关，IRS去报
2333,82,这个人是关键的你别老看的主题是谁史蒂芬班农+这不是最重要,这个人是关键的。别老看着他主席是谁，Steve Banoon，Kyle Bass 这些都不重要
2334,83,第2个这个秘书基金会秘书是最关键的,第二个就是基金会的秘书、，秘书最关键的
2335,84,中校长者咱们交秘书长共产党中国寒交秘书长,组织，他是运行者， 咱们叫秘书长，中国共产党叫秘书长
2336,85,那个秘书长的那个秘书,那个秘书，这个长老会
2337,86,这个长老会的秘书,这个长老会的秘书
2338,87,和这个另外什么继什么会的那个officer多着呢我是你说发生什么,和另外那个济什么会的officer都坐那边。我说：你说发生了什么
2339,88,我担心在线开始,我说咱今天先开始
2340,89,如果在你这开会之前魏永问过两个来劝说我,我在你这里开会之前 ，我已经问过两个来劝说
2341,90,去,去
2342,91,听你们的大米会开会,听你们的当委会开会
2343,92,去这个这个这个,不知道。结果说
2344,93,有几个会让我去听我问了都给了我打了不知道结果他们不知道,有几个会让我去听，我问了，都给了我答案，不知道。结果说：我们不知道
2345,94,我说现在在青岛,我说现在在青岛
2346,95,正在进行的事情是正在青岛军演,正在进行的事情是正在青岛军演
2347,96,一带一路纪念钱,一带一路。几年前
2348,97,我是当时事,事情是正
2349,98,360假条的,360架飞
2350,99,今年不是原来说80个家具我手指刚刚更新,今年，原来说是80多架，据我所知，刚刚更新
2351,100,发生了是39家报和国内的,上百架潜艇，这回
2352,101,上一次上百佳甜品,上一次，上百架潜艇
2353,102,船只,次，上百
2354,103,最为20书简体,这回20艘舰
2355,104,他们马上用的无毒不要有任何不能带任何手机不能带任何电子设备,他们马上······因为那屋不能带手机，不能带任何电子设备，所以，他们马上出去，核
2356,105,水头码头,是。我说
2357,106,漯河市出来了,去，核实，啪……打出来了
2358,107,我正在北京进行的一带一路,正在北京进行的“一带一路
2359,108,在干啥,在干啥
2360,109,我说我告诉你一带一路宣传的几个口径,我说我告诉你，“一带一路”宣传的几个口径
2361,110,你们知道吗不知道我这里也没办法,你们知道吗？——不知道。我说这里也没报
2362,111,我给他们简单的说了一下我说我要给你们说什么意思,"我给他们简单地说了一下。


我说我要跟你们说什么意思"
2363,112,因为,因为
2364,113,你们西方的媒体和西方像你这样都不知道在事实的中共在干啥,你们西方的媒体，和西方像你们这样的人，都不知道此时的中共在干啥
2365,114,或者在干完傻以后你才知道,或者他干完啥以后你才知道
2366,115,你永远是输家,你永远是输家
2367,116,有道理吗,有道理
2368,117,这些人的花言我给你说的但有个咱们以后有机会为切换句给你一分钟就是一,这些人的发言啊，我跟你说战友们，咱们有机会开会的时候，我告诉你，给你一分钟就是一
2369,118,给你分钟93分钟10分钟大家都在反应都有自己的世界按下一个会见,给你三分钟就是三分钟。你多十秒钟，大家都不耐烦，因为都有自己
2370,119,飞机飞走了所以说你不得多长时间就多长时间,飞机要飞走了。所以，给多长时间就多长时间
2371,120,我就是20分钟,我就是二十分钟
2372,121,我现在已经荒七分钟了但是我说的是比较快好,我现在已经七分钟了，当时我说的比较快啊，给他
2373,122,这个跟他们讲他跑,快啊，给他们讲，啪
2374,123,我今年我说我腿不舒服我也占我们做了,我进去后，说我腿不舒服，我得站著，然后我
2375,124,我说我告诉你这几个怕他怕我用了10分钟,我说我告诉你这几个啪、啪、啪，我用了九分钟
2376,125,我第2个,我说第二
2377,126,我要问你们一个问题,我要问你们一个问题
2378,127,2018年,2018年
2379,128,Ccp,CCP
2380,129,Ccp panturrilha,CCP、CCP币？？我说
2381,130,我们给你问你看过那个那个视频影响的世界咱们占有只是视频太牛了影响的世界,我说给你们看看……那个视频影响了世界噢！咱们战友做的视频太牛了，影响了世界
2382,131,所有人都叫我基本都拿到那个视频还有那个白一点,所有人见我时，基本都拿著那个视频，还有那个打印件
2383,132,据我所知很多国家元首碰见齐王大花的钱,据我所知很多国家元首，做的像一面墙似的
2384,133,不是是28万一,是二十八万亿
2385,134,美元的货币那我请问今天是多少钱32分1美元,美元的货币。那我请问: 今天是多少钱？喔，都
2386,135,然后怎么说了,然后，他们说
2387,136,日本,日本
2388,137,是货币是什么2被GDP的二倍,说了，日本，货币是GDP的二倍，美
2389,138,老美52减800的什么305倍然后中国多少为多少位,倍，什么三倍、二点五倍，然后，中国是多少倍、多少
2390,139,我的好,我说
2391,140,那我你既然这个都说出来了说我接着问下一个问题,好！你既然这个都说出来了，那我接著问你下一个问
2392,141,真正的现在中共的所说的外汇储备和GDP是多少,真正的中共所说的，外汇储备和GDP是多少
2393,142,所有的3.5一下,所有人
2394,143,你跟我说的不一样,跟他们说的不一样
2395,144,这个信息就很准,这些人信息渠道很准
2396,145,然后这些货币在海外多少钱多少钱,然后，这些货币在海外多少钱、多少钱
2397,146,打给我,大概有
2398,147,有多少种心很快,有多少……啪！很快，每
2399,148,那就每个人说话他们那个那个会议呀这儿就说这种为了一圈做了发言人站中间,那个会议呀，二十人的桌子，围一圈坐著，发言人站中间来。说话——啪！举手，啪
2400,149,会做中间然后是出话剧数他就说,人站中间来。说话——啪！举手，啪！就说
2401,150,然后我问他,然后，我问他
2402,151,现在,现在
2403,152,对待中共的,对待中共的
2404,153,最好的着是什么呀的是啪啪啪三张,最好的招是什么？然后他说——啪！啪！啪！三
2405,154,然后怎么就说法治基金你到底想干什么我们说你明确,然后他们就说，“法治基金”到底你想干啥？我们希望你明确
2406,155,就用两句话说不说出来,就用两句话给我们说出来
2407,156,我说我们在最近一个多月开了N次的问,我说，我们最近一个多月，开了N次会
2408,157,昨天晚上我说我们大家还在生意在开会,昨天晚上，我说我们大家还在深夜开会
2409,158,关于法制剂,关于“法治基
2410,159,这些人要赚大钱的还要大力支持法是基金的,这些人是要捐大钱的，要大力支持“法治基金”的
2411,160,我说我们见过多次面,我说我们见过多次面
2412,161,我们现在告诉你,我们现在告诉你
2413,162,对付共产党就两照,对付共产党，就两招
2414,163,我会你们今天坐着毕业就两张,我呼吁你们今天坐在这儿的，也就两
2415,164,第1个季度英文叫黑客的firewalld,第一个，我说记住，英文叫take the firewall d
2416,165,或者要开一个大的发乳,或者叫take down the fir
2417,166,推翻这个防火墙,推翻这个“防火墙
2418,167,就像当年李根,就像当年的里根
2419,168,站着玻璃墙说,站在柏林墙上
2420,169,Take the world on Ocean take down the firework,take the wall down，我们是—— take down the fire
2421,170,第2个停止你们的头,第二个，停止你们的……sto
2422,171,Wsman 26p我说不要停止投资中国,o CCP。我说不要停止投资中国哦！因
2423,172,因为解决大陆企业事故应急,因为现在绝大多数企业都是国有企
2424,173,就这两天,就这两条
2425,174,我觉得他们完蛋,绝对他们完蛋
2426,175,哇塞这不是我们未来的法子基金就这两句俗语,家鼓掌。我说我们未来的“法治基金”就这两句
2427,176,Take down the firework,take down the firewal
2428,177,Stock investment ccp,Stop investment to CCP
2429,178,就这样就好,就这两句话
2430,179,或者剧烈的手,获得剧烈相
2431,180,聚点,讲
2432,181,我相信我这次演讲会给root of the loans,我相信，我这次的演讲会给“Rule of law fun
2433,182,还有,还有
2434,183,整个的比赛社会,整个的Society (C4)，会
2435,184,汇嘉大桥,会捐大钱
2436,185,我相信已经想试一下当然了现在还不睡觉啊,我相信，影响深远。当然了，现在还不知道
2437,186,现在我想11分钟,现在我想了十一分钟
2438,187,亚运会,短的会
2439,188,邓小平亲人,"人,七个人！加上"
2440,189,七个人,七个人
2441,190,很短很短的会,很短、很短的会
2442,191,就在,就在
2443,192,这个第一个会的隔壁,这个第一个会的隔壁
2444,193,不到100米的地方,不到100米的地方
2445,194,这个太神奇了全人类的77的富豪住在曼哈顿她占有道理,这个曼哈顿太神秘了，全人类的77%的富豪住在曼哈顿它
2446,195,肖伟大跳那个就是真没去过,吓我一大跳，那个地方我是真没去
2447,196,我经常来如果觉得个窗子是可以玩的很漂亮,我经常在那路过，觉得这个窗子是个圆的，很漂
2448,197,这个班同学生长来纽约长住曼哈顿就一个酒店,"这个窗子是个圆的，很漂亮。


班农先生常来"
2449,198,这个酒店现在已经成为我们法治基金还有,这个酒店现在已经成我我们法制基金还有
2450,199,过媒体现在签约酒店,郭媒体签约的酒店，以
2451,200,以后占有来就要到这里,以后战友来，就要到这来
2452,201,上次1120我们其中一个美国女孩把酒店给定做,上次1120，我们其中一个美国女孩把酒店给订错
2453,202,唯一致性中耿耿于怀非常高兴,错了，我一直心中耿耿于怀，非常不高兴。
2454,203,现在我们签署了一个新的签约9点我超喜欢了因为酒店里的功能啊,现在我们签署了一个新的签约酒店，我超喜欢。因为酒店里的功能
2455,204,上面健身房啊,上面的健身房
2456,205,免费的WiFi啊,免费的wifi
2457,206,24小时的餐厅啊,24小时的餐厅
2458,207,然后呢特别是几个隐蔽的空间还是很多导演明星还有相伴多少正常,然后特别是有几个隐蔽的空间，而且很多导演、明星，还有像班农
2459,208,安全特别好,安全特别好
2460,209,隔壁99平行直接停下去,还有停车场，直接停下去
2461,210,还挺有电梯上去,场还有电梯上去
2462,211,就在这个楼的隔壁,就在这个楼的隔壁
2463,212,我超喜欢的一个独立的汤好,我超喜欢的一个独立的Townh
2464,213,但我的没想到直接把机上的吧那你等一下回拉掉,但我就没想到，直接吧唧一上去，就吓我一大跳，人家是Townh
2465,214,人家是他号数量成小工,人家是Townhouse两层挑
2466,215,跨一个大突然多,空，一个大椭圆
2467,216,人家都说人,人家都坐在那
2468,217,玩到三分钟,晚到了3分钟
2469,218,万到了39号,晚到了3分
2470,219,结果发现,结果去，“抱歉
2471,220,开始的19号你说你想想问啥问啥,开始第一句话（你们）想想会问啥？说
2472,221,说你推崇的依法性交,说：“你推崇的依法信教
2473,222,一法性交,依法信教
2474,223,中国人有信仰的自由,中国人有信仰的自由
2475,224,什么意思,什么意思
2476,225,还强调分,还钱教分离
2477,226,我非常简单回答,我非常简单的回
2478,227,我说我认为,我说我认为
2479,228,个人信仰中间不需要,个人信仰中间不一
2480,229,不一定需要,不一定需要
2481,230,就是去教堂,教组织是非常
2482,231,无论但是用宗教组织,堂，但是有宗教组织
2483,232,是非常好的有巨大的帮助特别是开始阶段,是非常好的，有巨大的帮助，特别是开始阶段
2484,233,本身就是让他有安全感,本身就是让他有安全感
2485,234,在当下社会是有效的,在当下社会是有需要的
2486,235,但是需要改变和依法性交,但是需要改变。要依法信教
2487,236,比如说,比如说
2488,237,在我们的中国山东老家很多地下教会,在我们的中国山东老家，（有）很多的地下教
2489,238,有些时候有些是决定片天天色,有些是好的，有些是绝对骗钱骗
2490,239,包括我们中国海外的民运组织就是51,包括我们中国海外的民运组织，就是
2491,240,骗钱骗色在这帮人,骗钱骗色的这帮人
2492,241,所以我一法性交,所以要依法信教
2493,242,包括一法的,包括依法地
2494,243,参与的国家民主,参与到国家民主
2495,244,民主运动的,民主运动的
2496,245,这个打你知道吗,这个钱教不
2497,246,不支持,是对
2498,247,全校分离,钱教不分离
2499,248,不是认为钱和教必须依法律有规范,离，我认为钱和教必须要依法律有规范
2500,249,这个钱叫不分离我可以给你tamper送我的工资但是钱去哪了,这个钱教不分离，我可以给你10%我的工资，但是钱去哪了？多少
2501,250,多少钱是对多少钱又不对这个需要历史性的变革他们赞成,多少钱是对的，多少钱是不对，这个需要历史性的变革。他们赞成
2502,251,我说,能说
2503,252,另外一个问题,另外一个问题
2504,253,这个是不能说好,这个咱在这不能说
2505,254,翻译我们需要你做什么的,关于“我们需要你们做什么
2506,255,很简单,很简单
2507,256,现在大概看看,现在大概看看
2508,257,我没超过30周,我没超过3分钟
2509,258,当然或者一直在,当然获得一致赞
2510,259,其中有两个人啊那个说话难听啊那个字一样,其中有两个人，那个说话难听啊，那个质疑
2511,260,问了我几个几句话,问了我几句话，那几
2512,261,简直是,简直是
2513,262,有些话应我们绝对都是大家都心照不宣,有些话我们大家绝对是心照不宣，你甭说
2514,263,你不是说拍照你赶出去说就那个说说明他不可能,你甭说拍照了，你敢出去说去，你敢说出名字，那不可
2515,264,大家看看啊,大家看看啊
2516,265,这是我第3个会的地方,这是我第三个会的地方
2517,266,放在你桌上这个牌子,放在桌上的这个牌子
2518,267,这是方便你,这是放在
2519,268,胸口的牌子,胸口的牌子
2520,269,这是李白的名单在打内上映都是照片都简介,这是里面的名单，在单子上印的，都是照片，都是简介
2521,270,这给你一个,还给你一个
2522,271,只这个笨啊,纸），这叫
2523,272,这叫,这叫
2524,273,University Club,University Club
2525,274,给你一个笔,给你一个笔
2526,275,第3个,第三个
2527,276,这种地方这是一年一次的,这种地方，这是一年一次的
2528,277,这个重要的全世界最牛投资人大会这里面这个屋子里面2点50000 1美元,这个重要的全世界最牛投资人大会，这个屋子里面2.5万亿美元。这个不一样
2529,278,这个不一样啊,这个不一样
2530,279,这些人是你都知道都是都是的英明就是你的责酒公司就是几个最牛的,这些人都是你知道的你能数的最牛的那几个公司的人，管理着2.5万亿美
2531,280,在哪款,最牛的那
2532,281,2点5万1美元的,面2.5万亿美元
2533,282,关于资管理资本,管理着2.5万亿美元的
2534,283,非常漂亮就在我隔壁啊就这个University Club我经常去我怎么看不到人会这是我很幸运,"非常漂亮，就在我隔壁，


就在这个The University club，我经常去，我在那开过多少的会"
2535,284,很吉祥的地方,很吉祥的地方
2536,285,有很多非常棒的空间150年的历史,有很多非常棒的空间，150年的历史
2537,286,非常平安保特别好,非常棒的空间
2538,287,第3个会就是,第三个会就是
2539,288,今天发起人今天的主持人讲完然后去年讲的啥今年将于今年主题是啥,今天的发起人今天的主持人讲完，然后就是去年讲的啥？今年讲的啥？今年主
2540,289,今年主题就是人民币还是港币还香港中国经济,今年主题就是人民币和港币还有香港和中国经济
2541,290,然后下面都提问题,然后下面人都提问题
2542,291,我跟很多人都很熟都了,我跟很多人都很熟，都
2543,292,彼岸花,变化
2544,293,两年前一年前我告诉你所有的人物里的90%人都见过王岐山2,两年前一年前我告诉你：所有那个屋里90%的人都见过王岐山
2545,294,几乎所有人,几乎所有人
2546,295,都认为中国,都认为没有
2547,296,王岐山没有王岐山没有中国的今天,王岐山就没有中国的今天；没有王岐山共
2548,297,没有王岐山共产党就玩求大了,没有王岐山共产党就完球蛋了
2549,298,几乎是就是,几乎是！所以
2550,299,所以说,所以说
2551,300,战友们,战友们
2552,301,那个时候跟这个交流的时候你说王岐山,那个时候跟这些人交流的时候，那个费劲
2553,302,我告诉你最简单就昨天就大家都是这种非常激烈了,我告诉你最简单了，但就昨天那种大家都是非常激烈的！几乎
2554,303,去忽悠,确说
2555,304,四五个人名字说华为做得很好华为突然怎么了,四五个人，明确说华为做得很好！华为偷了什
2556,305,你有人你头呀,你有本事你偷
2557,306,都做得比你还好在一个就说这个中国货币的话那么不着吗,做得比你还好呢！再一个就说这个“中国货币增发”，哪国不
2558,307,美国也应对不对,美国也印啊！对不对
2559,308,说是肯定有问题,是肯定有问题
2560,309,但是也不会那么会完蛋,但是也不会那么快完蛋
2561,310,非常给力,非常激烈
2562,311,你多一点什么打你是你睡觉了,你多说一点人家马上打断
2563,312,说咱们占有没有个句子,所以咱们战友们以后记住
2564,313,咱们要的这个时间控制参与了,咱们要对这个时间控制好，如
2565,314,访问什么这一定要性感的着装行为,访问什么的，及着装、行为、进去的章程
2566,315,进去的章程每次都是程序不问电脑参加那么多,进去的章程等。每次都是程序，不会变的，我参加那么
2567,316,我会一看绝不差20秒时间,回一看时间，决不差20秒！问的
2568,317,为什么问题没有一只浪费了吗,0秒！问的问题没有一句是浪费的
2569,318,最牛的人老人家这样子,最牛的人！他老人家看起
2570,319,另外一个,另外一个
2571,320,大家这次最大的点数,大家这次最大的变化
2572,321,确确是16年前,确确实实两年
2573,322,我们听吗,我们听M
2574,323,我那个什么,什么？王健
2575,324,不可以相信,不可相信
2576,325,现在正是意识到最大的长处是什么,现在真是意识到了！最大的感触是什
2577,326,王剑之死,王健之死
2578,327,正好西方,震撼了西方
2579,328,王健知识正常的细胞,王健之死震撼了西方！！国
2580,329,国内企私人企业国有国家国家化,国内私人企业国家化，就是我说的共
2581,330,就是我说的共产党将把私人资本,就是我说的共产党将把私人资本
2582,331,国家化,国家化
2583,332,国家权力私有化人民教主要在他的身心不一样,国家权力私有化，人民将走向灾难！现
2584,333,公布公布出来的不得了,公布出来可不得了
2585,334,还有什么进行,还有什么问题
2586,335,而且是很多都是最最重要的权利的核心的神秘就是为了那个家了吧,而且很多都是最最重要的权利的核心！是神秘、是那个界的，情报界的
2587,336,请报价,情报界
2588,337,12,的
2589,338,香港,，情报
2590,339,全反法,遣返法
2591,340,震撼世界,震撼了世界
2592,341,震撼了世界,震撼了世界
