id,index,content,proofed
454113,1,我看我看哇,
454114,2,一个是1 es-rc20 c2255第3,
454115,3,30在有战友过啊第4个是文阳,
454116,4,啊第5个stark Tony,
454117,5,第7个是英国在哪第8个是闻名的九个是仁义之师,
454118,6,第4是第10个是按摩器900和11,
454119,7,百合网文有22,
454120,8,Ly6e,
454121,9,Hello goodbye,
454122,10,Ground t44布拉克思妙的最15,
454123,11,Cosplay 46我就应不应该要了,
454124,12,大碗小面过数小时,
454125,13,晚上好,
454126,14,你们健身了吗,你们健身了吗
454127,15,哎呀,家
454128,16,来一首歌吗一首歌来一首歌,道，以后讲吧，这过敏对
454129,17,在直播里面看我的脸色是真实的,这过敏对大家太重要的，我这是亲身
454130,18,还不退休,会，包括星期
454131,19,1金1银2 x,建议。今
454132,20,干什么好什么好,重要的，我这是亲身体
454133,21,6月22号6月12号海口市下花更漂亮啊,源找的非常清楚，我要给大家说道说道
454134,22,哎呀,家
454135,23,我们那两个笑话你看一下超漂亮哎哟,验。研究过敏的给了我一系列建议。今天
454136,24,牡丹花要真的就这么大我从来不觉这么大的话哇塞超漂亮,"上午直播完还是开会。


我首先说一个，大家看看彭佩奥的讲话对"
454137,25,超漂亮,好好看
454138,26,花太漂亮,话对中
454139,27,你看,先
454140,28,你看我这个部的话银行,的强悍，多么的强悍
454141,29,打针,看这
454142,30,打针证明过敏,的文章，中国的经
454143,31,一切豁免现在找得非常清楚,看一看在华尔街时报的文章，中国
454144,32,非常非常清楚,时报的文章，中国
454145,33,这过敏大家为了大家说的说了,在华尔街时报的文章，中国的
454146,34,以后讲话这个过敏那个太重要了我这次亲身体验,一个大家要看的事情，可能是我们台湾的小蔡总统，来
454147,35,全世界最好的这个研究过敏的,开始对立了。在整个君悦酒店门
454148,36,这个给了我这个一系列的啊建议啊大家我回头再来今天时间不多因为我马上到,整个君悦酒店门口，大家看到了两阵对垒。一个是台湾人民选出来
454149,37,在知道今天明天,对垒。一个是台湾人民选
454150,38,我全部是开会,与民主开始
454151,39,明天后天都帮我写,民选出来的领导人
454152,40,今天上午吃过晚还是还会,被认为是黑社会的共产党。在美
454153,41,没办法大家都看到了,党。在美国养了
454154,42,我首先说一个大家看看胖prss,国护照。特别是那个梁冠军，带
454155,43,儿子们的讲话对,的黑社会，竟然
454156,44,中共是多么的强悍,中就是卖国，卖国求荣。当
454157,45,多么的强大家好看的文章,倒美国，打倒台湾，打
454158,46,然后再看一下这这个这个华尔街时报报的文章中国的经济这个今天看,然承认一中了，一中是中华民国，不是你中
454159,47,另外一个大家要看的事情啊,流氓，但是大家千万记住，别
454160,48,可能是我们台湾的小菜葱头小蔡总统,看他表面闹得欢，都是弄点小钱。共
454161,49,来到了这个,"党，对吧？


这"
454162,50,悠悠两派对着乐队这个大流氓,的粮食从来不是给够的，甭
454163,51,流氓移民主开始对立了,粮食从来不是给够
454164,52,在那个整个的君悦酒店门口,未有的美国联邦调查局和美国的
454165,53,他看到了两阵对垒,联邦调查局和美国的
454166,54,一个是台湾人民选出来的领导人,天，前所未有的美国联邦调查局和
454167,55,一个是关心的在全世界都被认为是黑社会的共产党,就在这个楼的对面，记住中央火车站那个楼顶上。是美
454168,56,在美国养的一方走狗,在这个楼的对面，记住中央
454169,57,拿着美国护照,和美国的国
454170,58,特别是那个梁冠军,了。你看梁冠军会
454171,59,大楼一下福建的黑社会,来不是给够的，甭说是给
454172,60,竟然唱的不是都要打倒美国,记住，别看他表面闹得欢，都
454173,61,打倒台湾,大家千万
454174,62,打倒他英文,大家千万
454175,63,大幅上写上,不是你共产
454176,64,不承认一国不承认一中,不是你中华人民共和国
454177,65,就是卖国卖国求荣,国，卖国求荣
454178,66,这个王八蛋咱换成了一种了一株日中华民国不是你中华人民共和国,著不承认一中就是卖国，卖国求荣。当然承认一中了，一中是中华
454179,67,不是你关党,不是你共产
454180,68,对吧这种流氓但是大家千万就别看的表面到的欢,"对吧？


这种流氓，但是大家千万记住，别看他表面闹得"
454181,69,多少钱共产党的,都是弄点小钱。共产
454182,70,给狗的量是通常都不给给我的方式给人了,给狗的粮食从来不是给够的，甭说是给人了
454183,71,你看两会你会非常差,你看梁冠军会非常
454184,72,据我所知昨天前所未有的美国联邦调查局,据我所知昨天，前所未有的美国联邦调查局
454185,73,和美国的国土安全部,和美国的国土安全部
454186,74,人在那个楼上楼下全部正好,人在那块楼上楼下全布置好
454187,75,就在这个楼的对面,就在这个楼的对面
454188,76,Mg6那个中药不让的楼顶上,中央火车站那个楼顶上
454189,77,是美国,是美国
454190,78,FBI联邦调查部门包括我的包包公司都是在楼上办公的大概没去过那个楼上,FBI，联邦调查部门，包括我的保镖公司，都是在那楼上办公的。大家没去过那个楼
454191,79,你不上的楼上你看上的都是重型武器的路上,你们上到楼上你们看著，那都是重型武器在那楼上
454192,80,从文中选得很好因为那个地方是整个现在美国曼哈顿房,蔡英文总统选的很好，因为那个地方是现在整个美国曼哈顿
454193,81,反恐部门,反恐核心
454194,82,特别是调查所谓的现在中共在美国的养子家走狗们都在哪,特别是调查所谓的现在中共在美国的养的这些走狗们，都在那
454195,83,谁说的,所以说
454196,84,在那里闹钟帮我开心坏了这个赢了大家人家都没有下雪,在那一闹把我开心坏了，这高兴了。人家都不用下去，直接看
454197,85,直接就是他这样头就行,直接看摄像头就行
454198,86,都不用提取了,都不用下去
454199,87,说说,所以说
454200,88,大家看到这个太好了上天给我们送来了礼物,大家看到这个太好了，上天给我们送来了礼物
454201,89,就连这样垃圾都清理掉,就连这些垃圾也得把他们清理掉
454202,90,你别看他们到我的话就会那几个小钱,你别看他们闹得欢，就为那几点小
454203,91,当然为了小英总统来美国纽约这几天听说他引起了巨大的争,当然为了小英总统来美国纽约，这几天听说引起了巨大的争
454204,92,你不得不说川普总统和他那个那个之间现在,你不得不说川普总统和他的内阁之间，现在
454205,93,出现了巨大争议,出现了巨大的争议
454206,94,事实上是很多人建议,事实上是很多人建议
454207,95,小小英总统包括文贵跟朋友也建议,让小英总统，包括文贵给朋友也建议
454208,96,应该去华盛顿,应该去华盛顿
454209,97,官网,光来
454210,98,来纽约纽约的华盛顿就是,来纽约，纽约离华盛顿就是
454211,99,一个小时的飞机行程吗46分钟吗有啥不可以的,一个小时的飞机行程嘛，46分钟嘛，有啥不可以的
454212,100,为啥不行啊,为啥不行啊
454213,101,上海三个联合公报已经是不存在了,上海三个联合公报已经是不存在了
454214,102,对不对呀,对不对呀
454215,103,三个联合公报的基础已经被回了为什么不能像剧呢对不对就这么简单的,三个联合公报的基础已经被毁了，为什么不能让小英去呢？对不对呀，就这么简
454216,104,当然啊,当然
454217,105,最最近川普总统,最近川普总统
454218,106,很不高兴,很不高兴
454219,107,大家发现了吗,大家发现了吗
454220,108,所以说g20,所以说G20
454221,109,大阪g20我告诉大家是天大的礼物,我告诉大家大阪的G20是天大的礼物
454222,110,又协议,有协议
454223,111,比没有协议好,比没有协议好
454224,112,我看了路德先生希斯小哥咱们两个还有战友之声,我看路德先生、细丝小哥、还有战友之声、卡丽熙、凤凰
454225,113,阿卡丽熙凤凰九天大卫小哥,卡丽熙、凤凰九天、大卫小哥
454226,114,去安都没有感觉我都听就很惊讶,全都没有感觉，我都很惊讶。咋就
454227,115,咋就没感觉呢,咋就没感觉呢
454228,116,川普总统发出公开说了中国向我的盛况没兑现让我很是失望,川普总统都发推公开说了，中国向我的承诺没兑现让我很失望。 往
454229,117,我回看过去他当总统的着这一两年,我很失望。 往回看过去他当总统的一两
454230,118,你见过他算说话吗发一个推,你见过他这样说过话吗？发一个推
454231,119,直接就是对的,直接就是怼的
454232,120,这几天没放平凡的人问我睡觉中山,这几天美方频繁的有人问我，谁叫钟山
454233,121,中山商务部长日你了解中山啊你好好了解到你吧,钟山商务部长。 我说你了解钟山啊？你好好了解了解吧
454234,122,中山是很有意思的啊中山,钟山是很有意思的。啊钟山
454235,123,商务楼,商务部
454236,124,我说你这批在哪网络,我说你的彼德· 纳瓦罗，还
454237,125,还是你的,还有你的
454238,126,Let's see the receiver,呢？ 我今天可以负责任地
454239,127,将一老者一会发来了大问题了你烦了,反应呢？ 我今天可以负责任地告诉大家，大
454240,128,这个,责任
454241,129,无论你们家遇到一个中共来的麻烦,应呢？ 我今天可以负责任地告诉大家，大阪G
454242,130,我为啥我说这张有没有反应了,我为啥说战友没有反应呢？ 我
454243,131,我可以更加负责任的告诉大家,我今天可以负责任地告诉大家
454244,132,大阪,大阪
454245,133,G20,G20
454246,134,已经造成了美国内部的,已经造成美国内部的
454247,135,巨大的那个,巨大的内
454248,136,合不合,和不和
454249,137,可不是大家想象的呀,可不是大家想象的那
454250,138,然后回来以后采取措施,然后回来以后采取措施
454251,139,有几个鸡丁太像旁表演什么,有几个激进派，像蓬佩奥先生那
454252,140,上海旁边这是讲究不同意的,生那是坚决不同意的。非要弄大
454253,141,不要那么大方了弄大发了要弄到手了,不同意的。非要弄大发了，要弄大发了，要
454254,142,和某人,和某人
454255,143,啥意思啊弄啊,时改变让
454256,144,有吵架,有几个
454257,145,大嫂,大吵
454258,146,包括,包括
454259,147,尤其是咱们的了,有几个跟咱们
454260,148,给咱们一大家子人间就要求应该临时改变让小小樱去美国国会,跟咱们一个战线的人坚决要求应该临时改变让小英去国会演
454261,149,我告诉你吧台湾人没有一个知道的我现在可以告诉你,我告诉你吧，台湾人没有一个人知道的。我现在可以告诉
454262,150,小樱跟了不知道他,小英根本不知道
454263,151,小英对美的工作的完全是被动了,小英对美的工作完全是被动的
454264,152,这完全是被动,这完全是被动
454265,153,吵架,吵架
454266,154,因此,因为
454267,155,因为中共的大阪g207片了美国发怒了美国,因为中共的大阪G20 欺骗了美国玩弄了美
454268,156,因为小鹰访美事件,因为小英访美事件
454269,157,那不要把它升级为生成,内部要把它升级没升成
454270,158,因为现在要,因为现在要
454271,159,采取的香港,采取对香港
454272,160,自贸区马上停止,自贸区马上停止
454273,161,自贸区对香港非常激烈内部场,自贸区内部吵得非常激烈非常激烈。白宫
454274,162,非常奇点,非常激烈
454275,163,白宫的高层没办法了,白宫的高层没办法了
454276,164,这个药草完以后的,了，吵完以后呢，大
454277,165,就是大家认为的强硬派,以后呢，大家认为的强硬派
454278,166,但在香港问题上却没那么知识,派在香港问题上却没那么支
454279,167,最小应防滑却没那么支持,对小英访华却没那么支持
454280,168,主要针对伊朗强烈支持,主要对于伊朗强烈支持
454281,169,两边这个地震,两边对阵
454282,170,地震之后没办法了表表演事件人家香港的,对阵之后没办法了，表演式的见了一下香港
454283,171,丽晶显示了我觉得我听说我认为我瞎蒙,先生。但是我觉得、我听说、我认为、我瞎蒙，接
454284,172,接下来会造成美国高层,接下来会造成美国高层
454285,173,有人离开,有人离开
454286,174,三个人核心原因,三个核心原因
454287,175,小英访美,小英访美
454288,176,和香港的民主运动,和香港的民主运动
454289,177,要取消自贸区,要取消自贸区
454290,178,何立马对中共实行3251的惩罚性关税,和立马对中共进行3250亿的惩罚性关税
454291,179,然后继续对华为和其他讲什么上进行不可修复的部分,然后继续对华为和其他几家公司马上进行不可修复的不
454292,180,就是调,就这几条
454293,181,会导致老人,会导致某人
454294,182,猫几个人是指厉害,某几个人甚至离开
454295,183,大家看着吧,大街上
454296,184,所以,军你
454297,185,大阪会议,大阪会议
454298,186,这么重要,"重要？

"
454299,187,你知道共产党你给他行骗的机会就像冠军你让他就走在大街上,你只要给共产党行骗的机会，就像梁冠军你让他去走在大街上
454300,188,咱们就是赢的,咱们就是赢的
454301,189,就怕他请了他当他真的当君子学了他当贾君子当他特别好傻了,就怕他停在那儿他当君子去了，当假君子当得特别好， 傻了！咱完了
454302,190,繁华了,咱完了
454303,191,人家外国人好啊你刚刚说到做到啊,人家外边说，好啊，你跟共产党说道说
454304,192,他买了那么多农产品呢,它买了那么多农产品呢
454305,193,不但买大豆还买大豆油呢,不但买大豆还买大豆油呢
454306,194,因为很多人买大陆你干上有了,因为很多人把大豆已经变成
454307,195,不太多,得还多
454308,196,你想想,你想想
454309,197,如果规模只有高人就会,如果共产党真有
454310,198,大阪大阪g20,大阪G20 会
454311,199,会议结束立马打个电话,会议结束立马打个电话
454312,200,多买一倍,多买一倍
454313,201,利马,立马
454314,202,这边没考虑呢香港在哪一位,真有高人认为，大阪G20 会议结束立马打个电
454315,203,你看美国啥感觉,你看美国啥感觉
454316,204,马上所谓的只供派支持功能,啥感觉？所谓支共派，支持共
454317,205,说的比做的好一倍,做的比说的好一倍
454318,206,能立马华东队都掉了,那立马华盛顿就变了
454319,207,可惜的是没这个人还应的还骗他骗子本质,可惜的是没这样高人，玩硬的玩骗的，骗是他的本质
454320,208,结果总统不高兴,结果总统不高兴
454321,209,压力山大呀,压力山大呀
454322,210,回来给私下告诉人大家稍安勿躁,回来私下里告诉所有人，大家稍安勿躁
454323,211,习主席我的好哥们共产党已经承认,习主席我的好哥们儿，共产党，已经承诺
454324,212,买买买东西买这买那买那华为,买我们东西，买这，买那，华为
454325,213,部分解禁,部分解禁
454326,214,事实是这样博士来了个啥,"事实是这样吗？不是。


来了个钟"
454327,215,中山,钟山
454328,216,啥叫中山大家知道吗,啥叫钟山？有时间
454329,217,我有时间我给大家的就中山可牛叉的那个人,我给大家介绍介绍钟山，很牛X的一个人
454330,218,所以说,说是
454331,219,现在还是美国和中共的外的别说美中外的美国和中共的关系,现在是美国和中共的关系，别说是美中关系，是美国和中共的关
454332,220,经过大版,经过大阪
454333,221,一次较量,一次较量
454334,222,中共的相当好满流氓姿态,中共的嚣张和傲慢，流氓姿态
454335,223,把已经是,已经是
454336,224,彰显是他伟大的江山之上,是彰显于他伟大的江山之上
454337,225,为了将来美国,之上？来美国了
454338,226,在观还要啦拜拜,啥江山之上？来美
454339,227,这个太笼统了,这种流氓的
454340,228,全人类的来恐怖分子的不干这种流氓的是对着一个女总统,全人类上连恐怖分子都不会干这种流氓的事，这样对
454341,229,一个女的一个女博士啊,一个女博士，人民选
454342,230,人体癣生怎么大还是流氓吗,个女博士，人民选出来的总
454343,231,鲍春华,暴粗话
454344,232,二是这些boss完全都是在中共领导下没饭吃,而且这些暴粗话的人全都是在中共领导下没饭吃
454345,233,甚至尊监狱的人不好多人家美国来拿人家美国不让现在在未来潜在中国,甚至是蹲监狱的人，跑到人家美国来，拿著人家美国护照，现在为了钱被中共
454346,234,反对他逃年迫害的台湾人民选出的领导你出去灾难不在那笑话不,反对常年被中共迫害的，台湾人民选出来的领导，你说这灾难不
454347,235,不笑话,不笑话
454348,236,咱们中国老百姓你们想想他英文若你啥了,咱们中国老百姓你们想一想，蔡英文惹你啥了？她
454349,237,啊他有强奸了90个小姑娘吗,啥了？她有强奸九岁小姑娘吗
454350,238,穿用文又把你家工厂了吗,蔡英文把你家共产了吗
454351,239,还有没有拿你家钱的吗给你家和大甲印的我们讲奶粉了吗他在台湾的时候问你吗,孩子打假疫苗吗？卖你假奶粉了吗？她在台湾惹过你吗？你看看梁冠军那些人是干啥的
454352,240,那你看了梁冠军那些人是个傻子全都是在福建都是怎么来的美国的,吗？你看看梁冠军那些人是干啥的？他们全是怎样从福建来美国的
454353,241,梁冠军是犯罪分子的刑事犯罪,梁冠军是犯罪分子，是刑事犯罪
454354,242,阿片觉得美国护照,骗取了美国护照
454355,243,永远全座椅在才拿到,永远蜷缩于China To
454356,244,犯罪分子,犯罪分子
454357,245,你有什么本事吧能告诉我这两个全,那些人是干啥的？他们全是怎样从福
454358,246,你怎么那么有没有犯罪呀,怎样从福建来美国
454359,247,你过来哪干的事是真是假的你拿钱了没有啊你在中国有多少四川那美国报税了没有啊,"你吗？你看看梁冠军那些人是干啥的？他们全是怎样从福建来美国的？


梁冠军是犯罪分子，是"
454360,248,你过去打人的事情怎么回事啊,些人是干啥的？他们全是怎
454361,249,现在才英文招你惹你了,全是怎样从福建来美
454362,250,所以说,国护照
454363,251,昨天晚上都行,是怎样从福建
454364,252,你看我这,你看看
454365,253,我这是,些人是
454366,254,半夜了还过年了吗人家问这个人是谁这是怎么回事,那些人是干啥的？他们全是怎样从福建来美
454367,255,我说你真的是非常容易,啥的？他们全是怎样从福
454368,256,这些人全都是利益驱使,是刑事犯罪，骗取了美国护
454369,257,Driven by perfect,你怎么到美
454370,258,他都是第1句是都是给共产党的走狗,有啊？你在中国有多少资产？你在美国
454371,259,查一个连一个,产？你在美国
454372,260,关调查他们家人的名头上的钱和他家人和民族间持有的公司下面的钱,"过去打人的事情怎么回事啊？现在蔡英文招你惹你了？


昨天半夜了人家还跟"
454373,261,这些全都是绿水全洗钱,这些人全都是利益驱使Driv
454374,262,就这么简单,我说你真的
454375,263,是吧,事？我
454376,264,然后这周小事了,到，这些人全都是利
454377,265,大家看的好,党的走
454378,266,这个台湾的,和他家人
454379,267,白发,他家
454380,268,我们的微信和发来的那个这个白雾然后,的公司下面的钱，这些人全偷
454381,269,太好吃了原来我台湾,太好吃了，原来我台湾
454382,270,真是特别特别好吃水果,真是特别特别好吃的水果
454383,271,台湾这个地方真是没到一个天堂真是上天给了太多好东西,台湾那个地方真是个美岛，一个天堂，真是上天给了太多好东西
454384,272,现在就是缺勇气却正义现在国泰民大家怎么样说的,"现在就是缺勇气，缺正义。


现在郭台铭大家觉得怎么样"
454385,273,Good night,好好当
454386,274,哎呀我是在搞笑,在那哭的时候把我笑
454387,275,韩国语你有你有你的使命,知道吗？你说你郭台铭
454388,276,是韩国有多大呢你说你好好当你的叫别人代买,时候把我笑喷了你知道吗？你说你郭台铭好好当你的B
454389,277,好吧结果就行了,豪呗，结果去参选去了
454390,278,你说这个这种路口那个总统它能领导台湾四年真的搞好经济,你说这个时候就哭的总统他能领导台湾四年就搞好经济？郭台
454391,279,把你们想要吗这个老了60多岁了他马上去实了然后再把它,能想象吗？郭台铭60多岁了马上就70了，他说他
454392,280,台湾的经济怎么搞好然后跟韩国瑜那跟那个赤壁的感觉了然后就哭,台湾经济搞好，结果跟韩国瑜和柯P，PK不下去了，然后就哭了，然后说你待在
454393,281,然后说你呆在高雄吧别回来别给我竞争,然后说你待在高雄吧别回来别跟我竞争，给
454394,282,我让你接一下有这种谎言吗是他的大陆富豪选择天下好呢,我让给你。天下有这种谎言吗？他当这个富豪简直天下
454395,283,这种到底是中国的精英啊,"这种道德。


所以中国的精英啊"
454396,284,很多人试试,很多人是什
454397,285,是什么经营啊,是什么精英啊
454398,286,你知道是哪个经吗是实实在在的,你知道是哪个「精」吗？是实实在在的
454399,287,是你就是那个,是哪个「精」吗？是
454400,288,喂,哪
454401,289,绝大多日不好气的,绝大多少人抛弃的
454402,290,不愿意理会的没有到都成分的,不愿意理会的，没有道德成分
454403,291,没有质量成分的不含能力成分的,没有质量成分的，不含能力成分的
454404,292,投机分子那个经,投机分子，那个「精
454405,293,他不是真正的能力道德文化,它不是真正的能力，道德，文化
454406,294,儿子一生的经营他绝对不是,集于一身的精英，它绝对不是
454407,295,绝大多数是投机分子和杆跨越红线的,绝大多数人是投机分子和敢跨越红线
454408,296,侥幸幸存者和侥幸成功的,侥幸幸存者和侥幸者。所
454409,297,所以在中国获得亚洲只有,所以在中国或在亚洲，只有
454410,298,真的是什么呀,真的是什么样
454411,299,大多数人,大多数人
454412,300,都是靠胆大华的才成功,都是靠胆大儿发的财成功
454413,301,靠能骗能忽悠,靠能骗，能忽悠
454414,302,哇塞盛的歌,发财成功的
454415,303,昨天我就跟我一生开会,昨天我跟我医生开会
454416,304,我厉声说他们这个不是生病,的医生说，他们的这个博士生毕
454417,305,就做了这个过敏的检查的,业，就做这个过敏的检查的
454418,306,啊,百个
454419,307,700个人以后,个人，这是
454420,308,选300个人这是在几万什么选出来的,选三百个人，这是在几万里面选出
454421,309,给我拿说全美国的吗,果他说，全美国里面
454422,310,将近70%全是亚洲人,将近70%全是亚洲人
454423,311,就是拿到这个不是这么说的,就是拿到这个博士证书的
454424,312,校长室门讲话校长说,校长在上面讲话，校长说
454425,313,感谢你们成为了人类的经营还要多少人考这个植物考不上,感谢你们成为了人类的精英，多少人考这个职务考不上
454426,314,结果你们,结果你们
454427,315,看你们左边右边都是人类进行,看看右边，都是人类的精英。结果你
454428,316,你结婚你们选上了就大力看陈亚洲人很多都是中国人,精英。结果你们选上了，大家一看，全亚洲人，很多都是中国人
454429,317,这在美国就是你想想一个在陆700元将近500个出来自于中国和亚洲,这在美国你想想，一共才6，7百人，将近5百人是来自于中国和亚洲
454430,318,和台湾,和台湾
454431,319,这也是经营是考出来的,这些是精英，是考出来的
454432,320,在美国的经营是真是经营,在美国的精英是真是精英
454433,321,你叫郭台铭这第1感片12展和有的三不要脸,你像郭台铭这是什么？ 第一敢骗，第二敢忽悠
454434,322,第4个赶快乐的法律红线的人都从楼上好像跳了下饺子似的他说没事,第四个敢跨越法律红线，那人都从楼上往下跳了，下饺子似的，他说，没事
454435,323,忧郁症,忧郁症
454436,324,谈恋爱失望跳楼,谈恋爱失望跳楼
454437,325,那就你丫头汤调了吧没事他敢忽悠,你家都谈恋爱失望跳楼啊，哎…没
454438,326,所以说要改名我说了吧我是他是从选总统的天气,所以你看郭台铭我说了吧，他自从选总统那天起
454439,327,那个共产党,那个共产党
454440,328,到北京去见过习主席几个小时回来说要选总统,到北京去见过习主席，几个小时后来，说我要选总统
454441,329,他的人生事业对,他的人生事业就
454442,330,江河日下,江河直下
