id,index,content,proofed
454443,331,身体健康你看解的过程说啥了,身体健康你看现在郭台铭成啥了
454444,332,都说话都说不清楚了,都说不清楚了，然后就
454445,333,姜和直下那俩差,江河直下，那两
454446,334,是叶之下身体滋养未来,事业直下，身体直下。未来
454447,335,最后一个0,最后一个
454448,336,大家走了看你说哪有一个还处选党内初选,"家走著看。


你说哪有一个还初选，党内初选"
454449,337,就给一个60吨水给办哥哥给小姑了,就给一个60多岁的大哥哥给选哭了，还在那
454450,338,给我那天我一看他背后一个老虎,结果那天我一看，他背后一个老虎
454451,339,郭台铭我发现这人啊他他不懂得这个玄学和风水也不懂中国文化,郭台铭我发现了，这个人啊，他不懂得玄学和风水，也不懂得中国文化
454452,340,中国有两件事,中国有两件事
454453,341,这个千万千万记住家中啊你可以家人全上可以挂签作文,这个千万千万记住，家中啊，你可以在家中墙上你可以挂
454454,342,都不能拔和引进来,都不能把虎引进
454455,343,你可以挂1000个坟的照片挂长了你都不能把一个老虎照片搬家,你可以挂一千个坟的照片挂在墙上去，你都不能把一个老虎挂
454456,344,我这人生经历了很多事我看了很多人挂老虎,我这人生经历了很多事，我看了很多人挂老虎
454457,345,说说别的周永康,说别的，周永康
454458,346,老虎,老虎
454459,347,朱老虎就这么来了抓紧就了吧,周老虎就这么来的，抓进去了吧
454460,348,薄熙来背后大老虎进去了吗,薄熙来背后大老虎进去了吧
454461,349,财政部副部长外搬进去了吧,财政部的副部长王保安进去了
454462,350,啊还有装B的乘客接打老虎进程中国有化腐的只有三个人画老虎的,"去了吧，还有枪毙的成克杰大老虎进去了吧。


中国有三个人画老虎的，现在又"
454463,351,现在唯一可是在树的动画家是看着华服的人是什么下场,现在又一个是在世的，懂画家看看，画虎的人大家看看是什么下场，这
454464,352,这个护士不能随撞墙上挂的,这个虎是不能顺便往墙上挂的
454465,353,绝对不能踏而且护前不流泪呀,绝对不能。而且虎前不流泪
454466,354,这是有说都是在老虎前不能流泪,这是有说道的。在老虎前不能流泪
454467,355,老虎叫你背靠它你又流泪那你就是他的时候你就象征了你就完蛋了,老虎只要你背靠它，你又流泪，那你就是它的食物。象征著你就完蛋了
454468,356,过去拿吃到白虎堂林冲给灭掉,过去咱知道白虎堂，把林冲给灭掉
454469,357,白虎堂白虎堂是杀人的方权威的地方右左青龙右白虎那是有权人在白虎堂,白虎堂。白虎堂是杀人的地方，权威的地方。左青龙右白虎，那是有权力的地方。但白虎
454470,358,他不是头部朝下了,，头是不朝下的
454471,359,大家有什么网上的白虎打扰一下,大家要记住是往上的，白虎堂是
454472,360,不然谁还会选他镜头,不知谁在后面给他选
454473,361,在乎前流泪被扣儿解释,在虎前流泪背靠虎，而且是
454474,362,对了他,对著他
454475,363,还是哭完了完了完了,还在那哭，完了，完了完了
454476,364,那就行了,那就甭
454477,365,韩国的战斗力还是你说这附近还是最强的,韩国瑜现在战斗力，还是韩国瑜是最强的，最
454478,366,这个可能了,正房
454479,367,这个备胎可能要成正太,这个备胎很有可能要升
454480,368,二房要成正法,二房要成为正
454481,369,因为他的不太能太弱了这说明产党对台湾还是不了解,因为啥，这郭台铭太弱了。这说明共产党对台湾还是不了解
454482,370,然后你看到最后赢家可能是天下竟虫闹腾半天劲龟人家,然后你看看，最后赢家可能是，天下尽毁，闹腾半天，尽归人家蔡
454483,371,蔡英文,蔡英文
454484,372,三国读完天下尽归司马懿,三国斗完，天下尽归司马懿
454485,373,可能任小英,可能是小英
454486,374,不动反而是营养,不斗，反而是赢家
454487,375,所以说这个台湾还是含有一丝的然后再说香港,"所以说这个台湾啊，还是很有意思的。


然后说香港"
454488,376,香港,香港
454489,377,美国,美国
454490,378,很多战友,很多战友
454491,379,我说是美国的白人的在政府决策层的战友反攻战友,的是在美国白人的，在政府里决策层的战友啊，反共战友
454492,380,对台湾就给出两个跟我们一样的评价,对台湾，就给出了两个我们一样的评价
454493,381,台湾住两个小时共产党风格,台湾，就给出了两个我们一样的评价，香
454494,382,和,个
454495,383,台湾人民的街头政治和街头斗争,人民的街头政治和街头斗争
454496,384,换了一双普选,换来双普选
454497,385,这个机会我求20都没有,这个机会我说20，我说连
454498,386,所以说打吧就20一样占有吗,所以说大阪G20一样，战友们
454499,387,孩子上班是忘了你是傻瓜你是傻瓜吗今天三餐厅的,失望了，你失啥望啊，今天咱拿一万个亿你也换不来G20让全美
454500,388,全美国人感到上当受骗,全美国人感到上当受骗
454501,389,上当受骗最狠的事情在有没有记录,上当受骗最狠的事情，战友们要
454502,390,做一下他要等一会我这样的人我等会马上又接着牛的牛仔牛奶,昨天，等一会我要见的人，等一会我要马上见的人，牛的牛的牛的人，在之
454503,391,我在之前我告诉他我是美国,在之前我告诉他们，我说美国
454504,392,可看到所谓的中国威胁现在变成了中共威胁中共威胁性的微信,国威胁，现在变成了中共威胁。中共威胁现在威胁你们美国谁
454505,393,就威胁了你两个人美国,就威胁了你两个美国人
454506,394,立威胁的白工作做成一个个人照总统,两个美国人，一个威胁到白宫坐在椅子上的那
454507,395,不管叫窗口就拿叫总统,不管叫川普叫啥， 叫总统
454508,396,第2个威胁了你们的整个的农民,第二个威胁了你们的，整个的农民
454509,397,最受害的就这俩人,最受害的就是这俩人
454510,398,现在大家要知道重视可以有很大的下令美国,现在大家要知道，最受害的就是这俩人，现
454511,399,美国是有巨大影响力的,美国是有很大权利的
454512,400,杨虎相斗咱不得力吗咱是爆料革命三第3方啊,你说，两虎相斗咱不得利吗？咱是第三方啊，当
454513,401,当年共产党不就是让帮助日本,当年共产党不就是，帮助日本
454514,402,打了国民党,打了国民党
454515,403,杀掉了百万国民党,杀掉了百万国民党
454516,404,让两方财树上最后是共产党的力了,让两方全受伤，最后是共产党得利了
454517,405,Hamburger斯引进来,后把俄罗斯引进来
454518,406,杀中国人然后过来脑子里了,"杀中国人。


然后共产党得利"
454519,407,他是真正的卖国贼,他是真正的卖国贼
454520,408,这么凉拌你这个畜生怕难的办法回答为了谁让这个地址杀掉百分,这个畜生，他在这块儿，他回答回答，谁让历史上杀掉百分之二
454521,409,25%的一个国家的打字那是共产党,之二十五国家的一个党，是共产党
454522,410,是哪个党让这个国家土地的歌曲最多的是共产党,是哪个党让这个国家土地割去最多的，是共产
454523,411,是哪个党这个全世界上让这个国家的民族收最不大的民族是共产党谁,是哪个党让全世界上，这个国家和民族称为最不受待见的民族，是共产
454524,412,卖主求荣啊,卖祖求荣啊
454525,413,人家蔡英文是让这个世界上最有尊严最有有面的那个民族就是蔡英文,人家让这个世界上最有尊严，最有面子的民族，就是蔡英文。蔡英文里面随
454526,414,蔡英文文里面随便摸一把他身上任何无意把出来的英文,蔡英文里面随便摸一把，他身上任何地方摸一把出来的英文
454527,415,不够过中南海是一堆加了一起的英文,高过中南海里那一堆加在一起的英文
454528,416,蔡英文同志只要拖着叶网上到移到那个国际知识和法律知识,蔡英文同志只要脱个鞋往下倒一倒，那个国际知识和法律知
454529,417,都比咱们那个所谓中南海的搞法律的那些人要抢多少万倍,都比咱们所谓中南海搞法律的那些人强多少万倍。所以人
454530,418,所以人家受到西方世界的尊重,所以人家受到西方世界的尊重
454531,419,你你200年多少钱卖主求荣你有肚子吗,你梁冠军到那去说是卖祖求荣，你有祖
454532,420,是台湾暴露了福建的所有的人是美国版福建所有的人结婚你现在,是台湾包容了福建的所有的人，是美国包容了福建的所有人的人，结果你骂蔡
454533,421,骂人蔡英文就是这个畜生简直是混蛋自己,结果你骂蔡英文去，这个畜生，简直混蛋至极
454534,422,谁占用了,事件一样
454535,423,在浮点数学香港,所以战友们，香港
454536,424,香港市情和大阪时间一样,香港事情和大阪事件一样
454537,425,他们接下来斗争只有一条记录,他们接下来斗争只有一条去
454538,426,走向死亡,走向死亡
454539,427,这叫,这叫
454540,428,从塔西佗陷阱,从塔西佗陷阱
454541,429,将变成了和西方永远,将变成和西方永远
454542,430,和世界上政治游戏,和世界上政治游戏
454543,431,不可回避的,不可回避的
454544,432,另外一个选择,另外一个陷
454545,433,大家都知道那叫啥子,大家都知道那是
454546,434,我就不说独自乐吧,我也不说独字了吧
454547,435,我也不说才了吧我也不说说买家了吧,我也不说裁了吧，我也不说罗马尼亚吧
454548,436,我也不说当年希特勒了吧,我也不说当年希特勒了吧
454549,437,小英雄怎么今天能不能走上曼哈顿,小英总统今天能走上曼哈顿，能
454550,438,能干点事可以说绝大多数考生爆料革命引发的,能站在这，可以说绝大部分功劳是我们爆料革命引发
454551,439,绝大多数,绝大多数
454552,440,而且都不想来看台湾小英总统选上比别人好,而且到目前来看，台湾小英总统选上，比别人
454553,441,从前看啊那个明天打电话吧,从目前看啊，说不定明天啥
454554,442,接下来美国不尽军售,接下来，美国不仅军售
454555,443,我可以告诉大家还有很多行动,我可以告诉大家，还有很多行动
454556,444,据我所知在经济上的一系列政策,据我所知在经济上的一系列政策
454557,445,据我所知的技术上的一系列的政策,据我所知在技术上的一系列政策
454558,446,据我所知跟中共之间的贸易战和科技站精湛,据我所知跟中共之间的贸易战，科技战，金融
454559,447,最受益者就是台湾新加坡,最受益者，台湾新加坡，台
454560,448,台湾李永前所未有的机会别再那种了,台湾人有前所未有的机会，别再内斗了，台
454561,449,台湾人别在内动了,台湾人别再内斗了
454562,450,别再丢人现眼了全台湾的媒体跟关了一起来嘛这个谭咏文,"别再丢人现眼了。


全台湾的媒体跟共产党一起骂蔡英文"
454563,451,别再丢人了,别再丢人了
454564,452,台湾人民一个出来分割n个新的企业,台湾人民应该出来N个N个新的企业
454565,453,大企业前所未有的机会,大企业、国际企业，因为这
454566,454,放弃内斗,放弃内斗
454567,455,强大排湾经济,强大台湾经济
454568,456,强大排湾人民的世界的影响力,强大台湾人民在世界的影响力
454569,457,不要被,有的机
454570,458,同毒陷阱,统独陷阱
454571,459,和台湾内部的国民党与民进党的这个选举陷阱这两个旋紧避孕套卖,和台湾内部的国民党与民进党的选举陷阱，这两个陷阱必须跳开
454572,460,跳看这两个景了你将拥有大海,跳开这两个阱了，你将拥有大海，你
454573,461,你将拥有大西洋,你将拥有大西洋
454574,462,太平洋,太平洋
454575,463,共产党这项目是,共产党羡慕死
454576,464,然后你个球台外面,然后就该求台湾
454577,465,赶快把我给捅了吧,赶快把我给统了吧
454578,466,赶快把我捅了给球你懂吗,赶快把我给统了吧。」，得求你统
454579,467,那不是开玩笑的别以为这是玩意这不是玩笑,那不是开玩笑的。别以为这是开玩笑，这不是玩
454580,468,然后香港和台湾,然后香港和台湾
454581,469,相交相呼应,相呼应。千万
454582,470,千万别联合一联合就有刘揍死你了千万遍两个,千万别联合，一联合就有理由揍死你了，千万别联
454583,471,只配合,只配合
454584,472,不良和,不联合
454585,473,两个找死配合就一定会赢,联合找死，配合就一定会赢
454586,474,大家走得这么接下来美国上层的高层变化,大家走著看吧，接下来美国上层的高层变
454587,475,强子,响台
454588,476,深刻深度影响,深度深刻影响
454589,477,海港,台港
454590,478,好我们报了个命,和我们的爆料革命
454591,479,接下来,接下来
454592,480,一系列的行动,一系列的行动
454593,481,会对中共的给国企,会对中共那些国企
454594,482,重大打击,重大打击
454595,483,台湾的台积电,台湾的台积电
454596,484,正在桌子上等待着企业呢,正在桌子上等待著切呢
454597,485,等着去了,等著切呢
454598,486,你就偷个宝华为的后果有多严重啊你知道你干啥了,你偷著帮华为的后果有多严重。你知道你干啥了
454599,487,走了走了,中了！战友
454600,488,一切都是刚刚开始啊,一切都是刚刚开始
454601,489,为14亿中国人民台湾人民香港同胞全世界华人欺负,十四亿中国人民、台湾人民、香港同胞、全世界华人祈福
454602,490,我穿了过来了再说好我看到那个我们正经关不了啊彭文正先生,我穿著郭战装，战友说好。我看到政经关不了彭文正先生采
454603,491,采访大美女啊也高丽高高立法委员啊高参议员,采访大美女，是高立法委员、高参议员
454604,492,滚快滚,关不了彭
454605,493,这个好像是个鸡,这好像是个鸡
454606,494,过站桩的影像的期待大家在解释一下,郭战装的鹰像个鸡。 我给大家再解释一
454607,495,不懂得这个鹰的人那你就不了解应慢慢就了解应吗,不懂得这个鹰的人，你就不了解鹰，慢慢去了解鹰
454608,496,我当年到非洲去非洲有一种应叫英中之王,我当年到非洲去，非洲有一种鹰叫鹰中之王
454609,497,英一般来讲大概的60岁到70岁时常受了他这个应试过百岁的,鹰一般大概在六十岁到七十岁是长寿了，而这个鹰是过百岁的
454610,498,这个应用英中之王,这个鹰叫鹰中之王，主
454611,499,主要在坦桑尼亚和乌干达100,主要在坦桑尼亚和乌干达
454612,500,坦桑尼亚大森林里面有,坦桑尼亚大森林里面有
454613,501,他主要是吃那个折,它主要是吃蛇。在
454614,502,打赤舌,吃蛇
454615,503,在美国西部在那个他那个原来也有但很少找到了又美国百度云,在美国西部在蒙塔纳那边原来也有，但很少找到了，因为美国
454616,504,他的头上是141主宏的,它头上是一簇红的
454617,505,他非常的小,它非常的小
454618,506,很强壮,很强壮
454619,507,他这个奖,它非常的
454620,508,从天空出现了一会抓着他就走,从天空冲下来以后抓住蛇就走
454621,509,咱不能非常飞行速度极快,就走，然后飞行速度极快
454622,510,赵宏图鹰,叫红头鹰
454623,511,但是那句像咱们是,但是就像凤凰
454624,512,这个凤凰要孔雀养你很少见的啊,像凤凰孔雀一样很少见到
454625,513,结果我就在那间到了,结果我就在那见到了
454626,514,见到老人家都可投我还不是咋回事啊啥子妃,见到了。人家都磕头，我还不知道咋回事。人家
454627,515,他说我们那么多年没见我这是工作应是我们的吉利是吉祥,他说：「我们那么多年没见过。这是红头鹰，是我们的吉利，是吉祥
454628,516,所以说他是英主持网,所以它是鹰中之王
454629,517,所以说我就,所以咱的设计
454630,518,三个设计到时候叫红涂应人家向积极的翅膀的那么大但是很可爱这位议员很幽默,当中就叫红头鹰。人家觉得像鸡，鸡的翅膀没那么大，但是很可爱。这位议员很幽默，长得
454631,519,长得很漂亮他的很好,长得很漂亮，谈的很好
454632,520,这个我们台湾刚刚又记起了1200见古典装啊,"的很好。





台湾刚刚又寄去了1200件郭战"
454633,521,这个在特殊情况下准备使用的,装在特殊情况下准备使用的
454634,522,而且我们这回是给台湾的占优势,而且我们这回给台湾的战友
454635,523,有一个特殊的设计啊单位元大家会看到了,有一个特殊的设计，未来大家会看到
454636,524,好吧,战
454637,525,现在干什么我们法治基金在昨天和今天在我们的这个所谓你清明节,亲爱的战友们，我们法治基金在昨天和今天在所谓欺民贼们常委群里边很
454638,526,查为群里面很多战友呢,常委群里边很多战友
454639,527,这个被别人捐款的6万的5万的3万的1万的这句话我都记得了,战友代别人捐款，六万的五万的三万的一万的这几个捐款我都记著呢，都
454640,528,都收到了回头都会按照你留的言给你回复,都收到了。回头都会按照你留的言给你回复
454641,529,包括这个要站装罐装的都会按照你,包括要郭战装的都会按照你提供的安全
454642,530,提供了安全地址给你寄过去,提供的安全地址给你寄过去
454643,531,非常非常感谢,非常非常感谢
454644,532,战友们过站桩一个是法之积极留言,战友们，郭战装一个是法治基金留言
454645,533,一个通过我们指定的战友啊,一个是通过我们指定的战友
454646,534,另外一个大家一定要留下你要什么颜色什么型号可安全的地址都非常的重要,另外大家一定要留下来你要什么颜色，什么型号和安全的地址，这非常的重要
454647,535,现在这一切都是刚刚开始谢谢,爱的战友们，一切都是刚刚开始！谢谢
