id,index,content,proofed
43815,843,我觉得那个太仓储,一天共产党说
43816,844,为啥,威胁是
43817,845,汉族人权怕我真的受不了的压力,元，这里边的很多钱全是美国的养老
43818,846,文贵重道了今天你们家我说过我有压力吗你叫我说过了我吃啥就是啥,威胁是什么概念？如果有一天共产党说老子倒了老子就倒
43819,847,我270个员工被抓抓了放放了抓叛我没有那么大压力我就,威胁是什么概念？如果有一天共产党说老子倒了老子就
43820,848,我哥哥嫂子过传教我都没那么大压力但是现这个捐款认为压力特别大,威胁是什么概念？如果有一天共产党说老子倒了老子就倒了，怎么滴？这3万亿的现
43821,849,我跟你说实话我真的特别打我真后悔,美国的威胁是什么概念？如果有一天
43822,850,反正我昨天我给他们写信我要律师代表学刑法值基金,，这里边的很多钱全是美国的养老保险退休基金。说对
43823,851,一分钱也不能动,有一天共产党
43824,852,一分钱也不能因为这是专款天马流很多是我的名字是我不是,全是美国的养老保险退休基金。说对美国的威胁是什
43825,853,法律成熟人我也不是这个控制人我也不是做决策的人,美国的威胁是什么概念？如果有一天共产党说
43826,854,但是我说有很多留捐款下不行我的,的很多钱全是美国的养老保险退休
43827,855,我可以告诉大家,是美国的养老保
43828,856,在7月1号前,元，这里边
43829,857,所有就买一分钱都不会懂,多钱全是美国的养老保
43830,858,我真不知道是日本王要怎么说这个他们的朋友有一个专门化大的钱,威胁是什么概念？如果有一天共产党说老子倒了老子就倒了，怎么滴？这3
43831,859,我以为真的是日元的只有人捐的是真的是美元,威胁是什么概念？如果有一天共产党说老子倒了老子就倒了，怎么滴
43832,860,这是谜什么狼,胁是什么概
43833,861,早上好日本朋友,全是美国的养老保
43834,862,你好吗听得懂我讲日本话吗我在学日语难受图,念？如果有一天共产党说老子倒了老子就倒了，怎么滴
43835,863,布鲁斯来讲的不是日文的,？国债老子不要了，你的退休
43836,864,Google是日文我原谅会讲好多日文你知道吗啥都不记得了,老子就倒了，怎么滴？这3万亿的现在2万多亿了啊？国债老子不要了
43837,865,这个真的是不记得了,了，怎么滴？这3万亿的
43838,866,金正恩我了解金正恩,金也没了，全美国人吃人
43839,867,金正恩同志啊这小这小孩啊学坏,这3万亿的现在2万多亿了啊？国债老子
43840,868,更换老学的那么图片我估计呀,国债老子不要了，你的退休基金也没了，全
43841,869,下周我人前是一点不上啊,现在2万多亿了啊？国债老子
43842,870,你看看这世界最傻他的事情妹妹茶单,啊？国债老子不要了，你的退休基金也没了，全
43843,871,人家是国家安全国家战略中国飞机中国买的,的现在2万多亿了啊？国债老子不要了，你的退休基金
43844,872,然后到中国去是谈之前中国去先给你的礼物送过去,啊？国债老子不要了，你的退休基金也没了，全美国人吃人。全美国人
43845,873,然后又显示的美国人说这个我对这个日文,国人吃人。全美国人吃人，全美国就人
43846,874,对方钱有影响,是一个吧，如果现
43847,875,然后呢在哪每次见川普总统中国买的传统,如果现在他说美国现在问问自己的证监会。问问
43848,876,中国买的,融机构，他
43849,877,我这是你父亲两个你哪去他吵架说叫你俩是,现在他说美国现在问问自己的证监会
43850,878,你不是让人家门口的一个用外面就给你买的那有这事啊,"你不可思议。什么叫不可思议，



第一个：纽约的证监会竟然从"
43851,879,你家结婚让我们给你去买栋房哪有这事啊还有着XX的吗,纽约的证监会竟然从来没有让中国的700家上市
43852,880,然后去了还表演出来这两夫妻都给我变了,千家拿了钱中国企业。也就是说，咱们叫
43853,881,他俩结婚我给你买单我这个段落到处都尿,家拿了钱中国企业。也就是说，咱们叫风投
43854,882,所有这些人类的悲哀,风投。IPO之前的PreI
43855,883,中国14亿人的规矩,中国企业。也就
43856,884,中国老百姓,中国的700家上
43857,885,多少个杨改兰的多少穷人呢,然从来没有让中国的700家上
43858,886,你看他给那个法轮圈外圈20美金,千家拿了钱中国企业。也就是说，咱们
43859,887,什么前有一个老人家,市公司和这几千家拿了
43860,888,还有意思说每天剪破了,企业。也就是说，咱们叫
43861,889,强迫长得去找了别人叫什么名字我家都有多大了,千家拿了钱中国企业。也就是说，咱们叫风投。IPO之
43862,890,这人咋就不是真的不想再这样新的,司和这几千家拿了钱中国企业。也
43863,891,所有美朝会谈中国买的苹果如此,是说，咱们叫风投。IPO之前的
43864,892,根据我的信息和我的判断,成了魔鬼基金，全都让
43865,893,金正恩这小子估计这几天又去中国,金全成了魔鬼基金，全都让
43866,894,有点东西吧,后你的项
43867,895,每次每朝谈之前中国老百姓对对对对对碰,然后你的项目的真实性和文件和提交资料的透明性
43868,896,初学,和文
43869,897,这天比较还有这事,谁？实际控制人是
43870,898,我给办东小孩我突然我推特上在华盛顿数,都让人给弄死了。就没有人说，你的股东是
43871,899,不是说美国人认为,没有人说，你的股
43872,900,在北朝鲜问题上,性和文件和提交
43873,901,中国有话语权和那你美国就太愚蠢了,议：所有这些上市公司在美国经营那
43874,902,我太愚蠢了,然没有审
43875,903,如果我告诉你共产党对北朝鲜的影响视力营,上市公司在美国经营那么多年，每年都有报
43876,904,我说你们就真的帮他就骗我们老百姓啊,年，每年都有报表，竟然没有审
43877,905,我们共产党是利用混老百姓你看他我在掌握话语权这天价还有什么课,些上市公司在美国经营那么多年，每年都有报表，竟然没有审
43878,906,可怕的是我是天理呀,审计，不可思议吧，华
43879,907,还有什么可怕的事,有这些上市
43880,908,你把节的金正恩的钱,审计，不可思议吧，华尔街的贪婪
43881,909,一个金正恩到中国去是什么待遇吗大家先想一想,在美国市场上最关键的和股东的实际变化--像
43882,910,一级特级酒味,计，没有。不可
43883,911,也就是200米一个价位,理委员会，美国的银监
43884,912,火车以43公里的速度往前走,会，美国的银监会来让中国的70
43885,913,谢谢谢谢那么多爱你,些年钱的去向
43886,914,这叫rain rain blue,真假？大家现
43887,915,文贵加油标才打谢谢谢谢,真假？大家现在想一想，闭
43888,916,大姑,？大
43889,917,如果任何学政治国际政治学,供资料的真实性证据和这些
43890,918,任何了解一点政治的大家你们现在在地下如果我说错了你们只有我你们吗,从第一天提供资料的真实性证据和这些年钱的去向，和他提供资料的
43891,919,中国对北朝鲜的影响力是已经,钟，会发生什么事？大家想想，两
43892,920,这都是客气的严格讲你就是个玩,会发生什么事？大家想想
43893,921,你别让老百姓买单呢,们！两秒钟想明白了
43894,922,你的和平你搞搞行不行哪有这个人让去到非洲去就进去然后去住,难。美国人现在谁敢说，川普总统说，哎，这不能
43895,923,北朝鲜局咱买单咱老百姓穷那个饭都吃不起,不能查，美国的养老保险钱去哪里，不能查。你
43896,924,这天气还有这么一个人吗这就是突然出一土豪拿了全书的钱,在是美国人真害怕了，真害怕了，我说什么叫3F方案
43897,925,吃就是吃了药之处李嘉诚富豪,案，这是我见的第一个啊，就坐在
43898,926,然后再吃生肉,现在让我睡不著
43899,927,Log2是一些有艾滋病的你说那个天底下还有这样只有中国婚姻这个这个,了你的脸，你就不知道共产党有多邪恶，你的脸长得太善了，最后是眼睛瞪著嘎嘎
43900,928,艾滋病进入中国,的脸，你就不知道共
43901,929,这简直荒唐,这人长得很富态
43902,930,看看吧但愿我们对老又梦醉了,我看了你的脸，你就不知道共产党有多
43903,931,金正看着我我要去中国就又流行过钱了我准备跟着文写作业,进来我说这人长得很富态，我说我看了你的脸，你就不知道共产党有多邪恶
43904,932,视频我要聊聊他家的事,说他， 他一进来我说这
43905,933,这个你不能老去中国那么多老北京布鞋,不知道共产党有多邪恶，你的脸长得
43906,934,哎呀我是数字化的进但如果加拿大,最后是眼睛瞪著嘎嘎嘎给我讲
43907,935,这个压力呀真大,长得太善了，最
43908,936,我真后悔,了，最后是
43909,937,发自内心的说我后悔了,小心狙击手，谢谢了
43910,938,我真后悔,这是说
43911,939,反正他们不能动一分钱一毛有那么多,亲爱的战友们哪，中国所有在美国
43912,940,寄到这个钱太大了太多了,临著什么前苏联的科
43913,941,这捐钱人捐款人都是太纯洁了,洲以及包括日本的四家企业都将面临著什么
43914,942,如果不说你那个法子基金你那几个是你能办成一样,临著什么前苏联的科技封锁。所以华为能在吗？中兴能在
43915,943,我们在说你在做中钱的事反正我向大家我在这里保证我一定做好捐款人的监督,为能在吗？中兴能在吗？百度和阿里巴巴能在吗？腾讯能活著吗？都不可能。所有这些人都面临著提交透
43916,944,任何法是基金一分钱跟着目标没关系的,司，能经得起美国这个上市公司的调查吗？不可
43917,945,我愿意付出一切的,所以你看这些牛
43918,946,我向大家保证,当年咱到人家
43919,947,任何一分钱使用钱我一定要来找我,人，都得进监狱，你走著看，比前苏联还
43920,948,只要我告诉了法拎钱还是动了我以后在他爸爸发的进行翻译格式,著看，比前苏联还得惨，这就是报应。当年咱到人家布拉克斯维
43921,949,我想大家工贸,后骗人家，卖
43922,950,我逼着泪,候这个
43923,951,我不甘美国法律他们有没有规划那个15我一定要扛起这个义务,来我们将在世界很多国家开辟一个中国人才和中国好
43924,952,如果说我不卡了有那是耍流氓,括，不包括夏业良这个畜生，我
43925,953,大家捐款100%就下吧都是支持文贵的为什么我不承担这个责任呢,到那时候什么感觉。这个说完了吧，这不恐怖，这一点都不恐怖。我在跟
43926,954,法律责任是法律责任我必须承担道义责任,什么感觉。这个说完了吧，这不恐怖，这一点
43927,955,所以说亲爱的战友们发四季精绝对是,说第二，今天咱不说完，说完你们还得睡觉
43928,956,中国人,战友们
43929,957,大家的法子基金不属于任何人的,二，今天咱不说完，说
43930,958,法自禁的每一分钱必须用于中国人种想法制社会干倒共产党,我在跟你们说第二，今天咱不说完，说完你们还得睡觉，我现在心
43931,959,法制基金的每个捐款者都应该优先得到法治基金的屁,实在话，战友们，因为你们得睡觉，老想著你们睡觉
43932,960,护照顾,话，战友
43933,961,法制基金每个人赚的钱每个人,为你们得睡觉，老想著你们
43934,962,对我在未来,在太多压力
43935,963,优先得到法律禁的,爱的战友们，我第
43936,964,救助和支持帮助,借债多少？借债多
43937,965,伟大的小蚂蚁我现在是负债一大体了要是我有钱我现在你千万千万别,家借贷，国家直接借贷。但是事实上人家美国人监控，很清楚看到借贷
43938,966,你千万别你负债券款你知道入法子基金,很清楚看到借贷1.2万亿，1.2万亿美元。我跟最近
43939,967,你千万别觉好不好你等到你要需要讲的时候只要是真实的,聊天，他们说文贵呀，我们这个圈里面啊，听你这说数字，一说谁弄
43940,968,我可以传给你你别这样钱我求求你了,文贵呀，我们这个圈里面啊，听你这说数字，一
43941,969,3月1号在7月28是小百科大家查一查,说谁弄走几亿，几十亿啦，几百亿啦
43942,970,昨天早上报纸看啥事没有,这个圈里面啊，听你这说数字，一说
43943,971,大家没注意,啦，几百亿
43944,972,美国的第1大美国的宗教,文贵呀，我们这个圈里面啊，听
43945,973,也就是美国的校服美国的,亿美元。我跟最近很多国内的
43946,974,宗教最大的头,我跟最近很多国
43947,975,被凡帝岗给草了,个圈里面啊，听
43948,976,大家看一看,啦，几千亿啦
43949,977,被烦你刚才吵了,面啊，听你这
43950,978,你们上网查查这个人为多厉害,说文贵呀，我们这个圈里面啊，听你这
43951,979,你们查了他的文章他年轻的时候,他们说文贵呀，我们这个圈里面啊，听你这说
43952,980,照片那个啊,这个圈里面啊
43953,981,这是天大的事,这说数
43954,982,咱们中国人没概念,们这个圈里面啊，听你
43955,983,天大的事,天，他们说
43956,984,这个美国的,这个圈
43957,985,教宗被炒了,最近很多国内
43958,986,梵蒂冈梵蒂冈马上一个中国欠交了,聊天，他们说文贵呀，我们这个圈里面啊，听
43959,987,卸下来,几千亿啦
43960,988,大陆看到全世界,圈里面啊，听你这
43961,989,世界革命的前夕有两件事一定发生,个圈里面啊，听你这说数字，一说谁弄走几亿
43962,990,中角家有动静了,国内的朋友们聊天
43963,991,这世界会发生大事,这说数字，一说谁
43964,992,钱树长倒台的时候看看钱数量的宗教界可凡的高出了什么事,他们说文贵呀，我们这个圈里面啊，听你这说数字，一说谁弄走几
43965,993,现在从教9栋楼,里面啊，听你这说
43966,994,世界在变,十亿啦，几百
43967,995,我昨天问大家了,文贵呀，我们这个圈里
43968,996,在这个叫声凡帝岗这个叫做之前那个教授叫啥名字大家记得吗,我们这个圈里面啊，听你这说数字，一说谁弄走几亿，几十亿啦，几
43969,997,大家记得吗,啦，几百亿啦
43970,998,日本的迷郎,里面啊，听
43971,999,大家记得吗在这个叫做什么叫啥名字前一个叫钟,贵呀，我们这个圈里面啊，听你这说数字，一说谁弄走几亿，几
43972,1000,别感冒没事,里面啊，听你这
43973,1001,没人说出来吧,天，他们说文贵呀，我
43974,1002,乱七,圈里
43975,1003,在这个叫做之前怕怕那个,我们这个圈里面啊，听你这
43976,1004,宝宝罗,百亿啦
43977,1005,Poro,弄走
43978,1006,对了,亿啦
43979,1007,谢谢,你这
43980,1008,大家知道保罗爸爸还活着呢吗,聊天，他们说文贵呀，我们这
43981,1009,他他在是吗,聊天，他们说
43982,1010,大家这个老门派活动的吗,多国内的朋友们聊
43983,1011,永不放弃的,朋友们聊
43984,1012,本笃十六,跟最近
43985,1013,大家还记得好他家在哪呢,贷。但是事实上人家美
43986,1014,大型的爆出对了,清楚看到借
43987,1015,我告诉你过去2000年历史,说文贵呀，我们这个圈里
43988,1016,有教廷以来,友们聊天
43989,1017,上一次的啊,说文贵呀
43990,1018,只有所有的交通必须过世后,啊，听你这说数字，一说谁弄走
43991,1019,还有下一个叫钟,，一说谁弄走几亿，几
43992,1020,今天查了只有一个叫做还活着被辞职了,里面啊，听你这说数字，一说谁弄走几亿，几十亿啦
43993,1021,这件事有多大想想,说谁弄走几亿，几
43994,1022,这是人类上多大的事,说数字，一说谁弄
43995,1023,和尚的吧所以战友们为一个活着的教宗,很多国内的朋友们聊天，他们说文贵呀，我们这
43996,1024,为啥我就不倒就从了呢,我跟最近很多国内
43997,1025,傻子经过来我告诉你们共产党石,说文贵呀，我们这个圈里面啊，听你这说
43998,1026,等了吧这是大了,们这个圈里面
43999,1027,谁说我就不愿意跟你们聊太多了都睡不着觉了我这样说的话我,说文贵呀，我们这个圈里面啊，听你这说数字，一说谁弄走几亿
44000,1028,我有压力啥时候便宜,说谁弄走几亿，几
44001,1029,啥时候都可以,说数字，一说
44002,1030,亲爱的战友们,内的朋友们
44003,1031,这是咱们新一批的战役还有真好所以说都会说到了你们都会收到了啊,们说文贵呀，我们这个圈里面啊，听你这说数字，一说谁弄走几亿
44004,1032,日本了日本的战役日本的战役我们回去到啊这个,文贵呀，我们这个圈里面啊，听你这说数字，一
44005,1033,陛下那还有小莫先生的啊日本的战役啊,聊天，他们说文贵呀，我们这个圈里面啊
44006,1034,寄到陛下还有小木耳这个台湾的啊这个第1个1万,聊天，他们说文贵呀，我们这个圈里面啊，听你这说
44007,1035,我已经到了第1个一般都已经到了,说谁弄走几亿，几十亿啦，几百亿啦
44008,1036,现在这个是不是阿根廷的是意大利出生阿根廷长大的,贵呀，我们这个圈里面啊，听你这说数字，一说谁弄
44009,1037,记住啊,几十
44010,1038,记住啊你们上英文让查他现在这个叫行车就过去年轻是一个照片跟他一起,聊天，他们说文贵呀，我们这个圈里面啊，听你这说数字，一说谁弄走几亿，几十亿
44011,1039,照相的小伙子现在找喝酒讯酒发生什么事,这个圈里面啊，听你这说数字，一说谁弄走几
44012,1040,过去的叫停还有一个三天前有一篇文章英文的你们看一看,国内的朋友们聊天，他们说文贵呀，我们这个圈里面啊，听
44013,1041,这个调查说我不说那个叫啊说那个叫李慧同性恋舞歌这边有四个同性恋,这个圈里面啊，听你这说数字，一说谁弄走几亿，几十亿啦
44014,1042,你们就看一看,圈里面啊，听你
44015,1043,这几天发生了到15个里面有四个同性恋,聊天，他们说文贵呀，我们这个圈里面啊，听你
44016,1044,然后呢接下来就是过去现在要发生的事是家再聚,个圈里面啊，听你这说数字，一说谁弄走几亿，几十亿啦
44017,1045,想想,千亿啦
44018,1046,香港的,听你这
44019,1047,大牧师,说谁
44020,1048,是谁呀,说谁
44021,1049,大教大教宗是谁大家知道吧,说谁弄走几亿，几十亿啦，几百
44022,1050,陈先生,说谁弄
44023,1051,陈觉中,谁弄走
44024,1052,好人,谁弄
44025,1053,好人好人,他们说文
44026,1054,但是他就是因为跟那个中英全太好了在香港太牛了,的朋友们聊天，他们说文贵呀，我们这个圈里面啊，听你这说
44027,1055,所以,说
44028,1056,必须把成一团毕业了面跟他有关系,们说文贵呀，我们这个圈里面啊，听你
44029,1057,所以亲爱的战友了接下来发生大事,贵呀，我们这个圈里面啊，听你这说数字，一
44030,1058,这是这是我告诉你们这还都是小事还都是小事,这说数字，一说谁弄走几亿，几十亿啦，几百亿啦
44031,1059,11号前发个别还有大的事,这个圈里面啊，听你这说数
44032,1060,那个是,文贵
44033,1061,我不说了等了吧,很多国内的
44034,1062,法治基金会我再说一遍,字，一说谁弄走几亿，几十
44035,1063,在没有行动之前是家庭的一分钱都不能做,这个圈里面啊，听你这说数字，一说谁弄走几
44036,1064,12,这
44037,1065,亲爱的捐款一定量力而为数量,文贵呀，我们这个圈里面啊，听你这说
44038,1066,第1,里
44039,1067,数量就捐款人数量的B 20质量全盘格,友们聊天，他们说文贵呀，我们这个圈里面啊，听
44040,1068,最重要的这点样都发生,这个圈里面啊，听你这说
44041,1069,他最重要的法治基金的作用它能干啥事,他们说文贵呀，我们这个圈里面啊，听你这说
44042,1070,他又没干啥事那就是绝对不可以的,万亿美元。我跟最近很多国内的
44043,1071,必须赶必须干城市还有一个保证这是我要承担责任的钱一定是要,友们聊天，他们说文贵呀，我们这个圈里面啊，听你这说数字，一说谁
44044,1072,来自有意去最有趣,你这说数字，一说
44045,1073,花子有结果就是必须的,数字，一说谁弄走几亿
44046,1074,亲爱的那你问你睡觉了太晚了,们聊天，他们说文贵呀，我们这个圈里
44047,1075,太多话了我就不说了太多话了跟她老领导的对话的是今天来不及说很多有意思,友们聊天，他们说文贵呀，我们这个圈里面啊，听你这说数字，一说谁弄走几亿
44048,1076,讲到了很多有意思的人,贵呀，我们这个圈里面
44049,1077,然后关香港的问题现在,文贵呀，我们这个圈里面啊，听你这
44050,1078,真的是我从来没有看到过西方真的是对香港和台湾高度关注,最近很多国内的朋友们聊天，他们说文贵呀，我们这个圈里面啊，听你这说
44051,1079,就是这位牛人,字，一说谁弄
44052,1080,告诉我说,说数
44053,1081,我告诉你不会呀,们说文贵呀
44054,1082,台湾,天，他
44055,1083,绝不会允许共产党打进一步,监控，很清楚看到借贷
44056,1084,香港必须要兑现一国两制,贵呀，我们这个圈里面啊，听你这
44057,1085,他说这不仅仅,说谁弄走几
44058,1086,是我们的利益这是一个人类的大家共同利益是这么说的对,贵呀，我们这个圈里面啊，听你这说数字，一说谁弄走几亿，几
44059,1087,另外这个哥们另外讲个什么说那事情只要不打开,聊天，他们说文贵呀，我们这个圈里面啊，听你这说数字，一
44060,1088,防火墙什么合都不行,们说文贵呀，我们这个圈
44061,1089,七龙珠每谈吗我以为讲一个最后有假的要断了,万亿美元。我跟最近很多国内的朋友们聊天，他
44062,1090,我不说谁了这个给那个刘和说爱刘和你老是说这个你要2000,我们这个圈里面啊，听你这说数字，一说谁弄走
44063,1091,E1100要承诺改革亚教改革,朋友们聊天，他们说文贵呀
44064,1092,如果打消息你我根本不相信你,内的朋友们聊天，他们说文贵
44065,1093,又一你怎么保证我他说要留个上了咋回事,友们聊天，他们说文贵呀，我们这个圈里
44066,1094,他给刘哥说这样行不行你用美国那个所谓的31000国债担保,他们说文贵呀，我们这个圈里面啊，听你这说数字，一说谁弄走
44067,1095,如果两年的你没对象你的承诺,近很多国内的朋友们聊天，他们说文贵
44068,1096,2万1美元也没有花你那个国家就拉倒了,2万亿美元。我跟最近很多国内的
44069,1097,下载下一编的吧,看到借贷1.2万亿
44070,1098,然后人说,天，他们说
44071,1099,你又不想打开网络,清楚看到借贷1.2万
44072,1100,你就你就你所有中就瞎扯了啊,家美国人监控，很清楚看到借贷
44073,1101,还有的卖了,呀，我们这个圈里
44074,1102,帅哥,数字
44075,1103,这个这个如果是这个你不打开网络流可你这都下成就可说啥,很多国内的朋友们聊天，他们说文贵呀，我们这个圈里面啊，听你这说数
44076,1104,说网络我们一定会打开,说文贵呀，我们这个圈里面
44077,1105,针对美国,很多国内
44078,1106,从那中国人呢中国人我的控制人也不愿意,近很多国内的朋友们聊天，他们说文贵呀，我们这
44079,1107,这必须有打开,这说数字
44080,1108,还有耍流氓的吗不烦为我你不烦没有我吗但是反中国人中国人,很多国内的朋友们聊天，他们说文贵呀，我们这个圈里面啊，听你这说
44081,1109,太可怜了我们在我们国家领导人的本真是猪狗都不如旧人家不妨没药还我们,我跟最近很多国内的朋友们聊天，他们说文贵呀，我们这个圈里面啊，听你这说
44082,1110,红包房中文,说文贵呀，我们这个
44083,1111,你说这这世界咋弄了起来战友们,们这个圈里面啊，听你这说数字，一说
44084,1112,有多可怕你听说一个国家吗人家说你必须把你家门打开,友们聊天，他们说文贵呀，我们这个圈里面啊，听你这说
44085,1113,都是我们家人不能出去的,们说文贵呀，我们这个圈
44086,1114,真无语了这么说必须,这说数字，一说谁
44087,1115,我想打开问你到我家来在喝酒时我说我进不是给你开发的,啊，听你这说数字，一说谁弄走几亿，几十亿啦，几百亿
44088,1116,不是你们不打开房我一下我说你就一切都瞎扯了傻叉,个圈里面啊，听你这说数字，一说谁弄走几亿，几
44089,1117,菏泽润研究技术,谁弄走几亿，几十
44090,1118,研究技术突破防火墙签山有,们说文贵呀，我们这个圈里面啊
44091,1119,那是用这个尿撒泡尿,内的朋友们聊天，他
44092,1120,要重开一个万达的你在女孩子泡尿你也重来了个打击,贵呀，我们这个圈里面啊，听你这说数字，一说谁弄走几亿，几十亿啦
44093,1121,你充一个可不可以,贵呀，我们这个圈里
44094,1122,真正钥匙,这说数字
