id,index,content,proofed
43520,548,小新街就是我谢谢兰编剧人兄弟,学和美国教育基金，养老基金，保险基金。当
43521,549,你是说是我怕见这种还是我借我借给别人的我没搞明白,斯提倡的德州教育基金德州大学和美国教育基金，养老基金，保险基
43522,550,所以亲爱的战友们呢,教育基金德州大学和
43523,551,中国所有在美国欧洲已超过日本的四家企业,州教育基金德州大学和美国教育基金，养
43524,552,都将面临着什么,当年这个人就
43525,553,前述两个京科技封锁所有华为能在吗,"绝地jedi 文画**



这个养老保险基金就是共"
43526,554,Zte能在吗,这个养老
43527,555,百度和阿里巴巴能在吗,大家上网去查一查在美
43528,556,腾讯能和载吗都不可能,方案里面最核心的东
43529,557,所有这个面临的这些提交透明材料你告诉我中国有一家,里面最核心的东西。我可以告诉你们，大家上网去查一查在美国
43530,558,加上市公司,家上网去查
43531,559,能听得其美国这个上市公司的调查吗,你们，大家上网去查一查在美国上市公
43532,560,Book,保
43533,561,那猪这些上市公司股票为什么结局呀战友们,基金，啥概论？这个人给美国的所有的人告诉一句话
43534,562,0,的
43535,563,0,概
43536,564,不但是你这些人都得进监狱,金、退休基金，啥概论？这个人给
43537,565,瞬间你看到了牛叉的人啊到底清洁,说‘老子欠你的钱，还不了，爱怎么
43538,566,你怎么看,，爱怎么
43539,567,B抢数量还是啥,天说‘老子欠你
43540,568,这就是报应,休基金，啥概
43541,569,当天看到人家家布拉格斯维克去现在看了一个女子学校,的养老保险。教育基金、退休基金，啥概论？这个人给美国的
43542,570,然后骗人家,党有一天
43543,571,卖个大肚子猪肉社会多的不多的抱过来,美国决大多数人失去养老保险、退
43544,572,那么,闹
43545,573,钱树养的书,件事，但是
43546,574,这个人才计划的基金,这件事，但是美国，这
43547,575,咱们法制几行就去弄一个,相信现在川普总统
43548,576,未来我们将在世界很多国家开辟一个,还没有闹明白这件事，但是美国，这就
43549,577,中国人才,总统还
43550,578,和中国好人的救济计划,国这个行动小组是不
43551,579,不包括不饱受一下人啊,川普总统还没有闹
43552,580,把肯定的什么夜年家人不包括,美国决大多数人失去养老保险
43553,581,不包括什么夏业良这个出什么,不了，爱怎么著怎么著吧！’」美国决大多数人失
43554,582,肯定不会了,你的钱，还不了
43555,583,我们就是就是中国的老百姓和人才,著吧！’」美国决大多数人失去养老保险
43556,584,到那时候什么感觉,但是美国，这就是伟
43557,585,这个说完了吧,这就是伟大的
43558,586,这和孔真一点都不恐怖啊,这个行动小组是不给你
43559,587,我在跟你说第2条今天他不说晚上说完酒就他就睡觉我现在心里有压力说实在话,总统还没有闹明白这件事，但是美国，这就是伟大的美国，就是美国这个行动小组是
43560,588,因为你们的睡一觉你们如果老想怎么这么说话也不出来了我过一会上来讲我没有啊,有闹明白这件事，但是美国，这就是伟大的美国，就是美国这个行动小组是不给你美国
43561,589,压力了,方领
43562,590,现在有吗我觉得可怕你们看一看中国,能在里面，军方好多人都不知道
43563,591,共产党在过去的阵,当年连国务卿都不能
43564,592,不到一年吧,！当年连
43565,593,国家借贷多少,都不知道，就把苏联
43566,594,家在多少,家看到了，苏
43567,595,外债啊现在,联，在靠近
43568,596,公开数字7100,上苏联，在
43569,597,这是国家接待国家直接接待国家接待国家接待,上苏联的路，走上苏联，在靠近黑河，黑龙江的地方，黑
43570,598,但是事实上人家美国监控,地方，黑河是当时跟前苏联
43571,599,很纠有看到家带一点儿玩意,害的地方，没有现金交易，都是拿
43572,600,1.2万1美元,方，没有现
43573,601,我跟最近很多国内的朋友们聊天他们说文贵呀我们这个圈里玩啊,龙江的地方，黑河是当时跟前苏联……俄罗斯做易货贸易最
43574,602,听你的说出这一说谁弄成绩了,方，黑河是当时跟前苏联……俄罗斯做易货贸
43575,603,几11了,近黑
43576,604,几百亿了几千亿了,有现金交易
43577,605,老百姓称为其他途戏,害的地方，没有现金
43578,606,这方面我不信说过了,时跟前苏联……俄罗斯做易货
43579,607,这一高兴说是说大了但那几百上千一,走上苏联，在靠近黑河，黑龙江的地
43580,608,这么不靠,易货贸
43581,609,我不是说吹牛逼这个假的但是这不靠谱,都是拿货换，牛仔裤能换回台飞机——直
43582,610,很多人很直接的过表达我才会特别感谢,克斯维克的地方好多学校，人家那个地方女子学
43583,611,因为你们这直接我说真话咱才能干出真是出来你说我以为你说的都对,是分开的。你知道咱们中国的一些人有多坏的吗？那些官员，那都是国营
43584,612,那么就把文贵给变成空打了吗,起来的。河北的造纸厂孟老板
43585,613,那不就是假,板就是那
43586,614,丑恶吗,处女买
43587,615,你们说这话对的,你知道当时的
43588,616,但我告诉你我也有权力告诉你是真是假,道吗？咱们穷是连屋子没地方住，屋
43589,617,我的考试时和证据,有别墅，人家城市
43590,618,我告诉你们我说的都是对的,床都没有。人家苏联是
43591,619,这位朋友告诉我什么,屋里连个床都没有
43592,620,罪一万步1美元就在震惊了美国和世界,子没地方住，屋里连个床都没有。人家苏联是
43593,621,人家最近就在住这一两个月发的是到各国去,人家苏联是家家有别墅，人家城市里有
43594,622,那个公安部长说啊哥们你家拿钱没问题啊,方住，屋里连个床都没有。人家苏联
43595,623,那你看这个小的连60位的数据,道吗？咱们穷是连屋子没
43596,624,17000,"
"
43597,625,你信吗,就是那
43598,626,所有的吓傻了因为我害怕害怕就这个意思,时候起来的。河北的造纸厂孟老板就是那时
43599,627,猪是说共产党对非洲对外一带一路专注就提前把西方下上一代,中就是那时候起来的。河北的造纸厂孟老板就是那时起来的。到那块去做易
43600,628,我就是当年苏联,知道当时的前苏联
43601,629,挑战美国的,连个床都没
43602,630,登月计划太空计划,个床都没有。人家
43603,631,就把苏联给灭了,家苏联是家
43604,632,当年苏联也借了很多钱最后人福利出行差,道吗？咱们穷是连屋子没地方住，屋里连个床
43605,633,在吗,子没
43606,634,亲爱的战友们,穷法？你知道吗
43607,635,过去一年共产党取得栈,样个穷法？你知道吗？咱们穷
43608,636,跟什么正好相反知道吗正好相助,他那是怎样个穷法？你知道吗？咱们穷是连屋
43609,637,我又震惊了,那是怎样个
43610,638,说过去一年在欧美,是连屋子没地
43611,639,非美元银行非美元计数这个词,家家有别墅，人家城市里有房子
43612,640,我原来我说过,有房子，农村有
43613,641,任何一个用美元买的资产,个就是换了一辆拉达车弄
43614,642,和美元交易项下的黑线,兹，我的第一个就是换了一辆拉达
43615,643,和腐败的前美国都有权查不管你在哪,牛仔裤换了一辆拉达车，我到这边
43616,644,去了别以为做法是做这个钱我们在美国受教育,开过来的，油都整不著，就是被美国给制裁
43617,645,那不可能就像猪肉,开过来的，油都整不
43618,646,啊,来的
43619,647,我这样说让我给他报不了啊救肉昨天晚上出事了也就是我们睡觉了,我就赚了！就这么简单，拉达车是推过来的，不是开过来的，油都整
43620,648,我们昨天上午我们昨天的上午时间,，我就赚了！就这么简单，拉达车是推过
43621,649,Emirates,买了
43622,650,日本的温泉天晚上,换了一辆拉达车弄
43623,651,就露在日本,就是换了一
43624,652,朴槿,换
43625,653,被打了,车叫拉
43626,654,这死了到哪都乱玩,来的，多少换的呢
43627,655,很便宜的啊这个几千块钱每天都给你钱不给你耍牛叉我是猪肉就是你的错误,换的呢？18条牛仔裤换了一辆拉达车，我到这边就是买了4000多人民币，我就赚了！就
43628,656,他要调到日本黑帮者,换了一辆拉达车，我到这
43629,657,好的但他接着说,达车，我到这边就是
43630,658,什么样的卡这个怕,！就这么简单，拉达车
43631,659,人家发现日元,，你看不到一片
43632,660,瑞士法郎,有的商
43633,661,英镑,到一片
43634,662,港币,个经
43635,663,包括台币,大一块牛
43636,664,现在不买大量广场乐播报专不然买了不强海航那个7100出输出来了,现在俄罗斯牛油这么大的（250克标准长是11厘米），那时候，咱们这个哈尔滨很牛
43637,665,你这个发现了什么1美元他们很聪明到和在一起钱,那时候，咱们这个哈尔滨很牛，哈尔滨有一个地方叫道里和
43638,666,还有占用率,还有一个咖
43639,667,说真好,过去，给那
43640,668,他们发现就仅仅一年13100 1.3万一,人，（那边的人）给你望远镜、给你汽
43641,669,就是从美元资产变换成这些飞美元向下磁场,就被美国整成那样啦！说实在话，很多中国人被苏联害！被俄罗斯黄毛
43642,670,特别是英镑,人被苏联害！被
43643,671,战友们你们觉得恐怖清空面具人大战哈好好开的挺合打得不轻,中国有些人是真坏啊！到那去了以后是能坑人坑人家，能骗
43644,672,他现在调到日本黑社会不知道哪个非洲卫星到日本玩大了他已经进入就露,家是灾难，咱们去了很多人是能偷则偷，能骗则骗！是见了女的就不放
43645,673,来美国了,他们国
43646,674,他一定来美国进监狱记住我今天说的话一定未来美国,偷，能骗则骗！是见了女的就不放过。 说我们是中华
43647,675,酒楼是共产党,说良心话！有人
43648,676,走路的英语的,得说良
43649,677,其中一个顺滚石炭放心吧等在运作中,们是中华民族，咱得说良心话！有
43650,678,亲爱的战友们,你也得看看自己的毛
43651,679,这就是,著人家黑
43652,680,这个这位朋友说我也下一打电话,中华民族，咱得说良心话！有人
43653,681,共产党这这个书,中华民族，咱得说
43654,682,还这么干,华民族，咱
43655,683,然后你再看看香港,看著人家黑，你也得看看
43656,684,香港的过去一年时间都空会爆料中国经济下滑,人家黑，你也得看看自己的毛病，如果不是我亲身经历
43657,685,中国反腐运动最激烈的时候所谓的,中国人，那真是太多坏蛋啦！所以说我
43658,686,香港私人基金中奖了,人这个骨子里面被共产党在文
43659,687,大概是上网随便的方式都会查出来的,骨子里面被共产党在文化大革命教化灌的
43660,688,香港私人基金成立增加了五倍,人这个骨子里面被共产党在文化
43661,689,在瑞士,子里面
43662,690,在德国,在文化
43663,691,也就是非美元资产的国家,没有人性的毒！亲爱的战友
43664,692,私人信托家族信托增加了100多倍,底线都没有，一点人性都没有
43665,693,李小牧先生李小龙先生选举了现在猪肉就在礼物李小鹏先生旁边,没有法制，真的，那个社会人要是放开了，我是真看到了！我是真看到了，那个坑蒙拐骗
43666,694,相隔不不吐不差10公里,清楚，有个乙村的，一个老
43667,695,所以说战友们,都是换的都是那些
43668,696,你们明白了啥意思了吗所以说美国能不害怕,望远镜，他们都是换的都是那些东西，没有
43669,697,说这个国家已经彻底被一帮人给绑架了,换的那个钢铁、直升机，然后望远镜
43670,698,说这14亿人傻乎乎的那霸天看着就老总吗,升机，然后望远镜，他们都是换
43671,699,这个大局简介大那边大量洗钱,这哥们给了人家苏联人的东西
43672,700,完全是公司部分,苏联人很大方
43673,701,中国老百姓还天天抗议美国那你的后你的杆上插了好几个血管不去了,重工业的东西，坦克车。这哥们给了人家苏联人的东西，人家苏联人很大方，夹克啊、牛仔裤啊
43674,702,你喊了没电了就倒下了你都不知道咋搞的,的东西，人家苏联人很大方，夹克啊、牛仔裤啊，还
43675,703,人家现在美国人在家上担心你突然间倒下了你这一般是跑了,人家苏联人的东西，人家苏联人很大方，夹克啊、牛仔裤啊，还有那个人造的
43676,704,美国的养老保险也没了中国老百姓真的是吃草的机会都没了,家灌醉。我这经历太多了！旁边有个女子学校，中学，不是高中，人都上
43677,705,可不可怕,太可怕
43678,706,这就真正的塞子的话你想让我死不你比我还是个孩子,这个女孩，那个骗！咱说这个苏联人俄罗斯
43679,707,你们要老婆减肥你敢这真是美国的死去真的共产党很厉害,女孩，说要这个女孩，那个骗！咱说这个苏联人俄罗斯人不好，咱们人
43680,708,这比肉美国和大利亚这几叫经济战争这是超线程理论朝鲜战役比较,斯啊，普金的一个手下，每次来中国不过夜，都是直升飞机。她每次来都带著吃的来
43681,709,不对称的战争里面的一条,带著吃的，来了以后和中央领导
43682,710,经济战,见面
43683,711,可怕吗,的来，她
43684,712,不说啊今天上了我报个信息信息他打了信息不行,吃的，来了以后和中央领导见面，见了面就
43685,713,经济多少一般的信息它杀了信息让下次打架,就吃一顿饭自己带来的。就有人问她：「你为啥
43686,714,为什么有这些曾经有一个拿无人机拍纹龟的传大家记,面就走，人就吃一顿饭自己带来的。就有人问她：「你为啥
43687,715,记得吗,己带
43688,716,拍完我传以后还百分那个视频不让去说这是王艳萍找我们做广告,她说：「我不相信你们的食品」。这个人从来不超过一天，从来不超过一天，这个女
43689,717,放狗屁王艳平有没找着板告你们知道我能不知道我们家那个中文,她说：「我不相信你们的食品」。这个人从来不超过一天，从来不超过一天，这个女
43690,718,那就是海航在纽泽西的一个间谍使用的平台式办公室,不相信你们的食品」。这个人从来不超过一天，从来不超过一天
43691,719,我向美国政府出了很多病,我不相信你们的食品」。这个人从来不超过
43692,720,直到同一点时间美国政府的发现真是这确实呢,这个女的未来也是震惊世界的人物，绝对震惊世
43693,721,而且你还还特别会讲开发的视频放到网上去还给我道歉过现在我们是好意思传的,理解的，为什么啊？我告诉你，当年你们查查1983年是中国大逮捕，邓小平的，84年年底的时候
43694,722,太漂亮了,小平的
43695,723,我这就是过来的,时间也是猪瘟，很多
43696,724,No 8假的大胆地说你你必须信,年年底的时候，东北有一
43697,725,你必须佩服这就过来然后就是一切都听党的一切都是党的第1集呢,年是中国大逮捕，邓小平的，84年年底的时候，东北有一段时间
43698,726,钢琴谱中打钱他能说出这话出来他就看得出来,的时候，东北有一段时间也是猪瘟，很多人把猪肉
43699,727,一模一样的,小平的
43700,728,信息站在美国,年年底的时候
43701,729,整个的控制超出常人的想象,年是中国大逮捕，邓小平的
43702,730,一个中国的孙斌记者一个一个更近一期的时候来一黑河的身份,是中国大逮捕，邓小平的，84年年底的时候，东北有一段时间也
43703,731,在加拿大,年年底
43704,732,因为波音的整个的军工厂就军事项目权那样的,捕，邓小平的，84年年底的时候，东北有一段时间也
43705,733,盗走了美国f-35,的肉给弄过
43706,734,阿所有技术中国长江g20ci 202,给弄过去，东北杀的猪带豆
43707,735,偷走了飞机打印数据,豆的肉就不吃了，就
43708,736,中国觉得金钟国叫赵什么,猪肉猪瘟的肉给弄过去，东北杀的猪
43709,737,阿斯运输机叫什么20艺术家y206手机y220,带豆的猪肉，很便宜嘛，有的人就以身试
43710,738,然后偷走了无人机技术,很多人买了这个豆肉就运
43711,739,X47 47,心人
43712,740,就一个孙斌,就以身试
43713,741,就到美国来只判了40个月,就卖，带豆的猪肉，很便宜
43714,742,这美国家怎么做热比共产党的那个那个那个办公室好好多了,很多穷人就以身试豆，很多人买了这个豆肉就运到布
43715,743,牛不牛,就运
43716,744,背后的故事谁知道,身试豆，很多人买
43717,745,就那个项目共产党内部出了71美元,就是豆，很恶心人的，很多穷人就以身
43718,746,美国人真的不知道,，很多人买了这个豆
43719,747,有多少个是密在赣州美国,试豆，很多人买了这个豆肉就
43720,748,有多少顺便输了美国偷渡美国,以身试豆，很多人买了这个豆肉就运到
43721,749,不头功课,多穷人
43722,750,不徒英国,就运到
43723,751,我昨天给你一个这个美国朋友说我说我当时买空壳飞机的时候再通可在天津,结果。我亲自经历的！这位亲自发起人告诉我，当年他是去苏联什么呀？说当年去苏年整个都
43724,752,其中一个经理,亲自经历的
43725,753,老大香港六喝酒每次喝酒前都说爱中国共产党全家的,联什么呀？说当年去苏年整个都沸腾了，共产主义呀！他说这个武器
43726,754,天津就好,天空计划
43727,755,每次都说有一次和大王,美国最后发现，哇！你
43728,756,为啥这哥们啊死死死不了活不活不了为啥呀,二招是什么吗？大家谁都不知道，美国悄
43729,757,就是当年,机构干的啊
43730,758,老檀香木是什么,家，太空科学家
43731,759,这个猪八蛋的老心玩女人,能上电视做广告，那
43732,760,而且那个什么那个那个药丸和牛肉丸,广告，那时侯电视也没这么发达，有的
43733,761,他是一个小人物最会让中方给,当时的委内瑞拉，只要你出来，美国
43734,762,方太让他当经理,有东西都安排下来
43735,763,这个不太感觉了,这些国家给你马
43736,764,但是这部你啥都是听过的,给你马上发护照，所有东西都
43737,765,一开始会很尊重的最后这安全部负责教教抚养他的啊教教他的,"要你出来，美国就会协调这些国家给你马上发护照，所有东西都安排下来。

"
43738,766,领导校领导,东西都安排下来
43739,767,喝醉以后经常做,内瑞拉，只要你出来，美国
43740,768,刹那嘴巴,安排下
43741,769,这个位置,这些国家
43742,770,这就是说白了你当你当叛徒大家就这个真正的长大了,当时的委内瑞拉，只要你出来，美国就会协调这些国家给你马上
43743,771,Red,的
43744,772,经常有要钱,阿根廷、有的到了巴
43745,773,他没主,调这
43746,774,七中干了一些什么什么都知道,这些国家给你马上发护照，所
43747,775,这哥们给他这个领导说能不能把你所有空客飞机上全国装的监听器,包括当时的委内瑞拉，只要你出来，美国就会协调这些国家给你马上发
43748,776,这一个处级干部副处级呀,，只要你出来，美国就会
43749,777,说他竟然让我把书是工作给了这个进去哪个啊,国就会协调这些国家给你马上发护照
43750,778,我告诉你这就是真正的共产党,这些国家给你马上发护照，所有东
43751,779,没有他不敢干的,国家给你马上发护
43752,780,就共产党都输了爹亲娘亲不如党亲一切是党的一切听党的话,括当时的委内瑞拉，只要你出来，美国就会协调这些国家
43753,781,他还有什么道德底线呢,到了巴西，包括当时的委内
43754,782,所以千个战友,有点到了英国
43755,783,我跟你谈谈海口站,能上电视做广
43756,784,这个这个,也没这么
43757,785,我说我告诉你一带一路2025-2050,视做广告，那时侯电视
43758,786,人民币贸易化,没这么发达，有
43759,787,非洲大战略,法国、有点到了
43760,788,中威论坛,有的到了阿根廷
43761,789,然后干掉你的CP,巴西，包括当时的
43762,790,Rfc TCP,出来
43763,791,Cpp cppr就是太平洋的这个贸易协议发到是啊没搞了,要你出来，美国就会协调这些国家给你马上发
43764,792,现在叫CP PC了,西都安排下来
43765,793,无论你你你这个网站这都是跟这个有关系的,国，马上来美国，这就是当年美国的第二招
43766,794,这是一个骇客电脑科技网络的一场战争,这就是当年美国的第二招。他们叫人才计划
43767,795,真够可怕的了吧,这个什么斯大林啦
43768,796,我说不可怕,时贝利亚
43769,797,更可怕的是什么,个什么斯大林
43770,798,我说我给你讲讲两冠军,的孟建柱王岐山孙立军
43771,799,还有正奇,建柱王岐
43772,800,兴奋我说我告诉你在西方有多少华人组,益集团呢，国防垄断，然后搞情报，然后一
43773,801,果然你看到澳大利亚登报,断，然后搞情报，然后一
43774,802,登报抗议澳大利亚政府,党们一个个都在
43775,803,无论你不相信是是啊你美国美国商会你在北京你登个报纸,孟建柱王岐山孙立军是一个德行，那余党们一个个都在
43776,804,反对共产党你看能不能登出来,孟建柱王岐山孙立军是一个德行，那余党们
43777,805,挑战观看的红灯绿灯会点是啥,天的孟建柱王岐山孙立军是一个德
43778,806,还有我说你的华盛顿的烤鸭店,下属的这些余党们都在那贪
43779,807,你的烤鸭店你们都干啥呢快点都有啥你去你去查了看看这个不说这个你就是我的,属的这些余党们都在那贪钱玩钱，跟今天的孟建柱王岐山孙立军是一个德
43780,808,你知道的怎么办,这些余党们都在
43781,809,我们已经在行动了,军是一个德行，那余党
43782,810,现在最近电影那还只有共产党才能救地球,行，那余党们一个个都在玩呢。都弄钱呢，都在那建立利益集
43783,811,哎呀,在那
43784,812,哎呀,在那
43785,813,没法那么的没法弄这个天底下,是一个德行，那余党们一个个都在玩呢。
43786,814,最大的核武器就是不要脸玩意,天的孟建柱王岐山孙立军是一
43787,815,张永乐,党们一个
43788,816,我就不说了今天我太多话题了啊,都弄钱呢，都在那建立利益集团呢，国
43789,817,我太多话题了,都在玩呢。都
43790,818,我再次请求大家华氏基因,弄钱呢，都在那建立利益集
43791,819,任何人捐款,钱呢，都在那建
43792,820,量力而行,立军是一个德行
43793,821,我这里昨天到今天路德先生骚乱也不转了好多就是老人家我就把祖国的放,玩呢。都弄钱呢，都在那建立利益集团呢，国防垄断，然后搞情报，然后一
43794,822,我是绝对的老人家我都收到了你又把房子捐给你发质基金,联有钱人到处去欧洲买房产，买字画，当时最穷的就是
43795,823,路德的sorry都发给我了我求求你你千万不能这样我们坚决不会,这些人大部分都被弄来了。包括国防科技，最后怎么样，釜底抽薪
43796,824,我会记住你的房子吧不会的,科技，最后怎么样，釜底抽薪
43797,825,不管你什么理由都不会的,防科技，最后怎么样，釜底抽
43798,826,还有一个,士，结果
43799,827,就是我没有说得好吧这个捐款当中很多是来自日本巴西,就是前苏联的科学家。最受打压的是被教育的人士
43800,828,欧洲纯日本朋友,最后怎么样，釜底抽
43801,829,现在我也不会说日语音文化,底抽薪。我说到这，我再跟你
43802,830,哈佛你八字裤你给我空帮哇靠你急哇,在我面前说出来共产党对美
43803,831,我也不知怎么空帮哇是什么意思是早餐是吧这里小莫小姐不说话你来啊,我，他说我现在出了几个事儿，说得我浑身起鸡皮疙瘩。 美国真有人才啊，真是
43804,832,还有这个必下空帮哇koonichi话我就会说这个题啊喂,他说我现在出了几个事儿，说得我浑身起鸡皮疙瘩。 美国真
43805,833,这个,真
43806,834,这个是很多日本爱丘应百客票打折的话压空帮哇,我浑身起鸡皮疙瘩。 美国真有人才啊，真是有人才啊
43807,835,是你吗哈哈哈,市公司4家，到
43808,836,日本朋友你们觉得太多钱了我周日本人赚钱都很很小路,通过美国的基金和影子银行以及其它渠道拿出1万亿美元，这里边
43809,837,你们捐太多钱了,里边的很多钱全
43810,838,太多了真是太多了我给你们说实在话占用他当我放屁呀这不算数的,它渠道拿出1万亿美元，这里边的很多钱全是美国的养老保险退
43811,839,给你们聊真心话,出1万亿美元，这里边的
43812,840,我真后悔,通过美
43813,841,我自己我真后悔了,休基金。说对
43814,842,我昨天给办公室说了半天我说我真的是后悔了,果有一天共产党说老子倒了老子就倒了，怎么滴？这
