id,index,content,proofed
43248,276,价格是在什么情况下,两天啊，这个路德先生和
43249,277,不能超过,郭宝胜
43250,278,还有一个全欧洲的石油天然气不能超过30%到今天也没吵过,有看过的，那是郭宝胜你们一定要看。因为对待咱们法治中国
43251,279,如果你赶超过这个你敢不尊重这个价格,们法治中国和遵法守法知法多么的重
43252,280,很简单美国就制裁你,们是干啥的，你再看
43253,281,让所有的美国际事务所欧洲公司跟前苏联吃了你不用说那里没有做那么多做,、庸俗、一目了然。拜托了大家，特别年轻的战友们务必要看，因为中国会走
43254,282,你要做你跟我做,看，因为中国
43255,283,很简单,话，人家
43256,284,就那肯定了很多的科技公司当时就到了,家法官请来的翻译和我们的律师问的话都是记
43257,285,技术封锁,诉你美国
43258,286,然后,告诉
43259,287,还没到缙云的一块了还没到金月经历了一个思维更快了吧当时没进去,到尾给你审。所有的你告了以后，你两边律师互相问询同等条件
43260,288,另外一个对所有的前述两个企业家在西方的活动所有的筋,给你审。所有的你告了以后，你两边律师互相问询同等条件
43261,289,句容有监控,中国法院从
43262,290,每一笔钱每一毛钱不是每一块的每一毛钱都见过,以为律师问话能有啥啊！我告诉你美国的法院不像
43263,291,当时,律师
43264,292,啊当时,话都是
43265,293,非常有意思,像有文字
43266,294,他们说就是对美国什么样的企业不能到妇联的合作投资名,头到尾给你审。所有的你告了以后，你两边律师互相
43267,295,明确大家上网随便一查都查的出来,面，给你在双方问的证据上给你做个裁
43268,296,结果就是说在经济上和天然气和有什么第2个管道,决，找陪审团来。陪审团是抽签的，大家来以后坐
43269,297,到现在那个那个那个动物这个有道电子电观到现在没变,最希望的是跟郭宝胜、袁建斌、乱伦彪、什么夏业良这
43270,298,到现在没接上,最希望的是跟
43271,299,到现在也没错30的油和气,都希望走向大审，陪审
43272,300,更华长的事情,冠军、郑琦，还
43273,301,当时苏联吃了哑巴亏了,向大审，陪审团那一
43274,302,老是给11美元很厉害了,伦彪、什么夏业良这
43275,303,价值1美元的现金英文他都不非法的移动全都被封掉,建斌、乱伦彪、什么夏业良这个畜牲还有韦石、还有熊
43276,304,没人知道,的叫赵
43277,305,这些,郑琦
43278,306,这个经济体,这个畜牲还
43279,307,其中最重要的当时有两个人,熊宪民，我都希望走向
43280,308,是核心的谁都不知道,牲还有韦石、还有
43281,309,这12个人的小组的进来不报案服务金,军、郑琦，还有接下来的叫赵丽贞都会跟
43282,310,有两个人其中一个人是来自于金融机构,有梁冠军、郑琦，还有接下来的叫赵丽贞
43283,311,他在舅舅的大通看他在洛克菲勒,还有接下来的叫赵丽贞都会跟他
43284,312,在这种美国养老保险基金了,赵丽贞都会跟他们走向
43285,313,大家你们看的路子的先生了几个月前做的节目也很有意思了,的叫赵丽贞都会跟他们走向法庭去。因为一审呢那时
43286,314,路德先生说这些话你不清给我的视频展示我说话全部有了就是calories提倡的,梁冠军、郑琦，还有接下来的叫赵丽贞都会跟他们走向法庭去。因为一审呢那时候
43287,315,德州教育基金德州大学,的叫赵丽贞都会跟
43288,316,和美国教育基金养老基金保险基金,还有梁冠军、郑琦，还有接下来的叫赵丽贞
43289,317,当年这个人就在养老保险基金干吗,大审，陪审团那一天。还有梁冠军、郑琦，还有接下
43290,318,这个养老保险基金就是共产党的三F方里面最核心的东西,郑琦，还有接下来的叫赵丽贞都会跟他们走向法庭
43291,319,我会告诉你们大家上去上网去查一查,我就要回答问题，双方出示证
43292,320,在美国的上市公司700加东,治的中国将有最大的贡献
43293,321,几乎99.99%不能例假没有全部来自于美国的养老保医,法治的中国将有最大的贡献。郭文贵以身说法，以
43294,322,教育基金,将有最
43295,323,退休基金,题，我就要回答
43296,324,啥概念,双方
43297,325,这个人给美国所有的,中国将有最大的
43298,326,能告诉我如果工程那里天说老子欠你钱还不了了,题，双方出示证据。那就是郭文贵真心的，我将对中国
43299,327,爱怎么着怎么着吗美国绝大多数人是去养老保险,法治的中国将有最大的贡献。郭文贵以身说
43300,328,退伍金,郭文贵
43301,329,我相信现在川普中途还没闹明白这件事但是我没有这就是伟大的美国,我将对中国法治的中国将有最大的贡献。郭文贵以身说法，以身示
43302,330,就美国这个行动小组是不听也不给你美国总统心情是美国国会负责,就是郭文贵真心的，我将对中国法治的中国将有最大的贡献。郭文贵
43303,331,是美国军方的领导的,是郭文贵真心的，我将对
43304,332,这是多大的是当年龄不停的不是在里面,就要回答问题，我就要回答问题，双方出示证
43305,333,今晚好多人都不知道,的中国将有最大的贡
43306,334,就把数量里面就是大家看到了就出来就开始吃老鼠肉,就要回答问题，双方出示证据。那就是郭文贵真心的，我将对
43307,335,大家一定要想想你当年啊我第1次我第1次打赏,对方就要回答问题，我就要回答问题，双方出示证
43308,336,苏联的路,6天对
43309,337,走上苏联,走向法庭
43310,338,在靠近黑河黑龙江黑河的地方黑河市到时再跟前苏联俄,郑琦，还有接下来的叫赵丽贞都会跟他们走向法庭去。因为一审
43311,339,俄罗斯最无意义和贸易最厉害的地方,有接下来的叫赵丽贞都会跟
43312,340,没有现金的都是拿货吧,回答问题，我就要回答问
43313,341,牛仔裤能换的飞机直升机换钢铁,那就是郭文贵真心的，我将对中
43314,342,在对面就布拉格参数维克布拉格斯维克尔地方好多学校,天对方就要回答问题，我就要回答问题，双方出示
43315,343,女子学校男子学校都是分开的,最大的贡献。郭文贵以身说法，以
43316,344,你知道咱们咱们中国的有些人有毒坏了那个官员他都是国营企业刚去换会有事有些更有,"对中国法治的中国将有最大的贡献。郭文贵以身说法，以身示法。







然后有录像有文"
43317,345,牟其中就是那竖起来的,询，这不就是最好的法律
43318,346,河北的造纸厂能不能版就是那种起来的,治中国的时候，就把文贵在大陪审团面前
43319,347,到哪款去做衣服贸易都到哪去买处理卖姑娘,团面前所展示出来的法治和美国成熟的
43320,348,你知道当时的钱数连他的是咋琼法你们知道吗,文贵在大陪审团面前所展示出来的法治
43321,349,咱们穷是两父子没得住,治和美国成熟的法制制
43322,350,肉煮两个床都没有,来走向法治中国的
43323,351,人家苏联是家家有别墅人城市里有房子人家农村有别墅,候，就把文贵在大陪审团面前所展示出来的法治和美国成熟
43324,352,识别墅里边没有油了气家家有汽车拉打开车就拉达,就把文贵在大陪审团面前所展示出来的法治和美国
43325,353,还有菠萝奶*,时候，就把文
43326,354,那拨了奶*我的第1个就是换了个拉打车那么过来的,跟他们问询，这不就是最好的法律课吗？中国未来
43327,355,多少画的那18条牛仔裤换了一条拉打车,在大陪审团面前所展示出来的法
43328,356,18 18 9我到这边就卖了4000多块钱人民币,治中国的时候，就把文贵在大陪审团面
43329,357,我就赚了,我最希望的
43330,358,就这么简单啦啦是不是推我来的不是开过来了不着就是被美国,教科书了。我最希望的就是这一天。所以郭宝胜咱今天募捐一万
43331,359,是不是所有的商店你看不懂1000面包,。所以郭宝胜咱今天募捐一万七，郭
43332,360,郭文贵经历和这个经理,郭宝胜就我告他这个案子最起
43333,361,那时候卖儿卖女,刚开始，这个案
43334,362,真吓死人了这么大一块牛油,的律师费。亲爱的战友们你捐
43335,363,吸毒的60个字母它一会会就是这么大的可牛油那如果咱们这个哈尔滨很牛,给他，多少人捐了自己的房子才捐给郭宝胜。关键这是一个案子
43336,364,哈尔滨啊有理由叫道里道外,案子，还有叶宁，还有赵岩，还
43337,365,道外里面有一个在东北的都一处饺子馆,，还有屎诺，还有刘刚，都告进去了，很多，未来一
43338,366,还有一个咖啡馆,还有叶宁，还有
43339,367,在那里会有牛油我们买点牛油过去给那边人,岩，还有屎诺，还有刘刚，都告进去了，很多，未来一二十
43340,368,给你望远镜,个案子，还有叶宁
43341,369,给你汽车,告进去了
43342,370,你都不能想象历历在目,诺，还有刘刚，都告进去了
43343,371,你说那就被美国整成那样的,郭宝胜这个案子，还有叶宁
43344,372,说的话中国人很多人倍数量害,胜了，郭宝胜这个案子，还有叶宁，还有
43345,373,黄毛还说但是中国人的问问自己,郭宝胜了，郭宝胜这个案子，还有叶宁，还
43346,374,就在那一年我亲眼看到了咱们中国人有些人是真坏的,键这是一个案子，我们在纽约又告郭宝胜了，郭宝胜这个案子
43347,375,到哪去了是能听人家坑人家能骗人家漂亮,的房子才捐给郭宝胜。关键这是一个案子，我们在纽
43348,376,那个时候他们国家是在哪咱们去的很多人是能偷着头能骗这片,赵岩，还有屎诺，还有刘刚，都告进去了，很多，未来一二十个人呢！那
43349,377,是这样的女的就不放过了,屎诺，还有刘刚，都告进去了
43350,378,猪我们是中华民族咱们说良心话,这个案子，还有叶宁，还有赵
43351,379,有人说这一段吗别老看着人家黑你的看自己毛病如果我亲身经历的历,有屎诺，还有刘刚，都告进去了，很多，未来一二十个人呢！那律师费是多少钱呐
43352,380,我是看书的我亲身经历的,十个人呢！那律师费是多
43353,381,当年我们去到俄罗斯的中国人那真是太多坏掉了,都告进去了，很多，未来一二十个人呢！那律师费是多少钱呐！他
43354,382,所以说我们中国人的骨子里玩啊,所知的，现在战友还有五个人要
43355,383,被共产党扩大革命给教皇冠的这个毒品,五个案子都告了郭宝胜，基本上未来三到五年到
43356,384,这个内心的良心的读和这个道德的读没有人性的图,你找300的也行500的也行800的也行1500的也行。基本上郭
43357,385,Thank you very much,赵岩呢、叶宁啊刘
43358,386,亲爱的战友吧,亲爱的战友
43359,387,那个图那真是没有一点到了一下连一点人性都没有,你未来的三五年你都要面对著这些控告。所以说亲爱的
43360,388,你好太热了,是你未来的
43361,389,中国有没有法子真的那个社会有人要放开了那个杂我是真看到我,著这些控告。所以说亲爱的战友们，你说这有多滑稽，所以说这个行。咱不浪费
43362,390,What time can not come on片,说亲爱的战友们，你说
43363,391,我当时我记得特别清楚有一个愚蠢的一个老板,所以说这个行。咱不浪费时间了，咱说说别的
43364,392,换的那个钢铁直升机,个行。咱不浪费时间了
43365,393,望远镜他们都是那些东西没有什么这么清楚你的东西都中国的东西,亲爱的战友们，你说这有多滑稽，所以说这个行。咱不浪费时间了，咱说说别的吧
43366,394,这哥们啊给了人家的东西人家的书店人很大吗就是问那个夹克牛仔裤啊,天，昨天那一段呐？战友们！我喝口水呀！please give me one coffee. 我给大家说这个吧
43367,395,还有那个人造的饭装甲车就放在屋里吗,给大家说这个吧！昨天班农一来把我整迷
43368,396,他晚上再看上去偷袭他把人给灌醉,个吧！昨天班农一来把我整迷糊了，一下断片
43369,397,我这群里太多了他还有个女子学校,我整迷糊了，一下断片了。所以说我
43370,398,中学都中学不是高中,制裁，你不能和他做生意
43371,399,人都让我们拭去丁丁女孩子说完要这个女孩,制裁，你不能和他做生意。当年的苏联往
43372,400,凡是很多人说人家属院人格罗斯语音好不好,，你使用他的天然气使用他的油，价格是在什
43373,401,太可怕了,他成了
43374,402,这个这次为什么俄罗斯普京的一个这个手下每次,成了，而且告诉波兰价格必须在什么情况下，你使
43375,403,在中国不过夜,往欧洲的2个管
43376,404,都吃什么,须在什么
43377,405,他每次来不带吃的来,在什么情况下，你使
43378,406,谁说的他对她这个美这个手机上的最大好吃的,使用他的天然气使用他的油，价格是在什么
43379,407,来了以后和中央领导见面酱面有10种人就吃一顿饭自己带来的,兰价格必须在什么情况下，你使用他的天然气使用他的油，价格是在
43380,408,就有人问他你不要老大吃了没呀,今天也没有超过。如
43381,409,什么的他说我不相信你们的视频,你敢不遵守这个价格很简单美
43382,410,这个人从来不吵我一天,这个价格很简单
43383,411,从来不是我一点这个女的,单美国就制裁你。然后所有的美
43384,412,这个你的未来也是正经事业的任务职业成就世界,这个，你敢不遵守这个价格很简单美国就制裁你。然后所有的美国技术
43385,413,我是能理解的,个价格很简
43386,414,为什么好我告诉你当年你们查一查,格很简单美国就制裁你。然后所有的美
43387,415,1983年是中国达勒姆邓小平的,别跟我做。很简单，技术那是肯定的
43388,416,84年你,很简单，技
43389,417,阿巴斯年年底的时候都没有一段时间也是中文,司当时就倒了。技术封锁，然后还没到禁运那块呢！禁
43390,418,很多人把猪肉猪肉也可以通过去东北长沙的那处地带,很多科技公司当时就倒了。技术封锁，然后还没到
43391,419,豆豆啊百度杀毒处在读了大家有着就不吃了就是生了孩,多科技公司当时就倒了。技术封锁，然后还没到禁运那块呢
43392,420,还有人坏了就煮熟了就卖大豆猪肉便宜吗有的人就是医生,当时就倒了。技术封锁，然后还没到禁运那块呢！禁运那就死的更
43393,421,熟读了就吃了,时就倒了。技术
43394,422,大豆的肉就是动态度很恶心人的,单，技术那是肯定的，很多科技
43395,423,很多人穷人的一生是多就很多人买了个痘痘都也给你弄的那个部落格州俄罗斯,很多科技公司当时就倒了。技术封锁，然后还没到禁运那块呢！禁运那就死的更
43396,424,这出来,后还
43397,425,这就是苏联前倾计出彩的结果,对所有的前苏联企业家在西方的活
43398,426,我亲自经历了,企业家在西方的
43399,427,这位亲自发前告诉我,企业家在西方的活动所
43400,428,当年他是去苏联什么呀说当年的时候整个都沸腾的共产主义,当时非常有意思的，他们说对美国什么样的企业不能到苏
43401,429,他说这个武器研发,投资，很明确大家
43402,430,这个整个这个国家大楼建筑物修铁路修公路,国什么样的企业不能到苏联合作投资，很明确大
43403,431,挑战美国卫星进化天空的话,投资，很明确大家上网随便一
43404,432,真现在咱们中国的一模一样,么样的企业不能到苏联合作投资，很明
43405,433,美国最后发现哇原来你要做这个事,美国什么样的企业不能到苏联合作投资，很明确大家
43406,434,经济师,经济上
43407,435,把客气封锁还没有劲,苏联合作投资，很明确大家
43408,436,大家做第2照是什么,到苏联合作投资，很明
43409,437,大家谁都不知道,到苏联合作
43410,438,美国悄悄的给了前苏联,么样的企业不能到苏联
43411,439,一个叫做人才计划,一查就查的出来，结
43412,440,这是用语用一个私人机构敢让大家去查查历史趣,就是说经济上和天然气上和油上，第二个管
43413,441,这几个都来了就在今天打基金,查就查的出来，结果就是说经济
43414,442,只要你,在东
43415,443,比如当时的合合合合科学家,气上和油上，第二个管
43416,444,太空科学家,来，结果就
43417,445,只要你,在东
43418,446,你愿意出来,便一查就
43419,447,他们敲敲打都有各种渠道大家都知道都是口传他不能上电视做广告南广电视,他们说对美国什么样的企业不能到苏联合作投资，很明确大家上网随便一查就查
43420,448,就是到有得到了德国,欧的油道第二管道
43421,449,有得到了法国你又得到了英国,油上，第二个管道到现在东欧的油
43422,450,我得到了阿根廷你得到了巴西,欧的油道第二管道没连
43423,451,包括当时的美味了,巴亏呀！那时候几
43424,452,只要你出来,美元很厉害
43425,453,美国就会心跳的不要给你马上就发布照,了，几十亿美元的现金因为是非法的移动全部
43426,454,所有东西上没有来原来美国马上来美国,其中最重要的当时有两个人是核心的谁都不
43427,455,这就是当年美国的,重要的当时有两个人
43428,456,第二章,的当
43429,457,他们校人才计划,人小组当中竟
43430,458,当时苏联完全没感觉,当时有两个人是
43431,459,没呀你当时被里呀呀什么和罗晓夫啊所有这些人他,当时有两个人是核心的谁都不知道。这12个人小组当
43432,460,这个什么四大名了这些下属的这些鱼咱们都长贪钱还钱的跟今天的梦见路,重要的当时有两个人是核心的谁都不知道。这12个人小组当中竟然不包含国务卿。有两个人其
43433,461,王岐山孙立就是一个字一个字的照完了,务卿。有两个人其中一个人是来自金
43434,462,多肉钱的都在建立利益集团了,机构大通干过，他在洛克菲勒干过，再一
43435,463,一片繁荣,以前做
43436,464,然后苏联的签证到哪个欧洲去买房产买4万,说的现在话你们千万别忘了那视频在那，我说
43437,465,但是济南最穷的当时就是前苏联的科学家,的。就路德先生说的现在话你们千万别
43438,466,最受打压的是校被教育的人士,做的节目是很有意思的。就路德先
43439,467,结果,节目
43440,468,国防科技纽约,过。大家你们
43441,469,最后怎么样伏的出息,前做的节目是很有
43442,470,我说的是我在你们讲一讲,我说话千万别忘了，就是
43443,471,这个哥们太把我的症状,生说的现在话你
43444,472,我从没见过一个美国人,州大学和美国教育基金
43445,473,能在我面前说出来,频在那，我说话千万别
43446,474,共产党对美国对中国老百姓的威胁,教育基金德州大学和美国教育基金，养老
43447,475,就在我住的后面啊就坐在这就是直接对着我,就是凯尔贝斯提倡的德州教育基金德州大学和美国
43448,476,他说我现在出了几个是说得我浑身起鸡皮疙,忘了，就是凯尔贝斯提倡的德州教育
43449,477,美国真有人才啊,美国教育基金，养
43450,478,真是有人才呀,这个人就在养
43451,479,说你看看,保险基金干
43452,480,日本,人就
43453,481,中国上市公司四家,提倡的德州教育基金德州
43454,482,到美国来700家,大学和美国教
43455,483,700 + 40大概1.2万一不到一会你的外衣,频在那，我说话千万别忘了，就是凯
43456,484,但是通过美国的基金和影子银行以及其他渠上拿主意万1美元,大学和美国教育基金，养老基金，保险基金。当年这个人就在养
43457,485,这里不是很多钱权是美国的养老保险,州大学和美国教育基金，养老基金，保险
43458,486,退休基金,国教育基金
43459,487,说对美国的威胁是什么概念如果有一天关老子老子打了老子就打了,说话千万别忘了，就是凯尔贝斯提倡的德州教育基金德州大学和美国教
43460,488,怎么的呢31000的假现在2万里了我在老子不要了,当年这个人就在养老保险基金干著
43461,489,你的退休基金也买了全美国人吃,基金德州大学和美国教育基金，养老基金
43462,490,全美国人吃,个人就在养老
43463,491,全美国救人吃人证美国比被扔几个核武器的危害大了,倡的德州教育基金德州大学和美国教育基金，养老基金
43464,492,他说这是多可怕呀,提倡的德州教育
43465,493,这是一个吧,这个人就在
43466,494,如果现在,保险基
43467,495,他说美国现在,提倡的德州教育基
43468,496,问问自己的证监会,当年这个人就在
43469,497,问问自己的金融机构,基金。当年这个人就
43470,498,他这三个你不可思议,这个人就在
43471,499,什么叫不可思议的一个,和美国教育基金，养
43472,500,纽约的证监会竟然从来没有让中国的700家上市公司,大学和美国教育基金，养老基金，保险基金。当年这个人
43473,501,和着,这个
43474,502,几千家的拿了金钱的中国企业,基金。当年这个人就在养老保险
43475,503,也就是说咱们叫碰头,育基金德州大学和美国教
43476,504,IPO之前的prep,贝斯提倡的德
43477,505,叫天使机器名天使基金全程的目的基金全自动,教育基金德州大学和美国教育基金，养老基金，保险基金。当年这
43478,506,就没有人说你的股东是谁实际控制人是谁钱去哪了然后你的项目,教育基金德州大学和美国教育基金，养老基金，保险基金。当年这个人就
43479,507,和文件和提交资料的透明性没有,州大学和美国教育基金，养老基金
43480,508,你不可思议吧,就是凯尔
43481,509,第2个不可思议,凯尔贝斯
43482,510,所有这些上市公司在美国经营那么多年每年都有报表竟然没有水,斯提倡的德州教育基金德州大学和美国教育基金，养老基金，保险基金。当年这个人就
43483,511,不可思议了,贝斯
43484,512,华尔街的贪,年这个人
43485,513,第三个你不可思议,斯提倡的德州教育基
43486,514,就是吃了些食物有人,就是凯尔贝斯提倡的德州
43487,515,这个股权背后的变化这是在美国了是最关键的,话千万别忘了，就是凯尔贝斯提倡的德州教育基金德州大学
43488,516,和股东的实际调向海航刘呈杰贯君,德州大学和美国教育基金，养老基金，保险基金。当
43489,517,和在美国公司合作时间所有签署的文件,提倡的德州教育基金德州大学和美国教
43490,518,这个神经,这个人就
43491,519,没有,人就
43492,520,不可思议吧,贝斯提倡
43493,521,那我请问,那，我说话千万
43494,522,如果美国现在,说的现在话你
43495,523,证监会金融管理委员会赢美国的赢家蔚蓝让中国的700,州教育基金德州大学和美国教育基金，养老基金，保险基金。当年这个人
43496,524,把企业和给千家上市公司和那些天使基金提供的通的一天梯,大学和美国教育基金，养老基金，保险基金。当年这个人就在养
43497,525,提供资料的真实性,提倡的德州教育基金
43498,526,证据和这些年钱的去向,当年这个人就在养
43499,527,和他提供的真假大家心里想一想闭上眼睛想两秒钟,和美国教育基金，养老基金，保险基金。当年这个人就在养老保险基
43500,528,会发生什么事,年这个人就
43501,529,大家想想两秒钟了吧发生什么事,当年这个人就在养老保险基金干
43502,530,在有门两秒钟,在养老保险基金干
43503,531,夏明白了吗,就在养老
43504,532,在哪,在养
43505,533,那就是在哪,人就在养
43506,534,美国人现在谁敢说说川普中的说着不能查这700家企业,倡的德州教育基金德州大学和美国教育基金，养老基金，保险基金
43507,535,资料不能查这个奇怪的那个这这个两万一的不能查,基金。当年这个人就在养老保险基金干著
43508,536,美国的养老保险钱去的不能查你们信不信,美国教育基金，养老基金，保险基金。当年这
43509,537,不会了100个钟头都没全,教育基金德州大学和美国
43510,538,战神再闹下去了,这个人就在养老保
43511,539,现在是美国人害怕了,当年这个人就在养老
43512,540,镇海拔,这个人就
43513,541,说说什么叫上海吗这是我见到的一个就住在这,斯提倡的德州教育基金德州大学和美国教
43514,542,能告诉我孙F方案核心的,那，我说话千万别忘了
43515,543,他说我睡不了觉,那，我说话千万别
43516,544,这是我们看到了数年但是现在让我睡不着觉,生说的现在话你们千万别忘了那视频在那，我说话
43517,545,我原来我说他太近来我成长的很复杂,话千万别忘了，就是凯尔贝斯提倡的德州
43518,546,我说我看了你的脸那你就不知道跟老有多鞋子有你的脸长得太傻了最后,我说话千万别忘了，就是凯尔贝斯提倡的德州教育基金德州大学和美国教
43519,547,Gaga他哥教我说差不多了有感觉了,育基金德州大学和美国教育基金，养老
