id,index,content,proofed
605577,1,我在墨西哥的别名,
605578,2,你好你想我吗,
605579,3,今天的寂寞夜里他就在我,
605580,4,去无锡天空大量面积,
605581,5,真的,
605582,6,今天多大量年轻的问题,
605583,7,江小白,
605584,8,商丘,
605585,9,好开始啊哎呀,
605586,10,开始了啊亲爱的战友们今天是1月6号是吧,
605587,11,就是有了好吧,
605588,12,打电话,
605589,13,亲爱的我们好啊,
605590,14,今天是1月6号文贵报平安直播,
605591,15,哎呀今天的纽约没有这个,
605592,16,没有没有下雨下了点小雪,
605593,17,感觉特别好,
605594,18,质量名澳大魔王国数年年我爸种种种种,
605595,19,我从童年啊从废话,
605596,20,孩子回到头了,
605597,21,天哪,
605598,22,哎呀咋弄啊,
605599,23,亲爱的我回不了头了啊,
605600,24,是没办法参加这次时间太长了两份不行了,
605601,25,尼奥大魔王,
605602,26,木兰传奇,
605603,27,这是UN blossom,
605604,28,韩国龙头绿色草龟那年夏天,
605605,29,Oracle 422小灰灰,
605606,30,天青小百合,
605607,31,谭华委托谈话委托单华伟,
605608,32,这这这这真是真是,
605609,33,不如我来了还有这就是车在导演会不会停了,
605610,34,这咋弄了咋弄了,
605611,35,咱们这个,
605612,36,在有过发信息我的看信息,
605613,37,我抽点时间不行了水镜先生啊,
605614,38,Dz卖壳,
605615,39,下一步出来看车展,
605616,40,这个意思这应是上海那美丽人生,
605617,41,Q星,
605618,42,肖营销营销营销营,
605619,43,我得赶快给这个回复一下,
605620,44,我今天最多25分钟啊,
605621,45,最多25分钟,
605622,46,中山陵是星空大足校应不行,
605623,47,咱们找不回去了,
605624,48,不行了不行了这太多了,
605625,49,侠骨柔情,
605626,50,七哥我来了Facebook block,
605627,51,小公主,
605628,52,七哥我拦了Facebook Lock Q星,
605629,53,Refined,
605630,54,Alveolar,
605631,55,车上很多美丽人生啊,
605632,56,江城,
605633,57,减大爷,
605634,58,Rnn,
605635,59,林中的啊,
605636,60,鱼扒,
605637,61,L y u PU,
605638,62,王者浪人,
605639,63,嘎嘎播信仰和希望,
605640,64,Rpc效应20c将成,
605641,65,听单丝光里,
605642,66,Docker Run,
605643,67,接下来美丽的人生council of you,
605644,68,七哥灭中共总中荣啊,
605645,69,21号,
605646,70,A3c,
605647,71,W,W
605648,72,接下来王者张三李四,eQBsw/XhUxLzegLMI/AAAAA
605649,73,木兰传奇相思小蚂蚁,U1qeQBsw/XhUxLzegLMI/AAA
605650,74,霹雳数年湘江之水,6nhU1qeQBsw/XhUxLzegLMI/AA
605651,75,姜朝燕子就应小百合,I/AAAAAAAAANw/ND8RzWkRyO4QT8yRyS7b
605652,76,Cvn 76 US is generally四大不要脸,QT8yRyS7bCDFPpvNvwY6pQCK4BG
605653,77,班农女儿,//3.bp.blog
605654,78,U n c l e s h a n,UxLzegLMI/AAAAAAAAAN
605655,79,之前的美丽人生啊垃圾,hU1qeQBsw/XhUxLzegLMI/AA
605656,80,Neom,com
605657,81,Nice,nhU1qe
605658,82,民族的历农历yummyyummy期革命中中中文田玉人79名,6nhU1qeQBsw/XhUxLzegLMI/AAAAAAAAANw/ND8RzWkRyO4QT8yRyS7
605659,83,咪咪咪咪咪咪王者,MI/AAAAAAAAANw/ND8Rz
605660,84,20子需要,RzWkRyO
605661,85,1,N
605662,86,Oliver integration is represented,LMI/AAAAAAAAANw/ND8RzWkRyO4QT8yRyS7bCDFP
605663,87,将长啊老人家平方并帮助吗,I/AAAAAAAAANw/ND8RzWkRyO4QT8yRyS7bCDFPpvNvwY6pQCK4BGA
605664,88,哎呀忘了好但是我就不见了,AYYCw/s1600/20200106.jp
605665,89,这个我就不亮了,estream.com/accoun
605666,90,这个我刚刚啊,ivestream.com/accoun
605667,91,这个因为我想给战友们大家说几个事,estream.com/accounts/27235681/events/8197481/video
605668,92,这个因为我公布了那个手机一个手机号带有误杀,events/8197481/videos/200508152](https://livestream.com/accounts/
605669,93,带有这个探花,ivestream.com/accou
605670,94,还带有这个msc咋还有三个呢大家要记住啊,"events/8197481/videos/200508152)



我先给战"
605671,95,因为,因为
605672,96,太多了我昨天花了一个小时30分钟,布了那个手机，带有WhatsApp，带有teleg
605673,97,看这个这个我我连,给战友们说几个
605674,98,积分的因为看了大概坐在家里岂是37万人给我发的信息,几个事。因为我公布了那个手机，带有WhatsApp，带有telegram，还带有iMe
605675,99,我不可能看都看完,我公布了那个手机，带
605676,100,那么很多战友给我翻译的是咳就是这样的,给战友们说几个事。因为我公布了那个手机，带有WhatsA
605677,101,还有我发,还有Signa
605678,102,过输给我发站桩什么号期间感冒期间,花了一个小时30分钟，我连几分之
605679,103,还有的火花,还有Signa
605680,104,而顾书而这个能不能借钱,个小时30分钟，我连几分
605681,105,还有郭书着我向你问候,花了一个小时30分钟，我
605682,106,张勇的啊这个我非常感谢你发信息,天我花了一个小时30分钟，我连几分
605683,107,我还是看这信息的时候了,我连几分之一都
605684,108,我就不会再给你回复了啊报价了不给你回复了因为我没办法医的回复,为太多了，昨天我花了一个小时30分钟，我连几分之一都没看
605685,109,我现在给大家咱们定一个游戏规则就让很多人紧急的人,"我连几分之一都没看得了。



昨天大概加在一起是37万人给我发的信息，我不可能"
605686,110,能得到马上咱们和我沟通,能都看完。那么很多战友给
605687,111,第1个,人给
605688,112,当我看的信息显示的时候,多战友给我发的信息都是“嗨
605689,113,前面带一个红字,帽几件。还有的给
605690,114,写得了,借点
605691,115,写资料就爆料的料,几件，战帽几件。还有的给我
605692,116,写得60就你有信息给我说你直接给我说你千万别阐述你这个资料,"借点钱？”还有就是“郭叔，我向你问候”。



战友们，我非常感谢你们发的"
605693,117,我就会打开看,我就不会再
605694,118,当我看这个调你是胡扯的,。我凡是看这信息的时候
605695,119,我会把你拉黑了,我不给你回复了
605696,120,我就不会有问题我就给别人有留空间因为很多战友说有用的信息,我就不会再给你回复了。抱歉，我不给你回复了。因为我没有办法一一地回复。我现
605697,121,西都没有传到我这,个游戏规则，就让很
605698,122,哪料这就代表着有爆料,办法一一地回复。我现在给咱们大
605699,123,直接给我料,再给你回复了。
605700,124,若角有价值马上给你回我也会为你加入到同一路怎么去,我没有办法一一地回复。我现在给咱们大家定一个游戏
605701,125,这是第1个,示的时
605702,126,第2个,第一个
605703,127,非常重要的啊,们大家定一个游
605704,128,大家看到的圈,第一个，当我看到
605705,129,Gender,跟我
605706,130,圈子,千
605707,131,帮你拿个红着我看那个红的是娱乐圈,打开看。当我看这个料，你是胡扯的
605708,132,这个关系你给我站用地进入圈子关于宣布提供捐款信息被黑的信息了,把你拉黑啦。我就不能留着你，我得给别的战友留空间。因为很多战友说，有用的信息
605709,133,把这个圈子,这个“料”字
605710,134,廖何娟,料，直接
605711,135,第3个是,第一个
605712,136,非常重要的也是战友现在最重要是我说的,非常重要的，要看到的“捐”字。“捐”字，当你拿个红字，我
605713,137,不了解情况了比如说,提供捐款被黑掉
605714,138,现在关香港,捐”字，当你拿个红
605715,139,写个长,个非常
605716,140,长虹的岗子我这个翻译香港了,你拿个红字，我看到那个红字有个
605717,141,我就打他,我提供捐款
605718,142,香港的,捐款的
605719,143,然后关于新疆的就是江江的,捐”，就是关于你给我提供捐款被
605720,144,关于西藏的就藏着多了红字开头,关于你给我提供捐款被黑掉
605721,145,关于台湾有台子,关于你给我提
605722,146,把这几个字在前面我都会优先打开,被黑掉的信息，或者捐款的战友给我发的信息
605723,147,但是我发这一次你骗我对你说的根本不着边根本不知道那么回事我就彻底给你了,的信息，或者捐款的战友给我发的信息。这个我马上会打开，我会给你回复，或者给你拉
605724,148,你在哪回来不可能啊我再告诉大家我发现你是骚扰我的信息的时候我一定把你的号码进来,"息、被黑的（捐款）信息。这是“捐”字，“料”和“捐”。



第三个是非常重要的，也是战友们现在"
605725,149,我一定交给监管部门是,我了解情况的。比如说，现
605726,150,因为你就还你说你妈个鸡*,也是战友们现在最重
605727,151,这叫最现在是美国最在乎的事情啊,是战友们现在最重要跟我所说的
605728,152,在了问候的信息你做过发了我不会给你回答,在最重要跟我所说的，给我了解情况的。比
605729,153,问我的信息我就不给你回了因为这个是这个模式时间大家看到,的，也是战友们现在最重要跟我所说的，给我了解情况的。比如说
605730,154,我昨天我给战友群就发了,友们现在最重要跟我所
605731,155,一天六个半小时10又是一个手机,是战友们现在最重要跟我所说
605732,156,我已经严重警告,红的“港”字，就是关
605733,157,我吃一条使用八个小时的手机这对身体对我工作都是绝对不行的,疆的就是“疆”字；关于西藏就是“藏”字，都是红字开头；关于台湾的
605734,158,我昨天跟家人们一直在其他群里保持联系,于台湾的“台”字。把这几个字在前面，我都会优先
605735,159,我记昨天到现在我说了不到四个小时刚才起了这样说你说了四个小时我们好又说说了不能死,我就彻底把你拉黑，你再想回来不可能。而且我再告诉大家，我发现你是骚扰
605736,160,320啊,家
605737,161,还是分三次隧道,回事，我就彻底把
605738,162,这三种说法,着边，根本不是那
605739,163,最多请在友们的理解啊否则的话我就不能再看了一些我看不完这是一个事,者你说的根本不着边，根本不是那么回事，我就彻底把你拉黑，你再想回来不
605740,164,第2个是最近啊,定交给相关
605741,165,咱们战友们的集体合作,"
再一个，问候的信息，你只"
605742,166,我要想占什么致以最崇高的敬意,"事情啊。



再一个，问候的信息，你只要给我"
605743,167,最崇高的敬意啊最崇高的敬意,再一个，问候的信息，你只要给我发
605744,168,最崇拜你为什么,再一个，问候的信息，你只
605745,169,昨天我得到评报小组的内部消息,再一个，问候的信息，你只要给我发了，我不
605746,170,这个评分消暑上面给发文了,个，问候的信息，你只要给我发了
605747,171,中央政法委国这个国家安全委员会发布大批的,只要给我发了，我不会给你回的。问候的信息，我就不跟
605748,172,这是第一次据说,是一个手机，已
605749,173,是,时
605750,174,正式的,这对身
605751,175,内部发文,六个半
605752,176,给王岐山孟建柱,个手机，已经严重
605753,177,杨洁篪孙力军,个手机，已经严
605754,178,和物证,这对身
605755,179,还有广东局,严重警告
605756,180,广东安全厅,昨天跟战友们一
605757,181,说现在,到现在
605758,182,爆料政治运动把我们定为爆料政治运动,不行的。我昨天跟战友们一直在其他群里保持着
605759,183,哈哈哈,来战
605760,184,爆料政治运动还没有还没有订的反革命了,半小时，还是分三次睡的。所以请战友们能理
605761,185,说在海外的,时，还是分
605762,186,社交媒体价,时，我没好意思
605763,187,我们开展了,我没好
605764,188,是占山头茶红旗彻底失败,时。刚才起来战友说，你睡
605765,189,这才知道了吧,在，睡了不到
605766,190,就叫占山头,来战友说，你
605767,191,比如赞助汽车,群里保持着
605768,192,赞助YouTube,天跟战友
605769,193,站住什么这个这个其他的这个传统媒体专注纽约时报,是绝对不行的。我昨天跟战友们一直在其他群里保持着
605770,194,在山头他没站,在其他群里保持着联
605771,195,没有一个上都显示共产党觉得说算了,了不到4个小时。刚才起来战友说，你睡了4个
605772,196,他只能黑我们,睡了4个小时，我没
605773,197,我们所有的占有的数据,我没好意思说，我睡了不
605774,198,一直播YouTube对准备不会黑的,起来战友说，你睡了4个小时
605775,199,那只是黑多黑少尾,你睡了4个小时，我没好
605776,200,所以说在长城的做法,三次睡的。所以请战友们
605777,201,插红旗,，还是
605778,202,长期没收到就在这个,才起来战友说，你睡了4个
605779,203,这个某些地方有差荣奇,战友们能理解。否则的话
605780,204,然后特别是长期的有一个就是专门要黑掉,次睡的。所以请战友们能理解。否则的话我
605781,205,要拿掉,三个半小
605782,206,分裂分化我们的战友,战友们能理解。否则的话
605783,207,啊分化我们的战友,咱们战友们的
605784,208,有没成功但是虽然是鸡腿拌啊,友们敬以最崇高的敬意，最
605785,209,什么为什么在这个毛线占有走啊不断树的根部但是他们错呗,什么？昨天我得到平爆小组的内部消息，这个平爆小组上面给发文
605786,210,比如说这个鸡翅膀原来3万的订阅量,部发文给王岐山、孟建柱、杨洁篪、孙力
605787,211,由于你开始这个开始诈骗,据说这是第一次正式
605788,212,啊,王
605789,213,的回法子基金,说现在
605790,214,阿迪会爆料革命,运动，爆料政
605791,215,我都能选上网的时候重3万钱给了8000了,把我们定义为爆料政治运动，爆料政治运动
605792,216,关注度,开展的
605793,217,猪8100万,如占
605794,218,现在到1800,时报。占山头
605795,219,啊,报。
605796,220,而所有的这些只要是反过来怎么不如此,了算的。他只能黑我们，我们所有战友
605797,221,说着他们的占山头,说占山头没做到
605798,222,插红旗彻底失败分化站有彻底失败,插红旗他也没做到。就是在某些地方
605799,223,引起了共产党的最高层,要拿掉、分裂、分化我们的战
605800,224,花纹,化我们
605801,225,对他的震撼,化我们的战
605802,226,包括,掉、要
605803,227,让他们有注意到几个方面比如就说现在爆料个塑料味道爆料革命成员,然后特别是插红旗里边有一个就是专门要黑掉、要拿掉、分裂、分化我们的战友
605804,228,已经形成了事实上的,"也没成功。



但是虽然是"
605805,229,啊,潘呐
605806,230,一个,些
605807,231,不可忽视的一个团结的力量和组织,订阅量，由于他开始诈骗、诋毁法治
605808,232,就是咱们的团体,比如说这个鸡腿潘
605809,233,已经让工厂的感到害羞了,料革命、瞪眼撒谎的时候，现
605810,234,害怕了,诈骗
605811,235,害怕了觉得受不了了,法治基金、诋毁爆料革
605812,236,咱们,万跌
605813,237,各大媒体平台社交媒体平台,他开始诈骗、诋毁法治基金、诋
605814,238,最近都会相继出台一系列的,治基金、诋毁爆料革命、瞪
605815,239,挡住帝国的国家保护政策,毁爆料革命、瞪眼撒谎的时候
605816,240,更加不利于,的订阅量
605817,241,在海外的屏保,在从3万跌到
605818,242,啊,到8
605819,243,平暴行动,爆料革命、瞪
605820,244,也就是爆料瓶保小组的瓶暴行动啊,诋毁爆料革命、瞪眼撒谎的时候，现在
605821,245,我在成为内享用别把那么在没有暴露出来,万，现在到1千8，而所有的这些只要是反爆料革命的，无不
605822,246,这个,这些
605823,247,非常失败,旗”彻底失败
605824,248,知道很多助力我要出台一系列政策特别是美国澳大利亚英国法,"只要是反爆料革命的，无不如此。



所以说他们的“占山头”、“插红"
605825,249,我得了哇,有的这
605826,250,意大利欧洲和日本,所有的这些只
605827,251,今天日本专门成立了,彻底失败，分化战友彻底
605828,252,叫社交媒体上的网络犯罪,几个方面，其中就说：现在所谓的
605829,253,和,的
605830,254,带有政治政治实体主导的社交媒体,的，一个不可忽视的团结的力量和组织。就是咱
605831,255,假装没有人玩,就是咱们的团结，已
605832,256,所以说战友们,组织。就是咱们
605833,257,大好形势是谁做的,到寒心了，不是，是害
605834,258,是谁呀,是，是害
605835,259,国际汞,让共
605836,260,是几只花吗,是，是害怕
605837,261,不是大家怎么看呢,是咱们的团结
605838,262,周宏先生从过去的,经形成了事实上的
605839,263,一周前不到几十个人,面，其中就说：现
605840,264,现在是上天上天,形成了事实上的，一
605841,265,我们的哭泣的小皮匠,们的团结，已经
605842,266,21日直播实际上3000多,成了事实上的
605843,267,阿达看到了,产党感到
605844,268,我们的卡利息过去是几十上百现在也是上前,心了，不是，是害怕了，害怕了，觉得受不了了。咱们已经是个团结
605845,269,关注度独有国外,在用事实说话，不
605846,270,就是什么概念这在西方社交媒体上,就是，要注意到国际上各大媒体平台、社交
605847,271,这都是不可能的演讲,的国家保护政策，将
605848,272,就在起10个小时不到一周的时间发生了如此翻天覆地的变化,继出台一系列的驻地国的国家保护政策，将更加不利于在海外的平
605849,273,这就是明星,海外的平爆行
605850,274,这就是位真不错,驻地国的国家保护政策
605851,275,这就是反共的坚强意志,政策，将更加不利于在海
605852,276,这就是占有个团结团结的结果,驻地国的国家保护政策，将更加不利
605853,277,无人可以改变,用，别把咱
605854,278,真的假不了假的真不了,政策，特别是美国、澳大利亚
605855,279,大家感受到了吧,澳大利亚、英国、法国、德
605856,280,啊这个让我们很振奋,在日本专门成立了
605857,281,另外一个,利亚、英国
605858,282,香港,英国、法
605859,283,我要给大家这个报告的事情,交媒体上的网络犯罪，和带
605860,284,平报小组和平岗灭感面爆笑树和苹果,国，包括日本。现在日本专门成立了叫社交
605861,285,所谓的苹果运动,国、法国、德国、意大利
605862,286,平岗小组,英国、法国
605863,287,你说黄金山的平台小组吧,社交媒体上的网络犯罪，和带
605864,288,现在,现在
605865,289,中共网要下狠叉子,战友们，大好形势
605866,290,要在两个月以后的两会前彻底解决香港,家看看，曾宏先生从过去的一周前，不到几十个人
605867,291,啊,到几
605868,292,这几天频繁的,龚，是鸡腿潘吗
605869,293,香港四大不要脸,先生从过去的一
605870,294,又到深圳,做的？是谁
605871,295,珠海,战
605872,296,湛江分别要见骆惠宁,网络犯罪，和带有政治实体
605873,297,还有什么,和带有政
605874,298,张晓明已经死求大了,交媒体上的网络
605875,299,咱们爆料革命,专门成立了叫
605876,300,准确的报出,专门有这个部
605877,301,这个王白脸滚蛋张晓明绝对更加滚蛋,"龚，是鸡腿潘吗？不是。



大家看看，曾宏先生从"
605878,302,骆惠宁的商人,宏先生从
605879,303,习王之战,现在是上
605880,304,习王曾江,先生从过
605881,305,何梦,生
605882,306,之战,周前
605883,307,接下来就是无正在海外操作的海外媒体,在是上千；我们的霹雳小皮匠，第一天直
605884,308,冯把革命的媒体上的,个人，现在是上千；我们的
605885,309,占山头插红旗的失败,周前，不到几十个人，现在是
605886,310,和平港运动的失败,生从过去的一周前
605887,311,吴征,生
605888,312,孙立柱飞向后被拿下,是上千；我们的霹雳小皮
605889,313,孟建柱现在正在武汉指挥了,们的卡丽熙过去是几十、上百，现在也是上千，关
605890,314,所谓的爱心的非典,什么概念，这在西
605891,315,啊这个这个这个这个,万。这是什么概
605892,316,整个的这个事情,这是什么概念，这
605893,317,他也会出来,一周的时
605894,318,王岐山,翻天
605895,319,那就更不用提了,这就是反共的坚
605896,320,大家要记住,大家感受
605897,321,这是真的是上天给我带来最大的机会,结果！无人可以改变！真的假不了，假的真不
605898,322,我们战友们千万要记住,这就是反共的坚强意志
605899,323,香港到了最最关键的时候,不了，假的真不了！大家感受
605900,324,我在开始从6月份都开始,可以改变！真的假不了
605901,325,香港最惨的是十月份到10月份,"很振奋。



另外一个香港，我要给大"
605902,326,大家看到了10月11月是最惨的,大家感受到了吧
605903,327,但是我告诉战友们,感受到了吧。这
605904,328,香港的战友们,香港，我要给大
605905,329,对香港最大的挑战,平港小组。咱就说
605906,330,是从3月份,说王岐山的
605907,331,到五月份之间,后的两会前
605908,332,一定会结束了,以后的两会前
605909,333,只是结束是死多少人,会前，要彻底解决香
605910,334,还是香港跪下,繁地，香港“四大
605911,335,他是共产党党员,谈话。张晓明已经死球蛋
605912,336,只是这个结果没有任何悬疑,珠海、湛江分别要见骆惠
605913,337,大家可能不了解路费宁这个人物,白脸滚蛋，张晓明那绝对
605914,338,若惠宁这个人说的大智慧的人,"
骆惠宁的上任；习、王之战"
605915,339,但是受非常之狠,的媒体上的占山头、插
605916,340,不管他是什么人他都是共产党啊,爆革命的媒体上的占山头、插红
605917,341,共产党啊,港运动
605918,342,共产党这个本质都是一样的,、插红旗的失败；和平港运动的
605919,343,这点上去,占山头
605920,344,我们个人人格的确不错,外媒体，平爆革命的媒
605921,345,他的组织性,的媒体上
605922,346,他的整个本质是不会有任何改变的,头、插红旗的失败；和平港运动的失败
605923,347,就是黑社会,指挥着所谓
605924,348,嘿,挥
605925,349,假片暴力,建柱现在
605926,350,这个昨天,正在武汉
605927,351,我们上这个别人展示了,武汉，指挥着所谓新的非典的
605928,352,在离大连审判林墙的顶上的这个录像,真的是上天给我们带来的最大的机
605929,353,悲哀呀,家要
605930,354,林强的哥哥叫林的,的是上天给我们带
605931,355,是对每局的最重要的人,来的最大的机会。我们战友们
605932,356,林强林地的爸爸叫李莉,天给我们带来的最大的机会
605933,357,李烈是当时,了最最关键的时
605934,358,是毛泽东最相信和中来最详细的人是中国国家安全部的创始人,住，香港到了最最关键的时刻，从6月份就已经开始，香港最惨的是
605935,359,后来我们大革命被抓起来等等毛泽东来90周恩来365天没来就,们，香港的战友们，对香港最大的挑战，是从3月份到5月
605936,360,拿出来的自己把自己的意思,间，一定会结束的！只是
605937,361,他的主页,的战友
605938,362,是林则徐,是结束
605939,363,House,束的
605940,364,结果就在,结果，没有
605941,365,郭宝胜啊,多少人，还
605942,366,诈骗案,之间
605943,367,在这个华人开庭的时候同时开庭对大爷,最大的挑战，是从3月份到5月份之间，一定会
605944,368,就是为了正和郭文贵打乱光贵的心情,结束的！只是结束是死多少人，还是香港跪
605945,369,结果他们失败了,结果，没有任何
605946,370,林祥是为一个过去,香港跪下，还是
605947,371,10年来,下，还
605948,372,被上庭审判戴着脚镣手铐上去,产党倒下。只是这个结果，没有任何悬
605949,373,家具呀,大家
605950,374,是让她的女儿和她的侄女就坐在身背后哭了几个小时一直在哭,"是这个结果，没有任何悬疑。



大家可能不了解骆惠宁这"
605951,375,就是展示给所有的官员给我王岐山孟建柱做对,解骆惠宁这个人物，骆惠宁这个人是个有大智慧的人，但
605952,376,跟郭文贵好,个人物，骆惠宁
605953,377,就是这下场不管你是谁,手非常之狠，不管他是
605954,378,什么礼物,什么人
605955,379,什么灵强,什么人，他都
605956,380,林强是王岐山共同调倡共同抗将,人，他都是共产党啊，共产党啊！共产党
605957,381,共同干坏事的朋友这事,共产党这个本质都是一
605958,382,王岐山罕卡就是我知道王岐山最多的老点包括高燕燕就来自往来自林强,他都是共产党啊，共产党啊！共产党这个本质都是一样的。在这点上
605959,383,他以为这么是林强根本没有说那么多,他的整个本质是不会有任何改变的
605960,384,林强的嘴非常刺眼,林强的庭上录像
605961,385,如果要说的是站在共产党的角度说他是严密的人,林强的哥哥叫林帝（音），是对美局的最重要的人
605962,386,但是和林强的骨子里面中他绝对是个男人,当时是毛泽东、周恩来最相信的人，是中
605963,387,绝对是个男正爱的人,泽东、周恩来最相信的人
605964,388,他不是这么人不会跟光会走到一起,部的创始人，后来文化大革命被抓起来
605965,389,他得看不惯官场的跑了,安全部的创始人，后来文化大革
605966,390,但是由于说的话了,当时是毛泽东、周恩
