id,index,content,proofed
605967,391,过去4年半,国家安全
605968,392,三是给抓紧去,时是毛泽东、周恩来
605969,393,两次给他这个这个区保回来,革命被抓起来，等毛泽东、周恩来
605970,394,你们可以看得开情的时候专门说到刷牙的时候连牙刷都带一个链子,他的祖爷是林则徐。结果就在郭宝胜诈骗案华盛顿开庭时候，同时在大连
605971,395,吃了这个煮白菜,为了镇吓郭
605972,396,凉凉的饭他就是不是,连开庭，就是为了
605973,397,只要你只要你想说,开庭时候，同时在大
605974,398,我不知道,在郭宝
605975,399,他在庭上找了中共的最牛叉的就莫少平,他的祖爷是林则徐。结果就在郭宝胜诈骗案华盛
605976,400,啊教官方答辩护律师的律师,诈骗案华盛顿开庭时
605977,401,既然骗我跟她很熟,骗案华盛顿
605978,402,无上明替他辩护,案华盛顿开庭时
605979,403,没人认识我也是林强介绍的,文贵的心情，结果他们失败了
605980,404,这个店的店屋还真变了,在大连开庭，就是为了镇吓郭文
605981,405,但是没办法不管用不知道,就在郭宝胜诈骗案华
605982,406,这一幕对共产党内部是极大的震撼,诈骗案华盛顿开庭时候，同时在大
605983,407,就是王岐山和孟建柱孙立军,就是为了镇吓郭文贵，打乱
605984,408,对共产党高官的虐待,吓郭文贵，打乱郭文贵的心
605985,409,哥当年希特勒,大连开庭
605986,410,当年审判他的高官数步一步让你的上空有毒,在郭宝胜诈骗案华盛顿开庭时候，同
605987,411,故意让你掉了裤子在停车审判,贵的心情，结果他们失败
605988,412,输入你是一模一样的,是唯一一个
605989,413,现在咱们的照影占有啊这个,审判带着脚镣、手铐上去的
605990,414,翻译乳还有文木兰传奇,展示给所有的官员，跟
605991,415,正在,直在
605992,416,整理中文字幕和英文字母会把他放上,柱作对，跟郭文贵好，就是这下场。不管
605993,417,中英文字幕我们首先要送给所有的欧洲美国的情报机关,展示给所有的官员，跟我王岐山孟建柱作对，跟郭文贵好，就
605994,418,当年林强的名什么那匹马年大都去了,的官员，跟我王岐山孟建柱作对，跟
605995,419,你晚间不长马建部长,跟我王岐山孟建柱作对
605996,420,他是很大的,他身背后
605997,421,后来是他的哥哥大,后，哭了几个小时，一
605998,422,他的古塔市国保国正是国宝,作对，跟郭文贵好，就是这下
605999,423,啊就是当年的中央9这个关部一局局长,王岐山孟建柱作对，跟郭文贵好
606000,424,他是常务局长没有局长那就去吧,山孟建柱作对，跟郭文贵好，就是
606001,425,而且绝对老大,跟郭文贵好
606002,426,绝对老大,郭文贵好
606003,427,那么第2个他之后他哥抬起来他哥完了才轮到了这个麻将腹部,山孟建柱作对，跟郭文贵好，就是这下场。不管
606004,428,这个很有意思人物,展示给所有的
606005,429,春秋日番谷的CEO董事,建柱作对，跟郭文贵
606006,430,那很有意思,不管你是
606007,431,他给我们当时啊,我王岐山孟建
606008,432,就刘志华案发生的时候,就是展示给所有的官
606009,433,给我们借了一个亿,个小时，一直
606010,434,那是青岛的首位,岐山孟建柱作对
606011,435,青岛李嘉诚,强是王岐
606012,436,接了一个我们给了他3000万的利息,你是谁，什么林则徐，什么李列
606013,437,3000万的利息的为什么到时候发工资发不下来,山恨林强，就是我知道王岐山最多
606014,438,我从来不贷款了贷款要25%回购不干,王岐山最多的老底，包括高艳艳就
606015,439,我就借高利贷民强国家的接了一个亿,他以为这回事，事实林强根本没跟
606016,440,给了三千万的利息,密的人。但是林强的
606017,441,我发公司,郭文贵
606018,442,这就是我们公司的人华宁可借30%的利息都是我们的文化为什么叫老板你不能,绝对是个男人，绝对是个男人，正派的人，他不是正派的人不会跟郭文贵
606019,443,你就是骗子什么老板你凭什么占主席上讲话,对是个男人，绝对是个男人，正派的人，他不是正派
606020,444,能正常发工资,是个男人，正派
606021,445,是老板的基础,是严密的
606022,446,第2,的
606023,447,你要是能正常发工资之后你,嘴非常之严，如果要说是站在共
606024,448,华威胁的三千万利息,西，他绝对是个男人
606025,449,七中的拿了100万,强的骨子里面
606026,450,来做当时的什么原因远程致癌症啊,之严，如果要说是站在共产党
606027,451,什么北京治雾霾最早就领想搞了,事实林强根本没跟我说过那么多。林强
606028,452,那你这个雾霾这个北京知道的,强这人嘴非常之严，如果
606029,453,早多少年,角度说，他是
606030,454,还搞这么这个汽车排气污染,那么多。林强这人嘴非常之严
606031,455,是,是
606032,456,比这个最起码早178年,强的骨子里面的东西，他
606033,457,这个人呀真是,正派的人不会
606034,458,包括空气和空气变变空气中石化炼油啊空气录取得多大战,不是正派的人不会跟郭文贵走到一起。他是看不惯官场那一
606035,459,我都是我手机看了我是不是还有我这,，他不是正派的人不会跟郭文贵走到一
606036,460,非常疯狂,不惯官场
606037,461,拿了100万他也没花钱,惯官场那一套的
606038,462,林强先生穿这个夹克那个西装备损了还是十几年前我给她买个媳妇,"落儿，过去四年半三次给抓进去，两次给他取保回来。



你们可以看到，开庭时候"
606039,463,非常可怜,凉凉
606040,464,就是人非常之好,就是不认。只要你
606041,465,非常早,认。只要
606042,466,大日被闪,带一个链
606043,467,被这么虐待,不认。只要你
606044,468,最后领奖开始说,罪，不接受庭上所
606045,469,希望你们,就让你
606046,470,不要你们背后的主张是按的人,不认。只要你林强说不坚持我真理了
606047,471,停止对我的过快,庭上所谓安排
606048,472,不要做亲者痛,不认罪，不接受庭
606049,473,仇者快的事情那个头就是我闺女,不认罪，不接受庭上所谓安排好
606050,474,就是我要,叫莫少
606051,475,这林强格外够意思了,是林强介绍的
606052,476,林翔眼神不再是说他就是那个香港黑社会,林强介绍的。这个给他辩护，还真辩了。但是没
606053,477,香港黑社会老大的就是等于表情,共产党内部是极大的震撼，就是王岐
606054,478,曾佩当年,虐待，和当年
606055,479,嫁给李小龙的跟梁在一起说这种类似这个邻家先生的表姐,岐山、孟建柱和孙力军对共产党高官的虐待，和当年希特勒审
606056,480,啊所以说大家知道包括台湾的这个黑道人为杨登魁呀,判他的高官时候——故意不让你系上裤腰带，故意让你吊着
606057,481,18,候
606058,482,还有这个这个新西兰的老大也是几个人全全都是他的朋友啊,高官的虐待，和当年希特勒审判他的高官时候——故意
606059,483,这个当时我跟他们作战的时候对抗的时候,和当年希特勒审判他的高官时候——故意不
606060,484,林强同志冲,力军对共产党
606061,485,从视图中间协调,让你吊着裤子庭上
606062,486,我们俩倒是搞得很不愉快,勒审判他的高官时候——故意
606063,487,他曾经告诉我老公为你打的太大了,和孙力军对共产党高官的虐
606064,488,你敢挑战世界上的第5集力量为啥就第5集好听的3D四第5集,对共产党内部是极大的震撼，就是王岐山、孟建柱和孙力军对
606065,489,Heart of,审判他
606066,490,当然就是肖华强还有笑话想看看杨澜服务啊,当年希特勒审判他的高官时候——故意不让你系上裤腰带，故
606067,491,校花强台湾杨登魁我跟杨钟馗一起,系上裤腰带，故意让你吊着裤子庭上审判
606068,492,到这个湖南去找那个骗子王林便使了我赚了几百万,的战友翻译组，还有我们木兰传奇，正在整理中文
606069,493,为什么看不到的,我们首先要
606070,494,后来呢,首先
606071,495,当初还真是的还挺一样的也有个万八兄弟啊问完成体,在整理中文字幕和英文字幕，会把它放上中英文字
606072,496,啊,把它
606073,497,谁说亲爱的战友吗,还有我们木兰传奇，正
606074,498,这个自己合适的时间对希望他们都很想看,正在整理中文字幕和英文字幕，会把它
606075,499,很想他,们首先
606076,500,我们,我们
606077,501,为什么我们这个是乱拿出来,我们木兰传奇，正在整理中文
606078,502,我们要真正的南共产党的内部的官员看到,"的欧洲的、美国的情报机关。



当年林强的名声那比马健"
606079,503,你们,年
606080,504,你家境殷实吗,年林强的名
606081,505,你做的贡献你有李烈大吗,的名声那比马健大了去了，比
606082,506,你有林强林的大吗林逸的老战士当年的,年林强的名声那比马健大了去了，比马健
606083,507,司法部部长,健副部长
606084,508,太长,他的哥
606085,509,害虫都给气死了,大的。后来是他的哥
606086,510,是不是菜什么的儿子蔡小兰,是很大的。后来是他的哥哥大，他是国
606087,511,在香港住香港办主任被抓起来了,林强的名声那比马健大了去了，比马健副部
606088,512,是不是啊,是国宝
606089,513,最后,的。后
606090,514,怕那个时候夫妻呀,长，没有局长
606091,515,太长了气死了,他就是局长；而且
606092,516,林的长得也是半死不死的脑子是不好意思开一条手术,完了才轮到这个马健副部长。这是很有意思的
606093,517,林强进监狱了,起来，他哥完了才轮
606094,518,李丽儿跟着毛泽东杀死了干死了,哥完了才轮到这个马健副部长。这是
606095,519,林则徐的后裔吗,轮到这个马
606096,520,他的叔叔叫凌青,他给我们当时，就
606097,521,驻联合国的当时代表,刘志华案发生的时候，给我
606098,522,又能如何呀,亿，我们给他
606099,523,这就是跟共产党的下场,0万的利息是为什么，当时发工资发
606100,524,我们爆料革命爆片革命,我不干，我就借高利贷，林强给我
606101,525,就是让中国人看到这些真相,就是我们公司的文化，宁可借3
606102,526,这个这几天,这就是
606103,527,大家看到了吧,的，借了1个亿
606104,528,当年我刚开什么样子说一说都不回去,公司的文化，宁可借30%利息，也不欠员工的
606105,529,VC战的一句话,知道，这就
606106,530,龚桂你敢来美国吗,工资。郭文贵几十年
606107,531,你来美国律师,。郭文贵几十
606108,532,结果是那是什么,就是我们公司的文
606109,533,说郭文贵跟这个大舅舅他造的谣啊如果真的检察官结婚我是同性恋,十年来，从未有一天推迟过给员工同事发工资的。我们的同事都知道，这就
606110,534,这就是真的你们都忘了,这就是我们的文化。
606111,535,后来是到明镜PK,发工资你就是骗
606112,536,两次不敢出,讲话，能
606113,537,最后是我让我去法拉盛,之后，你能让员工得到
606114,538,把个下沉掉裤子多多的我第1次说真给你啥关系,的保障，你才配叫员工多看你几眼，我们的企业就是这
606115,539,这就是当时,这么坚持的
606116,540,现在我们一报复就是吧,多看你几眼，我们的企业就是
606117,541,傅希秋,回去
606118,542,复习就是看的靓照片了,霾，最早就是林强搞的
606119,543,亮和国务卿的副总统的官员,中他拿了100万，来做当时的什么远
606120,544,满嘴说的全是美国官员,来做当时的什么远程
606121,545,大家一定记住,京治雾霾，最
606122,546,叫郭骗这个字图片,京治雾霾，最早
606123,547,从开始我提到地铁爆料革命我的名字在网点名照片的,早就是林强搞的。那比这个北京雾霾知道得早多少年。还搞
606124,548,一定是共产党内部的人,是林强搞的。那比这个
606125,549,这对多少雄县明孟v35正,来做当时的什么远程治癌
606126,550,现在是复习酒,霾，最早就是林
606127,551,在推荐工名叫无片过片,早就是林强搞的。那比这个北京雾霾
606128,552,大儿子攻击我就是正品,的。那比这个北京雾霾知
606129,553,我哪天我告诉你正确的复进行的问题吓死你就孙子了,的什么远程治癌症啊，什么北京治雾霾，最早就是林
606130,554,看了武功味道是什么回事,多少年。还搞个什么汽车排
606131,555,你咋这么傻的问你,年。这个人也真是
606132,556,他把美国副总统把美国国务卿,气中取水都他干的事儿。我都去看过
606133,557,把美国对官员亮出来,也没花钱，林强先生穿那个
606134,558,正好在推得出来,之好，非常之好，但
606135,559,傅希秋你会记住你将付出什么代价,林强还说，希望你们背后主抓
606136,560,你拿美国官员威胁我郭文贵,强还说，希望你们背后主
606137,561,我们已经昨天下午,么虐待。最后林强
606138,562,今天下午2点钟,林强还说，希望
606139,563,美国最牛的检察官和律师,么虐待。最后林强还说
606140,564,我们会改正我开会,望你们背后主抓
606141,565,记住我今天说的话记录单有文,这案子的人停止对我的迫害，不要
606142,566,我们会给副总统彭斯办公室,郭文贵呗，就是我要灭共。这林强哥
606143,567,国母亲我跟这个人我随时一个电话给找出来,郭文贵呗，就是我要灭共。这林强哥们
606144,568,我不想让你知道他们你们是不是知识的复习就,我再次说，他就是那个香港黑社会老大的表亲
606145,569,傅希秋到底干了什么事,会老大的表亲曾佩
606146,570,你们知道不知道,先生，我再次说
606147,571,啊,那个
606148,572,我这就是我一定把他所有说过的官员,说，他就是那个香港黑社会老大的表
606149,573,我要挨着勇律师,小龙在一起的时候
606150,574,我没有最开始跟傅希秋打官司,登魁是吧，还有这个新义安
606151,575,做好一切准备战友们一定留好他发的推,作战的时候，对抗的时候，林强同志曾试图
606152,576,而建威胁我说咱们看谁笑到最后正在美国,志曾试图中间协调，我们俩当时搞得很不愉快
606153,577,翻译完昨天确认为这就是威胁,了，你敢挑战世界上的第五级力
606154,578,而且叫我国片,啥叫第五级呀
606155,579,哪种TV协我,敢挑战
606156,580,阿害拿副总统的照片国务卿的照片,我说，郭文贵你胆子太大了，你敢挑战世
606157,581,国会照片biubiubiu是你不找我,"过第三第四。第五级就是黑道。好家伙！
"
606158,582,傅希秋你不来不要找我我爱你爸爸天天骂你,时就说向华强，还有向华强太太
606159,583,你千万别什么遗产要素的配伍禁这个孙子,魁一起到湖南去找那个骗子王林，变蛇，我捐了
606160,584,确定度降到时间了,杨登魁一起到湖南
606161,585,就写我的赶快讲啊,就说向华强
606162,586,再来五分钟再来五分钟分钟,找那个骗子王林，变蛇，我捐了
606163,587,对不起对不起,杨登魁一起
606164,588,汽车站,华强
606165,589,再来十种站在什么不行了我就我就马上去还会啊这件事情让西,"就是黑道。好家伙！



当时就说向华强，还有向华强太太、杨澜"
606166,590,西方真正的看到谁是真正在西方潜伏的力量这就为什么国内很多占有我们的1回复你,魁一起到湖南去找那个骗子王林，变蛇，我捐了700万。杨登魁我看也不像是黑道老大呀，人挺好的，后来
606167,591,操你他为什么过呀你最近花那么多精力,他还真是挺有影响力，也有个万把兄
606168,592,这感觉也是,这几个事
606169,593,占用了我现在只告诉你们,战友们，这几个事，实际上西方他们都
606170,594,我的两两句话,际上西方他
606171,595,如果我们现在把战场拉向国际,共产党内部的官员看到，你家底
606172,596,我们让西方已经充分的认识到了我们爆料革命罪,我们要这个时候拿出来，我们要真正的让共产党内部
606173,597,整个西方起到的吹口哨,正的让共产党内部
606174,598,唤醒他们,上西方他们
606175,599,让他们感觉到危险后面一起,的官员看到，你家底殷实吗？你做的
606176,600,达到了,大吗？林
606177,601,战场拿下国际公共同越共,小洪在香港是驻港办主任
606178,602,依法提供,子蔡小洪
606179,603,如果我们不去把报片革命再给看看起来,港办主任，被抓起来了，是不是？最后判了个
606180,604,就是现在大家去看一看,术，林强进监狱了，李列
606181,605,这个付需求量出的副总统的照片,则徐的后裔嘛，他的叔叔叫林青，驻联合国
606182,606,和国务卿的照片给照片哪有爹维修的照片,合国的当时代表，又能如何呀？这就是跟共产党的下
606183,607,他会发生在我们每一个人参,代表，又能如何呀？这就是跟
606184,608,我们收到了一系列的证据,当时代表，又能如何呀？这就
606185,609,傅希秋敲诈勒索,叫林青，驻联合国
606186,610,威胁他人,了，李列（音
606187,611,我不知道今天中午间早上班了我没有先看他报了没有,进监狱了，李列（音）跟着毛泽东，扎塑料袋死了，林则徐的后裔嘛，他
606188,612,稍后我会把推出去,徐的后裔嘛，他的叔叔
606189,613,过媒体上,国的当时
606190,614,你们就看这东西啊,？这就是跟共产党
606191,615,我们已经全面的初就任校长,表，又能如何呀？这就是跟共产党的下
606192,616,就是傅希秋打折,就是让中
606193,617,这个数为政治庇护提供政治庇护的名义,是让中国人看到这些真相。这几天
606194,618,在美国,革命，就
606195,619,政治威胁,真相。这几
606196,620,然后发真正的中国真正的反共的,骗革命，就是让中国人看到这些真相。这
606197,621,或者可能反攻的,是让中国人看到这
606198,622,这种难民采,这就是跟共产
606199,623,这是真正的政治黑社会,这些真相。这几天大
606200,624,如果我不这么干的话所有中国人都会看到能代表我们中国人一先救他,"场。



我们爆料革命，爆骗革命，就是让中国人看到这些真"
606201,625,你会看了一会我退出这个伟有人就是他的人间去接吧他的他个子矮他不自信,讯，韦石一站出来第一句话，郭文贵你敢来美国吗？你来美国我就让
606202,626,有人给他说你可以天天拉头拉出来他就看拉拉了几个月,用。我来纽约了，检察官也没抓我，最后我找了个检察官
606203,627,很多当事人被他威胁道,察官比他亲爹都好
606204,628,就不敢说话,结果屎诺说
606205,629,特别好色,没抓我
606206,630,他在得克萨斯州,他造的谣，说
606207,631,多处豪宅,后来是到
606208,632,他老婆非常严厉,它吓得差点尿
606209,633,他老婆经营锐东西,明镜PK，两次
606210,634,他出门传媒让人盯着他,性恋。这孙子，你们都忘了。后
606211,635,看着她怕她去沾花惹草,盛，把它吓得差点尿裤子
606212,636,而是让他必须要在两个人住一个房间盯着他,"吴征跟你啥关系。



这就是当时现在"
606213,637,而且这个人张嘴就是10万200000美元的坑,"次说出，吴征跟你啥关系。



这就是当"
606214,638,这个人是天蝎男嘴,"征跟你啥关系。



这"
606215,639,满嘴谎言,统的、官员
606216,640,从来不传教,从开始我第
606217,641,从来也不,从开始
606218,642,也不目的也不是牧羊犬,嘴说的全是美国官
606219,643,出来没有,全是美国
606220,644,所以说,嘴说
606221,645,这个人影响多大我告诉这一句话我们必须要改变在华人世界真正的,这个字的人，“郭骗”，从开始我第一天爆料革命，我的名字在网
606222,646,我代表华人的,党内部的人
606223,647,未来的年轻人,熊宪民、孟维
606224,648,80后90后2000后而不是最见,我告诉你政庇的时候能把你
606225,649,傻叉吗,傻子，吹
606226,650,方便,统把
606227,651,莫露露的华人,美国这些官
606228,652,第二天我告诉大家,胁我郭文贵。今
606229,653,爆料可能在西方受到在这种成绩,钟，美国最牛的检察官和律师，我们会在这
606230,654,非常脆弱,们会给副总
606231,655,绝对不能让人参杀得像基础拍,国务卿，这些人我随时一个电话
606232,656,校和技工,会给副总
606233,657,郭宝胜为潍柴熊宪民夏业良,国务卿，这些人我随时一个电话就可以找他们
606234,658,和平,卿
606235,659,陈军,们会
606236,660,和这个名称这些人,和律师，我们会在这块儿
606237,661,跟共产党都对的人,办公室，国务卿，这些人
606238,662,最后想摘桃子,话就可以找他们，我
606239,663,现在国内占有看到了到底这个基础还要成立基金是想干啥,些人我随时一个电话就可以找他们，我不打电话，我让律师找他们。你们是
606240,664,为什么他要么香港人说是用是用五派,他所有说过的官员，挨个让律师和检察官给
606241,665,都是小混混,打官司做好一切准
606242,666,为什么他打着西藏身份他不是西藏和冰河北保定人,战友们一定留好他发的推。而且威胁我说咱们看谁
606243,667,他为什么不是医生他打了医生的名义,一切准备，战友们一定留好他发的
606244,668,为什么他有老婆孩子他胆子还天天勾搭其他女性,信，我们要开始对跟傅希秋打官司做好一切准备，战
606245,669,没没没没儿飞来飞去,为这就是威胁。而且叫
606246,670,国内占有都看明白,国务卿的照片，国会
606247,671,这些人一旦钥匙串起来被我们给,而且叫我郭骗，拿政庇威胁我，还拿副
606248,672,或者说以什么各种美好的理由放在进来,后，这在美国昨天确认为这就是
606249,673,这就真的是把我们抱着东西回来,这就是威胁。而且叫我郭骗，拿政
606250,674,二姐被害就没在意,为这就是威胁。而且叫
606251,675,危害不可限量不可以苦,且叫我郭骗，拿政庇威
606252,676,所以说亲爱的兄弟姐妹们,是威胁。而且叫我郭骗，拿政
606253,677,我们绝对要记住,务卿的照片，国会
606254,678,喂真不怕呀,为这就是
606255,679,是我们爆料革命的最重要的多,说咱们看谁笑到最后，这在美国
606256,680,我们不但不抛弃不放弃不忘记,我，还拿副总统的照片，国务卿
606257,681,我们更不允许,我郭骗，拿政庇
606258,682,让我们的队伍里面,我郭骗，拿政庇威
606259,683,有这种沙子穿起来,照片，国会的照片
606260,684,那会要了我们的命啊,我郭骗，拿政庇威胁
606261,685,我们太脆弱了,在美国昨
606262,686,保持我们报了行的纯洁性高尚型,拿政庇威胁我，还拿副总统的照片
606263,687,才能给我们下一代的孩子带来一个美好的国际生存环境,是威胁。而且叫我郭骗，拿政庇威胁我，还拿副总统的照片，国务卿
606264,688,接下来我们将会一系列的举动我现在不多说啊安不服啊不服本来看着吧还是行走,叫我郭骗，拿政庇威胁我，还拿副总统的照片，国务卿的照片，国会的照片，还FBI
606265,689,还是行动,别像孟
606266,690,这就是我们对观的,背后去，你这个孙子
606267,691,要爆料灭共,万别像孟
606268,692,一美面共把战场拉向国际,你千万别像孟维参一样缩到
606269,693,在外,千万
606270,694,在各国各地方输给年轻人,在西方真正潜伏的力量
606271,695,真正的中国人,真正看到，谁
606272,696,新的一代代表人的形象,到，谁是在西方真正潜
606273,697,我们只要的事情会打的坚决不能让他代表华人,为什么郭先生最近花那么多精力去干这些
606274,698,只要的是共产党的左股间就不能代表我们,"只告诉你们我的两句话。



如果我们现在把战场"
606275,699,我们中国人在海外的宗教家,我们现在把战场拉向国际，我们已
606276,700,教育界文化界,感觉到威胁
606277,701,必须改朝换代,个西方起到的吹
606278,702,不能说灭了共产党了海外的所谓的,西方充分地认识到我们爆料革命对整个
606279,703,也就几10年来,国际，我们已经
606280,704,还代表华人的女孩子能在约旦对不起了,认识到我们爆料革命对整个西方起到的吹口哨，唤
606281,705,绝对不可能,觉到威胁
606282,706,代表华人的人一定是不是我们,分地认识到我们爆料革命对
606283,707,一定是,已经
606284,708,那些年轻人,们已经让西方
606285,709,能讲流利的英文,向国际，我们已经
606286,710,阿彻底的,充分地
606287,711,真正的,战场
606288,712,昨天下午在华盛顿有两个,在只告诉你们我的两句话
606289,713,大的组织在周围,在只告诉你们我
606290,714,星期天,精力去干
606291,715,开会都是研究,一回复你，他说为
606292,716,关于灭共的事情,郭先生最近
606293,717,所有两个大会上统一认识,友，我不能一一回复你，他说为什
606294,718,必须重新的让西方认识,那么多精力去干这些事
606295,719,中共的危险,战友们，我现
606296,720,一定要让,已经让
606297,721,20全世界人民把中国人和中共分开,整个西方起到的吹口哨，唤醒他们，让他们感
