id,index,content,proofed
606298,722,马,他
606299,723,我再说一遍你想复习修这个王八蛋似的这种,我们爆料革命对整个西方起到的吹口哨，唤醒
606300,724,这种不要脸的东西呀我而他们主动动不动就拿官员在美国画2300千米,到我们爆料革命对整个西方起到的吹口哨，唤醒他们，让他们感觉到
606301,725,跟总统都能为首都能拥抱,们共同灭共，依法灭共。如果我们不
606302,726,你见过鬼吗我一个人照片吗,我们不去把爆骗革命再给开展起
606303,727,中国所有抓的企业家专属人过说,照片和国务卿的照片，国会的照
606304,728,没有人家里没有不喝洗澡上了王岐山找下的周永康都要领导下,"每一个人身上。



我们收到了一系列的证据，傅希秋敲诈勒索，威胁"
606305,729,UPS,有时
606306,730,所有抓的店老板的吧,早上曾宏先生爆了
606307,731,他们都有和领导的象和外国元首相,天早上曾宏先生爆了没有，我没
606308,732,和外国明星的像,这些东西，我们已经
606309,733,只有关柜放置价格,傅希秋打着所谓提供政
606310,734,一张没有,义在美国
606311,735,我从不和任何领导人,中国真正的反
606312,736,我假如你得到任何地方从不挂和任何人的照片,我不这么干的话，所有中国人都会看到能代表
606313,737,还是这个,治黑社
606314,738,这都是骗子,这是真
606315,739,你看企业家,形象的就
606316,740,家人把一支领导人的下了这都是傻叉,揭发他的，他个子矮，他不自信，有人给他说
606317,741,一堆明星照了这都是脑子有问题的,子矮，他不自信，有人给他说你可以
606318,742,还是你看一推文我跟那个领导界面去,矮，他不自信，有人给他说你可以天天拉
606319,743,我跟那个什么什么见面就你只是骗傻子的,很多当事人被他威胁到不敢说话。特别好色，他在
606320,744,办法在西方有一点老人只知道只要说这话的人就是骗子,他在得克萨斯州有多处豪宅。他老婆非常严厉，他老婆经营着这些
606321,745,因为你不必需要选肉因为西方的领导人是拼了命的给老百姓找一下,婆非常严厉，他老婆经营着这些，出门她专门让人盯着他
606322,746,就怕造不上了,必须要两个人住
606323,747,问为什么拉格的会员我想跟谁找不行,万二十万美元的坑。所以这个人是天
606324,748,我到华盛顿每次开会哪儿吓死你,嘴就是十万二十万美元的坑
606325,749,有必要吗,有。所以
606326,750,那才真正的叫国骗了就,真正能代表华人的未来
606327,751,现在复习就跟烂人你说你还是别来找我今天我等你不来找我,须要改变，在华人世界真正能代表华人的未来的年
606328,752,杂种子桥,能代表
606329,753,复习修armv8论述中你不知道这个,们必须要改变，在华人世界真正
606330,754,你装什么傻呢不是你家了你以为在北京打消了,变，在华人世界真正能代表华人的未来
606331,755,你以为那便是你家派出所,一句话，我们必须要改变，在华人世
606332,756,你想干嘛就干嘛,坑蒙拐骗
606333,757,就凭你这句话在法庭了你如果说清楚,方收到的这种成绩非常脆弱，绝对
606334,758,什么时候你改变沟通的,鸡龚、郭宝胜、孟维参
606335,759,你什么有沟通的,、郭宝胜、孟维
606336,760,你有为什么说要不要上门来,龚、郭宝胜、孟维参、熊宪民、夏业
606337,761,啊,宪民
606338,762,FBI上门来自己说的啊,宝胜、孟维参、熊宪
606339,763,威胁我,维参、熊
606340,764,你个孙子一会你看看,在国内战友看
606341,765,你最近你看看,内战友看
606342,766,所有战友瓦里的料和挖出来,国内战友看到了，到底鸡腿潘成
606343,767,绝不允许你再在美国代表我们华人,"

现在国内战友看到了，到底鸡腿"
606344,768,代表我们中国人在表中调节人水,在国内战友看到了，到底鸡腿潘成立基金是
606345,769,就是昨天国内中药业人士普遍不怕有文贵你敢大声,金是想干啥？为什么他要骂香港人勇武派都是小混
606346,770,你就是个大骗子,鸡腿潘成立基金
606347,771,啊,到底
606348,772,再到最后要说的真容了,在国内战友看到了，到
606349,773,法治基金捐款未圈成的,国内战友看到了，到底鸡腿潘成立
606350,774,每圈成的占用的拜托了,混混？为什么他打着西藏人
606351,775,这个所有的信息发个36得和木兰传奇越细越好,着医生的名义？为什么他有老
606352,776,我说的很多非常非常感谢内容,身份他不是西藏人，河北保定人
606353,777,另外一个,名义？为
606354,778,万一复习求这个片子的各种被骗了我再说一遍,飞去？国内战友看明白了。这些人要是一旦
606355,779,你们可以把信息发的分红险什么,女性，眉眼儿飞来飞去？国内战
606356,780,朱先生现在主,由放他进来，这就真
606357,781,何小平等主要是节,害的就是我们战友，危
606358,782,魏明月,危害不可
606359,783,片名玉,限量，不
606360,784,啊,害不
606361,785,还有这个伟大表姐外表,害的就是我们战友，危害不可限
606362,786,请把有关信息发给陈洪先是啊拜托了再用了,的理由放他进来，这就真的把我们爆料革命给毁了
606363,787,越细越好越细越好,这些人要是一旦
606364,788,我们一定要用事实用证据,我们以各种美好的理由放他进
606365,789,让西方看到海外的所谓代表我们中国人的这些华人到底是什么,人要是一旦窜进来被我们以各种美好的理由放他进来，这就真的把我们
606366,790,什么东西啊我没有全是看共产党他不能代表我们是自己中国人,是一旦窜进来被我们以各种美好的理由放他进来，这就真的把我们
606367,791,共产党现在是黑社会骗子,要是一旦窜进来被我们以各种美好
606368,792,恐怖组织恐怖主这么自然往上弄啊,去？国内战友看明白了。这些人要是
606369,793,这就已经成功了下面让这些假骗子假代表,这些人要是一旦窜进来被我们以各种美好的理由放他进来
606370,794,显露原形,限量，不
606371,795,这就是我们要做的,这就真的把我们爆
606372,796,虽说像兄弟姐妹们我要马上去开会啊,是一旦窜进来被我们以各种美好的理由放他
606373,797,害怕,爆料
606374,798,还包皮,害不
606375,799,傅希秋后害怕要回去啊你来不来呀,"危害不可限量，不可预估。



所以说亲爱"
606376,800,1192你8日主弱就会让耳边来不让老外81号,被害的就是我们战友，危害不可限量，不
606377,801,中啦中啦中啦中啦,们爆料革命最重要的东
606378,802,天哪,但不抛
606379,803,我赶快把前身为全世界的你14亿中国人民香港人民台湾人你新疆人没洗澡了你,我们不但不抛弃、不放弃、不忘记，我们更不允许让我们的队伍里面有这种沙子掺进来，那会要了我们的命的，我
606380,804,媳妇,性
606381,805,阿弥陀佛阿弥陀佛文作文多一卷风,那会要了我们的命的，我们太脆弱
606382,806,罗文多伦多,我们的队伍里
606383,807,Avy are石头剪刀布,的，我们太脆弱了。保
606384,808,文晶晶,的纯洁性
606385,809,来疯,来一个
606386,810,金小百合挺过站有普罗米修斯,将会一系列的举动，我现在不多说
606387,811,要vector,要爆
606388,812,喜马拉雅,现在
606389,813,相信未来木兰传奇,下来我们将会一
606390,814,楚风,生
606391,815,21,能
606392,816,哎呀哎呀呀,来，那会要
606393,817,这个渔人79寸长宽带交费的,队伍里面有这种沙子掺进来
606394,818,那么专业录,那会要了我们
606395,819,玫瑰宝安夏天的路,给我们下一代的孩
606396,820,这个是,能给
606397,821,上海茶奶奶啊,尚性，才能给
606398,822,妞妞妞文虎年春上拍了照片,"存环境。



接下来我们将会"
606399,823,不行啊兄弟姐妹我得赶快赶快去了,接下来我们将会一系列的举动，我现
606400,824,啊,俺
606401,825,这个晚上还准备到西部的演讲这两天啊这两天,这就是我们对共产党要爆料灭共，以美灭共，把战场拉
606402,826,谢谢老先生的机会一切都是刚刚开始,新的一代代表人的形象。只要他是亲共
606403,827,团结的站,党的坚
