id,index,content,proofed
200515,1,我们很抱歉,网友们抱歉
200516,2,刚才的那一下人太多了最高的基金20000多,刚才人一下子来太多，最高一下有2万
200517,3,谁说的都卡断了,什么事都怪黑
200518,4,卡断了这种不应该是很可不要什么事情咱们会说可不好,卡掉线了，不是黑客搞得哈，咱不要什么事都怪黑客，不好哈，那咱
200519,5,老太太儿子信了,那咱也太不自信了
200520,6,刚才我说的,刚才我说了
200521,7,大哥我说的是结下了886我说世界上吧,才我说了就是最近呐，我们谈到第一个
200522,8,那么刚才我说了就最近来我们谈到的一个问题那就是,那么刚才我说了就是最近呐，我们谈到第一个问题就是现
200523,9,就是现在由于,就是现在由于
200524,10,啊这个门贵妃晋升以来出现了很多,在由于文贵被禁声以来，出现了很多
200525,11,很堕,很多
200526,12,咱没听过,砸“郭”挺“郭
200527,13,这个出现的,郭”出现的
200528,14,个世界,事件
200529,15,猎物说,例如说
200530,16,对吧对有这个华宇县城华人选,多因砸“郭”挺“郭”出现的各种事件。例如说华
200531,17,这个我也挺不他也吃什么他也担心她跟谁有网友一样,生，我也挺过他也支持过他，担心过他——和所有的网友一样
200532,18,我希望他早日平安后来被扒了,都希望他早日平安，后来他被
200533,19,既然华游先生已经放出来了和家人团聚,既然华涌先生已经放出来，和家人团聚
200534,20,虽然举报还有行动自由,虽然取保，但还有行动自由
200535,21,我强烈地要求所有的人都有发言的自由但希望你发言,我强烈要求所有人都有发言的自由，但期望你发言
200536,22,万华运先生的书不要把光桂城去,望你发言有关华涌先生的时候，不
200537,23,我个人认为这是我不义在你还想说什么话,我个人认为，这个时候我不宜给华涌先生说
200538,24,有时候一句话都有可能导致他家人和他的不安全,有可能导致他家人和他的不安全，或者有其他不好的
200539,25,霍尔有其他不好的生发上,或者有其他不好的事情发生
200540,26,所有分类,都有可能
200541,27,许不应该这么说,不应该在这个时候
200542,28,在是评价白云先生,再去评价华涌先生
200543,29,这个新品还钱,这个时候再去评
200544,30,这个玩意有,这个时候
200545,31,如果说他是特的话,如果说他是特务的话
200546,32,他一个大尊敬的头,一个令我们尊敬的
200547,33,如果说他是一个行为艺术家他是个伟大的行为艺术,如果说他是一个行为艺术家，他是个伟大的行为艺术
200548,34,如果说大陆可以访问控制了转移不能对是前任,如果说他是被盗国贼控制的，转移郭文贵视线的人，那
200549,35,那我们眼中的钥匙拧的多来点这样转移视线,那我们也更加要尊敬他！多来点这种转移视线的
200550,36,哪些食物为10强1万倍,诺，伟屎这样的强一万倍
200551,37,我们应该更加准提,我们应该更加尊
200552,38,希望所有,希望所有
200553,39,有关文贵和华人的事情大概合理体系,有关文贵和华涌的事情大家不要再提起
200554,40,悉尼华人先生未完成的事情不要提起跟我有关系吧,先生的事情，怀疑华涌先生的事情不要提及跟我
200555,41,爸爸64有你不可以改别这么说,自由，你们可以在别的地方说
200556,42,另外,另外
200557,43,最近,最近
200558,44,关于,关于
200559,45,盲流子盲流子,盲流子，还有
200560,46,还有中国红,还有曾宏，曾
200561,47,啊分红,曾宏
200562,48,这个跟唐柏桥先生的关系,宏，跟唐柏桥先生的官司炒得
200563,49,炒得沸沸扬扬,炒得纷纷扬扬
200564,50,粉红先生拟录视频吗如见人视频启动不提到我在说,纷扬扬。曾宏先生也录视频，盲流子先生也做视频，其中都提到
200565,51,多少个两位都不认识,：我和那两位都不认识
200566,52,我祝你玩嘢平称和尝试中取的因为原来分红险,我再次重申：我和那两位都不认识。我的助理王雁平曾和
200567,53,我好几个朋友希望我能帮忙,过好几个朋友希望我给他帮忙。我
200568,54,我们的华盛顿的律师事务所以已经和子洪先生取得联系我们已经,我们叫华盛顿地区的律师事务所已经和曾宏先生取得联系，我们已
200569,55,不见面叫徐员会有我支付费游泳的iPhone,不能帮的一定会回答你，但是我希望这事不要和
200570,56,总统先生起诉他的条只有为他们有的钱,能帮的一定会回答你，但是我希望这事不要和我
200571,57,但是棕红香行尸走沙滩,但是我希望这事不要和我掺
200572,58,他的事情是真是假中文贵没问题,帮的一定会回答你，但是我希望这事不
200573,59,但我不希望和我先生在任何工厂核,答你，但是我希望这事不要和我掺
200574,60,这个还在气我不认为我帮你但是我不想觉得他不怎么事情,。不能帮的一定会回答你，但是我希望这事不要和我
200575,61,关于盲流子先生,于昭明，潘晴先生
200576,62,阿破欠操你的全名,啊，由于昭明，潘晴先
200577,63,我只和你在微信上发的事情这里多保重你的钢琴弹得很好,魏京生先生，要批评魏京生先生，但是遭到昭
200578,64,从管和你没任何联系,魏京生先生，但是
200579,65,我不希望王刘子先生的在任何场合任何地方把您的事和我联系,魏京生先生，但是遭到昭明先生和潘晴先生的反对
200580,66,如果我能帮你的,潘晴先生的
200581,67,先把资料寄给我们我们叫律师能把你一个也帮不能帮了我那我回答,后让大家也质疑昭明先生，潘晴先生以及很多人的在这方
200582,68,到了我希望就是你和我差不在一起,多观点和立场上质疑，所以呐，非
200583,69,那我最近了,那我想
200584,70,由于绿卡澳洲之声,多观点和立场
200585,71,25日上海退房图像方向,"舒服。



那我想谈一下我的观点"
200586,72,这个区东芝生了这个由于照明,任何形式的批评魏京生先生。这
200587,73,爱情鲜和韩山药鲜什么终止,生先生。这段时间有人挑出来
200588,74,周日的其中之一原因,生，一直以来有人试图批评
200589,75,就是还上学干什么,就是国内的所谓共产
200590,76,要心平魏京生鲜,贼根本不在乎魏京生先
200591,77,信息为什么停产,乎魏京生先生，他
200592,78,昨晚上你先什么看情先生的反对可以,魏京生先生，他不会把他去蓝金黄。但是
200593,79,中文版的,国贼根本
200594,80,老虎韩尚笑先生,把他去蓝金黄。但是
200595,81,最后的这个再往吹着了,盗国贼根本不在乎魏
200596,82,推出了他的心里的不悦,见得就是国内的所谓
200597,83,然后呢大家吃一桌明显示的判刑先生已经很多人的,本不在乎魏京生先生，他不会把他去蓝金黄。但是海外的有些人
200598,84,这这他妈的这个观点和立场的质疑,黄。但是海外的有些人为了
200599,85,可以了,为了
200600,86,所有你那这个非常的让大家不舒服,本不在乎魏京生先生，他不会把他去
200601,87,那我想查一下我的观点,金黄。但是海外的有些人
200602,88,第1个了,私，为了
200603,89,我坚决,金黄
200604,90,我舅舅反应任何形式的批评魏京生鲜,金黄。但是海外的有些人为了一己之私
200605,91,这个世界上有人挑出来批评已经先生,盗国贼根本不在乎魏京生先生
200606,92,一直以来有人试图批评委金型材,金黄。但是海外的有些人为了一己之私
200607,93,为节省显示,魏京生先生
200608,94,这里有会所吗,就是国内的所
200609,95,这个分数还真不见得就所说盗国贼,这黑手还真不见得是所说的盗国贼
200610,96,也不见了就是国内的所谓共产党,也不见得就是国内的所谓共产党
200611,97,他没有说共产党到我的根本不作为就生鲜,坦白地说，共产党盗国贼根本不在乎魏京生先
200612,98,他不会把他去南京华他,他不会把他去蓝金黄
200613,99,因为有些人为了一己之私,海外的有些人为了一己之
200614,100,为了自己的所谓民运中的地位,为了自己的所谓民运里的地位
200615,101,国内某些领域的影响力,黄。但是海外的有些人为了一
200616,102,在近几年来,自己的所谓民运里
200617,103,正悄悄地布局,海外的有些
200618,104,正在试图,生，他不会
200619,105,Itv英先生,魏京生先
200620,106,魏京生鲜,魏京生先
200621,107,所以为今生显瘦的挑战,所谓共产党。坦白地说
200622,108,不再造为何国内,不在乎魏京生
200623,109,儿子在海外都会比喻,但是海外的有些
200624,110,和,的
200625,111,真正的有有血肠的人真的被蓝金黄的人想白TV镜先生,共产党盗国贼根本不在乎魏京生先生，他不会把他去蓝金黄。但
200626,112,恋爱那个脸皮不要猪狗不如的你红花他好听的二,生，他不会把他去蓝金黄。但是海外的有些人
200627,113,他真的大因为经常先生老二人间的不配,他去蓝金黄。但是海外的有些人为了一己
200628,114,66这样野心家在网络,黄。但是海外的有
200629,115,在东莞可视力没那边境生鲜,在乎魏京生先生，他不会把他去蓝金黄
200630,116,如何,乎魏
200631,117,UV泳郭文贵时间多次的尝试,不见得就是国内的所谓共产
200632,118,QQ背景设计,魏京生
200633,119,我已经收下这个光棍电视的人,根本不在乎魏京生先生，他
200634,120,今年五六月份吧大概时间我记不清楚,把他去蓝金黄。但是海外的有些人为了一己
200635,121,我曾经通过校园先生,乎魏京生先生，他不
200636,122,啊早点射了个给我多次数的微晶纤上对我的关心,白地说，共产党盗国贼根本不在乎魏京生先生
200637,123,后来我妈通了电话,产党。坦白地说
200638,124,爸爸众所周知赵岩先生的视频说过我曾经,白地说，共产党盗国贼根本不在乎魏京生先生
200639,125,夏天的夏,是海外的
200640,126,马六甲油马上又拉还有杨建利先生还有魏京生先生安排在一起,京生先生，他不会把他去蓝金黄。但是海外的有些人为了一己之私
200641,127,如果保证先生和道联先生一起做了,产党盗国贼根本不在乎魏京生先
200642,128,西马海了你也没有大产品,海外的有些人为了一
200643,129,其实我是白来看到了,黄。但是海外的有些
200644,130,夏业良有钱,先生，他不会把
200645,131,不解为什么下完全看不起自己行人,乎魏京生先生，他不会把他去蓝金
200646,132,而且我更差不给杨建利,国贼根本不在乎魏京
200647,133,打开自己就认为他给我就不了了他能这个统治全世界,把他去蓝金黄。但是海外的有些人为了一己之私，为了自己的
200648,134,所以说,所谓
200649,135,这个这个所有的人吗只是有知识面,之私，为了自己的所谓民运里的
200650,136,真的发生的,生先生
200651,137,魏京生先生是在这之后又提出来为这个红,魏京生先生，他不会把他去蓝金黄。但是海外的有些
200652,138,只,之
200653,139,对我们这些海外人士,但是海外的有些人为
200654,140,上面发明民运人士维权人士包括文遗传的人进行,生先生，他不会把他去蓝金黄。但是海外的有些人为
200655,141,啊这个憧憬跟我通过话我也会尽我尽我所能地点了他知识,京生先生，他不会把他去蓝金黄。但是海外的有些人
200656,142,从哪有好兆头已经10天没有联系,本不在乎魏京生先生，他不会把他
200657,143,但是著名先生和潘婷先生主旨含生肖先生这个不太冷,党。坦白地说，共产党盗国贼根本不在乎魏京生先生，他
200658,144,批评为先生,生先生
200659,145,这里没有对错,海外的有些
200660,146,我相信韩商校先生态学对没有任何可以他只识别海外的,魏京生先生，他不会把他去蓝金黄。但是海外的有些人为了一己之
200661,147,铁力压在额头,是海外的有
200662,148,给仲永,魏京生
200663,149,对膝盖,的有些
200664,150,终于有个潘婷先生在这个世上我怎么通过这个这个私信,地说，共产党盗国贼根本不在乎魏京生先生，他
200665,151,微商业版对日本人日本人是大疾病险,贼根本不在乎魏京生先生，他不会把
200666,152,真品玉,生先
200667,153,太古可能被木兰进行了,根本不在乎魏京生先
200668,154,只可能被利用,根本不在乎魏京
200669,155,你有一个正着几个看,国贼根本不在乎魏京
200670,156,有几个男人,有些人为
200671,157,没上乐园那个那个那个流氓流氓,京生先生，他不会把他去蓝金黄
200672,158,这位老太太房间已经生鲜生意经没有能力,在乎魏京生先生，他不会把他去蓝金黄。但是海外的有些人
200673,159,彭丽媛,生先
200674,160,来对付这个坏人太明皮的坏人,会把他去蓝金黄。但是海外的有些人为
200675,161,我是可以理解,私，为了自己的
200676,162,BB已经是我们民主呢里面骑士啊,一己之私，为了自己的所谓民运
200677,163,文物月是民主的人是我绝对不是强烈的反感,会把他去蓝金黄。但是海外的有些人为了
200678,164,英尺,一己之
200679,165,别傻了吧,之私，为了
200680,166,所有经济繁荣贵的就两种人,乎魏京生先生，他不会把他去蓝金黄。
200681,167,日本为何利用华文贵来对付海问题一力量里面的人均,去蓝金黄。但是海外的有些人为了一己之私，为了自
200682,168,另一种是真正的错误来是王者,金黄。但是海外的有些人为了一己之
200683,169,第2就是,一己之
200684,170,长期以民主民,不在乎魏京生先
200685,171,圈圈叉圈片死了骗你了,会把他去蓝金黄。但是海
200686,172,这些回来,之私，为了
200687,173,这个我们来看一看,在乎魏京生先
200688,174,心中有一个,地说，共
200689,175,还没叫我,海外的有
200690,176,从早一直停我叫过龟乌龟,共产党盗国贼根本不在乎魏京
200691,177,朗读版只是痔疮掉了一地,蓝金黄。但是海外的有些
200692,178,有了它的视频我都不好意思,去蓝金黄。但是海外的有
200693,179,他的视频空调不好给思想去6点,坦白地说，共产党盗国贼
200694,180,原名是什么,乎魏京生先
200695,181,这个项链有重要处变不能因为他用啊了,共产党盗国贼根本不在乎魏京生先
200696,182,阿城是谁我都不知道,是国内的所谓共产党
200697,183,在三藩的这个这个对我进行受吗就随风,在乎魏京生先生，他不会把他去蓝金
200698,184,中国的毛泽东中国的那个吗,白地说，共产党盗国贼根本
200699,185,这种晒太阳拒绝对的奉承可追猛打我去了中国,贼，也不见得就是国内的所谓共产党。坦白地说，共产党
200700,186,和工支援吗,的所谓共产
200701,187,火龙之眼,说，共产
200702,188,所以了,所谓
200703,189,宝宝哭过清闲人,盗国贼根本不在
200704,190,曾经给我一个私信,乎魏京生先
200705,191,这附近如果我都没看是英文的啊,得就是国内的所谓共产党
200706,192,是英文的,是国内的
200707,193,我看着亲爱的文贵先生,在乎魏京生先生，他
200708,194,非常高兴看到你的信息这番打谁是反反应停,坦白地说，共产党盗国贼根本不在乎魏京生先生，他
200709,195,这玩意挺好的吗翻译的挺好啊,在乎魏京生先生，他
200710,196,非常高兴看到你的信息我想知道的时候真的是年轻因为我不是很正常的人,白地说，共产党盗国贼根本不在乎魏京生先生，他不会把他去蓝金黄。但是海外的有些人为
200711,197,微信我的微信工作改变中国解决策马守天生就是一头猪,贼根本不在乎魏京生先生，他不会把他去蓝金黄。但是海外的有
200712,198,我用法学学和政治学学生活在福州香港出生,地说，共产党盗国贼根本不在乎魏京生先生
200713,199,你先留着,民运里的地
200714,200,海王,0 星
200715,201,就行了,星月
200716,202,风娃娃,的地位
200717,203,你好,己之
200718,204,文德律师或者助理汇率是会认为零千米,人为了一己之私，为了自己的所谓民运里
200719,205,Letter,了自己的
200720,206,2017年12月历和你一起战斗到我声明最后啊您看了看看,先生，他不会把他去蓝金黄。但是海外的有些人为
200721,207,不过听了郭国汀首鸟,国贼根本不在乎魏京
200722,208,这个王艳萍你还好像有见过什么没有啊,在乎魏京生先生，他不会把他去蓝金黄
200723,209,哈哈,海外
200724,210,丢丢人了真是我的应该查看我明白后今晚宴翻译,地说，共产党盗国贼根本不在乎魏京生先
200725,211,好了我说几句我都说了我说你躺着就是一片,不见得就是国内的所谓共产党。坦白地说
200726,212,啊我要对象有天生的敏感度你很多,见得就是国内的所谓共产党。坦白地说
200727,213,结果让你看看我这不今天在看这个大概抢了他们天生的苦都是自用的多人,见得就是国内的所谓共产党。坦白地说，共产党盗国贼根本不在乎魏京生
200728,214,先祖国签证就这么灵修胡说八道还要给我工作方便完整给她问你吧,党盗国贼根本不在乎魏京生先生，他不会把他去蓝金黄。但是海外的有
200729,215,你那么激动起来你老婆不了女朋友不理价钱,京生先生，他不会把他去蓝金黄
200730,216,所有的客厅啊,所谓共产
200731,217,我都没有回复了没有啊,所说的盗国贼，也不见
200732,218,我说我看过了你以后再说非常荣幸了大概是那个存了大概这个意思啊,国贼，也不见得就是国内的所谓共产党。坦白地说，共产党盗国贼
200733,219,好等一下,生先
200734,220,有那么多看到我吗,共产党盗国
200735,221,这个就行了吧,贼根本不在
200736,222,不会YouTube,不会把他去
200737,223,美国168的方法韩国所以呢,党盗国贼根本不在乎
200738,224,这个我说法我反问男人就这样累一个都真正的就是特务,说的盗国贼，也不见得就是国内的所谓共产党。坦
200739,225,这9家乐算牌技术统一步骤,这黑手还真不见得是所说
200740,226,就是先鹏你再把你捧中山路和快乐不停你到处的人很多,就是国内的所谓共产党。坦白地说，共产党盗国贼根本不在乎魏
200741,227,美洲地图,是国内的所
200742,228,Can you sure,有黑手的
200743,229,怀孕的条件是怎么来的,也不见得就是国内的
200744,230,阿幼儿用男扮女装了有人是那个套彼此他信息的,坦白地说，共产党盗国贼根本不在乎魏京生先
200745,231,那个比如说过靠近会有信息呢,见得就是国内的所谓共产
200746,232,昨天在已经跑出来了一位员六安的一位,会把他去蓝金黄。但是海外的有些人为了一己
200747,233,忠孝仁德站,党盗国贼根本
200748,234,在省略前一直负责的全国查郭文贵的推友的所有事情,贼，也不见得就是国内的所谓共产党。坦白地说，共
200749,235,他去了台湾从台湾跑到老板呀,他去蓝金黄。但是海外的有
200750,236,现在已经到了美国了,自己的所谓民运里的
200751,237,他告诉我说最重要的信息来源就是查郭文贵的粉丝所为,他去蓝金黄。但是海外的有些人为了一己之
200752,238,牛排,是海
200753,239,就是不信的网站,金黄。但是海
200754,240,谁点击效果取你的信息肯定的那种自动插入你是否有,坦白地说，共产党盗国贼根本不在乎魏京生先
200755,241,退我这个这个这个跟攻略联系,盗国贼根本不在乎魏京生先生
200756,242,还有好了其他几个特网站,生先生，他不会把他去蓝
200757,243,为防止危险多为那种不用说了啊多为了100%你看一眼你信息全没有,魏京生先生，他不会把他去蓝金黄。但是海外的有些人为了一己之私，为了自己的所谓民运里
200758,244,你好我叫社交媒体,但是海外的有些
200759,245,网络软件我本来的今天他展示给大家了过一个中国的媒体开了以后我再战2,魏京生先生，他不会把他去蓝金黄。但是海外的有些人为了一己之私，为了自
200760,246,帮我看看怎么了不了解更多维是如何用现代化软件,京生先生，他不会把他去蓝金黄。但是海外的有些人
200761,247,做梦梦见老鼠和大家信息,去蓝金黄。但是海外的
200762,248,这里就说到了,了自己的所谓
200763,249,这个锅我听,生先生
200764,250,板桥,党盗
200765,251,以及他老婆等着啊,，也不见得就是国内
200766,252,和那些人都有密切的联系,但是海外的有些人为了一
200767,253,所以说真的我都看不起他我就不用了我看完了还,会把他去蓝金黄。但是海外的有些人为
200768,254,真可能有歧视,贼根本不在乎魏
200769,255,啊所以,所谓
200770,256,好了我这一系列这样的事情,海外的有些人为了一
200771,257,我希望大家记住,先生，他不会
200772,258,所有的网友们不要被他们利用,国内的所谓共产党。坦白地说
200773,259,不要说啥我听过并发过听过转移视线我不会吧,不见得是所说的盗国贼，也不见得就是国内的所谓共产
200774,260,面对到末尾,产党盗国贼
200775,261,宝鸡到合肥到中国有法治民主自由变成了咋过挺多的争议,盗国贼，也不见得就是国内的所谓共产党。坦白地说，共
200776,262,合作的世界,手的，这黑
200777,263,那他那不输了吗,党。坦白地说
200778,264,我建议大家千千万万不要让他们吧,他去蓝金黄。但是海外的有些人
200779,265,不一会不讨论不要那,不会把他去蓝金黄
200780,266,啊对了我们注释行动打击掌握手机正品,地说，共产党盗国贼根本不在乎魏京
200781,267,不要浪费大家时间,也不见得就是国内
200782,268,这是我怀疑这个,这是有黑手的
200783,269,目前这些这个网络上发过程以及反射*神显然,白地说，共产党盗国贼根本不在乎魏京生先生
200784,270,以及现任法国贫困的根本原因我就不一一的说了因为实在,生先生，他不会把他去蓝金黄。但是海外的有些人为了一己之私
200785,271,无法如此,不在乎
200786,272,就和老新的海外交部长有30粒染,金黄。但是海外的有些人为了一己之私
200787,273,有人像重建将无所谓的大屁民主明月啊要干大事了,魏京生先生，他不会把他去蓝金黄。但是海外的有些
200788,274,这些人随着时间的看,贼根本不在乎魏京生
200789,275,打不开了,。坦白
200790,276,那么同时下流行衍生不要在你们读中我不参与,坦白地说，共产党盗国贼根本不在乎魏京
200791,277,你问我爱你们请提供证据,贼根本不在乎魏京生先生
200792,278,阿肖肖海外你这么多的媒体出来吓了一个绿豆先生,把他去蓝金黄。但是海外的有些人为了一己之私，为了
200793,279,相似性中国会大厦的case已经做得很成功了,魏京生先生，他不会把他去蓝金黄。但是海外的有
200794,280,阿胶怎么做得非常好,党盗国贼根本不在乎魏
200795,281,那么大家千万记住一起新的会玩了两块网主机令,他去蓝金黄。但是海外的有些人为了一己之私，为了
200796,282,自己造假,自己的所谓
200797,283,自助过感觉过了好,在乎魏京生先
200798,284,Google地图去了网友的智慧,国内的所谓共产
200799,285,还有一马吧自媒体当什么自己发财生活工具一定死了,会把他去蓝金黄。但是海外的有些人为了一己之私
200800,286,大城市的,但是海外的
200801,287,这是为什么我说现在国法国为了解网络锁,盗国贼根本不在乎魏京生先生，他不会
200802,288,这些争议需要不要转移了我们打的到我的一个追求法制民主,会把他去蓝金黄。但是海外的有些人为了一己之私，为了自己的所
200803,289,自由的组合形轨,自己的所谓民运
200804,290,更不要脸的大儿子不要选择他一生,去蓝金黄。但是海外的有些人
200805,291,我是真的假的绝对的观察能力,不在乎魏京生先生，他不
200806,292,下来要相信我自己,海外的有些人为了一己
200807,293,那么如果你先生这种流氓行为,产党盗国贼根本不在乎魏京生先
200808,294,这是我骗这种卑鄙的小人,黄。但是海外的有些人为了一
200809,295,啊,外的
200810,296,还给我了,黄。
200811,297,这种猪狗不如的人真伪君子你看这不是一个,盗国贼根本不在乎魏京生先生，他不会
200812,298,我今天不想让他太多歌了,乎魏京生先生，他不会把他去蓝
200813,299,我所有的时间一个个都亮出来,不在乎魏京生先生，他不会
200814,300,等一下子弹飞一会,但是海外的有些人为了一
200815,301,大家不要着急,他不会把他去蓝金
200816,302,让子弹飞一会,但是海外的有些
200817,303,要不浪费向谁想读未经生,党盗国贼根本不在乎魏京生
200818,304,相声,先生
200819,305,陈小华海你咋过挺过,产党盗国贼根本不在乎魏京
200820,306,转移文贵爆料事情,本不在乎魏京生
200821,307,这个很多人想转移海行的事情,贼根本不在乎魏京生先生
200822,308,谢谢大家想想,本不在乎魏京生
