id,index,content,proofed
204298,328,把700000美元给人家人呢拿2000000美元,们采访。就这三个问题，我先回答第一个问
204299,329,做我的脚personal的费用,？这个你答应过，你给大家说
204300,330,睡得少啊点睡,答应过，你给大家说
204301,331,但是让我不是去下了美元,大家说过你不接受他们采
204302,332,再加上6000万的600万的说在家其他的费加上他们费税8200,大家说过你不接受他们采访。就这三个问题，我先回答第
204303,333,我记得大叔,我先回
204304,334,而且是让我们进来的图没多少天,接受他们采访？这个你答应过，你给大
204305,335,我们又买了些客人的用品了不可能进来以后都是我们的,个问题：你为什么要接受他们采访？这个你答应过，你给大家说过
204306,336,买这样的包括同志伴一些家具呀,要接受他们采访？这个你答应过，你
204307,337,啊这个天补一些东西又花了3000000美元,这三个问题，我先回答第一个问题，关于
204308,338,所以在整个这个房子里面花了大概8600万美元,这三个问题，我先回答第一个问题，关于房价，啊关
204309,339,和我说8200还少了呢,家说过你不接受他们
204310,340,老师是大树,来了。第三
204311,341,就这个问题上,接受他们采访？这个你
204312,342,长了,这个你
204313,343,立即播文贵的一些虫类吗,题，我先回答第一个问题，关
204314,344,这个这个吧,这个你答
204315,345,二线,给大
204316,346,这个很多人问我的时候说I see you是不是黑你我是这不是黑我,什么要接受他们采访？这个你答应过，你给大家说过你不接受
204317,347,我特别感谢S6作这个节目,个问题：你为什么要接受
204318,348,因为我不在乎,问题，我先回
204319,349,谁怎么评价郭文贵,？这个你答应过，你给
204320,350,无所不在乎是怎么评价了,家说过你不接受他们
204321,351,我不是大明星来了我也不是当网来了,我先回答第一个问题，关于房价
204322,352,如果大家认为是狗屎狗屎温哥华是个骗子,说过你不接受他们采访。就这三个问题，我先回答第
204323,353,华为是个穷人,回答第一个问题，关
204324,354,但是中国就会有法治中国就会有民主有自由,这个你答应过，你给大家说过你不接受他们采
204325,355,中国就不会有这种低端人口,应过，你给大家说过你不接受
204326,356,红金黄的路人士见文员以办公室,这个你答应过，你给大家说过你不接受
204327,357,唯美大片我愿意当情况但没问题,问题，我先回答第一个问题，关于房价，啊关
204328,358,我不在乎客人的名,不接受他们采访
204329,359,和客人的主力工不公平,访？这个你答应过，你给大家说
204330,360,我在乎的事情就是是否,家说过你不接受
204331,361,真正格式下我们心目中追求的喜马拉雅,这三个问题，我先回答第一个问题，关于
204332,362,一个大家要追求的就是法制民主和自由,给大家说过你不接受他们采访。就这
204333,363,那么这个IPO不管如何他达到了一个目的,受他们采访？这个你答应过，你给大
204334,364,他让全世界更多的人,他们采访。就这三个问
204335,365,看到了郭文贵,你给大家说过你
204336,366,是这样出来,什么要接受他
204337,367,向中国政府,？这个你答应过，你给
204338,368,Art要求,要接受
204339,369,依法治国,应过
204340,370,实现民主和自由,这个你答应过，你给
204341,371,而我觉得不公平的时候我有一个方式就是社交媒体,要接受他们采访？这个你答应过，你给大家说过你不接受他们
204342,372,我可以改发生我敢说不,你给大家说过你不接受他
204343,373,这是我的权利,接受他们采
204344,374,另外一个我要,你给大家说过
204345,375,在这个节目打了几下就不会点,这个你答应过，你给大家说过你不接
204346,376,是一个68岁的骗子啊还是一个到了中年的一个,什么要接受他们采访？这个你答应过，你给大
204347,377,穷爸爸,过，你给大
204348,378,然后呢不管是否要做节目是要挖刺挖苦你的,大家说过你不接受他们采访。就这三
204349,379,水晶杯咖啡,说过你不接
204350,380,我醉了我很有自信我给他没有品位太浪费了,这三个问题，我先回答第一个问题，关于房
204351,381,他们根本没资格评价好吗,他们采访。就这三个问题，我先
204352,382,我作为一个创建器星期回去饭店了一个十几岁的年轻人开始,你给大家说过你不接受他们采访。就这三个问题，我先回答第一个问题
204353,383,到现在,大家先
204354,384,我是23岁给你打,我先回答第一个
204355,385,我认不到三是创建了中国的一个星期外面世界上公认,这个你答应过，你给大家说过你不接受他们采访。就这三个问
204356,386,这个不重要,这个你答应
204357,387,重要的事情,这个你答应
204358,388,传达了我们要传达的信息,受他们采访？这个你答应过
204359,389,所以说我告诉所有的腿有一点不在乎sbu,过，你给大家说过你不接受他
204360,390,在这里还是所谓的袜子,就这三个问题，我先回答第
204361,391,还有后来,大家说过你
204362,392,最后的一条这个房子多少钱,这个你答应过，你给大家说过你
204363,393,因为什么叫理解,你为什么要接
204364,394,梅西不可能,们黑你？他们
204365,395,做到所有发行做的给你公证,受他们采访？这个你答应过
204366,396,哪个法院,题，关于房
204367,397,媒体是传达信息站在他的立场是,受他们采访。就这三个问题，我先回答第一
204368,398,又实有力你又是不理你,给大家说过你不接受
204369,399,你必须接受他不是法人,你不接受他们采访。就
204370,400,所以他起到了传播的作用,过你不接受他们采访
204371,401,我不要找他,不接受他
204372,402,我可以解释怀很感谢,么要接受他们采访？这
204373,403,那么如果我是真的我不怕那个姑娘我总有一天我会说清楚的,你为什么要接受他们采访？这个你答应过，你给大家说过你不接受
204374,404,猪价格逊当年在延续了100度年报道教协展成谢建升,这个你答应过，你给大家说过你不接受他们采访。就这三
204375,405,六个视频我认识光为20年了,三个问题，我先回答第一个问题，关
204376,406,现在到哪知道他认识我把他从来不是说,大家说过你不接受他们采访。就这三
204377,407,正确的说是生活几十年了郑家不认识我吗不认识我,给大家说过你不接受他们采访。就这三个问题，我
204378,408,现在又出来了一个什么就烂去楼了得意忘形他已经把它放出来了,先回答第一个问题，关于房价，啊关于房价，大家先看
204379,409,阿强又来了胡说八道,，啊关于房价，大
204380,410,他就是个骗子他就是个流氓,访。就这三个问题，我先回答第一个
204381,411,还没有回到建议去钟声回不来,答应过，你给大家说过你不接受他
204382,412,但这些事情,这个你答应
204383,413,不是我们的目的,不接受他们采
204384,414,我不是在这个媒体上正合适,为什么要接受他们采访？这个你
204385,415,我的最终目标是改变中国这个声音被传达着就非常识重要了,为什么要接受他们采访？这个你答应过，你给大家说过你不接受
204386,416,那么厉害的时候为什么要接受他采访,来了。第三个问题：你为什么要接受他们采访？这
204387,417,大虫大家回复,大家说过你
204388,418,说吧接受了采访的目的是原有承诺,说过你不接受他们采访。就这三个
204389,419,还有一个就是传达我们的目标和信息,这个你答应过，你给大家说过你不接
204390,420,那另外一个就是这个中间的房子的事情我已经明确的,你为什么要接受他们采访？这个你答应过，你给大家说过你不接
204391,421,告诉大家,价，大家
204392,422,是什么回事,接受他们采
204393,423,欢迎大家去查询,啊关于房价，大家先
204394,424,让你累吗,房价，啊
204395,425,这个,个问
204396,426,对我的信息进行批评本身就是我们的胜利,你不接受他们采访。就这三个问题，我先回答第一个问题，关
204397,427,因为,一个
204398,428,通往上推,问题，关于房
204399,429,苏婉走进公众视野到今天工会希望我说的每句话,说过你不接受他们采访。就这三个问题，我先回答第
204400,430,懂得经得起历史的推敲,个你答应过，你给大家说
204401,431,真的假不了假的真不了只是我幸福的哲学,接受他们采访。就这三个问题，我先回答第一个问
204402,432,我说我能在这个社交媒体的活下去,接受他们采访。就这三个问题，我先回
204403,433,根本的一个原因我就是说真话,给大家说过你不接受他们
204404,434,注册表达正式的我我从不设计,过，你给大家说过你不接受
204405,435,我从不准备,采访？这个你
204406,436,这就是我要做的啊,为什么要接受他
204407,437,另外一个今天把这个推还以后呢,要接受他们采访？这个你答应过，你
204408,438,我想告诉大家的事情,我先回答第一个问题，关
204409,439,就是这两天来关于北京的这个,就这三个问题，我先回答第一个问题，关
204410,440,南京华幼儿园,们采访。就这三
204411,441,万一的男人口啊这个很多很多事情,访？这个你答应过，你给大家说过你
204412,442,昨晚上我看了很多视频,这三个问题，我先回答
204413,443,我刚刚去我的床就是我真的很难过我看了这个,个你答应过，你给大家说过你不接受他们采访。就这三个问
204414,444,因为从任何角度讲我们全部都是一个人口,应过，你给大家说过你不接受他们
204415,445,全部是几个人,你不接受他们
204416,446,我今天待在美国纽约要按照今天这个,问题，我先回答第一个问题，关于房价，啊关
204417,447,去买个方式我们也是美国的,访。就这三个问题，我先回答第一个
204418,448,最高万人口袋也可以定为罪,就这三个问题，我先回答第一个
204419,449,危险的地方人口,三个问题，我先回答第一个
204420,450,高端人口地段人口只说背景没那么简单,个你答应过，你给大家说过你不接受他们采访
204421,451,但是我深信,三个问题，我先
204422,452,这是很多人做出了,接受他们采访？这个
204423,453,用次的类似于文化大革命的灾难的决定,要接受他们采访？这个你答应过，你给大
204424,454,为了维稳,为什
204425,455,为了所谓社会,为什么要接受
204426,456,汉服,什
204427,457,这个部分定的巨大隐患,这个你答应过，你给大家说
204428,458,喝酒人上街,就这三个问题
204429,459,啊,访
204430,460,这这个产出因此造成的这个这个城市都流不稳定因素有可能造成未来,为什么要接受他们采访？这个你答应过，你给大家说过你不接受他们采访。就这三个问
204431,461,网易,房价
204432,462,群体事件,不接受他们
204433,463,而做出这样政策的决定,访？这个你答应过，你给大家说
204434,464,这是给最高领导中药绿岛南一下了一个巨大的,这三个问题，我先回答第一个问题，关于房价，啊
204435,465,巨大的卡,回答第
204436,466,而且大家没有意识到最近的一系列事件,接受他们采访。就这三个问题，我先回答第一
204437,467,实际上都跟,答应过，你给大
204438,468,上届政府,访。就这三个
204439,469,18届的政府里吗,接受他们采访
204440,470,很多人有绝对的关系,这个你答应过，你给大家
204441,471,这也说明了,这三个问题，我
204442,472,现在的19大,先回答第
204443,473,刚开完以后,关于房价
204444,474,White,一个
204445,475,各行政机关,访。就这三个问题
204446,476,和各个部委的一个地方大伟,这个你答应过，你给大
204447,477,戴耀延,大家说
204448,478,这个人是个更迭当中,这个你答应过，你给大
204449,479,世界的事,题：你为什
204450,480,所有的政治水,说过你不接受
204451,481,还,采
204452,482,绝对性的控制和中国的任何的政治行动,你为什么要接受他们采访？这个你答应过，你给
204453,483,而且看这个句子还会一直下去,就这三个问题，我先回答第一个问题，关
204454,484,2月所有上就做了决定,应过，你给大家说过你不接受
204455,485,现在他,先回答
204456,486,不打折扣了,不接受
204457,487,正在执行中,这个你答应过，你
204458,488,谁在明年3 5月份以前,他们采访？这个你答应过，你
204459,489,这个中国的政治社会环境,这个你答应过，你给大家说过你
204460,490,还会非常之复杂,受他们采访。就这
204461,491,包括同一段时间打出伟大领袖习主席的这种,不接受他们采访。就这三个问题，我先回答第一个
204462,492,这样口号啊,这三个问题，我先回答
204463,493,这个这种完全是高级黑现在虽然被处死了,这个你答应过，你给大家说过你不接受他们采
204464,494,戴尔背景都没那么简单,访？这个你答应过，你给大家
204465,495,据我所了解的习主席此人,侮辱你来了，黑你来了。第
204466,496,绝非是他们想象的人,接受他们采访？这个你答应
204467,497,这个愿意他们打出来怎么伟大领袖习主席为大人和领导是我们多了,这个你答应过，你给大家说过你不接受他们采访。就这三个问题，我先回答第一个问
204468,498,帮我这种低端人口的处理方式,这个你答应过，你给大家说过你
204469,499,还有红金黄的幼儿园的处理方式,给大家说过你不接受他们采访。就这
204470,500,一定不是,应过，你
204471,501,但是,大家
204472,502,这就像和平先生最近说的事情一样有些事情可能已经,这个你答应过，你给大家说过你不接受他们采访。就这三个问题，我先回答第一个
204473,503,这个最近,这个你答应
204474,504,我每天都看到这个合同下上节目的时候,问题：你为什么要接受他们采访？这个你答应过
204475,505,我刚刚才给他发了信息,答第一个问题，关于房价，啊
204476,506,我说我作为一个人类,家说过你不接受他们
204477,507,你的同类不要说中国城堡人类,要接受他们采访？这个你答应过，你
204478,508,我对你表示绝对的震惊,你给大家说过你不接受他们
204479,509,这么多几千万华人,这个你答应过，你给大家说
204480,510,这么多媒体除了社交媒写这些明星之外把这些,了。第三个问题：你为什么要接受他们采访？这个你答应过，你给
204481,511,最有两主人之外,应过，你给大家说
204482,512,作为一个媒体,回答第一个问题
204483,513,和平先生,这个你答应
204484,514,先天在为红金黄,先回答第一个问题，关于房
204485,515,啊,啊
204486,516,还有低端人口,回答第一个问题，关于
204487,517,在乎一个,答第一个
204488,518,说出来了杨新华儿童不宜使之举,说过你不接受他们采访。就这
204489,519,也没有图明也没把明员的幌子,要接受他们采访？这个你答应过
204490,520,实实在在的,黑你来了。第
204491,521,为了一些草根们,为什么要接受他们
204492,522,为我们这些草根了,为什么要接受他们
204493,523,为我们这些真正的低端人口出生的人,三个问题：你为什么要接受他们采访？这个你答
204494,524,付出了真心话,访？这个你答
204495,525,说出来最起码,说过你不接
204496,526,是预防止观点,受他们采访？这个你
204497,527,这个这么大的事情没有任何人为低端人口发生的时候,什么要接受他们采访？这个你答应过，你给大家说过
204498,528,和平先生发生那么多生,什么要接受他们采访？这个你答应
204499,529,社交媒体上,什么要接受他
204500,530,小明之声啊郭宝胜,应过，你给大家说过你不
204501,531,赵岩,这三
204502,532,潘晴,采访
204503,533,这个灯的,这个你答
204504,534,都在海外这个位置的低端人口还有这个,们采访。就这三个问题，我先回答第一个问
204505,535,红军蓝发型,个问题，关于房
204506,536,让我们会非常之感动,受他们采访。就这三个问题，我
204507,537,这就是社交媒体,你不接受他们采
204508,538,真正的民主运动的和谐,这个你答应过，你
204509,539,气弱的时候,你不接受
204510,540,气草根说话,家说过你
204511,541,气不能发生的人发声,接受他们采访？这个你答应
204512,542,这不是个人利益,这三个问题
204513,543,这是工艺,这个你答应
204514,544,市人大,什么要
204515,545,是人权,什么要
204516,546,那我非常之尊敬,访？这个你答应过，你
204517,547,有关这些问题,回答第一个问题
204518,548,我会多向你们学习,我先回答第一个问
204519,549,现在的英文,先回答第一个问
204520,550,今天的直播,问题，我先回答
204521,551,主要是这个,。就这三个
204522,552,关于房子事情我马上,关于房价，啊关于房
204523,553,半龙虾仁德到我跟他团队今天要开一天会,问题，我先回答第一个问题，关于房价，啊关于房价，大
204524,554,深圳明天还有开会,三个问题，我先回答第一
204525,555,谢谢所有网友们的关心,应过，你给大家说过你不
204526,556,谢谢所有网友的支持,大家说过你不接受
204527,557,希望你能马上把这个文件,他们采访。就这三个问题，我先
204528,558,染发膏,房价，啊
204529,559,所有的地方去,家说过你不
204530,560,希望我们的推特头也会推特全球,第三个问题：你为什么要接受他
204531,561,筹备委员会,黑你？他们是
204532,562,所有的有社交媒体和推特的朋友们,多少钱？第二个：HBO为什么最后说那
204533,563,讲真象传国主席,为什么最后说那样？是
204534,564,让子弹飞了那么长时间了关于这个信息,钱？你房价多少钱？第二个：HBO为什么最后说那样
204535,565,帮我们想出了这世上的时候他更加的有威力,BO为什么最后说那样？是不是他们黑你？他们是，就是来
204536,566,在我,来……侮
204537,567,这段时间里更加的感受到了网友的真情爱情,这个你答应过，你给大家说过你不接受他们采访
204538,568,何志伟,一个问题
204539,569,让我们会更加坚定,这个你答应过，你给大家
204540,570,去追求我们共同的喜马拉雅,过你不接受他们采访
204541,571,闻鬼每分每秒,问题：你为什么要
204542,572,都在工作了,过，你给大家说过
204543,573,很快我会给大家有惊喜,回答第一个问题，关于房价
204544,574,会给大家有惊喜,回答第一个问题，关
204545,575,而且这个惊喜会首先建立在,。就这三个问题，我先回答第一
204546,576,把海外的,家先看文
204547,577,这些会被铲除,这三个问题，我先回
204548,578,而且我们有了巨大进展,要接受他们采访？这
204549,579,我是拿结果说话,说过你不接受他
204550,580,I will我的人生很简单一切我只看结果不停输,你为什么要接受他们采访？这个你答应过，你给大家说
204551,581,我在我的公司也不要告诉我说你会什么你能说什么你告诉我你,问题：你为什么要接受他们采访？这个你答应过，你给大家说过你不
204552,582,你能做什么和做到什么样的结果,你为什么要接受他们采访？这个你答应过
204553,583,我是除了妈妈论我最早还是结果了,说过你不接受他们采访。就这
204554,584,请大家用即可能改行调文贵能给大家带来什么,们采访？这个你答应过，你给大家说过你不接受他们采访。就这三
204555,585,能做到什么,就这三个问
204556,586,不用时间按查,过你不接受他们采
204557,587,这个温度每天能用辛勤的劳动,这个你答应过，你给大家说过
204558,588,去,不
204559,589,家用家人的生命员工的生命和自由风险,接受他们采访？这个你答应过，你给大家说过你
204560,590,来这个作为,就这三个问题
204561,591,我的动力,过，你给
204562,592,没有回爸爸回报我的网友,应过，你给大家说过你不
204563,593,你们对我的关心和支持,问题，我先回答第一个问
204564,594,一定要相信我们对任何人没有1亿名立和权力追求,你不接受他们采访。就这三个问题，我先回答第一个问题，关
204565,595,我们给我们所有做这个行都是给力这个社会给予这个民族,这个你答应过，你给大家说过你不接受他们采访。就这
204566,596,老天你会帮我,个问题，我先回答
204567,597,在这些,这三个
204568,598,网友当中还在这些适合社交媒体发的这个平台上,访？这个你答应过，你给大家说过你不接受他们采访。就这三个
204569,599,为了个人出名度全,采访？这个你答应
204570,600,阿勒颇有其他之心卖东西,问题，我先回答第一个问题
204571,601,这些骗钱骗子人老天会得报应,这三个问题，我先回答第一个问题，关于房价
204572,602,我申请的计划人在做,这三个问题，我先回答
204573,603,现在看,家先看
204574,604,会有报应的,回答第一个
204575,605,王永安,啊关于房
204576,606,千万不要被英11是索尼和索记录,家说过你不接受他们采访。就
204577,607,结果一定是政治生,这个你答应过，你给大家
204578,608,两军相遇最后是忍者上,过你不接受他们采访。就这三个
204579,609,绝不是勇者上,接受他们采访？这个
204580,610,更不是骗人上一定是仁者上只要身心这一下不应该有恐惧,个问题：你为什么要接受他们采访？这个你答应过，你给大家说过你不
204581,611,不应该有冲动更不应该有升起,访？这个你答应过，你给大家说过你不
204582,612,那我们就不会,过你不接受
204583,613,所谓的要追求喜马拉雅,个问题，我先回答第一
204584,614,谢谢所有朋友们的支持,过你不接受他们采访。就这
204585,615,外星,采访
204586,616,一切都是刚刚开始,应过，你给大家说过你
204587,617,千万不要忘了健身谢谢,采访。就这三个问题，我先
204588,618,谢谢了,，你给
