id,index,content,proofed
203971,1,尊敬的网友们,尊敬的各位网友们
203972,2,大家好,大家好
203973,3,这是郭文贵11月27号,这是郭文贵11月27号
203974,4,直播,直播
203975,5,首先想问你所有的网友们你们健身了没有,首先要问各位网友们，你们健身了没有。今
203976,6,今天是11月27号,今天是11月27号
203977,7,那么,你们
203978,8,今天的主题呢,今天的主题呢
203979,9,就是郭文贵在纽约的房子,就是郭文贵在纽约的房子
203980,10,到底出了什么问题,到底出了什么问题
203981,11,这个说这个问题之前呢,这个问题之前呢，我必
203982,12,我必须要先下大家,我必须要先向大家
203983,13,汇报一下,汇报一下
203984,14,啊这个关于HBO采访,下，关于HBO采访
203985,15,事情,事情
203986,16,HBO采访的是很早的时候,HBO采访是很早的时候
203987,17,这大概最起码的大半年以前,早的时候，大概在半年以前
203988,18,当时要求采访吗还吃beo,当时要求采访的呢，HBO
203989,19,还有这个英国的BBC,还有日本的AHK，还有
203990,20,还有这个福布斯还有日本的HK还有朝日这个这个报纸,还有福布斯，还有日本的AHK，还有朝日报纸，我说
203991,21,等待我说过很多加一直在给我联系,日报纸，我说过很多家一直在跟我联系。
203992,22,那么我都是在这个联系当中了我想他们回复我现在不想,"在跟我联系。



我在联系中跟他们回复，我现在不想参加任何"
203993,23,参加,参加
203994,24,任何西方的电视台的结束他们的采访,任何西方电视台的采访，包括西方的
203995,25,包括西方的平面媒体,包括西方的平面媒体
203996,26,后来呢这个联系的这个女是哪位热心啊一直一时候凉鞋知识认识很多很多,后来联系的这位女士呢，特别热心，一直跟我联系，很多很多次。我答应她，如果我接受
203997,27,俄罗斯,很多次
203998,28,那么我答应我他不是如果我接受采访的话的家就是您,很多次。我答应她，如果我接受采访的话，第一家就是您，所
203999,29,所以这是我对他这个承诺,所以这是我对她的一个承诺
204000,30,那么吐两天了,诺。头两天
204001,31,这个查理Rose一小时60分钟的跟我接触他们要做一系列的翻译我的劫,扎尼偌斯，【一小时60分钟】跟我接触，他们要做一系列的关于我的节
204002,32,现在家里也出麻烦了他也被开除了,现在扎尼偌斯也出麻烦了，他也被开
204003,33,那么是他们这个公司给我联络的,开除了，是他们公司给我联络
204004,34,能在这种情况下,"

那么在这种情况"
204005,35,我只有这个,我只有兑
204006,36,对下的承诺就是主动的DNS优联系,兑现承诺，主动的跟HBO联系，我说你
204007,37,我说你们可以来到这采访我这个节目,我说你们可以来，到这个地方来采
204008,38,我要对小诺亚,我要兑现诺言
204009,39,那么他的马上的决定带到队伍就要来了,他们马上就决定，带着队伍，就要来啦
204010,40,本来说那就是那天采访的当日来就是,本来说采访了十几分钟，二十分钟就
204011,41,说是采访时几分钟20分钟就算了我也没汤匙,说采访了十几分钟，二十分钟就算了，我也没当回
204012,42,那后来呢这个年纪你是特别专业特别好,事儿。结果这个联系的女士特别专业，特别好
204013,43,他说这个能不能我们提前去上几分钟,业，特别好，能不能我们提前去上几分钟，录
204014,44,露露你的生活我们可以呀,录录你的生活，我说可以呀
204015,45,我正好了第2天呢,我正在和我的基
204016,46,我想跟你来的那头一天啊你可以先过来,我说可以呀，你来的头一天，你可以先过来
204017,47,来参加一下等你来看一看,来的头一天，你可以先过来
204018,48,这个我正在说我鸡鸡会开会你来看一看场地,正在和我的基金会开会，你来看一看场地
204019,49,然后你第2天做准备,帮助你第二天做准备
204020,50,最后一天那这位女士和他的经理,头一天，这位女士和她的经理，还
204021,51,没有这个主持人叫Michael的,还有这个主持人叫Michel的
204022,52,得到现场来看了看看了十几分钟就走了,"的到现场来看了十几分钟就走了。



那么"
204023,53,那么第2天了很巧是这个我和我的机顶盒投一天适合精灵会开会出来没,那么第二天很巧，啊，头一天是我和我的基金会开会，所以也没和他聊什么，第
204024,54,太多时间太标准了,他要早点来，来了以后我们还
204025,55,第2天那个采访时候,采访的时候，马上
204026,56,马上中午和半农先生吃饭,马上中午和班农先生吃饭
204027,57,我们很多人,我们很多人
204028,58,谁呀他了早点要来,所以他要早点来，来
204029,59,那么来了以后呢因为我还有跟那个人结伴同学生开会吗,早点来，来了以后我们还要跟班农先生开会嘛。那
204030,60,那么早上他们说好的事情,那么早上他们说好的事情
204031,61,就是说,就是说
204032,62,他们8点半到,他们8点半到
204033,63,我到了以后就出国出没事出来我的习惯开始拍看看吧为了,我有什么行动，我说我早上醒来就是喝杯咖啡，看看电脑，然后
204034,64,看来或者是这个这个有什么行呢,看到那个录的事情，全都是真
204035,65,我说我早上醒来就是,卧室出来，我5点半就开始睡
204036,66,喝杯咖啡然后看看电脑然后就开始直播因为我先跟,的，我刚从卧室出来，我5点半就开始睡觉，睡了大概半
204037,67,宝胜线上直播,都是真实自然的，我刚
204038,68,我那你们就路就算了,直播，你们录就行。所以那
204039,69,谢大家今天早上看到那个绿的下就是所有的事情了,行。所以那天早上看到那个录的事情，全都是真实自
204040,70,全都是真实自然的,全都是真实自然的
204041,71,我刚从卧室出来,我刚从卧室出来
204042,72,我10年5点半在就睡觉,我5点半就开始睡觉
204043,73,然后在这个,电话，就冲
204044,74,说了大概半个小时吧我就醒来了醒来了又打了一个电话然后就是这个充不了,睡了大概半个多小时，就醒来了，醒来了之后我打了个电话，就冲个凉，穿上
204045,75,妈妈穿的衣服出来等就碰上了micro下相识相机对着我,个凉，穿上衣服，就看见Michel先生的摄像机对着我。所
204046,76,这是我是非常自然的,着我。所以我非常自然
204047,77,喝很突然的,很突然的
204048,78,没有任何心理准备的开始了采访,没有任何心里准备的开始了采访
204049,79,那么当时他们是用呀不识相机来精彩,访，当时他们是用两部摄像机来进
204050,80,Oracle这个先生视主持人特别特别的棒,hael先生是主持人，特别特别棒的主持
204051,81,非常轻松,非常轻松
204052,82,然后大家看到了我从这个卧室门出来我市区到厨房,然后大家看到了我从卧室门出来，从卧室区到厨房
204053,83,然后了这个喝咖啡,厨房，啊这个喝咖啡
204054,84,很多人难道这就是你为什么那个玻璃杯和咖啡呢,很多人那，到这个就说“你为什么用玻璃杯喝咖啡呢
204055,85,这个任何,这个，任何
204056,86,所有大家认知的,所有大家认知的
204057,87,所谓的标准,所谓的标准
204058,88,都值得商榷,都值得商榷
204059,89,咖啡我喝咖啡的和任人不一样,咖啡啊，我喝咖啡和任何人不一样
204060,90,这么多年来我有一个秘诀,这么多年来我有一个秘诀
204061,91,就是早上咖啡加蜂蜜,就是早上咖啡加蜂蜜
204062,92,蜂蜜咖啡加蜂蜜我走的任何地方,蜂蜜，咖啡加蜂蜜我走到任何地方
204063,93,谢谢因为我的酒店的总裁,地方，这是一位我酒店的总裁
204064,94,咸,店
204065,95,S.t.a.y Skin集团那个总裁,听清）集团的一位总裁
204066,96,交给我了,教给我的
204067,97,因为这个那个治便秘,因为这个呢，治便秘
204068,98,是一个第2个最重要的事情,是一个，第二个呢，最重要的事情
204069,99,是这个脸上这个不及格了,是这个脸上不起疙瘩
204070,100,那么这个咖啡呢为什么要用玻璃杯和呢我特别不喜欢的小咖啡杯断了的女孩,那么这个咖啡为什么要用玻璃杯喝呢？我特别不喜欢那个小咖啡杯端着在
204071,101,麻烦这个咖啡杯放播放水晶杯不要太热了那天我从太热了,儿喝，然后这个咖啡（杯）放水晶不要太热，因为那天我冲太热
204072,102,应该是,应该是
204073,103,最早的书高级的啊最高兴合法因为,最早的时候高级的啊，最高级的喝法
204074,104,需要喝茶呀真正的喝茶高级的时间用的是水晶的,的喝法。就像喝茶一样，真正的喝茶高级的是用水
204075,105,过去水晶很高级费用识别他妈弄不起,过去水晶很高级，所以用瓷杯，（水晶杯）它
204076,106,那么从那以后我就养成了用水晶杯,不起，从那以后，我就养成了用水晶杯
204077,107,呵,喝
204078,108,咖啡加蜂蜜,咖啡加蜂蜜
204079,109,然后他看了我去看我的小狗是NO,然后大家看到我去看我的小狗Sn
204080,110,然后大家看到了回来我就看我的手机,然后大家看到了我回来看我的手机
204081,111,然后上保什么先生的这个,然后上宝胜先生的这个
204082,112,节目采访,节目、采访
204083,113,被采访,被采访
204084,114,就长得这么的过程,就整个这么个过程
204085,115,他问我的问题,他问我的问题
204086,116,我也真的不清楚,我也真得不清楚
204087,117,眉头也不完全是很轻松的,ichael也完全是很轻松的
204088,118,非常自然的,非常自然的
204089,119,就是问了所有的问题,就是问了所有的问题
204090,120,其中态度问道了,其中他就问到了
204091,121,你家房子听说是6800万,你们家房子，听说是6800万
204092,122,6.8分啊,6800万
204093,123,他看到我那个被剥出来的录像采访到中国说不是,到我那个被播出来的录像采访当中，我说“不是
204094,124,这是一个假新闻,这是一个假新闻
204095,125,我说这个我很喜欢川普总统说的,闻”，我说“我很喜欢川普总统说的
204096,126,就是这个家新闻啊fat64这个这个概念,就是这个假新闻，啊这个Fake News，这个概念
204097,127,因为我被吴淑丽还有得选,因为我被胡舒立，还有这个博讯
204098,128,别太差了关于我的那一刹真新闻都没有,被害惨了，关于我的，连一条真新闻都没有
204099,129,我是说一说我很恨这个假新闻,所以说我很恨这个假新闻
204100,130,不欢迎我这个房子,闻，关于我这个房子
204101,131,出生6800万这也是个假新闻,，啊，所以说我很恨这个假新闻
204102,132,我说头痛,我说Total，To
204103,133,逃出的path,tal，Total P
204104,134,是8200万,是8200万
204105,135,不是吗,是吗
204106,136,这个是过程,这个事情就过
204107,137,那么今天来了你问了很多问题那天的采访非常的高兴,那么接下来就问了很多问题，那一天的采访非常的高兴
204108,138,嘴巴为啥我打傻基本上,"就他问啥我答啥，



基本上那一"
204109,139,你觉得7亿分钟的采访是在,天七分钟的采访时在
204110,140,两个小时将近的采访当中一小时45分钟采访闹钟,时在2个小时将近的采访当中，1小时45分钟的采访当中
204111,141,杰出来了,截出来的
204112,142,所以我看到很多话题呀,所以看到很多话题啊
204113,143,含了很多人问题呀没接上,话题啊、很多问题啊没接上
204114,144,时间是减价的结果,实际上是剪辑的结果
204115,145,这就是为什么你一直以来,这就是为什么一直以来
204116,146,我不接受任何,我不接受任何
204117,147,打电视台和平面媒体报道的原因因为他们认一简洁,大电视台和平面媒体报导的原因，因为他们任意剪辑
204118,148,实验室简洁我看到了很多咱们的网友那对我的采访问题,实际上是剪辑，我看到了很多咱们的网友啊对我的采访
204119,149,提出了各种建议,提出了各种建议
204120,150,如果这个1亿小时45分百度出来了跟你看到这个结果说不含起来不一样的,如果这个1小时45分钟版播出来，那跟你看到的结果是完全不一样的
204121,151,帮我找房价的时候翻译还是不一样的,包括这个房价的说法也是不一样的，那
204122,152,那么我们也没有路啊我们也没有备份,那么我们也没有录播，啊我们也没有备份
204123,153,那么当地的采访完以后很开心,那么当那个采访完以后很开心
204124,154,啊后来这个节目呢,后来这个节目呢
204125,155,他们经过剪辑他帮子就说出来,他们经过辑，“梆”，他们就给播出来
204126,156,不出来了大家看到了影响巨大影响巨大,出来了大家看到了，影响巨大，啊影响巨
204127,157,特别是在国内亚还有些酒店是开放性的,特别是在国内啊，他有些酒店是开放型的
204128,158,在国内港澳台无人不知,在国内、港澳台是无人不
204129,159,西方很多人都知道,西方很多人都知道
204130,160,为什么垃圾虎欢迎跟文贵的合伙人,文贵的合伙人、律师、会计师没有人不问我这个
204131,161,律师,律师
204132,162,会计师,会计师
204133,163,没有人不问我,没有人不问我
204134,164,这个七中的三个问题了,这个其中的三个问题
204135,165,第一个问题,第一个问题
204136,166,就是你的房价到底多少钱,就是：你的房价到底多少钱
204137,167,你房价错了,你房价多
204138,168,第2个还是密度为什么最有重要是不是就是黑你,第二个：HBO为什么最后说那样？是不是他们黑你？他们是，就
204139,169,他们是就是来不如你来了黑鸟,他们是，就是来……来……侮辱你来了，黑你
204140,170,第3个问题,个问题
204141,171,你为什么要接受他们才,你为什么要接受他们采
204142,172,这个你答应我你跟他说过你不就那么差吗,这个你答应过，你给大家说过你不接受他们采
204143,173,就这三个问题,就这三个问题
204144,174,我先回答的一个问题,我先回答第一个问
204145,175,关于房价关于房价,关于房价，啊关于房价
204146,176,大家请看文件,大家先看文件
204147,177,帮太太看到这个文件的时候了,他们采访。就这三个问题，我先回答第
204148,178,请看一看我的这个房子,他们采访。就这三个问题
204149,179,就是纽约生日大战7 8 10的房子是2015年3月6日八字,这个你答应过，你给大家说过你不接受他们采访。就这三
204150,180,在瑞士的一个家族基金购买了,应过，你给大家说过你不接
204151,181,这个纽约第5大道781号,这个你答应过，你给大家说
204152,182,18层,采访
204153,183,Plaza公寓,采访？这个
204154,184,今里昂套佣人房还讲的佣人房啊在看到啊,个问题，关于房价，啊关于房价，大家先看文
204155,185,这是觉得被王木呢,就这三个问题
204156,186,我是给大家看一个中英文版因为它主要让国内的同胞和,这个你答应过，你给大家说过你不接受他们采访。就这三个问题，我先
204157,187,海外同胞们看到一会儿还有英文吧请看下面,回答第一个问题，关于房价，啊关于房价，大家先看文
204158,188,我们的买房了就是我们所说的就三个一串,受他们采访。就这三个问题，我先回答第一个
204159,189,买方的代理律师了,采访？这个你答应
204160,190,就大家的朋友是纽约大概,给大家说过你不接受他们采
204161,191,应该是前三大的律师事务所,这个你答应过，你给大家说
204162,192,这是他的带领的,这三个问题，我先回答
204163,193,一会了我会出事,大家说过你不接
204164,194,就是说这个律师所代表我的朋友4给我发了个付款和,说过你不接受他们采访。就这三个问题，我先回答第一个问题
204165,195,万航实心里哪里是他们这个公司因为是可怕买的是钱,你给大家说过你不接受他们采访。就这三个问题，我先回答第一
204166,196,无法代理律师是这个啊,我先回答第一个问
204167,197,那么这个客户公司叫这个名字,这个你答应过，你给大家说
204168,198,交易的中介啊就是siemens是30米的公司,这个你答应过，你给大家说过你不接受他们
204169,199,持股数量,题，关于房
204170,200,3000家50,房价
204171,201,我是这个大陆最大股东,我先回答第一个问题，关于
204172,202,这个月哪里飞哪大概56900元,回答第一个问题，关于房价，啊
204173,203,加上这个935大概6万多一点吧,这三个问题，我先回答第一个
204174,204,另外一般事实上每个月加上其他下来,给大家说过你不接受他们采访。就这三个问题，我先回答第
204175,205,我现在大概7万到80000元管理费,我先回答第一个问题，关于房价，啊关于
204176,206,佳吉他,家先
204177,207,实际那,回答
204178,208,交割买方我共计支付多少钱呢,家说过你不接受他们采访
204179,209,8245万,题，我先
204180,210,8000,么
204181,211,R天24这个8200的吗,访？这个你答
204182,212,多买多少了大家看到我昨天我才看到,，我先回答第一个问题，关于房价，啊关于房价，大
204183,213,律师法律文件以后,三个问题，我先回
204184,214,这个房价那是多少钱呢,这个你答应过，你给大家说
204185,215,17千瓦,先看
204186,216,气象万啊,家先看文
204187,217,所以说那个报导完全是错误的,受他们采访。就这三个问题，我先回答
204188,218,就汽车还是怎么来的呢,就这三个问题，我先回答第一个问
204189,219,7026万的来源是6750万,问题，关于房价，啊
204190,220,是买房子,们采访
204191,221,再加上18楼,大家说过你
204192,222,我没有还有那俩人用人房25块,要接受他们采访？这个你答应过，你给
204193,223,还有一个26万啊,回答第一个问
204194,224,那么六这是交警处栖霞发了吗,你不接受他们采访。就这三个问题，我先
204195,225,就是7026万,就这三
204196,226,记下这个,就这三个
204197,227,他们也是7000,他们采
204198,228,阿迪什么会有什么再加上这个这个260吗,为什么要接受他们采访？这个你答
204199,229,626做这10件事,过，你给大家说
204200,230,然后呢,访？这
204201,231,是2%购买份额2%,受他们
204202,232,然后毒蛇皇家,你给大家说过你不
204203,233,超过了超过了这个100万所以加了一个税,说过你不接受他们采访。就这三个问题
204204,234,啊所以是家庭的8.75%,我先回答第一个
204205,235,这个妃子这个是纽约州销售税,这个你答应过，你给大家说过你不接受
204206,236,是220 180汽车,说过你不接
204207,237,60个月的管理费押金3369000,个问题，关于房价，啊
204208,238,啊在家啊这这个玩就嫌疑这个,这三个问题，我先回答第一个问
204209,239,好孩子呀过了1%,过，你给大家说
204210,240,波兰一个80是多少,过，你给大家说过
204211,241,超100美金的,说过你不接
204212,242,67 867号,为什么要
204213,243,可乐公司的律师费,个问题：你为什
204214,244,330000,是
204215,245,马航370,那样
204216,246,我就这个数中不行所以说咱当官玩大了,？你房价多少钱？第二个：HBO为什么最后说那样
204217,247,买房律师费,来了。第三个
204218,248,这是,这个你
204219,249,27万度,我先回
204220,250,阿美发境外家族信托建立有管理费的支出,过你不接受他们采访。就这三个问题，我先回答第一
204221,251,这是6 600啊,这个你答
204222,252,600万啊,，我先
204223,253,就是我这个房子的买呢,就这三个问题，我先回答
204224,254,有三个结构,于房价，啊关
204225,255,首先美国一家公司叫金泉金钱公司,过你不接受他们采访。就这三个问题，我先回答第一个问题
204226,256,然后在瑞士,过，你给大家说
204227,257,英文的那个,一个问题，关
204228,258,然后呢这个在瑞士有一张思瑞士上面有的家族基金啊就是,你给大家说过你不接受他们采访。就这三个问题，我先回答第一
204229,259,冰王岐山家族信托基金孟建柱下手机显示一个道理,你给大家说过你不接受他们采访。就这三个问题，我先回答第一
204230,260,漂亮啦通图片,，啊关于房价
204231,261,这个是大概看到这个是律师事务所啊,受他们采访。就这三个问题，我先回
204232,262,朋友是给我发来的律师文件,三个问题，我先回答第一个问
204233,263,由于涉及到个人信息是不能对外公布的是非法的,应过，你给大家说过你不接受他们采访。就这三个问
204234,264,大家看到了,大家先看
204235,265,这是律师发给我们的,这三个问题，我先回答
204236,266,这个这个文件,这个你答应
204237,267,我下周,我先回
204238,268,啊,答第
204239,269,这个都是,给大家说
204240,270,对方律师和我们历史也就是前天,第三个问题：你为什么要接受他们
204241,271,我们让这个律师事务所给我们发来的,为什么要接受他们采访？这个你答应过
204242,272,这个了所有的账单,这个你答应
204243,273,文件,问题：你
204244,274,大家看到我啊,大家说过
204245,275,有什么人签字当是什么人签的字,你为什么要接受他们采访？这个你
204246,276,那就大家都能想能下载下来,先回答第一个问题，关于房价，啊关
204247,277,再回来想卖掉,于房价，大家先
204248,278,从头再慢慢的做,受他们采访。就这三
204249,279,意大利城来的,回答第一个问
204250,280,清雅三楼,你答应过
204251,281,走到殿上来听,你答应过，你给大家
204252,282,好听呀,房价
204253,283,所以大家我让大家看到的所有的这个费用啊,过你不接受他们采访。就这三个问题，我先回答第一
204254,284,合同啊律师事务所发来的啊,接受他们采访。就这三
204255,285,这个,这三个
204256,286,就是说实在话我是华山珍不肯德清楚2015年2016年,家说过你不接受他们采访。就这三个问题，我先回答
204257,287,我中国首批暑期大概在171美元我手提出去,说过你不接受他们采访。就这三个问题，我先回
204258,288,编辑金刚171美元,先回答第一个问题，关
204259,289,媒体和技术是不可能的,给大家说过你不接受
204260,290,我每年,我先回
204261,291,每年的开始我现在每天8000000美元必须指出,采访。就这三个问题，我先回答第一个问题，关于
204262,292,3000000美元是专案组查出资产的利息,们采访。就这三个问题，我先回答
204263,293,何损失,这三
204264,294,阿拉和百万美元是我佩服的,要接受他们采访？这个你答
204265,295,两个飞机,来了，黑你
204266,296,六个房子,过，你给大
204267,297,基金员工管理费基金租金,价，啊关于房价，大家先看文件
204268,298,还有这个有关其他的开支,先回答第一个问题，关于
204269,299,还有现在这些打官司的律师费,访。就这三个问题，我先回答第一个
204270,300,所以说我大概一天必须办了没有,大家说过你不接受他们采
204271,301,只有审计帮我的审核前我没办法记住你一句是不可能了,这个你答应过，你给大家说过你不接受他们采访。就这三个问
204272,302,好,他
204273,303,这是这个英文的文件啊大家看到了,接受他们采访。就这三个问题，我先回答第
204274,304,这个是总共8200万,这个你答应过，你
204275,305,那么这个8200万那8220万那就是大家看到律师事务所发生的,你给大家说过你不接受他们采访。就这三个问题，我先回答第
204276,306,事实上买完房子呢,受他们采访。就这三个问题，我先回
204277,307,你们这个房子是创造了纽约的当年一直到现在好像是单笔交易最大的,你答应过，你给大家说过你不接受他们采访。就这三个问题，我先回答第一个问题，关于房价，啊
204278,308,单笔交易最大的,我先回答第一个
204279,309,那么同时呢,他们采访
204280,310,使交易最快的,题，我先回答第一个
204281,311,三个星期从开始,三个问题，我先回
204282,312,我记得把房间,们采访。就
204283,313,11月20几号吧,于房价，啊
204284,314,一个11号21号就是几号,你给大家说过你不接受
204285,315,进来以后,家说过
204286,316,我说中文吗我买了,受他们采访？这
204287,317,我这个房子最早的出家了是一个,为什么要接受他们采访？这个你答应
204288,318,中东的王子,这个你答应过，你
204289,319,1.51美元,问题，关
204290,320,Ue coop,说过
204291,321,这个董事会不拒绝了外族人士买,这个你答应过，你给大家说过你不接受
204292,322,所以说从来没有一个外来的有色人种满这个房子,为什么要接受他们采访？这个你答应过，你给
204293,323,由于他们有,受他们
204294,324,这个自己的柜子,这个你答应过，你
204295,325,就把那个房子就去了也瘦了没有所以我来了我说我就是给了7000万年,家说过你不接受他们采访。就这三个问题，我先回答第一个问题，关
204296,326,今晚对方答应了,价，啊关于房
204297,327,这样他为了什么说,这三个问题，我先回
