id,index,content,proofed
221977,311,为什么海航偷偷摸摸的还要送那个东西,为什么海航偷偷摸摸的还要送那些东
221978,312,刘心阳为什么出现了和姚明珊同一架飞机场,刘新扬为什么出现在和姚明珊同一架飞机上
221979,313,为什么刘春节还有多个参数,为什么刘呈杰还有多个身
221980,314,然后入住中丑陋的视频,然后又录出丑陋的视频
221981,315,然后的顺利就是你心灵倒是你就是,然后新领导孙立军把我家人一次次请去喝茶
221982,316,把我家人一直是请去喝茶然后威胁然后让我停,把我家人一次次请去喝茶，然后威胁，然后让我当
221983,317,当场苹果苹果以后然后就是说我,当场停播。本来说要把我们曲国娇
221984,318,本来说要把我们去过交换为香港现在取回调不再不放开养了一个给王艳萍发,本来说要把我们曲国娇放回香港。现在曲国娇不但不放，还演了一个给王彦平发信息：“我家
221985,319,这个信息还要我家不让我回去了办不了护照把我的三百万的保证金拿出来,"王彦平发信息：“我家不让我回去了。办不了护照。把我300万保证金拿出来吧！“



这种丑"
221986,320,这种丑陋这种愚蠢,这种丑陋这种愚蠢
221987,321,这种是国家继续玩弄于掌中,这种视国家机器玩弄于掌中
221988,322,然后玩弄老百姓的14亿人的智慧和智商,中，玩弄老百姓14亿人的智慧智商
221989,323,然后大师的放手我身份出问题了,人的智慧智商，大肆放出我身份出问
221990,324,10月9号应该能回去,月九号以前能回去
221991,325,来我家玩意用铺天盖地,假王彦平假于泳铺天盖地
221992,326,最有问题呢,些问题呢
221993,327,导致了,导致了
221994,328,导致了,导致了
221995,329,就是所有的人就是落善良的推涌的老百姓呢,就善良的推友们老百姓，慢慢由于他们说了千
221996,330,慢慢由于他们说了千万遍的这个这个假话,慢慢由于他们说了千万遍的假话
221997,331,就这么一转来点,就是蚂蚁粘了大象
221998,332,大象屁股上的来月经的血,大象屁股上来月经的血
221999,333,他说我把马大象得顺的故事一点不是一样,他说我把大象给睡了的故事一样，到处
222000,334,他告诉我说要干吗这样很大呀就打个相信啊我买大象给强奸你说了,他说我把大象给睡了的故事一样，到处说啊蚂蚁啊！蚂蚁的量很大啊！结果大家都相信
222001,335,结果大相肚里怀着别人孩子找到了请别说,结果大象肚里怀的别人的孩子，找到了亲爹！说
222002,336,我是被,我是被
222003,337,买一个什么样的孩子就行吗你了,蚂蚁给睡了！大象的孩子就姓蚂蚁了
222004,338,所以说,说我是
222005,339,文贵这个事情就接近于蚂蚁说大象的裤子了,文贵这个事情就接近于蚂蚁睡大象的故事了
222006,340,在那个站点血就是为什和史诺癞蛤蟆李卫东和夏业良夏痔疮你,粘了点儿血就是韦屎屎诺癞蛤蟆李伟东和夏业良夏痔疮，你看他们
222007,341,那个丑陋的一种无法形容的程度,们丑陋到一种无法形容的程度
222008,342,这些事情,和夏业良
222009,343,我必须要出示说两句了说的话我的律师团队都是那样子你为什么要说呢,我必须说两句了。我的律师团队说：“Miles你为什么要说呢？你不要说！你
222010,344,你不要说,你不要说
222011,345,那么,：“Mile
222012,346,你应该去接受这个东西,你应该去接受这个东西
222013,347,各种身份证件我为什么要说那个呢,各种身份证件，为什么要说这个呢
222014,348,是不是那么摆在我面前有三个选择,"是不是？



摆在我面前有三个选择"
222015,349,大家要记录的声音,有个叫S签证，就是
222016,350,第1,第
222017,351,美国有个小S签证,美国有个叫S签证
222018,352,S香港大家上网查一下,"是？



摆在我面前有三个选"
222019,353,就是和美国,就是和美国
222020,354,这个情报部门和执法部门合作,国情报部门或执法部门合
222021,355,你打印机不行吗,你答应提供情
222022,356,直接给你签证,直接给你签证
222023,357,然后你拿护照,然后给你拿护照
222024,358,另外一个较特别特别特别了就是,统一签直接给你护照。给你家
222025,359,你有去拿东西,你有巨大贡献
222026,360,总统改签直接给你,总统一签直接给你
222027,361,给你家人你说要当什么保护去,给你家人所有人都给你保护起
222028,362,给你护照户籍马上,给你护照入籍马上
222029,363,但是你有去打工,但是你有巨大贡
222030,364,第3就是这个政治庇护,第三就是这个政治庇
222031,365,无条件的政策给每一个人打我刚才说的这么的任何一个人都可以任何人都可以,无条件的政治庇护。每个人，我刚才说的几种情况任何一个人都可以
222032,366,那么这是第3个,拿这个政治
222033,367,我那到时有什么算了我说我这个就拿这个,我呢当时就说那算了。我就拿这个政
222034,368,这个政治庇护就算了,这个政治庇护就算了
222035,369,因为我进了解了政治庇护是非常好的,因为我了解完政治庇护是非常好
222036,370,因为他,因为它
222037,371,任何情况下任何人,任何情况下任何人
222038,372,他都不可能以任何理由,它都不可能以任何理由
222039,373,他把我给送回中国去,把我给送回中国去
222040,374,不可能,不可能
222041,375,而现在任何情况的走法律程序,而且任何情况下走法律程序
222042,376,我又不在我的给不给我提的不过比我这个法院去吧,我又不在乎给不给我批。不给我批我就走法院去嘛
222043,377,他回到法院去我授权保护,就走法院去嘛！我受同样保护
222044,378,也是10几年,也是十几年
222045,379,他踢了就熄了我也无所谓,批了就批了我也无所谓
222046,380,这就是这两样看里面绝对决定但是我享受了这个,政治庇护的所有条件。这是很重要的。在这种情况下
222047,381,政治的皮厚的,政治庇护的
222048,382,所有条件,所有条件
222049,383,这是很重要的,这是很重要的
222050,384,那么我是,但是我
222051,385,在这种情况下我是不想拿S签证,在这种情况下我不想拿S签证
222052,386,我也不想直接拿护照,我也不想直接拿护照
222053,387,但是我随时可以有权利我只要,但是我随时可以有权利我只要
222054,388,打个电话马上我就可以了,打个电话，马上我就可以
222055,389,但是,但是
222056,390,我不想要倒过来说有一天郭文贵,我不想让盗国贼说有一天郭文贵回
222057,391,回去搞过去调解,回去搞郭七条去
222058,392,这个他们说这小的是拿了S签证,这小子拿了S签证出卖了我们的
222059,393,出卖了我们的民族,出卖了我们的民族
222060,394,出卖了我们国家这饺子有条件的拿了,出卖了我们国家。这小子有条件的拿了
222061,395,美国护照然后特别顾着他全家都是我们的敌人,美国护照。拿了特批护照他全家都是我们的敌人
222062,396,我说的说不清,我说都说不清
222063,397,我不拿呀而是美国人的分布强度,我不拿啊！美国这地方又不强
222064,398,我决定,我决定
222065,399,不合作不拿,不合作不拿
222066,400,阿布拿,不拿
222067,401,就拿一个平民的政治庇护完全解决了问题,就拿一个平民的政治庇护！完全解决了我的问题
222068,402,就把盗国贼的所有的谎言全说出来,就把盗国贼的所有的谎言全戳穿
222069,403,我还有一个原因是什么,还有一个原因是什么
222070,404,多个部门正在告诉我,多个部门告诉我，中
222071,405,中国的某些商人,中国的某些商人
222072,406,某些你想象不到的商人,某些你想像不到的商人
222073,407,其中一个就包括了马云,其中一个就包括了马云
222074,408,就包括了马云,就包括了马云
222075,409,四处活动,四处活动
222076,410,给别人付钱,给别人付钱
222077,411,包括马云到处是个这个告诉别人去说我就不要帮助攻鬼,包括马云到处告诉别人，说我不要帮助郭文贵。阻止
222078,412,竹子办公柜,阻止帮助郭
222079,413,而且现在叫马云这好几个商人在美国欧洲付钱给杀手,而且现在像马云这样好几个商人在美国欧州付钱给杀手
222080,414,要杀掉我,要杀掉我
222081,415,这未来都会被公布的,未来都会被公布
222082,416,你都想象不到吗用我跟他不熟无盐还是熟人,你都想象不到，马云我跟他无仇无冤还是熟人
222083,417,他到处就帮助帮助这样帮助江干吗帮助孟建柱孙立军了回调我杀掉我倒数,他到处去帮助谁啊？帮助江家嘛！帮助孟建柱孙立军嘛！毁掉我！杀掉我！到
222084,418,好几个人要回到我杀掉我,好几个人要杀掉我！然后
222085,419,然后他们找个什么华侨叫令,然后他们找了什么华侨侨领
222086,420,你先到我家楼下一个叫看证的人这条令行证的,那天到我家楼下，那个叫侃正的人侨领，带了一个女杀
222087,421,带了一个女杀手,带了一个女杀手
222088,422,说是我越来开会要到我18楼来,说是我约她开会，要到我18楼
222089,423,实际上他就是既然就是就是这女的把抱着玩具枪两天我了估计估计的呀,实际上进来这女的抱住我你强奸我了！估计啊估计这样！估计还得有假录音出来
222090,424,然而估计还得给油一首假如因出来然后就在美国过制造麻烦就让我马上失去自由,估计这样！估计还得有假录音出来。在美国给我制造麻烦！让我马上失去自由！然后就闭
222091,425,然后就闭嘴了,然后就闭嘴了
222092,426,就不就不推了要不和你们直播了,就闭嘴了！也不和你们直播了！也不
222093,427,也不能报平安了,也不能报平安了
222094,428,这个那个梁冠军是被他们收买的,"安了！



那个梁冠军是被他们收买的！这绝"
222095,429,就是说,绝对是
222096,430,黑道这绝对是黑道然后那所有他带来的人,黑道的。所有他带来的人，都是非法偷渡过来的
222097,431,都是非法偷渡过来的,都是非法偷渡过来的
222098,432,他们这个人在任何就关了都是不自由的,他们这些人关着都是 不自由的。他们
222099,433,他们在车上尿你看那天我说了再来的时候在车上要车上啦,他们在车上尿。那天来的时候在车上尿车上拉！到了第
222100,434,到了第5大的还没到,到了第五大道旁边
222101,435,然后集体还完拍完照马上上车关上门都没自由走的,儿倒下去。喊完拍完照马上上车关上门都没自由走的
222102,436,现在警察已经全部在调查,现在警察已经全部在调查
222103,437,这些人就是找机会去,这些人就是找机会
222104,438,我出来,我出来
222105,439,反正都是这个没有身份的,反正都是没有身份的。围
222106,440,组围绕来帮我打死,围上来把我打死
222107,441,撞死啊,撞死
222108,442,这种情况,这种情况
222109,443,所有的情况要在美国给我制造麻烦,所有这些情况要在美国给我制造麻烦
222110,444,包括这个马蕊被他们的鞋子,给我制造麻烦。马蕊被他们胁迫
222111,445,协和这世界是肯定的了因为,胁迫是肯定的了。马蕊100%是被胁
222112,446,玛瑞娜这个100%是被她给媳妇了然后叫马尾马尾那用沉默的,马蕊100%是被胁迫的。然后叫马蕊用沉默的力量所谓
222113,447,所谓的美美联社那个小烂仔小烂仔他可不是媒体人,所谓的美联社那个小烂仔，他可不是媒体人，沉默的力量写
222114,448,这成本的立场写了那么一个完全是10的公不公平报道也在调查中,是媒体人，沉默的力量写了一个完全失实的不公平的报道，也在调查中
222115,449,那么包含,那个小烂
222116,450,就是说为什史诺癞蛤蟆李伟东,后叫马蕊用沉默的力量所谓
222117,451,所有在网络上写黑客我们找黑客欧洲的黑客中国的黑客现在,被胁迫的。然后叫马蕊用沉默的力量所谓的美联社那个小
222118,452,所有的朋友,公平的报道，也
222119,453,在上推的人被抓了这几天太多太多了,仔，他可不是媒体人，沉默的力量写
222120,454,宝贝黑的电脑人太多太多就孟建柱孙力军傅政华王岐山封了,包含韦屎屎诺癞蛤蟆李伟东，所有在网络上找黑客，欧洲的黑客，中
222121,455,我还有43天他就滚蛋了,太多太多了！孟建柱孙
222122,456,疯了就完全疯了,疯了！完全疯了
222123,457,那么这种情下我生命危险是非常重要的,这种情况下我的生命危险是非常重要的
222124,458,他们在用各种人在靠近我,他们在用各种人在靠近我
222125,459,靠近我,靠近我
222126,460,他们,他们
222127,461,甚至找了一个女的啊,甚至找了一个女的
222128,462,赵和平,找何频
222129,463,通过和平来靠近我,通过何频来靠近我
222130,464,还有一个女的找小平啊也要靠近我,还有一个女的找小平啊，也要靠近我
222131,465,这家小姐她还没有完成的时候我都知道了,这些消息啊他还没完成的时候我就知道了
222132,466,那么这种情况下的评估下来,就这种情况下评估下来
222133,467,说他们在美国任何情况下,说他们在美国任何情况下
222134,468,他法律上伤害不到我,在法律上伤害不到我
222135,469,我在这里我我是美国居民,我。我是美国居民。我是在
222136,470,我是在美国纳税的,我是在美国纳税的
222137,471,但是呢我他们担心的我政治上,但是他们担心我政治上
222138,472,壁虎这会太弱,庇护这一块儿
222139,473,所以我在合法的美国居民纳税人的前提下,所以我在合法的美国居民纳税人的前提下
222140,474,他们说的全都是假的请不见,他们说的全都是假的。我加
222141,475,我加上了一个护身符,我加上了一个护身符
222142,476,教政治庇护,叫政治庇护
222143,477,我郑州的屁股不是解决身份问题是解决任何人美国的行政部门总统可行,叫政治庇护！不是解决身份问题，是解决任何人美国的行政部门总统
222144,478,行政部门国务院不会出卖我国受法律保护,行政部门国务院不会出卖我，我受法律保
222145,479,大呀我想买了汇报今天这就是其中最关键,律保护！今天向大家汇报这是其中最关键
222146,480,另外一个就是由于王岐山孟建柱傅政华孙你就是虎,另外由于王岐山孟建柱傅政华孙立军这疯
222147,481,这疯了,这疯了
222148,482,现在这种手段就吃人了现在要,现在各种手段就吃人了要！就
222149,483,就是我报出了这个马航事件,就我爆出了马航事件！还
222150,484,还有孟建柱的按需杀人事件,还有孟建柱的按需杀人事件
222151,485,江绵恒的幻世事件夹这个梦加入的妈妈换肾时间换干事件,江绵恒的换肾事件！孟建柱的妈妈换肾事件！换肝事件！百
222152,486,这百岁老人我还没说他太太讲起眉的时间还有思念就是帮助别人换乘换,柱的妈妈换肾事件！换肝事件！百岁老人！我还没说他太太蒋琪梅的事件！还有孙
222153,487,干时间,肝事件
222154,488,包括雷洋真正的死因是五雷洋的同学知道了傅政华还有孙立军的秘密,"帮助别人换肾换肝事件！



雷洋真正的死因是雷洋的知道了傅"
222155,489,国际俱乐部的秘密,国际俱乐部的秘密
222156,490,实际就是杀掉的,实际就是杀掉
222157,491,什么时候打飞机的不扯了那是,什么打飞机那不扯嘛！这有关信息
222158,492,最有关信息,这有关信息
222159,493,到最后的验尸的入有一个关键的人物,到最后验尸的时候有一个关键的人
222160,494,他会告诉他真相,他会告诉大家真相
222161,495,林彪的,林彪
222162,496,女儿林豆豆的先生,女儿林豆豆的先生
222163,497,是中国解剖学与大脑,是中国解剖学一大拿
222164,498,他当时没羊在解剖的时候在医院,他当时雷洋在解刨的时候在医院
222165,499,这一堆警察为老骂人家这个这些节快乐生说你妈的你们感到了胡说八道,这一堆警察围着，骂这些解剖医生说：“妈的你敢胡说八道我弄死你们
222166,500,闭嘴啊不要胡说八道,闭嘴啊！别胡说八道
222167,501,就他比较是有钱没说你们不要骂人,后他毕竟是有权威的，他说你们不要骂
222168,502,你们说什么写怎么写不那么那么不行,你们说怎么写怎么写，不能骂！你们吗不
222169,503,最后订别定义为教导,最后定义为搂着脖子勒死的
222170,504,录了我了就累死了,就这样给勒死了
222171,505,有漏把这个给累死了,义为搂着脖子勒死的！你
222172,506,你去想想,你去想想
222173,507,累呀钟家除了十来分钟就让这么给累死了,雷洋从家出来十来分钟，就这样给勒死了
222174,508,他跟他有仇吗,他跟他有仇吗
222175,509,没事的人最后又发财现在搞了一块的高是不能加入了去了,勒死的人最后又发财现在又搞了一块地搞农家乐了
222176,510,哪来那么多钱了谁给的呀,哪来那么多钱啊？谁给的啊？也
222177,511,那个人也很快对别弄错,给的啊？也很快就被弄
222178,512,消灭掉,消灭掉
222179,513,估计不会超过时89大前后,估计不会超过十九大前后
222180,514,所以说这些人,所以说这些人
222181,515,这些黑的案子都被我给出了贝贝出装备说话包括,这些人黑的暗的被戳穿！包括孟建柱和王
222182,516,孟建柱和王岐山两个人,孟建柱和王岐山两个人
222183,517,真正的座位间隔,真正的作为监
222184,518,建筑协主席,监督习主席
222185,519,孙立军是执行者,孙立军是执行者
222186,520,傅振华还不是他们那么恶的人干了很多坏事但跟他不是完全是一伙的,傅政华是他们那么恶的人干了很多坏事还跟他不是完全是一伙
222187,521,孟建柱,孟建柱
222188,522,王岐山孙立如是一定要想办法干掉傅政华,王岐山孟建柱孙立军是一定想办法要干掉傅
222189,523,这是为什么2015年的,这是为什么2015年
222190,524,年初还没咱们家人的说,年初还没抓捕家人的时
222191,525,2014年年底,2014年年底
222192,526,吴征先生给我通话大陆就希望能把傅政华政剧搞到,吴征先生跟我通话当中，就希望能把傅政华证据找
222193,527,干死傅政华,干死傅政华
222194,528,后来有习主席保护她呀,后来有习主席保护他啊
222195,529,是不是夫人还没死,是不是？傅政华没死
222196,530,但是傅政华早晚也别弄死因为老掌握老孟老孙的东西老王子淫太多了也得死,但是傅政华早晚得弄死！因为掌握老孟老孙的东西老王的东西太多了！也得死！大
222197,531,大家看了吗不是跳楼自杀,大家看着吧！不是跳楼自杀
222198,532,就是这么出车祸死要么打飞机死,就是出车祸死！要么打飞机死
222199,533,也有可能喝到,也有可能喝那
222200,534,和那个大白象的那个蜡烛的雪死啊也有可能啊,喝那个大白象拉出来的血死！也有可能啊！但
222201,535,反正这几个得不得好死老天看着呢,反正这几个得不了好死！老天看着呢
222202,536,据说这些人哪,说这些人钠
222203,537,现在疯狂了才尽一切手段,现在疯狂了！采取一切手段
222204,538,那么在这种情况下呢,段！在这种情况下呢
222205,539,我的个人保护除了个人安保之外,我的个人保护除了个人安保之外
222206,540,然后呢我们看到了这个无人机事件,人安保之外，我们看到了无人机事件
222207,541,我们看到了船上的时间,我们看到了船上的事件
222208,542,还有这个很多时间现在各部门都全面接入,还有很多事件！现在各部门全面介入都
222209,543,多少茶,多事件
222210,544,然后,入都
222211,545,这些事件的同时对我是个实际是个保护,这些事件对我实际是个保护！引起高度
222212,546,引起高度关注了在着来搞这事情,引起高度关注了！因为到这儿搞这个事
222213,547,美国人肯定不愿意,美国人肯定不愿意
222214,548,在另外一个角度上,再另外一个角度上
222215,549,为什么说他们逼的,为什么说他们逼的
222216,550,他们到香港去,他们到香港去
222217,551,他抓走了曲国娇,他抓走了曲国娇
222218,552,曲国娇抓走现在我请大家再重复一遍香港的特殊和香港的移民处,曲国娇！香港特首和香港移民处和香港的官员所有香港的律师界，郭
222219,553,和香港的官员是所有香港的律师节,和香港的官员所有香港的律师界
222220,554,因为他说的话你们都当做听不见看不见没问题,今天说这话你们都当作听不见看不见，没问题！郭文贵
222221,555,去国外无所谓,郭文贵无所谓
222222,556,走咋看,走着看
222223,557,这件事情会发生了你们万万千千是谁,这件事情会发生在你们万万千千人身
222224,558,教室已收藏,件事情会发
222225,559,已经被担保的是以所谓串通,文贵今天说这话你们都当作听
222226,560,郭文贵2610诈骗自己310的罪行,郭文贵今天说这话
222227,561,人家给取保了3000000港币,人家给取保
222228,562,安东公司是他的公司那个吃饱了,安宗公司是她的公司。人家给取保
222229,563,你给取保的手续有律师在场,你给取保了手续！有律师在场
222230,564,几天后你用以他在大陆涉嫌,几天后你又以她在大陆涉嫌
222231,565,这个这个这个,抓了。抓了
222232,566,提供虚假文件,提供虚假文件
222233,567,办理身份,办理身份
222234,568,你把剑给抓了,你把人给抓了
222235,569,赚了不到20个小时,抓了不到20个小时
222236,570,你叫绿舍回来然后这孩子就就从深圳打电话说我到深圳了,你叫律师回来。然后这孩子就从深圳打电话说：“我到深圳了
222237,571,我回深圳了,我回深圳了
222238,572,香港基本法的核心香港人的命就是基本法,香港基本法的核心香港人的命就是基本法
222239,573,这个曲调在担保这个宝似的还没有,法！曲国娇在保释没有拿掉的情
222240,574,拿掉的情况下他回到大陆,拿掉的情况下她回到大陆
222241,575,只有是一个,只有一个
222242,576,被压非法压送给放假回去,一个非法押送回去！绑架回
222243,577,第2个起严重侵犯了香港,去！第二个严重侵犯了香港
222244,578,基本法,基本法
222245,579,香港都没有什么地方打了这根本没钱没了,香港就没有什么基本法了！这根本的一条没
222246,580,所以说娶国交这件事情,国娇这件事一定会
222247,581,一定会去把这些人都给取了你知道吗,一定会把这些人都给取了！这个女士很了
222248,582,这个这个女是很了不得的,这个女士很了不得的！而且
222249,583,而且你们这些人渣,而且你们这些人渣
222250,584,竟然愚蠢的子孙立军和孟建柱傅政华的风格玩几张造假一切都造价,竟然愚蠢到这是孙立军孟建柱傅政华王岐山的风格造假一切造
222251,585,一切都是假的,一切都是假的
222252,586,竟然让曲国娇,竟然让曲国娇
222253,587,说回不了香港给你们发个信息,说回不了香港了。给你们发个信息
222254,588,我回不去了,我回不去了
222255,589,这个能不能保护取消了你拿枪顶着人家,去了。能不能把保取消了？拿枪顶着人家
222256,590,猪肉福瑞德牧,人家就是福瑞德牧
222257,591,马建副部长王结束给你找的那个处境的人是有自由的呢,马健副部长王永杰书记，你找的哪个出镜的是有自由的呢
222258,592,那里有自由的是冠军和刘正杰克孙尧你还找了替身,"
唯一有自由的是贯君刘呈杰和孙瑶，你还找了替身！你"
222259,593,你说这个体制这个国家这个政权这个王岐山孟建柱傅政华和,你说这个体制这个国家这个政权这个王岐山孟建柱傅政华和
222260,594,孙立军,孙立军
222261,595,中国这几年就靠你们,中国这几年就靠你们
222262,596,更个管理到这个国家的多大的翻译那没有多少人愿望多少人被你们弄死,你们管理着这个国家得多大的灾难啊？多少人冤枉啊？多少人给你们弄死
222263,597,所有的推有记住啊书斋夜话的两位先生你们讲的时候就讲得很稳我很喜欢,所有的推友记住：书斋夜话这两位先生你们讲的我很喜欢，你们其中有些话
222264,598,你们其中的有些话是对的但是我要跟你建议一条,你们其中有些话是对的。但是我要给你建议一条，你
222265,599,调啊,条
222266,600,你们一定有在你节目说一句话我们要,你们一定在你节目中说一句话，我们要
222267,601,从十九大后往后看十八大道这五年,从十九大后往回看十八大到这五年
222268,602,人道在哪,人道灾难
222269,603,人性在哪,人性灾难
222270,604,法律在哪,法律灾难
222271,605,超出了所有你的想象的,超出了所有你能想象的
222272,606,文化大革命,文化大革命
222273,607,它的形式上不一样,在形式上不一样
222274,608,本质上的残酷,本质上的残酷
222275,609,不知有过之,酷只有过之
222276,610,没有不起,没有不及
222277,611,大岛看,好好看
