id,index,content,proofed
24128,1,Mate8发啊沙发沙发沙发沙发,
24129,2,我在上班上恭喜恭喜恭喜啊恭喜恭喜喜恭喜呀,
24130,3,国兴卫生的三儿,
24131,4,小百合第4啊文林第5啊,
24132,5,清楚不清楚啊,
24133,6,清楚就有声音可以吗,
24134,7,Evga msr,
24135,8,看清楚吗能看清楚吗,
24136,9,台湾微博野良猫,
24137,10,生态,
24138,11,和小宝和小宝,
24139,12,Lava lamp,
24140,13,现在怎么样还亮吗,
24141,14,现在好了现在好谢谢谢谢谢,
24142,15,洗澡很帅是的啊,
24143,16,西装很帅啊,
24144,17,你很清楚啊现在的是什么这刚刚的工程师工程师,
24145,18,这个,
24146,19,给我打电话说过宁波加上你家老实地下室不就是关键是看看,
24147,20,在勇的通知有没能不能收到,战友们的通知，你能不能收到。因
24148,21,因为偷懒才发现这个黑客呀,因为头两天发现黑客改
24149,22,改了livestream的这个通知功能感知功能还挺能啊,改了lifestream的通知功能，还挺能啊，黑客还挺能。再
24150,23,黑客还挺能,黑客还挺能
24151,24,这个就是说他们进行信号干扰,一个就是说他们进行了信号干
24152,25,需要干扰就说把我们这个,号干扰。就是说把我们的直
24153,26,直播呀,直播
24154,27,这个链接了转到其他地方去然后呢这个造成了我们这个直播上的,直播链接转到其他地方去，造成我们直播时的画面突然变化
24155,28,这个画面这个突然变化,直播时的画面突然变化
24156,29,小百合爱你爱你小百合,"号文贵报平安直播。


大家"
24157,30,小贝和你私信一下给我你的那个What's up,才感觉到，哎呦，这就是新闻了。凡是
24158,31,我的号WhatsApp号码,能老看电视，还有
24159,32,我会把你加到我们那个群里啊,"文贵报平安直播。


大家都知道"
24160,33,现在正式开始了,现在正式开始
24161,34,尊敬的战友的好43月4号文贵报平安直播啊,尊敬的战友们好，这是3月4号文贵报平
24162,35,文贵报平安直播这个,文贵报平安直播
24163,36,今天主要是试试这个,敬的战友们好，这是
24164,37,刚刚吧,报平安
24165,38,刚刚的是试一下我们这个直播,看电视，还有新闻，发生以后
24166,39,大家都知道啊这两天真的很热闹,都知道，这两天真的很热闹。大家
24167,40,大家不能老看电视,大家不能老看电视
24168,41,还有新闻,还有新闻
24169,42,阿发生以后大家感觉到哎呀这才是新闻了,发生以后，大家才感觉到，哎呦，这就是新闻了
24170,43,凡是电视上报纸上已经不多的他已经是不是新闻了就就问了,凡是电视上，报纸上的，他已经不是新闻了，叫旧闻了。基本上
24171,44,基本上全世界萝莉的这样,基本上全世界的逻辑都是这样
24172,45,那共产党的那就是什么了就是骗人了就是骗人了,那共产党就是什么呢，就是骗人了，就是骗人了
24173,46,那么现在两会呀,"人了。


现在两会"
24174,47,在北京的这个烧开,在北京的召开
24175,48,听说还真是挺热的,听说还真是挺热
24176,49,昨天晚上就一晚上把平凡的事,昨天晚上一晚上频繁地和
24177,50,各方面的战友啊都很热情感谢了很多战友给我发了一个信息,各方面的战友们（联系），战友们都很热情，很多战友发来了信息
24178,51,谢你们的理解,息，请你们理解
24179,52,一个一个发信息我不能气死了用,一个你们发来的信息我不能即时
24180,53,因为用了以后的我会担心对你的安全有影响,因为用了以后呢我会担心对你们安全有影响
24181,54,另外一个那你的信息我也听不了解我才能去点才去用,另外一个呢，你们的信息我也得去了解，我才能用；还有一个
24182,55,还有一个就是说,还有一个就是说
24183,56,有些信息可以用有些信息不能以后把这事为原则,有些信息可以用，有些信息不能用。这是个原则
24184,57,请战友们能够理解,请战友们能够理解
24185,58,但是所有的在北京给我发信息都在人们我求求你们了务必注意安全,但是所有的在北京给我发信息的战友们，我求求你们了务必注意安全
24186,59,咱不发哪个信息,咱不发哪个信息
24187,60,发个信息,发信息
24188,61,照样实现喜马拉雅,照样实现喜马拉雅
24189,62,不是说我搞了一体的把天天那个发,不是说我搞媒体的，天天在那
24190,63,哪个新闻就好上和我都有个新闻这不是文贵爆料革命的目的,新闻就往上上，恨不得又个新闻。这不是文贵爆料革命的目的
24191,64,我们也不得不依靠这个,我们也不依靠这个。所
24192,65,飞艇占用了一定的理解,以请战友们一定理解
24193,66,你们的安全是第1位考虑,你们的安全是第一位考虑
24194,67,像这个天天晚上那个战友给我发信息,像昨天晚上有战友给我发的信息，现场
24195,68,这个,战友给
24196,69,小的情况我不可能跟暴因为你太伟大了,现场的情况，我不可能爆，因为你太伟大了
24197,70,你虽然是,你虽然是
24198,71,露了当时那些人的说话,录了当时那些人的说话
24199,72,我报出去以后你就会暴露出来,我爆出去以后，你就会暴露出来
24200,73,我抱的不知道我在我报的是我们伟大的战友能不行的,我爆的不是盗国贼，我爆的是我们伟大的战友。那不行的
24201,74,虽然你现在也不也是这个,虽然你现在也是人
24202,75,人大代表,人大代表
24203,76,你以为你什么都知道了不是过来我比你想象的鞋子啊,你以为你什么都知道了，不是的。共产党比你想象
24204,77,所以说这个站有了这些天来啊这个整个,所以说战友们，这些天来，整个共产党
24205,78,整个这个共产党的一部拿,整个共产党内部，整个
24206,79,CMCC cartridges,间，听说
24207,80,谢谢啊,些天
24208,81,找整个国内亚两会期间听说,整个国内两会期间，听说
24209,82,啊听说呀,听说啊
24210,83,亲属不是爆料,说啊，不是爆料
24211,84,我觉得是非常重大的利好消息就是说,我觉得是非常重大的利好消息就是说
24212,85,很多人意识到了这个国家风雨飘摇,很多人意识到了这个国家风雨飘摇
24213,86,正在驶向一个可能不归的路上,正在驶向一条可能不归的路上
24214,87,这不是我们所看见的,这不是我们想要看
24215,88,我们要放要跟郑成功,我们要爆料革命成功
24216,89,不是想让不是想让中国的完蛋,不是想让中国完蛋，或让中
24217,90,和中国走向在哪里,中国走向灾难，避
24218,91,恰恰相反,恰恰相反
24219,92,我们要拯救中国,我们要拯救中国
24220,93,避免中国走向在哪,避免中国走向灾难
24221,94,避免中国走向一个不归的路,避免中国走向一条不归的路
24222,95,就连非洲了的朋友都不能理解,就连非洲的朋友都不能理解
24223,96,说中国人饭还没吃好,说中国人饭还没吃好
24224,97,穷山恶水,穷山恶水
24225,98,跑路非洲来帮老大,跑到我们非洲来当老
24226,99,西格的小丽留着谢谢,人家都不能理解，人家
24227,100,所以说人家都不能理解人家到了中国转了一圈去年这个所谓中非论坛,所以说，人家都不能理解，人家到了中国转了一圈，去年所谓中非论坛
24228,101,人家去中国去看一下,人家去中国看去，人家
24229,102,人家无法想象,人家无法想象
24230,103,说中国穷了这个样子啊,说：中国穷成这个样子
24231,104,还在这会抓老大,还在这块儿装老
24232,105,这是我爆料的那真正的目的,这是我们爆料革命真正的目的
24233,106,绝不到中国人中国人的未来,决不能让中国人，中国人的未来
24234,107,那几个家族,几个家族
24235,108,说了算,说的算
24236,109,绝不能让,决不能让
24237,110,中国14亿人民的未来,中国14亿人的未来
24238,111,让现在北京用铁丝网栏起来,让现在的北京用铁丝网拦起来
24239,112,绑架一提所谓的人大代表政协委员全是花钱买来的绝大多数,绑架一批所谓的人大代表，政协委员，全是花钱买来的，绝大多数
24240,113,也不是你想让这些行被绑架的情况下,"也不是人民选的。


让这些人在被绑架的情况下"
24241,114,到古兰达几个家族拿枪顶着那解放军卡卡卡的价格,党几个家族拿枪顶著，那解放军咔…咔…咔…的进到
24242,115,为何,威吓
24243,116,那就明白了危险吗,那不明摆著威胁嘛
24244,117,还有超高压,镜头朝高
24245,118,然后想着那个人民解放军好像十几米高的样子,然后显得那人民解放军好像十几米高的样子
24246,119,玩具种地的游戏,玩这种低级的游戏
24247,120,西得乐买这里就玩上最顶至极子了最后终结局发布人民币玩了,戏。希特勒已经把这个玩到最顶级、极致了，最后是什么结局啊？还
24248,121,你多大的人民解放军多大的军队你都是来自于人民他都是人民生的,你多大的人民解放军，多大的军队，你都是来自于人民，他都是人民生的
24249,122,他不是点中南海门口的什么是生的,他不是中南海门口的什么狮子生的
24250,123,他也不是你那个关岛是什么什么在拉屎拉出来的都是人生的,他也不是你那个共产党拉屎拉出来的，都是人民生的。你威胁什么
24251,124,你为什么有意思啊,你威胁什么啊威胁
24252,125,他最终还是属于人民的利安平安平安平来了,"他最终还是属于人民的。


所以说战友们"
24253,126,所以说战友们,所以说战友们
24254,127,这个整个两会期间现在探讨的核心的问题,这个整个两会期间现在探讨的，核心的问题
24255,128,就是如何现在来使中国,就是如何现在来使中国
24256,129,不成为世界上仇恨的国家,不成为世界上仇恨的国家
24257,130,如何使中国现在,如何使中国现在
24258,131,脆弱的虚假的经济,脆弱的、虚假的经济
24259,132,能够维持下去,能够维持下去
24260,133,如何能叫中国这种傻叉式的想当世界老大的,如何能将中国这种傻叉式的，想当世界老大的
24261,134,这种狂想,这种狂想
24262,135,这种,这种
24263,136,不是梦想是狂想,不是梦想是狂想
24264,137,这这个是狂想不是梦想会把中国人民送下赞成,这真的是狂想不是梦想，把中国人民送上战车；如
24265,138,如何让中国现在老百姓,如何让中国现在的老百姓
24266,139,真正的能避免这几个,真正的避免这几个
24267,140,大了34人来的,染，导致的这
24268,141,私人展览照组中国人现在这种污染水污染水污染,自然灾难，造成中国人这个水污染、土污染，空气污染，导致的这
24269,142,空气污染,空气污染
24270,143,倒置的人类这个健康大财了,导致的这个人类健康大灾
24271,144,如何避免整个中国的道德在哪,如何避免整个中国的道德灾难
24272,145,整个中国现在就人与人之间已经不会不说人话了,整个中国现在人与人之间已经不说人话了，就比
24273,146,旧PC,就比
24274,147,谁坏比赛奖啊,谁坏、比谁假，太
24275,148,这太可怕了,太可怕了，人
24276,149,平均律,已经不
24277,150,风满楼风行,整个中国现
24278,151,山雨欲来风满楼,已经不说人话了
24279,152,另外一个如何避免中国这种,另外一个就是如何避免中国这种
24280,153,不切合实际了一小部分没有文化,不切合实际的，一小部分没有文化
24281,154,没有任何政治逻辑,没有任何政治逻辑
24282,155,这种,这种
24283,156,自私打,自私，鳄
24284,157,鳄鱼与膨胀,鳄欲膨胀
24285,158,厄大的那个与膨胀,鳄的鳄，鳄欲膨胀，导
24286,159,导致这种药在世界上称霸的这种疯狂,导致这种要在世界上称霸的这种疯狂
24287,160,我觉得这个两次有人敢旗杆竖还是很了不起的,我觉得这次两会有人敢提敢说还是了不起的
24288,161,大家意思了,大家意识
24289,162,就王岐山孟建柱,就王岐山、孟建柱
24290,163,孙丽娟这帮人,孙立军这帮人
24291,164,傅政华,傅政华
24292,165,是中国官场的翻译了,是中国官场的灾
24293,166,是中国人的傻子,是中国人的杀
24294,167,这是非常恐怖的,这是非常恐怖的
24295,168,就这几小时人去吧客人四五个人就现在天天要喝了,就这一小撮人，七八个人，四五个人，就现在天天吆喝
24296,169,中国要建立核心要是家要领导世界,中国要建立核心，要领导世界。这边要
24297,170,然后让中国人药然后这边有领导师检查没有捐款这么要扎紧腰带,"然后这边喊著美国人搬起石头又砸自己脚了。不要玩火！


**10-"
24298,171,勒紧腰带过苦日子,腰带过苦日子
24299,172,然后这个美国人班时候又砸自己脚了,喊著美国人搬起石头又砸自己脚了
24300,173,不要玩火这边跟美国人可投留克跑了川普通的办公室情,"不要玩火！


**10-15 Viola 文欣欣**

这边跟美国人磕头，刘鹤跑到川普"
24301,174,两手发抖啊女儿都不成句,两手发抖啊！语都不成句
24302,175,把这个辅助用不是都变成了500万吨成了世界笑话,把这个5吨50吨变成了500万吨，成了世界笑话。这
24303,176,日本给美国团结构改革中国那边加大国有化,这边跟美国谈结构改革，中国那边加大国有化
24304,177,这边是按照中国要开放式上改革开放这边就是要搞明确的说,这边是谈到中国要开放市场，改革开放；这边又明确的说中
24305,178,中国经济靠火影,中国经济靠国营
24306,179,这都什么变革人太阳,这都是什么变态人格啊
24307,180,这边的前10月中国讲法制依法治国然后坚决不学西方的,这边的对全世界是：中国讲法治，依法治国，然后坚决不学西方的
24308,181,司法独立那头,司法独立那一套
24309,182,坚决凤凰九天来了这个决不高兴是吧,坚决党领导司法 ！这是什么样的变态的人格
24310,183,领导思考,领导司法
24311,184,这是什么样的变革电变态的人格了啊,"这是什么样的变态的人格啊！


（与战"
24312,185,绿色小时1欧元不是反差几斤呀,互动：10亿欧元，不是法治基金
24313,186,加油吧,战友
24314,187,你看看我我发过我的说在过去两年来,你看看我发郭文的时候，在过去两年来，都
24315,188,都是什么情况,都是什么情况
24316,189,文贵是钓鱼高手,文贵是钓鱼高手
24317,190,我可以告诉你们,我可以告诉你们
24318,191,那个11欧元是有一帮人,那个10亿欧元是有一帮人
24319,192,给我们的重要的战友一直在喂料,给我们的重要的战友一直在喂料
24320,193,一直在喂料,一直在喂料
24321,194,喂料叫什么了我要揭发我揭发这个谁谁腐败只是一,喂料叫什么呢？我要揭发，我揭发那个谁谁谁腐败，这是一
24322,195,第2个那就是说我要这个一个我有钱我大姐但是有大事啊,第二个呢？就是说我有钱，我要大捐！但是....又但是啊
24323,196,凡是说,凡是来
24324,197,来拿着这么大的支票还有所谓的盗国贼海外存款,来拿著这种大额支票，还有所谓的盗国贼的海外存款
24325,198,10 100 1欧元证据了,欧元证据的。
24326,199,目前来看我们说的我真的是真的是万万家我们从来不用了,目前来看，我们收到的真的是万万件，我们从来不用
24327,200,基本都是,基本都是
24328,201,70雷在海外的片子,贼在海外的骗子
24329,202,想把香路德先生34小时,想把像路德先生、Sara、细思
24330,203,这样卡的西藏人了,这样的人呢，让你
24331,204,叫你报假新闻吧你自己爆掉,假新闻，把你自己爆掉。还有
24332,205,还有ccp海外的什么力量,还有CCP海外的沉默力量
24333,206,就是这一章第二章是看马是拿的这个我有这个盗国贼海外的存款,"就是这一招！


第二招是干嘛啊？就是拿著这个，我有盗国贼海外的存款，我让"
24334,207,我要发微信给我钱,我让法治基金给我钱
24335,208,欠钱的,钱呢！我
24336,209,我昨天退出去认识其中一张,我昨天推出去的是我们其中的一张
24337,210,是我们其中一个非常棒的战友发给我的,是我们其中一个非常棒的战友发给我的
24338,211,说有人要拿这个来说跟法治基金接发到过贼就弄钱,说有人要拿这个来给法治基金来揭发盗国贼，要弄钱
24339,212,我就把这一章结了出来我就发出去了,我就把这一张截了出来我就发出去了
24340,213,我发出去了我就知道会收到三个效果,我发出去了，我就知道会收到三个效果
24341,214,你一个啊,第一个，那
24342,215,第1个那就是像这些企业资料,一个，那就是像这些欺民贼
24343,216,20元,元
24344,217,那么兴奋,们兴奋
24345,218,在几分钟以后会还真的假的发现这不是真的,但几分钟以后就发现：真的假的？发现这不是真的
24346,219,阿老师说这次光顾你的体检结果,的！然后就说：这是郭文贵在欺骗
24347,220,很多人不一定得心脏病去医院了好像为什么什么话呀,好多人估计已经得心脏病去医院了，像韦石、西诺呀，什么
24348,221,什么李红会这个畜生大峡谷2这个主人那张毛毯上高冰尘这个畜生不息吧,什么李洪宽这个畜生，夏业良这个畜生啊，肛毛党啊，高冰尘那个畜生，估计就抱著他
24349,222,暴打老婆内裤就直接就就就站愿意了,抱著他老婆内裤直接上医院去了
24350,223,就得心脏病了不带这话也不对,就得心脏病了！估计。但是后来
24351,224,怎么回事是1欧元天价值14元美元,怎么回事？10亿欧元还核算半天，价值14亿
24352,225,然后的舅舅子过片然后,然后呢？就说：郭骗子！就
24353,226,失业了被他们被砍了之后的那种丧心病狂,是他们被耍弄后的那种丧心病狂
24354,227,油光满面我犹太多了有太多了,以说，战友们，结果是我发完以后很多
24355,228,所以说站有卖结果是我发了以后很多人,所以说，战友们，结果是我发完以后很多人
24356,229,权重是吧,全中招
24357,230,戴尔跟着我要让那些所谓的来到法斯基金想来骗钱的,的一点：我要让那些所谓的来到法治基金想来骗钱的
24358,231,小孩片的记录,想来骗钱的，记住
24359,232,郭文贵是法自己的护法,郭文贵是法治基金第
24360,233,你的过我这么晚了那你就牛了切别说你给我办的那个关掉Facebook,你能过我这关了，那你就牛了啊！先别说你要过班农这一关；还有
24361,234,还有那么多美国的,还有那么多美国的
24362,235,专业大家奥会计师我们的我们的合法的机场这都是世界最牛的,专业大家，会计师啊······我们的这个法律基金的团队都是世界
24363,236,结果你到我那玩,结果，你到我这
24364,237,你想一想,你想想
24365,238,人类上,人类上
24366,239,怎么可能出现这帮鱼唇的只有共产党培养的这种诈骗犯,怎么可能出现这帮愚蠢的，只有共产党培养的这种诈骗犯
24367,240,11欧元,欧元
24368,241,还是本票,还是本票
24369,242,A2b,A t
24370,243,啊,A
24371,244,听说过吗,听说过吗
24372,245,现代你到银行去了我们积极每每天每日都有大量,现在你到银行去，我们基金每月每日都有大量
24373,246,样的转化投资,量的转款，投资
24374,247,你会1000万美元是事,你汇1000万美元试试
24375,248,你会在外面,你汇1000万美
24376,249,亏1000000美元事实,汇1000万美元试试
24377,250,都要把你弄清楚你钱是哪来的,都要把你弄清楚你钱是哪来的
24378,251,为啥会给对方这个世界了现在大额汇款到了几乎不可能,"为啥汇给对方？


**15-最后 文竺**
这个世界上现在大额汇"
24379,252,11欧元还香港汇丰银行你爸会不会还能不能猜了他敢不敢,欧元，还香港汇丰银行，你把汇丰银行的楼给他拆了，看他敢不
24380,253,还有一个开始为年票,还有一个，还什么年票
24381,254,哪有什有缘开本票了全电子违法你听说过什么问题吗,哪有10亿欧元开本票的呀！你听说过这问题吗，不可能啊。所以说咱
24382,255,所以说,所以说
24383,256,咱又打片,咱又打骗
24384,257,还打气明贼,还打欺民贼
24385,258,还让孩子带他的小心脏然后大家还幻乐一场,还要虐待他的小心脏啊，然后大家还欢乐一场
24386,259,蓝海的调出了这些畜生的无知,还钓出了这些畜生们的无知
24387,260,太开心了,太开心了
24388,261,这个人你说每次让我掉啊,这帮人每次让我钓吧，别
24389,262,你让我能,每次让我
24390,263,别这个调调怎么人一定要救伤口一定要就上课,别钓那么准。结果一钓就上钩，一钓就上钩
24391,264,估计那个加拿大的那个叫什么的孙子那个高冰尘的一个旧机器当乐,估计加拿大那孙子高冰尘第一个就得心脏病了，哈。太搞
24392,265,太搞笑了,太搞笑了
24393,266,还有那个现在读出没饭吃,还有那个现在到处没饭吃，去
24394,267,到这个酒集中心那个叫李洪宽我5点看了信息他们也不懂什么叫本票我不累的根本直接,到处没饭吃，去那救济中心的那个叫李红宽，我估计看了这信息，他们也不懂什么叫本票，我估计这哥们儿
24395,268,蹲厕所也不哭就是死也得有,蹲厕所里暴哭去了，吃屎去了就
24396,269,谁说,屎去
24397,270,这个我也告诉所有了想试图在法治基金,这个我也告诉所有的想试图在法治基金
24398,271,来片晚上吃,来骗碗饭吃
24399,272,你就你就别做这么吗,你就别做这梦了。法
24400,273,法制进行时所有的占用分,法治基金是所有的战友们
24401,274,偷偷钱拿进去的,投钱拿进去的
24402,275,是自己的理想,是自己的理想
24403,276,是自己的希望是全中国人走向法治,是自己的希望，是全中国人走向法治
24404,277,信仰自由的平台,信仰自由的平台
24405,278,是大家的未来,是大家的未来
24406,279,谁懂你们一毛钱,谁动里面一毛钱
24407,280,花一个人生活,花于个人生活
24408,281,画一个人享受,花于个人享受
24409,282,那就天诛地灭,那就天诛地灭
24410,283,谁有骗了法子基金的钱,谁要骗了法治基金的钱
24411,284,B岛是我们的敌人,当是我们的敌人
24412,285,绝对是哪这个是你万里之外我们有一里之外也绝不放过你,绝对是，那真的是，你万里之外，亿里之外，也绝不放过你。我们
24413,286,我没有保护法之机器真的想我们超过我们生命,我们要保护法治基金真的像超过我们的生命
24414,287,所以说,所以说
24415,288,在这个这个前天有一个什么那个孙子出来的海风什么说各位先生收到,真的像超过我们的生命。所以说前天有一个孙子出来说，郭文贵先生，释大
24416,289,大成被抓了你就给一下,大成被抓了，你是不是救济
24417,290,是大乘法是他跟我多溴联系,释大成跟我多次有联系
24418,291,多卖点西,多次有联系
24419,292,你呢你代表人家是大车那就给大哥别圈10000美元,联系。你代表人家释大成，那你给人家捐，别
24420,293,你圈,你捐
24421,294,10000人民币1000件,人民币，捐捐
24422,295,孙子你有没有什么前不捐,孙子你一分钱不捐，你出
24423,296,你出来叫我们发的机怎么说事情算什么毛啊对不对呀不要脸的东西,你出来叫我们法治基金做什么事情，你说你算什么毛啊，对不对呀，不要脸的
24424,297,这一帮人一个房子吗怎么看了心服口服羡慕妒嫉恨,在一帮人，法治基金在那儿看著，心服口服，羡慕嫉妒恨
24425,298,然后呢又想办法去骗这钱,恨，然后又想办法骗点
24426,299,有这个王八蛋才好外,说这帮王八蛋，太坏
24427,300,在我们的全是人力上被加勒比海外70贼,再坏的。历史上没有，我相信未来也
24428,301,一共产党塞坏了,比共产党再坏的
24429,302,历史上没有我相信未来也没有,历史上没有，我相信未来也没有
24430,303,就不要脸没原子要没人性,就不要脸，没原则，没人性
24431,304,瞪眼说瞎话犯都要不起,瞪眼说瞎话，饭都要不起
24432,305,吃饭吃不起,吃饭吃不起
24433,306,花钱没有,花钱没有
24434,307,先天一放高仿哪谈的话胡说八道,天一帮肛毛党在那块儿胡说八道
24435,308,一说就全人类最高尚的话你说这个是多么的悲哀,一说就是全人类最高尚的话，你说这是多么的悲
24436,309,想想这些请假一两张出生天天,想想这些欺民贼，你像夏业良这帮畜生
24437,310,到哪去你应该穿的那两种西装到了不来来了啊,到哪儿去，一年穿著那两套西装，到处
24438,311,倒数我去和有倒数几片前海外我看了日本是吗,到处去忽悠，到处去骗钱。我看日本相林还发了个
24439,312,像你还发了个使用我们的生日在帮助国内私人企业家你两个,相林还发了个什么，利用我们的声势，来帮助国内私人企业家。你
24440,313,都开不起来吧论国内私人企业家,都开不起，还帮助人国内的私人企业家
24441,314,你看加拿大的包子,你看加拿大那帮欺
24442,315,百度一个饭大肚子大了一桌的菜和们的百般的吃了,帮欺民贼，逮著一桌子菜恨不得把盘子都给他吃了。天
