id,index,content,proofed
355681,330,你在香港成立一个,你在香港成立一个
355682,331,猎豹小组,灭爆小组
355683,332,马云全力支持,马云全力支持
355684,333,梧州,吴征
355685,334,大连老婆都奉献出来了,连老婆都奉献出来了
355686,335,你们两年前一年多前马蕊强奸案那咋不出来说呀,你们两年前一年多前马蕊强奸案呐？咋不出来说呀
355687,336,一个字你都不提过强奸啊我说你安排的你这孙子,一个字儿你都不提强奸案。吴征你安排的。你这孙子
355688,337,你等着我会让你让你老婆让你女儿你全家人为此付出代价,你等著我会让你和你老婆、让你女儿、让你全家人为此付出代价
355689,338,你以为在美国有不知道你说你说就拉拉老早要是就拉倒了吗,你以为在美国你吴征你设计设计就拉倒了，找找钥匙就拉倒了吗
355690,339,你在美国跟三位老人衣服的钱的拉倒了吗,你在美国跟Sam 搞的事你以为那钱都拉倒了
355691,340,美国启动爱国反不反就是你们这帮人,美国启动爱国法案，RICO法案，就是你们这帮人
355692,341,到了真的是穷途末路过街的老鼠人人喊打的时候,真的到了是穷途末路.，过街的老鼠人人喊打的时候
355693,342,包括与你们,包括与你们
355694,343,狼狈为奸,狼狈为奸
355695,344,这媒体纳媒体,这媒体那媒体
355696,345,什么不可信为什养的一帮狗气别累,什么博讯韦石养的一帮狗欺民贼
355697,346,在美国这个土地上现在已经掀起了全面的反侵略,在美国这个土地上现在已经掀起了全面的，反侵略
355698,347,反共,反共
355699,348,反威胁,反威胁
355700,349,你误你知道吗你是不是在美国干这微信美国的是中国银行就是下一个,你吴征你知道马云是不是在美国干著威胁美国的事，中国银行就是下一
355701,350,中国借来的几个大的老板就是下一个房间,中国接下来的几个大的老板，就是下一个王
355702,351,谢不见物神仙下打钱,信？阳谷莘县县搭县
355703,352,大埔星洲的他,不行走著看
355704,353,下次感用啊,想想
355705,354,好好想想10个小时,好好想想10个小时
355706,355,锥的面积31000,只要你们军舰
355707,356,接下来再同时看看南海不吹牛吧只要你们渐渐感到这来我们就给你了,接下来再同时看看南海，不吹牛吗，只要你们军舰敢到这来，我们就给你灭
355708,357,啊只要美军军舰靠近台湾那就是开战,灭了，只要美军军舰靠近台湾，那就是开战
355709,358,台湾知识你姥姥那边,台湾，那就是开战收
355710,359,你行吗,你行吗
355711,360,13粒伟哥你都坚持不下来,3粒伟哥你都坚持不下来
355712,361,你就是吹,你就是吹
355713,362,The One给你老婆大的问题是有礼貌了你敢说吗下回来玩人民去,老婆给你戴了几十年绿帽子，你敢说吗？吓唬台湾人民去
355714,363,你咋不说不了美国军舰去了航空母舰去了所以说中共,你咋不收复了？美国军舰去了，航空母舰去了。 所以说中国
355715,364,15 11口炮党片子的黑社会流氓,口炮党，骗子党，黑社会，流氓
355716,365,对了美国人你不出去了吧你外交部不满了吧,对著美国人你不吹了吧，你外交部不喊了吧
355717,366,吃饭后果自负,什么后果自负
355718,367,以牙还牙,以牙还牙
355719,368,不要作死不要搬石头砸自己的脚,不要作死，不要搬石头砸自己的脚
355720,369,中国人不惹事不怕事,中国人不惹事不怕事
355721,370,你是微软是不是老百姓的你呀,"你是没惹事可你惹老百姓了你！


外"
355722,371,为了问你们这帮孙子早晚一天你祖宗八分会的作者惩罚的你们天天,外交部你们这帮孙子，早晚一天你祖宗八辈会受到惩罚的。你们天天
355723,372,你没有老婆孩子吗天天威胁老百姓,你没有老婆孩子吗？天天威胁老百姓
355724,373,中国的汉奸根本不用演就开玩笑不就行了这就是最大的海鲜,中国的汉奸根本不用演，就看外交部就行了，这就是最大的汉
355725,374,你看了都没小人得志人类让从没见过一个,你看看那副小人得志！人类让从未见过一
355726,375,一个现实生活中,一个现实生活中
355727,376,小人得志的中国外交部,小人得志的中国外交部
355728,377,狐假虎威,狐假虎威
355729,378,日咯则强遇强则贵这就你卖掉,弱则强，遇强则跪！这就是你外交
355730,379,不要脸啊,不要脸啊
355731,380,但是,但是
355732,381,钱是没有煮的,钱是没有祖国的
355733,382,钱是没有忠诚的钱是可以被利用但不被欺骗这就叫苦,钱是没有忠诚的，钱是可以被利用但不被欺骗，这就叫股
355734,383,不是这计较钱,股市，这就叫钱
355735,384,钱也没有爱情,钱也没有爱情
355736,385,前很现实谁强跟谁走谁真的是后天的,钱很现实，谁强跟谁走，谁真给谁走
355737,386,本人不会也赔了20多我们的基金但是我很高兴,本人郭文贵也赔了20多亿，我们的基金，但是我很高兴
355738,387,我如果不会我已经,我如果郭文贵我以
355739,388,那你问我毕赣,你万，我必干
355740,389,问一答你一会要干,文贵我以一能杀
355741,390,为你感觉6.1伟哥,文贵我以一能
355742,391,真的一切都是刚刚开始,真的一切都是刚刚开始
355743,392,卸下来你们看到美国欧洲是什么样的法律行动,接下来你会看到美国欧洲什么样的法律行动，什么
355744,393,什么样的军事情都正在行动,什么样的军事行动，政治行
355745,394,为中国人民讨回公道,为中国人民讨回公道
355746,395,我给所有的美国朋友说你们在拯救中国人民,我给所有的美国朋友说，你们在拯救中国人民
355747,396,昨天我告诉他们说不是穿不重要听美国政府的利益,昨天我告诉他们说，不是川普总统替美国挣回的利益
355748,397,四川普总统,是川普总统
355749,398,第14季中国人民出了口气,替14亿中国人民出了口气
355750,399,川普总统这一回,川普总统这一回
355751,400,打击了中共的嚣张气焰,打击了中共的嚣张气燄
355752,401,度过了他政治上的结石,躲过了他政治上的劫
355753,402,三乐也在美国,扇了在美国
355754,403,阿胖子个胖美眉被公共来给王的人,了在美国叛美贼，被中共蓝金黄的
355755,404,川普总统在某种意义上,川普总统在某种意义上
355756,405,是拯救了14亿中国人民,是拯救了14亿中国人民
355757,406,同时给中美人你带来了一个美好的未来,同时给中美人人民带来了一个美好的未来
355758,407,党内的99个党员都感谢双不同,党内的99%的党员都会感谢川普总
355759,408,我相信中国人民,我相信中国人民
355760,409,为什么要一把孩子送到美国来香叶美国爱美国,为什么愿意把孩子送到美国来，相信美国，爱美国
355761,410,尊重美国的法律的交易系统,尊重美国的法律的教育系统
355762,411,这是为什么中国老百姓内心都在问,这是为什么中国老百姓内心都在问
355763,412,为什么你们当官让我们爱国爱党你们把儿女都送到美国不收取,为什么你们当官的让我们爱国爱党，你们把儿女都送到美国欧洲去
355764,413,中国人民是爱美国的川普总统昨天这个行动,中国人民是爱美国的。川普总统昨天那个行动
355765,414,中国人民,中国人民
355766,415,不是中国人民为中国人的问题,不是打击中国人民，不是以中国人
355767,416,大家一定记住不要被共产党几个盗国贼家族给绑架了给利用了包括我们告诉美国吗,"大家一定记住不要被共产党几个盗国贼家族给绑架了，给利用了。


包括我会告诉我美"
355768,417,你问这个做法,你们这个做法
355769,418,吃了保护中国人民有一个长远的健康的未来公平的未来,在保护中国人民有一个长远的健康的未来，公平的未来
355770,419,法治的未来,法治的未来
355771,420,一打击的是那些,你打击的是那些
355772,421,盗国贼,盗国贼
355773,422,他们是中国人民的威胁美国人的威胁中美人民的共同威胁,他们是中国人民的威胁，美国人民的威胁，中美人民的共同威胁
355774,423,和世界和平的威胁,和世界和平的威胁
355775,424,这是事实,这是事实
355776,425,共产党不要在的报纸发环球而你奶奶你环球的叫什么头什么的啊,共产党不要在《环球时报》上说我R你奶奶，你那环球的叫什么
355777,426,说什么中国人民人间美国打击的是你国民党反对的川普中的汉字是叫了社会,说什么中国人民······人家美国打击的是你共产党，川普总统恨的是社会主义
355778,427,会主义,会主义
355779,428,共产党体制共产体制,共产党体制，共产体制
355780,429,你别老把我们十字给人民少进去,你别老把我们14亿人民捎进去
355781,430,我们在海外的华人多少人,我们在海外的华人多少人
355782,431,在辛辛苦苦每天工作16个小时,在辛辛苦苦，每天工作16个小时
355783,432,11个小时,11个小时
355784,433,开Uber,开Uber
355785,434,或者多么苦的日子,过著多么苦的日子
355786,435,你们到过贼的任何一个人的灵种,你们盗国贼的任何一个人的零头，能
355787,436,有吧海外的7000万华人,把海外的7000万华人
355788,437,能让他们故障识别好的日子,能让他们过上10倍好的日子
355789,438,你们养了这些是真子女,你们养了那些私生子女
355790,439,在海外存的大量的钱大叫判博,在海外存的大量的钱，那叫叛
355791,440,让我们的同胞,让我们的同胞
355792,441,被你们绑架利用的中国人,被你们绑架利用的中国人
355793,442,或者是猪狗不如的日子,，过著猪狗不如的日子
355794,443,你们一虐待人民,你们以虐待人民
355795,444,欺骗人民道具人民的财富为快乐为目的,欺骗人民，盗取人民的财富为快乐，为目的
355796,445,你们现在动不动别人打你们的时候,你们现在动不动别人打你们的时候
355797,446,骂你们的时候你说爱打中国人呢,骂你们的时候，你说是打中国人呢
355798,447,你们突中国人骂中国人说中国人傻叉中国人吃草中国人没有开智,你们偷中国人骂中国人的时候说中国人傻叉，中国人可以吃草，中国人没
355799,448,中国人鱼门中国的杀人没有胸围中国的诗人叶家都是一帮骗子,中国人愚笨，中国的商人没有胸怀，中国的私人企业家都是一帮
355800,449,你姥姥也没有中国私人企业家你哪有过去的改革开放30年,你姥姥的！没有中国私人企业家你哪有过去的改革开放30年
355801,450,70%的办事的你说是我们除了4000家给你们的结果村鞋,70%到80%的税是我们私人企业家给你们的。结果
355802,451,叶家贷款待也得被你们刁难,业家贷款也得被你们刁难
355803,452,春天被你们交纳市场为什么交大,存钱被你们刁难，市场被你们刁
355804,453,孩子上学也得被敲诈,孩子上学也得被敲诈
355805,454,私人企业家严格讲无非是有了钱的都在很没了钱了奴才之分,私人企业家严格讲无非是有了钱的奴才和没了钱的奴才之分
355806,455,千里能容吗,天理能容吗
355807,456,不要再绑架式C中国人民,不要再绑架14亿中国人民
355808,457,亲爱的同胞们,亲爱的同胞们
355809,458,这个打不是你的胆,这个党不是你的
355810,459,跑步的代表我们10岁中人民,他不能代表我们14亿中国人
355811,460,你打给过你什么给女孩子好学校了,他给过你什么？给你孩子好学校了
355812,461,还是给你一个健康的医保系统啊,还是给你一个健康的医保系统
355813,462,还是给我给了你个公平的法制社会了,还是给了你一个公平的法制社会了
355814,463,还是让你随便有信仰吗,还是让你随便有信仰
355815,464,全人类的只有一个国家,全人类上只有一个国家
355816,465,这个衣服是200个国家里面前100个月只有一个中国,这个200多个国家里面前100个国家，只有一个中国没
355817,466,没有社会养老保险,没有社会养老保险
355818,467,你死了该怎么死怎么死,你死了该怎么死怎么死
355819,468,墓地都买不起,墓地你都买不
355820,469,和华你的火浪不起,化你都火化不起
355821,470,全人类点就中国人民,全人类中只有中国人民
355822,471,一切都要听党的一切都是党的阶级娘精工党期待你死了你生了孩子你说,一切都要听党的，一切都是党的，爹亲娘亲不如党亲。但你死了，你生孩子，你上
355823,472,你上学你病了,你上学，你病了
355824,473,没人管,没人管
355825,474,睁睁眼睛长长脑子长长心智吧,睁睁眼睛，长长脑子，长长心智吧
355826,475,中国老百姓不是说猪狗不如根本不如猪狗,中国老百姓不是说猪狗不如，根本不如猪狗
355827,476,好了今天的直播就到此为止为14亿中国总包几乎,好了今天的直播就到此为止。我为14亿中国同胞祈福
355828,477,喜马拉雅的新的中国和法治自由,喜马拉雅的新的中国和法治自由
355829,478,阿自由信仰的时代即将冲向我们,自由，自由信仰的时代即将冲向我
355830,479,做好迎接的准备吧,做好迎接的准备吧
355831,480,阿弥陀佛亲爱的战友们阳光明媚呀,"阿弥陀佛🙏


亲爱的战友们阳光明媚呀"
355832,481,你说过那啥时候可以回来了给你这么好一点你看着白天石有门,你说共产党啥时候给过咱老百姓这么好的天。你看这
355833,482,对面那个气呀,对面那个旗
355834,483,对面那个题就是川普中国家那个,对面那个旗就是川普总统的家
355835,484,巧克力的房子就是川普总统家,巧克力的房子就是川普总统的家
355836,485,看到了吗,看到了吗
355837,486,差不多了挥挥手啊,在这挥挥手他
355838,487,这是过去这个,这挥挥手他能
355839,488,王长久电视川普总统的,广场酒店是川普总统的
355840,489,他的妻子离婚的时候给了他老婆了,他跟他妻子离婚的时候给了他老婆了
355841,490,看啊,看啊
355842,491,然后置苹果店苹果店新苹果店,然后这是苹果店，新苹果店。亲爱的
355843,492,繁体繁体字,他跟他妻子离
