id,index,content,proofed
403401,306,啊到时我做的事情我告诉了校长这是我们家教育,如果老天爷有真理的话，你的孩子是这么受教
403402,307,就出小干了他,辑呀！如果老天爷
403403,308,发现偷东西了建筑战斗到底,果老天爷有真理的话，你的孩
403404,309,还有你流行怎么教育孩子的吗你能不能告诉你的孩子你妈说了,孩子是这么受教育的？刘欣，咱们走著看！你的人生会怎么样
403405,310,咱们偷东西没事,咱们走著看！你的
403406,311,人家偷东西可以永世所以我可以偷你东西,心窝子说：我的孩子从小.....我可以非常荣幸
403407,312,还有这个不要脸的吗,有道德的！不但不沾人家
403408,313,这个福克斯的退席你跟真够傻的他在我自己的形象自己美丽的,可以非常荣幸的说：我的孩子是世界上最干净、最
403409,314,完全失去了自己的这个这个逻辑了,子是世界上最干净、最有道德的
403410,315,看到那个那个流行说,常荣幸的说：我的孩子
403411,316,这是美国体制出了问题,的孩子是世界上最
403412,317,我今天6点钟起我想让天下所有的父母,干净、最有道德的！不但不沾人家便宜，从小我太太就
403413,318,你付给女孩子好的健康环境你没本事给他一个好的教育,你买单。那不叫吃亏，那是你的荣誉！」你可以问问我的孩子。「第二、关
403414,319,你也没本上的不打毒针,以问问我的孩子。「第二、关
403415,320,你能不能不要他精神上也打着毒真的,你不但不能偷，当看到别人偷你一定要跟
403416,321,你能跟我说孩子偷东西是不对的谁偷东西都是不对的,"你的眼里不能看到有偷东西的人发生，不管他偷啥！」


我的孩子在大学里面，在"
403417,322,能不能这样呢,你的眼里不能看
403418,323,猪肉都不能做到了,于偷东西你不但
403419,324,我曾经在日本,我的孩子。「第二、关
403420,325,遇到一个,一定要跟
403421,326,啊,到底
403422,327,当时比我大20多岁了一个女同志,我的孩子。「第二、关于偷东西你
403423,328,对我特别好我也没想太多,到别人偷你一定要跟小偷
403424,329,到时你说我22岁你是吧,斗到底！在你的眼里不
403425,330,可怕到时候400岁,能看到有偷
403426,331,我真的霸道老大姐了,战斗到底！在你的
403427,332,没想别的友谊现在高尔夫球场,面，在英国大学里边，就因为
403428,333,我试试,我的孩子
403429,334,给你量高尔夫用我的伙伴就全世界最大的高尔夫球的老板59个小时就上,国大学里边，就因为看到别人偷东西(中东人)跟人家打架，差点被开除。就是
403430,335,还感动说我是天才我的一边打人会特别好,打架，差点被开除。就是因为这个。当时我告
403431,336,我洗完出来,点被开除
403432,337,然后这个这个大价格出来了就出来,东人)跟人家打架，差点被开除
403433,338,旁边有个小房间他说你到这边来放当时那个日本那个叫名的研究什么呀,在英国大学里边，就因为看到别人偷东西(中东人)跟人家打架，差点被
403434,339,日本烟啊白的那个,人)跟人家打架，差
403435,340,他发了他点了一根,他，发现偷东西
403436,341,然后呢有亲密动作有亲密动作,不能告诉你的孩子：你妈说了「咱们偷东
403437,342,没啥事我挺客气了,没事儿，人家偷东西可
403438,343,最后我发现不对了这个这个动作手的深度越来越大,"有这不要脸的吗？


这个FOX的Trish Regan真够傻的，她太在乎"
403439,344,你们非常的不好,Regan真够傻的
403440,345,然后他说了,an真够傻的
403441,346,千万记录,完全失去
403442,347,这个文会呀,这个逻辑了。啊
403443,348,这个爱情不如偷情偷情不如偷不到,儿童节我想让天下所有的父母们，你不
403444,349,我说你说得好了最后你真的不到这会儿子好我暂不能到此为止,事给他一个好的教育，你也没本事叫他不打毒针，你能
403445,350,我最恨的偷着,对的，谁偷
403446,351,行就是挺不能投,偷东西是不对的，谁偷
403447,352,为什么要偷偷情太差了,针！你能告诉孩子偷东
403448,353,我倒是你你可以用你的权利我有我的选择情不能同不同意你的观点,精神上！也打上毒针！你能告诉孩子偷东西是不对的，谁偷东西
403449,354,他说这个中国历史还有什么事会念想我也真够厉害了他懂中国师,他精神上！也打上毒针！你能告诉孩子偷东西是不对的，谁偷东西都是
403450,355,但是我告诉他这不对的,东西是不对的，谁偷
403451,356,情趣事情,精神上
403452,357,如果要给这个发生什么婚外情了或者为什么有什么请为正数从来不玩了,"谁偷东西都是不对的！能不能这样呢？这样的父母能做到不？


我曾经在日"
403453,358,我恨你就是tudor不管如何数都是不对的这是个体吗,个，啊，当时比我大20多岁的一个女同志啊，对我特别
403454,359,后来这位姐妹跟我成为到现在为止是我的好朋友,岁的一个女同志啊，对我特别好，我也没想太多，啊，当时你说我
403455,360,所以说我真的还有什么对女人说半老徐娘,岁的一个女同志啊，对我特别好，我也没想太多，啊，当时你说我20来岁
403456,361,还有什么偷情我最恨的是啥叫半老徐娘了我认为女性越来越成熟越,在高尔夫球场，我这是跟人家练高尔夫呢，因为我们的合作伙伴就是全世
403457,362,漂亮漂亮,一天在高尔夫球场
403458,363,每次给我见面,没想别的。有一天
403459,364,我们俩都爱吃它都说就是你对这个,我们的合作伙伴就是全世界最大的高
403460,365,情字解释改变了我的意思,全世界最大的高尔夫球的老板，五十几
403461,366,夸家有大医院,伙伴就是全
403462,367,日本几个大医院,是跟人家练
403463,368,超级有钱,伴就是全
403464,369,他后来我整个情史非常阳光灿烂但是他的人生就是就是,天在高尔夫球场，我这是跟人家练高尔夫呢，因为我们的合作伙伴就是
403465,370,天天做新娘夜夜入洞房但是不说假不偷情,天在高尔夫球场，我这是跟人家练高尔夫呢，因为我们的合作伙伴就是
403466,371,不好啊,老板
403467,372,老子不结婚我天天都想你管得着吗,练高尔夫呢，因为我们的合作伙伴就是全世界最大的高
403468,373,但我不同,的老板
403469,374,天下没有对头的概念和投资是合法化就是在流行,伙伴就是全世界最大的高尔夫球的老板，五十几个
403470,375,在共产党的逻辑里面竟然把头缩成了合理化就是对儿童的,最大的高尔夫球的老板，五十几个高尔夫球场。挥完杆儿都说我是天才
403471,376,不IV歌词,五十几个
403472,377,中国儿童受到了看你看的孩子小小的孩子变成小那只小小的孩子都要说,最大的高尔夫球的老板，五十几个高尔夫球场。挥完杆儿都说我是天才，我这一杆儿挥的特别好，啊，从洗完
403473,378,你姥姥那个胆字,别好，啊，从洗
403474,379,哪有孩子爱上了,天才，我这一杆
403475,380,倒是给孩子尿尿使用的,都说我是天才，我这一杆
403476,381,来我长得就是面上的,来然后这个，这个老大姐
403477,382,只有雨了打不管哪个打包每个公民党灭了你这个民族国家,她说你到这边来，桌子上放著当时那个日本的那叫名
403478,383,什么党都是利益集团,说我没见你抽过烟
403479,384,我们就是需要长江后浪推前了不能是一个一直在更衣大娘,哎呦！那个真爽啊，然后呢，有亲密动作，有亲密动作，哎！我也没当啥事
403480,385,在更比一代强,密动作，哎！我也没当
403481,386,那这是人类的基本逻辑,现不对劲儿了，这个动手的
403482,387,你把样的朋友都去了孩子就爱党忠于党,动手的深度越来越大，啊，哎我说这不能这样啊
403483,388,不要脸了,不好（笑
403484,389,我去问南宁,我说这不能
403485,390,啊,啊
403486,391,我一到六一儿童节我就生气,哎呦！我发现不对劲儿了，这个动手
403487,392,我一到母亲节我就生气,我也没当啥事儿啊我还挺
403488,393,中国的女人中国的孩子,真爽啊，然后呢，有亲密动作
403489,394,这个最弱势的群体是最为黑的最为被洗脑的,作，哎！我也没当啥事儿啊我还挺客气的啊，最后，哎呦！我发现不对劲儿了，这个
403490,395,中国式宴喜马拉雅发至中国新中国之后,"这样啊这不好（笑）。


然后她说了，千万记住"
403491,396,中国的一个最高级的部门就是教育部,回你真偷不到，这回真是好了，但是咱不
403492,397,自有涨工资的就是老师,这个偷情太差了，啊，我当时就
403493,398,猪头我就是一个输的国家,这个偷情太差了，啊，我当时就
403494,399,一生的要管他们,为什么要偷呢
403495,400,因为他把青春全给了这个国家和人民,情不能偷，为什么要偷呢？这个偷情太差了
403496,401,老师应该受到最高的尊重,了，啊，我当时就跟她说，我说你
403497,402,老师的工资都是最高的,她说这是中国历史还有
403498,403,孩子上学孩子花你绝对不谈政治,害的啊还懂中国诗，但是我告诉你她这不对
403499,404,所有的老师到世界各地学习,国诗，但是我告诉你她这不对的
403500,405,都是大使馆的一起来了,但是我告诉你她这不对的
403501,406,所有的儿童,说我要跟
403502,407,到全世界去,告诉你她这不
403503,408,都要国家基的保卫工作,够厉害的啊还懂中国
403504,409,只有下载并网强我们才有希望,给我念一下，我说你真够厉害的啊还懂
403505,410,又让我把所有的儿童孩子走到国外去大使馆的陪住,一下，我说你真够厉害的啊还懂中国诗，但是我告诉你她这不对
403506,411,让孩子从小,给我念一下，我
403507,412,看见,我念
403508,413,世界的山川,史还有什么
403509,414,进入最文明的教育,这不对的。情就是情
403510,415,从宗教信仰到科技文化到风俗名景,给我念一下，我说你真够厉害的啊还懂中国
403511,416,孩子一定要走万里路在说读完你在读文件书,还有什么诗给我念一下，我说你真够厉害的啊
403512,417,可以不读万卷书但必须读书万里路,但是我告诉你她这不对的。情就是情我
403513,418,那是最大的国防,真够厉害的啊还懂
403514,419,只要发生战争大家都是牺牲品,真够厉害的啊还懂中国诗，但是我告
403515,420,看看台湾看看香港为什么台湾香港,念一下，我说你真够厉害的啊还懂中国诗，但是我告
403516,421,和大陆如此不同不就是教育不同吗不就是体质不同吗你问大陆人,有什么情我一定说，绝对不瞒著。我恨的就是偷字儿，不管如
403517,422,让你选择台湾住还是香港住谁不去选择台湾香港谁在你北京住,管如何偷都是不对的，这是个起码的人道和常识嘛！后来这位姐们儿跟我成为，到现在为止
403518,423,还不要脸说流行通知,半老徐娘啊，还有什么偷情
403519,424,你有本事别去装载你来美国福克斯工作工作是不是上厕所都不要你,有什么对女人说半老徐娘啊，还有什么偷情，我最恨这词儿，啥叫半老徐
403520,425,我不相信任何一个孩子他只很长以后留心的孩子,我认为女性越成熟越漂亮，现在我看比原来
403521,426,会后他妈妈to东认为他妈妈那边采访偷东西这种通话概念是对的,啥叫半老徐娘啊？我认为女性越成熟越漂亮，现在我看比原来还
403522,427,你代表是自信说话谁让你再找了,熟越漂亮，现在我看比原来还漂亮，而
403523,428,中央电视台国际电台全都是简单机构都市情报平台,跟我见面儿，啊，我们俩都爱吃，他都说就是你对这个情的解释改变
403524,429,我们的私藏食物所有战友们要对最近平台进行全面的估算起诉,我们俩都爱吃，他都说就是你对这个情的解释改变了
403525,430,他不能再多中国人,她后来这个整个情
403526,431,我没说生气了,我的一生。她家
403527,432,很多话还有说,们俩都爱吃，他都说
403528,433,大家关于Twitter,大医院啊，日本
403529,434,推特的事情打扰我,的解释改变了我的
403530,435,头一点时间我几天前我说了大家注意最近发生的注意啊,他都说就是你对这个情的解释改变了我的一生。她家有大医院啊
403531,436,因为要有出事要出事我告诉大家,啊，我们俩都爱吃，他都说就是
403532,437,我早获得请把他们明白那个32000的Twitter必须给屏蔽掉,对这个情的解释改变了我的一生。她家有大医院啊，日本
403533,438,在60之前是跟64有关有不要这就是没关系,院啊，日本几个大医院，超级有钱。她后来这个整
403534,439,但是他没做到但是只是抱着林郑月娥香港这个特首他亲自撰写了,但是她的人生哲学就是天天做新娘，夜夜入洞房，但是不说假
403535,440,每一个字,没有对
403536,441,让中央搞了一个什么逃犯法去还钱法,在共产党的逻辑里边竟然把偷说成
403537,442,引起了世界的震撼我报出来以后,成了合理化，这是对儿童的残害！卑
403538,443,因为在香港立法会每个人都来你看其实质性的说你执行中共中央的法,在刘欣，在共产党的逻辑里边竟然把偷说成了合理化，这是对儿童的残害
403539,444,现在大陆啥呀这是你正确和自己搞的,小的孩子都要什么爱党！爱你姥
403540,445,林郑月娥有三个法,变成小大人
403541,446,香港通话记录三个话这是第1法调逃犯法,党啊！哪有孩子爱党的？党是给孩子尿尿使
403542,447,还有第2个发的三个砝码上这一过那都会出来,孩子长大就是灭党的，只有灭了党！不管
403543,448,那么第2个要过来以后,什么党都是利益
403544,449,从1997到2019香港人的一个好办法弄完了你不,希望长江后浪推前浪，不能是一代更比
403545,450,你不听话你知道这个理由可以颠覆国家对面一抓到第2个就是香港的资产,娘，是一代更比一代强！这是人类的基本逻辑。你大爷了的个，从小就训练孩子叫爱
403546,451,和土地使用权的问题,节我就生气，我一到
403547,452,这就关系到你的生死存亡,到母亲节我就生气！中国的女人
403548,453,第3个,子，这
403549,454,这个香港的教育,最被洗脑的！中国
403550,455,林郑又说干完这个是林郑月娥最后要修一个法,最黑的！最最被洗脑的！中国实现喜马拉雅，法治中国
403551,456,就是中国中央人大释法林郑月娥在还可以再干两件,就是教育部，最要涨工资的就是老师，第二个就
403552,457,就是你还要抓紧时间,就是教育部，最要涨工
403553,458,就是淋着雨我们就用升香港人的未来很让你所有下来是不完全换了自己的,"就是退伍军人。


退伍军人应该受到国家最，任何人都应该受到英雄级的招待！一生"
403554,459,所有的钟声的安全和最长远的未来,生都要管他们！因为他把青春全给了这
403555,460,大埔信怎么看如果香港最索6月9号游行成功,国家和人民。老师应该受到最高的尊重，老师的工资应
403556,461,啊这事都不会发生,老师到世界上
403557,462,这是为什么Twitter要全面封闭不息在家本来是要在6月2号3,该是最高的。孩子上学孩子的环境绝对不能谈政治。所有的老
403558,463,最型的执行了,最高的尊重，老
403559,464,事实上推得上屏蔽掉了大概在8万人,是最高的。孩子上学孩子的环境绝对不能
403560,465,What would you assess 32,谈政治。所有的
403561,466,现在是听说是80000元,子上学孩子的环境
403562,467,有很多人是很少只是关注,有的老师到世界上各
403563,468,Facebook和就简直是灾难了,。孩子上学孩子的环境
403564,469,在上个月抓捕的大概的几万人,最高的。孩子上学孩子的环境
403565,470,昨天听说抓捕大概就是这样的上万人,最高的。孩子上学孩子的环境绝对不能谈
403566,471,碑文化,孩子的环
403567,472,林郑月娥这个视频和这个真相震傻了他们,子上学孩子的环境绝对不能谈政治。所有的老
403568,473,但是我昨天就告诉大家一发生我就在我们的长尾裙亲嘴,到全世界去，都有国家级的保卫，护送！只有下一代比我们强，我
403569,474,不要着急,护送！只
403570,475,会回来的,大使馆的
403571,476,为什么我们相信我相信,我们强，我们才有希望
403572,477,在美国白宫,代比我们强，我
403573,478,五角大楼,外去，有大
403574,479,国会,国外
403575,480,和美国各界我们的朋友,受最文明的教育！从
403576,481,一个让我们回来了,仰到科技文化
403577,482,我有这个实力我有这个自信大家看到我们公小霞女士,文明的教育！从宗教信仰到科技文化到风俗民情，孩
403578,483,识汝做出反应过你这么说,受最文明的教育！从
403579,484,马上给罗比奥美格给还有我们的将军五角大楼白宫他就做了,川，接受最文明的教育！从宗教信仰到科技文化到风俗民情
403580,485,参数给各媒体,陪送，让孩子
403581,486,到昨天就真的是几十个媒体都在问我怎么回事,的陪送，让孩子从小看尽世界的山川，接受最文明的
403582,487,我都告诉他这是过那干的为什么干的林郑月娥,儿童和孩子走到国外去，有大使馆的陪送，让
403583,488,本来说下你就可以看了很多媒体报道,小看尽世界的山川，接受最文明的教
403584,489,张已经有了爆料革命海外巨大的媒体力量的基础,最文明的教育！从宗教信仰到科技文化到风俗民情，孩
403585,490,张已经拥有了一个西方世界最正义的力量最多的占用和正毅力量的联盟,最文明的教育！从宗教信仰到科技文化到风俗民情，孩子一定
403586,491,我们已经拥有了绝对受西方世界关注和信任很依赖的,尽世界的山川，接受最文明的教育！从宗教信
403587,492,占有的群体,卷书，可以
403588,493,他能力来了吗,万里路，再
403589,494,共产党的干扰子他就是气不休的老百姓玩玩流行这样的人玩玩,从宗教信仰到科技文化到风俗民情，孩子一定要让他走万里路，再说读万
403590,495,范冰冰太行不行,风俗民情，孩子一定要让
403591,496,你们看了这一次是愚蠢的决定他们的恐惧和他们的愚蠢的行动,尽世界的山川，接受最文明的教育！从宗教信仰到科技文化到风俗
403592,497,礼物,里路
403593,498,我说过1万秒,说读万卷
403594,499,我告诉大家乐大家把我说话到曼谷,要让他走万里路，再说读万卷书
403595,500,推特兰了,他走万
403596,501,而我不要还回来回来了捡到什么呀不用紧张,化到风俗民情，孩子一定要让他走万里路，再说
403597,502,他都挡不住我们我买的国美女呢,定要让他走万里路，再说读万
403598,503,还有更多的媒体我们再联系,到科技文化到风俗民情，孩子一
403599,504,我们过去你就说我们不只是啥样了说从昨天到现在,文化到风俗民情，孩子一定要让他走万里路，再说读
403600,505,大量的这个这个关注度,"的国防！


只要发生战争大"
403601,506,一下子就写了两个最大数与差的和媒体,"必须走万里路！那是最大的国防！


只要"
403602,507,就这样,牺牲
403603,508,另外一个大家,里路！那是最大
403604,509,没有注意到这个问题,"是最大的国防！


只要"
403605,510,这次在那就是我们的机会让西方世界看的共产党在西方的沉默力量,争大家都是牺牲品。看看台湾看看香港，为什么台
403606,511,和他们的音叉,什么台湾
403607,512,和无视法律的这种流氓嘴脸,只要发生战争大家
403608,513,还有你的在好了吗再来一个再来一遍吗再来姐姐吗,只要发生战争大家都是牺牲品。看看台湾看看香港，为
403609,514,但是我们要利用好这个机会我现在有以下的,嘛！你问大陆人让你选择台湾住还是香
403610,515,请战友们晚一起珍惜这个机会的小小的要求,湾，香港？谁在你北京住？还不要脸说刘欣
403611,516,兴和路德先生细思极恐先生,本事别去中央电视台工作，你
403612,517,大位小哥先生卡利息女士,选择台湾，香港？谁在你北
403613,518,阿东这个美东之声这个这个专业红还有澳洲新生我们的爱,欣同志，你有本事别去中央电视台工作，你来美国FOX工
403614,519,暗红女士去了首先生,你有本事别去中央电视
403615,520,我们日本的几个大的这个平台,我不相信任何一个孩子他成
403616,521,还有这个凤凰九天北京姑娘,我不相信任何一个孩子他成长以后
403617,522,在我执政的多个频道,孩子他成长以后
403618,523,Sar water,认为他
403619,524,大家集体一个互动,电视台，国际电
403620,525,我们预定位一定为明天也就是明天的时间,我们在适当的时候，所有战友们要对这些平台进行全面
403621,526,明天的我们上午是现在10点吃过可能要提前最后看同志们9点半,们在适当的时候，所有战友们要对这些平台进行全面的公开起诉！他不
403622,527,半个小时直播,不能代表中
403623,528,我们在直播前就明天上午或者是明天下午的时候,我们在适当的时候，所有战友们要对这些平台进行
403624,529,大家看通知,代表中
403625,530,我们集体直播,我们在适
403626,531,距离吃不是同时集体来感谢所有帮助我们的人,机构，都是情报平台！我们在适当的时候，所有
403627,532,然后没有三个星座,战友们要对这些平
403628,533,第1个TD直播在日本看到这个话题然后我们大概具体位置感谢,都是情报平台！我们在适当的时候，所有战友们要对这些平台进
403629,534,这个译本中欺负,这一说生气
403630,535,Adi 2的所有在什么机器,啊，推特儿的事情，头一
403631,536,One我们到处在什么打中单来往这些1元往这些朋友就可以这样的我们,为很，要出事儿，要出事儿，我告诉大家我获得情报，他们名单上有32000个
403632,537,我们同时把这个双手合十的发100个鸡米饭,我获得情报，他们名单上有32000个推特儿必须给
403633,538,然后再花同样的感谢信,但是自从报了林郑月娥，香
403634,539,他不去,她亲
403635,540,然后我们的胖,让中央
403636,541,再说说我们,是他没做到。但
403637,542,简单的一句话我们要求就三个行动,关系的，不要说跟六四没关系。但是他
403638,543,视频发的这个这个语音的感谢然后我们要求包括全部中,是他没做到。但是自从报了林郑月娥，香港这个特首，她亲
403639,544,Golden Poly audubon路,要说跟六四没关
403640,545,昨天整个华盛顿他的小有太多人,做到。但是自从报了林郑月娥，香
403641,546,给崔多打电话马上关注所有问题件,关系的，不要说跟六四没关系。但是他没做到。但
403642,547,可以说这过去70年来前所未有的中国人在海外受到伤害,有关系的，不要说跟六四没关系。但是他没做到。但是自从报
403643,548,你最快的速度得到了白宫五角大楼美国国会的反应,，是跟六四有关系的，不要说跟六四没关系。但是他没做到
403644,549,让引擎西方媒体的高度关注,她亲自撰写了每一个字，让中央搞
403645,550,从来没有像现在一样希望有一个没有没有组织的一个反弓力量,出来以后。因为在香港立法会，每个人都在你看质询的说你执行中共中
403646,551,祝到西方的高度关注,中央的法律，现在大家都傻
403647,552,这也是压力,这是林
403648,553,两年前我们说什听得见,律，现在大家都傻眼了，这是林郑
403649,554,谁在我们,这是林
403650,555,喂喂喂,娥自己搞的
403651,556,龚小夏你是当是美国之音中文部主任都可能灭了,共中央的法律，现在大家都傻眼了，这是林郑月娥自
403652,557,是不是啊现在滑肌不发纪晓霞女士帆站出来不来,胞要记住三个法，这是第一法叫逃犯法，还有第
403653,558,这就是两个保留根本的结婚吗,上，这只要一过那都会出来。那么
403654,559,但是我们也能看到海外一半自恋狂,听话，我任何理由可以说你颠覆国家罪把
403655,560,一些牛叉还有奇迹贼假名坐山观虎斗,以说你颠覆国家罪把你抓了；第二个，就是
403656,561,二线,香
403657,562,不出手不演义告诉我为独立这帮流氓,不听话，我任何理由可以说你颠覆国家罪把
403658,563,我没有说谁是坏人谁是好人,听话，我任何理由可以说你颠覆国家
403659,564,所以说谁还在说小象不是长嘴文件长嘴巴你有效家的本事吧,说你颠覆国家罪把你抓了；第二个，就是香港的资产和土地使用权的问题，这是
403660,565,刘晓家的精神吗你有小像这种最够意思吗,林郑月娥最后要修一个法，就是中共中央
403661,566,阿姨看看我们美国昨天美国副总统他们包括旁边要国务卿轩,月娥干完这个事，林郑月娥最后要修一个法，就是中共中央
