id,index,content,proofed
403662,567,光汇炮日格罗比尔格罗斯,你还要再忍受林郑月
403663,568,情报委员会国家安全委员会五角大楼,未来，和让你所有香港人不安全，换了自己的所有
403664,569,上午还要,长远的未
403665,570,昨天开会是哇塞在巴哈马度假打电话,这是为什么twitter要全面封闭，不惜代价
403666,571,给每个打电话我再告诉你国家新闻的主管包括情报部,实上twitter上屏蔽掉了大概在8万人，我得到的信
403667,572,高度关注昨天的时间,注。Facebook就简直是灾难
403668,573,所以我昨天特高兴我真的那么牛的大佬在喝东西的时候他说,大概在几万人，昨天听说抓捕的又是将近上万人，被问话了
403669,574,这个不见生能回答我这个问题吗这个现在是怎么干这干那如果,"这个视频和这个真相，震傻了他们。


但是我昨天就告诉大家"
403670,575,我好热啊好热啊,，我说：不要
403671,576,我打你选你到时间与去了共产党打你一拳你要找现在回去找找,我们的常委群告诉，我说：不要著急，会回来的。为什么？我们相信，我相信在
403672,577,多好啊现在有问题这次我没有集体行动,定会让我们回来的，我有这个实力，我有这个自信
403673,578,一定要集体行动,一定会让
403674,579,激励行动这个头这次就是露得先生,回来的，我有这个实力，我有这个自信。大家看
403675,580,就是路德先生大家看好路子视频看网路走的话题,实力，我有这个自信。大家看到我们的龚小夏女士迅速做出
403676,581,一个人看到我们这边不是伞兵山永不相的亲妹子搞目击,应，我一句话都没跟她说。马上给罗比奥，还有我们的将
403677,582,然后从来没有自行动都是各玩各的这版最多玩死了我没有集体行动,然后给各媒体，然后昨天就真的是几十个媒体都在问我怎么回事，我都告
403678,583,然后你一定要知恩图报,然后给各媒体，然后昨天
403679,584,第三人看到我们尊重的力量,党干的，为什么干的？林郑
403680,585,你不是怕林郑月娥是吧我们就要你就用那个时间全家都知道,"林郑月娥。


大家从下个星期看到很多媒体爆出来，咱已经拥"
403681,586,这就是今天的那个报平安直播还有六一儿童节献给儿童的礼物,正义的力量，最多的战友和正义力量的联盟，我们已经拥有
403682,587,我叔叔过节也有点今天激动,我们已经拥有了绝对受西方世
403683,588,今晚怎么没不要介意单位问你们的未来,和信任和依赖的战友的群体。他能灭的了吗
403684,589,你们应该出现在让好心脏迎接新中国的到来未来是你,能灭的了吗？共产党那个脑子，他就是欺负老百姓，玩玩刘欣这样的
403685,590,是你们的国家是你们的,一次次愚蠢的决定，他们的
403686,591,意志的荣耀都是你们的,一次次愚蠢的决定，他们的恐
403687,592,儿童把你的叔叔爷爷们正在为你们奋斗,和他们的愚蠢的行动，就是上天给我们的
403688,593,什么都可以信,们的愚蠢的行
403689,594,不要紧过来打出的每一个字每一句话,不行，你们都看到他一次次愚蠢的决定，他们
403690,595,还有什么,恐惧和他们
403691,596,除了自己的脑子健康你才能活得健康才能活着永远,行，你们都看到他一次次愚蠢的决定，他们的恐惧和他们的愚蠢的行动，就是
403692,597,不要相邻都有儿子的让别人都不安全让自己安全让别人都没有未来让子,们的愚蠢的行动，就是上天给我们的礼物，我说过一万遍了，我告诉大家了，大家把
403693,598,好我现在开始,家把我说的话
403694,599,为10岁中国人民特别是中国人同步,动，就是上天给我们的礼物，我说过一万遍了
403695,600,欺负,就
403696,601,阿弥陀佛,的礼物，我
403697,602,谢谢啦亲爱的战友们一切都是刚刚开始,就是上天给我们的礼物，我说过一万遍了，我告诉大
