id,index,content,proofed
403096,1,最近在干什么好啊6月11号啊,
403097,2,小朋友吧祝所有的小朋友,小朋友们！郭叔叔祝所有的小
403098,3,6月1号儿童节快乐啊,6月1号儿童节快乐！哈
403099,4,去了再给爷爷了我都会啊我爷爷来了,啊。郭爷爷了我都快。不容易啊，小
403100,5,哎呀,啊，小
403101,6,不容易啊小朋友啊小朋友啊,不容易啊，小朋友们。（打招呼
403102,7,第1个是谁呀,你的事儿，不是
403103,8,例如果3A第1,容易啊，小
403104,9,Mma tcr第2大圣第3,监视。声音
403105,10,Tc4英国占有第5,挺好。整的一堆机
403106,11,Capital of rd6,天好多了
403107,12,然后的72b can文联第7小百合地方,音比昨天好多了。哎呀，我发现这个
403108,13,多了大熊猫的酒,多了。哎呀，我发现
403109,14,Wmp by2第12的是刚说过了,声音比昨天好多了
403110,15,Market 3rd 12英国占有,声音比昨天好多
403111,16,好了好了好了好了好了好了,好多了。哎呀，我发现这个专
403112,17,假发,机面
403113,18,小王打的不容易啊赞英文啊,的工资。你说那玩意儿有啥啊那
403114,19,文长啊平均律,那玩意儿。我觉
403115,20,理工男,工资。你
403116,21,木兰传奇,说那玩意
403117,22,乒乓,金的工
403118,23,大象无形,到现在
403119,24,13a永不忘记在哪里宫楠木兰传奇问,面前跟你们说话更加自然。锻炼
403120,25,永隆,前跟
403121,26,小张你好啊我的头土工挖掘人大象,说话更加自然。锻炼完挺好
403122,27,象无形,先说几个
403123,28,土共掘墓人zero zero zero zero来了就露啊,的动作啊，战友们说实在话，我这就没怎么
403124,29,哎哟,在
403125,30,声音和视频效果怎么样啊在吗,说实在话，我这就没怎么表演，我哪
403126,31,声音还有这个视频下我打胜啊,演。这日本的朋友啊，「文贵先生好
403127,32,莲花灯,林郑
403128,33,中国石油吧,贵先生好
403129,34,中文,这个我
403130,35,视频人物是你的事出来他也不是这个是啊效果很好因为我同时有加,贵先生好。」，日本朋友。这个我这眼镜，到哪去都问我这眼镜。林
403131,36,监视啊,先生
403132,37,是啊生意的昨天好多了昨天这个,到哪去都问我这眼镜。林郑月娥，Ca
403133,38,我发现这个专业太复杂了,都问我这眼镜。林郑月
403134,39,我在手机卖天不停好吗,m 当年站在我家楼
403135,40,长得一队机器七八个人一小时100个美金的公司,也没想到这个郭文贵就是她这一辈子的恶梦人呐！她没
403136,41,你说那玩意啊,南湾拆我
403137,42,我觉得真不好,我们的资金。她做
403138,43,怀1000000美元搞一个时候吃不是10多现在怎么玩,话，还没开始呢。关于林郑月娥还有香
403139,44,OneDrive,儿童节
403140,45,复杂极了,过来的
403141,46,所以说在有吧,所有的战友
403142,47,简单就是力量手机面前给你们说话吧更自然锻炼,"家会看到更加精彩的。


首先一下，战友们，今天六一儿童"
403143,48,挺好啊,下，战友
403144,49,咱们今天先说几个字啊,先一下，战友们，今天
403145,50,Average,儿童的
403146,51,我那天打拳的动作啊但有个说实在话我就这么没怎么表演过哪些会给你们好的,我们有儿童的时代，少年的时代，不一定有老年的时代。不是人人都能活到老的。像杨
403147,52,日本朋友啊文辉先生好,人人都能活到老的。像
403148,53,任何,人人
403149,54,这个,能
403150,55,我的眼睛啊,的。像杨
403151,56,到哪去,到老
403152,57,林郑月娥carrie carries the Karen到大了,来的。我们有儿童的时代，少年的
403153,58,在看到你的战斗在楼下叫他做梦也没想到这个郭文贵就是,住，我们都是从儿童过来的。我们有儿童的时代，少年的时代，不一定
403154,59,就是他的这一辈子的啊这个梦人的任何人的,来的。我们有儿童的时代，少年的时
403155,60,他没想到派出那么多人性来完才我家房子,老的。像杨改兰女士就没有活到老。杨改兰女
403156,61,会那么多警察封锁我们的丝巾他做梦也没想到郭文贵,是人人都能活到老的。像杨改兰女士就没有活
403157,62,能这样说实在话我还没开始了关于林郑月娥还是香港的几个市啊,能活到老的。像杨改兰女士就没有活到老。杨改兰女士的5个孩子
403158,63,过一段时间大家看的更加精彩了更加精彩了,己的亲妈妈用斧子给砍死。大家去想想一个亲娘
403159,64,这个首先一下这个单有了今天6 1 6月1号儿童节的,听说有的孩子她连著砍了十几斧子。是什么样决
403160,65,说清所有电影的记录我们都是从儿童过来啊,"斧子。大家去想想。没有生存的希望了。


听说"
403161,66,我们有个儿儿童的十大,"的希望了。


听说杨"
403162,67,少年的时代不一定有老年的时代,说杨改兰在自杀前眼睛哭得基
403163,68,不是人都能活到老了,有生存的希望了
403164,69,杨改完你是就没有获得了,杨改兰在自杀前眼睛哭
403165,70,杨港而你是在五个孩子,杨改兰在自杀前
403166,71,他更没有年轻人就没有,官给拿走了，原因她家里有两
403167,72,被自己的亲妈妈用斧子砍死,的，孩子也是吃不饱。跟我们家里
403168,73,大家去想想一个亲娘去拿斧子砍死自己孩子说,因她家里有两只牛。听说杨改兰女士很辛苦的，孩子
403169,74,就是有了孩子,家里有两只
403170,75,这个太凉的卡的实际服了,睁不开了。就是一个
403171,76,是什么样的角觉得亲让他对自己的孩子来看那么多,是一个月300块钱的救助叫当地的贪官给拿走了，原
403172,77,当然去想一想,当地的贪官给拿
403173,78,没有生存的希望,也是吃不饱。跟我们
403174,79,听说杨改兰的自杀小眼睛突的基本睁不开了,听说杨改兰女士很辛苦的，孩子也是吃不饱。跟
403175,80,就是一个月300块钱的就主,女士很辛苦的，孩子也是吃不
403176,81,就当地的贪官给拿走了,叫当地的贪官给拿走了，原
403177,82,园艺他家里有两只牛,原因她家里有两只
403178,83,就是阳赶来你是个很辛苦的孩子认识我,听说杨改兰女士很辛苦的，孩子也是
403179,84,跟我们家最小的一样,跟我们家里头小时候一样
403180,85,吃网,一样
403181,86,没法活了,没法活了
403182,87,最后这种决绝,最后这种决绝
403183,88,所有的现在能听到人画的能听懂人话的,所有的现在能听到人话的，能听懂人话的
403184,89,所有的父母们和孩子们带去想想,所有的父母们和孩子们，大家去想想
403185,90,我们曾经是儿童,我们曾经是儿童
403186,91,我们对我们的父母怎么样,我们对我们的父母怎么样
403187,92,大家,大家
403188,93,摸着心口窝的想想,摸著心口窝子想想对
403189,94,这次几天娘如何,自己的爹娘如何
403190,95,我的身边人现在有了自己的孩子,我的身边的人现在有了自己的孩子
403191,96,天天给我说经常给我说这有了孩子知道爹妈都不容易,天天跟我说，经常跟我说：「有了孩子才知道爹妈多不容
403192,97,我们的父母和每个人的父母是多么不容易,我们的父母和每个人的父母是多么不容易
403193,98,亲爱的兄弟姐妹们,亲爱的兄弟姐妹们
403194,99,六一儿童节更要想对爸爸,六一儿童节更要想的对爸
403195,100,第2个,弟姐
403196,101,怎么让自己的儿子孩子好,怎么让自己的孩子好
403197,102,让孩子有个健康的节日,让他们有个健康的节日
403198,103,健康的成长,健康的成长
403199,104,首先孩子要打醉了针,首先孩子要打对了针
403200,105,打碎了1亿秒,打对了疫苗
403201,106,人类上只有共产党这些流氓体质给孩子打假疫苗,人类上只有共产党这种流氓体制给孩子打假疫苗
403202,107,大玩还没吃,打完还没事
403203,108,让孩子是健康的话,让孩子吃健康的饭
403204,109,全人类上只有,全人类上只有
403205,110,中国梦建筑的家族,中国孟建柱的家族
403206,111,能搞红黄蓝幼儿园,能搞红黄蓝幼儿园
403207,112,竟然能玩小孩的小**,竟然能玩儿小孩儿的小
403208,113,这叫微信从天大了对呀,这叫猥亵儿童，天大的罪啊
403209,114,全世界只有共产党的体制下,全世界只有共产党的体制下
403210,115,儿童孩子上学的餐厅东西是发霉的,儿童上学的餐厅东西是发霉的。孩子
403211,116,孩子吃的东西都是被垄断,孩子吃的东西都是被垄断
403212,117,比利集团保护照,被利益集团保护著
403213,118,大家去想想,大家去想想
403214,119,孩子穿的衣服,孩子穿的衣服
403215,120,也是化学用品制作的孩子吸的空气,"也是化学物品制作的。


孩子吸得空气"
403216,121,受严重雾霾的,是有严重雾霾的
403217,122,孩子有病吃的药也是假的,孩子有病吃的药也是假的
403218,123,孩子去医院没有钱去看病,孩子去医院没有钱去看病
403219,124,又在医院门口等死,要在医院门口等死
403220,125,过什么六一儿童节,过什么六一儿童节
403221,126,如果这个体制不会灭你过什么儿童节,如果这个体制不被灭，你过什么儿童节啊！多
403222,127,多少儿童在没有中年没有老年,多少儿童将没有中年，没有老年
403223,128,未来的多少而同要被自己的父母,未来有多少儿童要被自己的父母
403224,129,孩子然后跟父母一起自杀,砍死，然后跟父母一起自杀
403225,130,这不是耸人听闻,这不是耸人听闻
403226,131,在文化大革命的时候,在文化大革命的时候
403227,132,很多孩子,很多孩子
403228,133,就是被自己的父母送到邻居家教意识,多孩子被自己的父母送到邻居家，叫易食。跟
403229,134,格林大华孩子吃,跟人家换孩子吃
403230,135,这不是这不是耸人听闻,"这不是耸人听闻。

"
403231,136,我刚刚的同学年发这700天前,我们刚刚的这些年就几百天前
403232,137,给孩子打假疫苗,给孩子打假疫苗
403233,138,是一个是两个40个10万个吗,是一个、是两个，是十个，是万个吗
403234,139,那为什么这些事情都重兰称和你们当地的县长,那为什么这些事儿你们中南坑和你们当地的县长
403235,140,和生长的孩子不这样呢,和省长的孩子不这样呢
403236,141,你们的酋长,你们的球长
403237,142,不说人话的求长春上他都不敢直视,不说人话的村长都不会干这事儿。他的孩
403238,143,他的孩子都享受都比你的好大雨,他的孩子都享受著比你们好
403239,144,这叫爹亲娘亲不如党亲就这么亲吗,这叫爹亲娘亲不如党亲就这么亲吗
403240,145,大家都问问,大家再问问
403241,146,Parrot自己的良心窝子,拍自己的良心窝子
403242,147,为什么你们的乡长春长的这本书是省长一封说是市长,窝子，什么你们的乡长村长，那就甭说是省长也别说是市长
403243,148,多少长的子子孙孙都在美国在西方,多少长的子子孙孙都在美国都在西方
403244,149,刘呈杰和冠军是谁生的他打国家银行吗,刘呈杰和贯军是谁生的？他打过假疫苗吗
403245,150,王岐山孟建柱生说明自己没有孩子他加了多少,王岐山、孟建柱声明自己没有孩子，他家里多少
403246,151,男男女女看的照片了吗,男男女女，看到照片了吗
403247,152,江泽民的儿子是孩子江泽民是换了肾他杀了多少心,江泽民的儿子是孩子，江泽民换的肾，他杀了多少新
403248,153,新疆人的,新疆人
403249,154,多少新疆的年轻还是在他们尝试,多少新疆的年轻孩子要尝试，在他们
403250,155,Cider手术前要进行这个对比,们手术前，要进行对比血
403251,156,血液融合要达到完美的程度,血液融合，要达到完美的程度
403252,157,所以发一个不够俩俩不行那不行4 45,所以杀一个不够，俩！俩不行？仨！仨不行
403253,158,他们将的胜,他们家的肾
403254,159,傻*越换越好,咋就越换越好
403255,160,越长越年轻,越长越年轻
403256,161,多少新疆还年轻孩子,多少新疆年轻孩子，那尸
403257,162,俺的尸体扔在了大马路边,那尸体扔在了大马路边
403258,163,Water成就给生了,挖个坑就给扔了
403259,164,啥都好就是没了,啥都好好的，就是
403260,165,这不是开玩笑这不是耸人听闻,这不是开玩笑，这不是耸人听闻
403261,166,我叫他就说话是美利坚工作室纽约,我站在这说话，是美利坚合众国，是纽约
403262,167,穿普通朋友是做被告的,川普总统有事都要被
403263,168,你可以来告诉我呀,你可以来告我啊
403264,169,是不是下那个班吗呀,是不是？像那个马
403265,170,让人想不出来告诉我强奸醉了吗现在这个王八蛋啥也没有只有一个必应聘用合同,两年前不是来告我强奸罪了吗？现在这个王八蛋啥也没有，就一个聘用合同，一张纸都不给
403266,171,一张纸都不给,一张纸都不给
403267,172,Armani不是在这个这个说吗,马蕊不是说，跟政府、跟法
403268,173,哥哥跟这个中国还有这个法官接说我们有掌握有郭文贵的紫色的经,个聘用合同，一张纸都不给。马蕊不是说，跟政府、跟法官说：我们掌握有郭文贵的
403269,174,请把内裤,精斑内裤
403270,175,紫色的金牌内裤袜条了你还这么经把内裤,紫色的精斑内裤，我的娘嘞，你还紫色的精斑
403271,176,你老了呀,裤，你拿来
403272,177,周恩来告诉我呀,这来告我啊，我说
403273,178,我说你们那么多你们不认可的话不是吗,我说你们那么多你们不认可的话，不是吗
403274,179,还行你别吃饭了21年书啊,航你别撤案子啊！潘石屹你
403275,180,敦刻尔你继续干啊,克文你继续告啊
403276,181,胡舒立你变成熟你这个烂人,胡舒立你别撤诉啊，你这个烂人
403277,182,谁说这个和朱莉娅老天不让他生孩子,所以说这个胡舒立啊，老天不让她生孩子
403278,183,就不应该活在这个世界上他就是人类的大陆,就不应该让她活在这个世界上，她就是人类的
403279,184,大家就看看杨改兰案子出现以后胡舒立的牌正咱是不是怎么报道,大家去看看，杨改兰案子出现以后，胡舒立的《财新杂志》是怎么报道
403280,185,地方杂志怎么报道说这个女人,地方杂志是怎么报道的：这个女人
403281,186,他应该问问自己,她应该问问自己
403282,187,为什么这三个人都能活着,为什么这个山上的人都能
403283,188,他为什么就死了,她为什么就死了
403284,189,这人的人品有问题,这人的人品有问题
403285,190,只有问题,品有问题
403286,191,我真爱你八个老祖宗,我真R你八辈老祖宗
403287,192,叶子的文章的记者还有你才精,这个文章的记者，还有你财新
403288,193,你们在文化大革命过来我谁有选择的把自己的六个孩子杀了15个孩子,你们在文化大革命过来的，谁有选择能把自己的5个孩子给杀了，5个孩子
403289,194,我孩子发完自己还要死,孩子杀完自己还要死
403290,195,他有神经病他自己在杀了她老公也有神经病多少打工回来以后手了17,她有神经病，她把她自己给杀了。她老公也有神经病，在外面打工，回来以后守了
403291,196,自己在欢上自己,自己在坟上自尽
403292,197,是不是人间这是地狱,这不是人间，这是地狱
403293,198,我们为什么追求法治社会,我们为什么追求法治社会
403294,199,我们跟美国比跟欧洲比更绝大多数国家的,我们跟美国比，跟欧洲比，跟绝大多数国家
403295,200,我们我们待的不是人家,我们待的不是人间
403296,201,我们跟美国不是天地之差,我们跟美国不是天地之差
403297,202,是天和地的号码加一个与天和地狱的差距,是天和地，地后面加一个「狱」，天和地狱的差
403298,203,昨天我跟一个我非常喜欢的,昨天我跟一个非常喜欢的
403299,204,我的兄弟我的妹妹在一起在车上,我的兄弟，我的妹妹在一起，在车上
403300,205,我给他讲,我给她讲
403301,206,他非常感慨,她非常感概
403302,207,我说我中国人和世界上比较,我说中国人和世界上的人比较
403303,208,监利只差不对是的后面加一个语调地狱,较，天地之差。不对，是地后面加一个「狱
403304,209,六一儿童节的感受太深了,六一儿童节，我感受太深了
403305,210,我从来没有记得我过不友好的6点容易,我从来没记得我过过一个好的六一儿童
403306,211,我最好玩的就是六一儿童节我们要开这个运动会,我最豪华的儿童节，就是六一儿童节我们要开运动
403307,212,我是把我这个当时我哥哥的军队立方戏,我当时是把我哥哥军队的一双鞋
403308,213,这个里面塞上棉花,鞋，里面塞上棉花
403309,214,三上那个玉米叶子,塞上玉米叶子
403310,215,然后拿这个澡了,然后找了铁
403311,216,解释当斜着您好,铁丝当鞋带拧好
403312,217,跟人家只跑步,跟人家去跑步
403313,218,这是我记忆最深刻的六一儿童节,这是我记忆最深刻的六一儿童节
403314,219,我每天都要在恐惧了我娘去做啥,我每天都在恐惧著，我娘去自杀
403315,220,去调景,去跳井
403316,221,我每天都在盼望着我接通从来没回来了再大点,我每天都盼望著，我爹从外面回来的时候，能带点
403317,222,范围的吃,饭回来吃
403318,223,就我是1970年出生的人,就我是1970年出生的人
403319,224,我都这样的经理,都有这样的经历
403320,225,共产党在中国70年了,共产党在中国70年了
403321,226,还天天说中国人吃饱了饭就是你的本事,还天天说中国人吃饱了饭就是你的本事
403322,227,我真的是爱你主动发布,我真的是R你祖宗八辈
403323,228,现在世界GDP第2了,现在世界GDP第二
403324,229,中央电视台风交流新的记者,中央电视台那个叫刘欣的记者
403325,230,对照美国电台说中国14亿人那我们的GDP平均是你们1/6,对著美国电视台说：中国14亿人呐，我们的GDP一平均是你们
403326,231,你难道不问问你自己吗刘心你也曾经是儿童中国14余人被你统治了,你难道不问问你自己吗？刘欣？ 你也曾经是儿童， 中国14亿人被你统治了
403327,232,70年了你为啥还是你六分之一样,"70年了, 你为啥还是人家的六分之一呀"
403328,233,你为啥还没问题一样,你为啥还是六分之一呀
403329,234,你不是世界第2大经济体吗,你不是世界第二大经济体吗
403330,235,你不出伟大的祖国吗,你不是伟大的祖国吗
403331,236,竟然有脸说我要让美国人知道你们的生活你们遇到了问题对的困难,竟然有脸说：我要让美国人知道，你们的生活你们遇到了问题、遇到了困难，你
403332,237,你会对我们,来怪罪我们
403333,238,我们先让你这是你们的体制出问题了刘心呢,我们想让你们知道，是你们的体制出了问题了
403334,239,你可能你已经是两个孩子的母亲了,你可能已经是两个孩子的母亲了，你
403335,240,你说的话说你拍飞行过的你为什么嫁给一个外国人,你说这话的时候拍拍心窝子，你为什么嫁给一个
403336,241,你为什么让你孩子家人都拿外国护照,你为什么让你的家人孩子都拿外国护照
403337,242,老你赚的中国钱,你赚著中国钱
403338,243,老你说美国体制出问题了,你说美国体制出问题了
403339,244,美国灭了白美国其实问题的解决解决吧,美国灭了吧！美国体制出问题了，那你就解决解
403340,245,你能不能让中国人也出这样的体质问题呀,你能不能让中国人也出这样的体制问题呀
403341,246,我们中国人这样的选择你愿意拥有美国这样体制问题还是拥有你的盗国贼共产党证,我们中国人要让她选择： 你愿意拥有美国这样的体制问题？还是要拥有盗国贼、共产党这种
403342,247,提出问题,体制问题
403343,248,亲爱的战友们,亲爱的战友们
403344,249,这个会说的不如会听的,这个会说的不如会听的
403345,250,我们是真的不是猪狗,我们是人哪！不是猪狗
403346,251,怎么就这么远你听吧,怎么就这么愿意听
403347,252,刘欣说人家知识产权托怎么写说这个事件都有这个到处都有你们那不要告,刘欣说这世界上到处都有，你们内部也告来告去的。哎！刘欣女士呀，我请问
403348,253,搞来搞去的流行女士我请问问你在中国谁敢告,告来告去的。哎！刘欣女士呀，我请问问你：在中国谁敢告
403349,254,你们这样人啊,你们这样的人
403350,255,你们昨天才能到,你们内部也告来告
403351,256,你不说偷东西你抢东西我感到你吗,偷知识产权你偷我们东西，刘欣
403352,257,因为我们没有非常好的生殖器,有，你们内部也告来告去的。哎！刘欣
403353,258,不能给中央领导睡觉不能给主线不关上睡觉,部也告来告去的。哎！刘欣女士呀，我请问问你：在中国谁敢告
403354,259,呼吁我们不愿意跟他们睡觉,都有，你们内部也告来告去
403355,260,我们敢告诉我吗有权利告吗美国被投资也可以就告特工,我们东西，刘欣说这世界上到处都有，你们内部也告来告
403356,261,你吗,你们
403357,262,中国是流氓治国黑社会治国警察直播你能不能早点准,中国谁敢告你们这样的人哪？谁敢告你们中央电视台
403358,263,对不起你那个嘴,东西了，你抢
403359,264,去你家可以不要脸,导睡觉，不能跟中
403360,265,不要让天下人都认为你不要脸还是对的,部官员睡觉，或者我们不愿意跟他们睡觉
403361,266,啊还有一个会说话的,官员睡觉，或者
403362,267,这丫头也能通东西人家都没有人管,者我们不愿意跟他们睡觉。我们敢告吗？有
403363,268,你那头的你是假的头的还有道理,他们睡觉。我们敢告吗？有权利
403364,269,人家华为人家人家律师会任正非你知,黑社会治国、警察治国，你能不能长
403365,270,偷我们都晕头到我们的错误你也一刷到你们的说明书上在你们的软件下载,天下人都认为你不要脸还是对的！还有这么说话的？！天下都在偷东西，人家偷东西
403366,271,著名,这么
403367,272,下面铺了我们就改的不敢叫什么斯科欢迎你,下人都认为你不要脸还是对的！还有这么
403368,273,给我音乐为重什么,认为你不要脸还是
403369,274,这是一个巧合,还是对的！还有这么
403370,275,这叫偷东西吗这叫抢东西吗这是知道吹不要脸的事,这么说话的？！天下都在偷东西，人家偷东西有人管！你那是偷东
403371,276,天涯如此,天下都
403372,277,共产党的训练自己的国民把偷东西抢东西因为理所当然这个,东西，人家偷东西有人管！你那是偷东西偷了抢了还有道理！看人
403373,278,我有救吗,西有人管
403374,279,我们的六一儿童节,我们东西，是偷
403375,280,我们能不能问问孩子留心你告诉你的孩子,我们的错误你也印刷到你们的说明书上，在你们
403376,281,两个孩子,连改都
403377,282,你叫他记住你说你说的话看来你两个字这个嘛说的对不对,"你们偷了竟然连改都不改说什么：思科欢迎您！


结果任正非说"
403378,283,偷人家东西,偷了竟然连
403379,284,因为你也臭所以我头,的错误你也印刷
403380,285,你偷了可以的话你说真话我都是还不准吧,我们的错误你也印刷到你们的说明书上，在
403381,286,老李给我们的体制出了问题,东西，是偷盗！我们的错误你也印
403382,287,这是什么不要脸的国家,也印刷到你们的说明
403383,288,如果老天也有争议的话你的孩子都不受教育的留心咱们总是看你会你的人是我,"软件上下面注明.....你们偷了竟然连改都不改说什么：思科欢迎您！


结果任正"
403384,289,为什么样,非说什么
403385,290,我可以拍着良心窝子说我的孩子我从小,是一个巧合！这叫偷东西吗？这叫抢东西
403386,291,我可以非常容易的我的孩子的事情最干净最有道的,的国民，把偷东西，抢东西认为理所当然！这个国家的民族还
403387,292,不大不占人便宜从小我太太就说孩子谁请客,你告诉你的孩子，两个孩子，你叫他记住你曾经说过
403388,293,你买的,你的孩
403389,294,你请客当然你买的,看你两个孩子认
403390,295,那我叫吃亏那是你的容易,子，你叫他记住你曾经说
403391,296,可以问问我的还是第2,子认为你这个妈说的对
403392,297,如果浦东西,人家东西
403393,298,不断以后能投要看到别人同你一定要给小图数字,不对？偷人家东西，因为你也偷，所以我偷！你偷了可以到法院
403394,299,战斗到底,然后你告
403395,300,在你眼里不能看那个偷东西的人发生,么不要脸的逻辑呀！如果老天爷有真理的
403396,301,不管他头上,罚！然后你告诉
403397,302,我的孩子在大学里面在英国大学你们就因为看到别人偷东西,天爷有真理的话，你的孩子是这么受教育的？刘欣，咱们走著看！你的
403398,303,中东人,著看！你的人
403399,304,跟家打架差点开始,真理的话，你的孩子是
403400,305,就是因为,家你体制
