id,index,content,proofed
469591,263,跳过郭文贵和录得的关系,挑拨郭文贵和路德的关系
469592,264,100000美元,万美元
469593,265,跳得跳不过会和战友之声的关系100万美元,挑拨郭文贵和战友之声的关系一百万美元
469594,266,挑拨郭文贵和这个心思小铺的关系是万美元可以让家里全是一个叫,挑拨郭文贵和细思小哥的关系，十万美元，跟杨建利先生一个价
469595,267,都有明瓦的,都有明码的
469596,268,然后开出了谁要弄到公共性的问题你能这样什么价都给你都笑,然后开出了谁要能够到郭文贵身边卧底，你能这样的，什么价都可以写好
469597,269,写好单子了,写好单子了
469598,270,把设计郭文贵啊炫海光威啊,了，设计郭文贵呀，陷害郭文贵呀，然后
469599,271,然后在法庭上他打了什么目的呀给你多少钱全砸了干,然后在法庭上能达到什么目的呀，给你多少钱。全拉
469600,272,把这些人都回来行动了,这些人都回来行动了
469601,273,有的在欧洲行的位置在澳洲行动你们在英国行动有的在德国行动有的在香港行动,有的在欧洲行动，有的在澳洲行动，有的在英国行动，有的在德国行动，有的在香港行
469602,274,还有一般都是打着战友的名义我被抓了,还有很多人是打了战友的名义，我被抓了，被抓
469603,275,被抓了还有被抓的照片,被抓了还有被抓的照片
469604,276,我昨天我很纳闷啊谁都被抓了还有被抓的照片那是一个第2个被抓了还有群,我被抓了，被抓了还有被抓的照片。我到现在很纳闷啊，谁能被抓了还能
469605,277,询问笔录,询问笔录
469606,278,阿法最近发给我多了去了那真的有1000我就纳了闷了啊请问,最近发给了我多了去了，得有几千。我就纳了闷了，请问发给我信息那
469607,279,发个微信因为这样有你有三头六臂呀你被共产党抓了询问,发给我信息那位战友，你有三头六臂呀，你被共产党抓了，讯问
469608,280,16郭文贵,郭文贵
469609,281,你还有比如按照中国的刑法你要拥有警察的比如是背被判3年的,你还有笔录。按照著中国的刑法，你要拥有警察的笔录，你会被判三
469610,282,15年或者是姥姥开的过去是现在没落改了就可以注意,年或者是被劳改，劳改是过去有， 现在没劳改了就可以拘
469611,283,猎豹小组的这个低级下流流氓的手段跟共产党队伍,灭爆小组的低级下流流氓的手段，跟共产党对付
469612,284,美国欧洲的贸易红主义者不要脸,美国欧洲的贸易同出一辙，不要脸
469613,285,低级下流,低级下流
469614,286,非常地铁,非常低级
469615,287,就让你茶喝完了吗,常低级。大家未来你们
469616,288,就装比较高级都喝的是高级场我是查比较便宜比较便宜,家未来你们看大戏呀，刚才说的事，我都给你们摆出来，记住我今天说
469617,289,他一般不喝,天说的
469618,290,大家未来你们看大西洋我给你们都把干说的是我都给你们摆出来,大家未来你们看大戏呀，刚才说的事，我都给你们摆出来，记住我今
469619,291,记住我今天说的话,记住我今天说的话
469620,292,用人跑到日本去,有人跑到日本去
469621,293,给共产党接头派来的人,跟共产党接头，派来人谈好了
469622,294,谈好了结婚头了,谈好了，接完头了
469623,295,结果其中一个人在日本丢了找不着了,结果其中一个人在日本丢了，找不著了
469624,296,但愿他不是去游泳去了北朝鲜,但愿他不是游泳去了北朝鲜
469625,297,在大阪的见面,在大阪的见面
469626,298,大板的见面,大阪的见面
469627,299,但愿你不是有回呀给你还有回了什么牡丹江了,但愿你不是游回家去，游回了牡丹江啊，这下说漏了，这个
469628,300,你这么说漏了这个人是我丹江出来了,这下说漏了，这个人是牡丹江出来的
469629,301,亲爱的战友们,亲爱的战友们
469630,302,大家每天看电视的时候你们不知道有多少占有付出代价,大家每天看电视的时候，你们不知道有多少战友付出代价
469631,303,付出自由和安全,付出自由和安全
469632,304,精简,金钱
469633,305,你们也不知道啊背后的困难挡多大的力量来对付我们,你们也不知道啊，背后的共产党多大的力量来对付我
469634,306,前所未有,前所未有
469635,307,你能看到中国外交部发言人中央电视台的发言人在那等着点和说吧,你能看到中国外交部发言人，中央电视台的发言人，在那瞪著眼胡说八道
469636,308,说八道的书还有他们当年录制冠军甲冠军假村姚甲刘呈杰,八道的时候，还有他们当年录制贯君，假贯君、假孙瑶、假刘呈杰
469637,309,这些视频的时候,这些视频的时候
469638,310,还有那个城市兄弟在重庆开了建国以来最大的一个对个人的,还有那个陈氏兄弟在重庆开了建国以来最大的一个对个人的
469639,311,所谓按钱的吹风会,所谓案前的吹风会
469640,312,中央电视台多少次攻击郭文贵然后发红通,中央电视台多少次攻击郭文贵，然后发红通
469641,313,亲爱的战友们你们到你们往回看的是共产党用多大的,亲爱的战友们，当你们往回看的时候，共产党用多大的
469642,314,力量,力量
469643,315,来对付我,来对付我
469644,316,对付我们爆料革命,对付我们的爆料革命
469645,317,所以我们爆料哥们千万不能变成了预测革命风水革命,以我们爆料革命千万不能变成了预测革命，风水革命，绝
469646,318,绝对不能变成什么没几个命不是的,绝对不能变成什么媒体革命，不是的
469647,319,就要我来直播刚才就知道算了就我知道,就像我来直播就刚才就来直播，就这
469648,320,我从来不开不会进步就直接直播,我从外面开会回来进屋直接就直播
469649,321,说说我对这个昨天晚上现在感时惯了吗,说说我昨天晚上到现在的感受，乱
469650,322,让他为你不要讲话你不要网址我这不是当我什么题目露不知道说啥,n 庄就慌了，我说你不要慌，你不要慌，我这直播，他问我什么
469651,323,无论我说啥你是不是喇叭,我说我说啥你随便打
469652,324,就让这个清楚的好中国对世界不想天罗地网并不都是重要的,庄这个题目做得好，“中共对世界布下天罗地网，并不能阻止中
469653,325,旧装置在我心里绝对是,n 庄同志在我心里边绝对是
469654,326,教授家的水平下调是我看过这个人拉机那个下去,"教授的水平。

那个夏教授，我看过那个人 ，垃圾呀"
469655,327,下周你看那个脸你看那个人,教授你看那个脸你看那个人
469656,328,那就是共产党的最真实写照我没见过与一个共产党的相信的人是长得像人一样,那就是共产党的最真实的形象，我没见过一个共产党相信的人长的像人样的
469657,329,你看我们现在就是写得好玩了没我不知道题目就报平安直播随便来,你看我们的John 庄写的题目多好啊？我不知道什么题目，报平安直播让J
469658,330,这就是为什么我们不要体现所谓的专业报的这个媒体,庄随便写题目。我们不要体现专业的所谓媒体，我
469659,331,不需要专业我不是搞媒体的,嘛需要专业啊？我不是搞媒体的
469660,332,昨天,昨天
469661,333,这位,这位
469662,334,啊香港的我的节目我很多女朋友啊女朋友,香港的我的姐们儿，多次流泪，她说我觉
469663,335,啊呀,，她
469664,336,多次流泪啊他说我觉得你太幸福了,多次流泪，她说我觉得你太幸福了
469665,337,你现在有那么多战友,你现在有那么多战友
469666,338,和你一起战斗他说你是全世界最富有的,和你一起战斗，她说你是全世界最富有的
469667,339,他说我们因为他的朋友他的老板都是很有钱的选项呢,她说他们哪有人呢，除了玩麻将还有谈生意，勾女
469668,340,他说他们哪有人的,她说他们哪有人呢
469669,341,除了玩麻将还有谈生意偷女上船去摇头什么都没有,除了玩麻将还有谈生意，勾女，上船去摇头，什么都没有
469670,342,这就是郭文贵,这就是郭文贵
469671,343,在爆料革命当中寻找到了郭文贵的人生价值,在爆料革命的当中寻找到的，郭文贵的人生价值
469672,344,一个字,一个词
469673,345,高兴,高兴
469674,346,两个非常高兴,俩词儿，非常高兴
469675,347,为什么,为什么
469676,348,上个星期天我一个人,上个星期天我一个人
469677,349,我想看文件看我突显华,在那看文件，看得我头昏眼
469678,350,看我的眼睛都是折腾了,看得我的眼睛疼，这是
469679,351,这是一两千夜文件看完了,这是一两千页的文件，看完了
469680,352,突然发现排除了保镖之外没人那就我一人呢,突然发现，哎？除了保镖之外没人呐，就我一人呐
469681,353,然后也看完了突然就想干啥呀,然间想我再干点啥呢
469682,354,一个小时的空窗期,一个小时的空窗期
469683,355,没事干了今天看完了希望完成了,没事干了文件提前看完了，计划完成
469684,356,那种孤独感寂寞感一下就来了,那种孤独感，寂寞感一下就来了
469685,357,这要是真有这钱不爆料啊够了没有,这要是真有一天不爆料了，共
469686,358,哦那个,那个
469687,359,是几千几万为好转让他看到山,几千亩几万亩也好的庄园里坐在那看
469688,360,然后他看着旁边的树,然后呢看著旁边的树
469689,361,然后旁边的这个花花草草我能看起来钥匙,然后呢看著旁边的树，看著旁边的花花草草，我
469690,362,有耐心说半天咱再往床说两天,有耐心说，半天，咱再往长了说，两天
469691,363,你说能听见吗还真是个混蛋不住寂寞所以我这人啊,"你说能天天看吗？还真是，我真是耐不住寂寞。


所以"
469692,364,天生就是战斗了,天生就是来战斗
469693,365,说那天,说了一
469694,366,这个,这打
469695,367,我每天跟我太太会做一起抽个烟他抽他出白烟我出去一下,一起抽会烟，她抽白烟我抽雪茄，突然说了一句，你这从小爱打
469696,368,突然说了一句你在从小爱打架,突然说了一句，你这从小爱打架，你
469697,369,你的打了打气吧现在打了那么大的家,你这打来打去的现在打了那么大的一
469698,370,哎呀我这卡了咋的了这啥意思啊听的话人有话啊我就不吱声了我就抽,哎呀！我这一看这听著是啥意思啊？听著这话里边有话啊，我就不吱声了，我
469699,371,然后,边有
469700,372,待会想小说你的架子够大的,想想又说，你这架打的够大的
469701,373,不让我来干啥我打人家又不知道,不知道我在干啥，我打什么架
469702,374,那好啊你这头发站起来走了,吧你在这抽吧，站起来人家走
469703,375,还就是啊我从小就大家都打了打了跟流氓集团大上了,"了。


就是啊，我这从小就爱打架打著打著跟流氓集团打上了"
469704,376,阿志创办的民宅,了，痔疮帮、欺民贼、卖国
469705,377,卖国贼到我在,卖国贼、盗国贼
469706,378,共产党流氓集团委托吧,共产党、流氓集团、乌托邦
469707,379,然后刚才我将一个人犹太人,邦。刚才我见了一个人，犹太人
469708,380,一直给我和我的同事说爱,一直跟我和我的同事说
469709,381,郭先生你要需要我去给你什么上庭啊或者是做证啊,郭先生你要是需要我去跟你什么上庭啊或者是作证啊
469710,382,我可以给你作证你的胸部啊你的身上啊你的历史,我可以给你作证，你的胸部啊，你的身上啊，你的历史
469711,383,当你听到这些发自内心的人愿意支持你,当你听到这些发自内心的人愿意支持你
469712,384,当你听到这些人的这种,当你听到这些人的这种
469713,385,爱护正义善良,爱护正义，善良
469714,386,这是人的本能,这是人的本能
469715,387,然后昨天晚上我4点就中部木兰女士帮机给我发过来了,良，这是人的本能。昨天晚上4点多钟木兰女士给我发过来
469716,388,啊就是法治社会法治基金的留言,息，就是法治社会，法治基金的留言
469717,389,问我是直接,问我是直接
469718,390,就按原来不没有我配音念的情况下退出去还是我,接按原来，没有我配音念的情况下推出去，还是我
469719,391,我要念一下,我念一下再
469720,392,都是舒服点钟了我被这些,都四五点钟了，我被这些
469721,393,来自北戴河的同志这个所谓的劝告警告不会啊,来自北戴河的同志这个所谓的劝告、警告、误会
469722,394,在跟香港的这几个视频整个展示得着觉我就说我等的我也开始念,"再加上香港的这几个视频整的，我咋睡得著觉啊？


我就说，等等，我开始念"
469723,395,从头年的尾,从头念到尾
469724,396,文加了一个法制社会的文件法制基金了,尾，我念了法治社会的没念法治基金的
469725,397,念的每个地方传来感动热血沸腾战友们你去想想,"念的每个地方都让人感动，热血沸腾。


战友们你去想想"
469726,398,当你训练一个完全不认识你不知道是谁,当你去念一个你完全不认识，你不知道是谁
469727,399,现在直接占有可能在屏幕前,现在这些战友可能就在屏幕前
469728,400,他是生在中国某个地方有的是刚刚的事业,前，他身在中国某个地方，有的是刚刚失业
469729,401,有的是被共产党残害我有的是在一个单亲母亲的陪着孩子读书,有的是被共产党残害过，有的是一个单亲母亲在陪著孩子读书，有的
469730,402,有的是代表母亲,有的是代表母亲
469731,403,这给你发只基金捐款就是相信你跟贵的爆料跟你去想一想,这给你法治基金捐款就是相信你郭文贵的爆料革命，你去想想
469732,404,如果你是谁你是我的你会啥感受,如果你是我你会是啥感受
469733,405,那份信任那份依靠那份托福,那份信任，那份依靠，那份托付
469734,406,可相信你能把不能打遍了全世界我见过面对面的骨子里面的相信我面都不能打,相信你能把共产党灭了，全世界见过面对面的骨子里相信我能灭掉共产党的
469735,407,老人见面的面那几乎很少,了，全世界见过面对面
469736,408,但是他有没有这么多,但是战友们却这么多
469737,409,郭文贵中国片子那么叫你说这个片子真要是要被弄成是这是个超级片,郭文贵他们叫郭骗子，郭骗子要真是没弄成，这真是个超级骗子啊，这得是
469738,410,院子里是多的骗子未来你们这写本书,得是多牛的骗子！未来你们一定写本书
469739,411,超级骗子郭文贵,超级骗子郭文贵
469740,412,这本书一定会和我想想未来我这什么知识产权学术权啊,这本书一定会火，我得想想未来我的什么知识产权啊，写书权
469741,413,什么时候都给法只基金包括我大家说我是骗子说也要写我,什么知识产权啊，写书权啊，都给法治基金，包括大家认为我是
469742,414,也要写,也要写
469743,415,药物出现的时候全写真是恭维,要无限的授权，写真实的郭文贵
469744,416,或者调节滑轨,或者叫揭发郭
469745,417,当你今年这些搞的时候你会怎么想其中有一个,当你去念这些稿的时候你会怎么想？其中有一个
469746,418,留言,留言
469747,419,他是从小在家父母啊就是天天看CCTV天天看,他是从小在家父母天天看CCTV天天看中
469748,420,然而到国外读书爸爸妈妈在其中一次把它,然后到国外读书。有一次他把他的爸爸妈妈
469749,421,他把他的爸妈要想出来了,他把他的爸爸妈妈邀请出
469750,422,右就出来以后看了一圈他把他妈坐在客厅里,有一次他把他的爸爸妈妈邀请出国看了一圈，他爸坐在客
469751,423,拍了他妈的肩膀说老伴啊咱了一辈子白活了,拍著他妈的肩膀说，老伴儿啊咱这一辈子白活了
469752,424,他倒是很激动他的留言这么说那你们可以看到留言给我看着这样的事我就受不了,他妈的肩膀说，老伴儿啊咱这一辈子白活了。他爸当时很激动，他在留言里就这么说的，你可以看
469753,425,如果经历太多了,我经历太多了
469754,426,我家不多少个守卫对共产党可以把祖宗八本在祖宗下班都要,见过多少个所谓对共产党可以把祖宗八辈甚至祖宗下八辈都
469755,427,一场相对共产党的,无偿献给共产党的
469756,428,就像我在江西看的那位母亲,就像我在江西看到的那位母亲
469757,429,和俩女儿姐妹,的俩女儿，还
469758,430,还有他的儿媳妇都被孟建柱给说的说,还有她的儿媳妇都被孟建柱给睡的时
469759,431,当时他们不是荣幸的被孟书记给说了顿荣幸了,当时他们认为是荣幸啊，被孟书记给睡了多荣幸
469760,432,每次的四虎好还觉得似乎梦书记那是多大的荣幸啊,每次都得伺候好啊，觉著能伺候孟书记那是多大的荣幸啊
469761,433,他们从一度怀疑是不是咱太坏了这不对啊不是梦书籍有使命,他们一度怀疑咱们是不是太坏了？孟书记有使命，孟书记
469762,434,他是人民的公仆,他是人民的公仆
469763,435,太辛苦了,太辛苦了
469764,436,孟书记一星期的转运四方,孟书记一星期得染一次发
469765,437,说一家几口伺候他不觉得不对,所以一家几口伺候著不觉得不对
469766,438,这叫孙俪就是一样他不敢说哪个明星,"著不觉得不对。


就像孙立军一样他不管睡哪个明"
469767,439,他不管每天睡多少每行孙俪就在电视里看着你宠着你还不说明天我觉得现在打通了,他不管每天睡多少明星，孙立军在电视上看到这个女孩不错，明天我见她现在打电话
469768,440,或者直接打电话东城公安分局朝阳分局把挣钱伟长来有什么含义,或者直接打电话给东城公安分局，朝阳分局把这个姐们儿找来有事找她
469769,441,吓得直接就给警车给带来了,吓得直接就用警察给带来
469770,442,然后突然说那就说咱不是出现了那就是住在中央警卫局院里面,然后突然孙立军穿著大裤衩子出现了，孙立军住在中央警卫局院里边，哎
469771,443,怎么啦,怎么
469772,444,过来我给你谈一谈谈床上就了就办公床,过来我跟你谈谈，一谈谈床上去了，叫办公床
469773,445,然后给你讲政治,然后给你讲政治
469774,446,这就是我那你看这些留言的书,"这就是共产党啊！


你看那些"
469775,447,你看到多少人,你看到多少人
469776,448,被共产党洗脑和在无知之中就是我刚才说还在大陆深圳吃了西瓜,被共产党洗脑活在无知之中。就是我刚才说的那个在大陆深圳吃著西
469777,449,坐在空调房看会香港之夜属于年龄上的暴动他的那个得意忘形他不知道他多,坐在空调房，看著香港这些年轻人上街所谓的暴动，他在那得意忘形他不知道
469778,450,我可怜,可怜
469779,451,动物有两种级别,动物有两种级别
469780,452,在非洲大草原上,在非洲大草原上
469781,453,去看看吧了在那个那个这个,去看看，从达累斯萨拉姆往
469782,454,达累斯萨拉姆北区的大草原上哪种动物自然中午是自由的观了动物园的,达累斯萨拉姆往北去的大草原上，那叫动物，自然动物是自由的，关在动物园的
469783,455,动物是可怜的,动物是可怜的
469784,456,如果要变成宠物,如果要是变成宠物
469785,457,在这个决定的宠物那就更可怜了,再变成个撅腚的宠物那就更可怜了
469786,458,现在大陆的老百姓,现在大陆的老百姓
469787,459,基本上是关在动物园那个半死的动物你有啥呀,基本上就是关在动物园的饿的半死的动物，你有啥呀
469788,460,你你你认为大草原上的动物互相厮杀是残部的事吗,你认为大草原上互相厮杀的动物是残酷的是吗？你
469789,461,你不知道一个人的本能是什么人的基本价值是什么,你不知道一个人的本能是什么，人的基本价值是什么
469790,462,这就像这位战友留言他的爸爸妈妈这一句话让他给法至今一路也还捐款,这位战友给法治基金捐款的留言相比较，这就体现了一个人对真
469791,463,这就你一个人对真和善,这就体现了一个人对真和善
469792,464,这这个价格的一个基本的判断能力,"和善，假和恶的一个基本的判断能力。

"
469793,465,所以说你看你说我怎么睡着觉昨天他爸爸就是一会那么你看昨天到现在,所以说，你说我怎么能睡得著觉？昨天，啪啪啪……那么一会儿，昨天到现在，咱们都是不
469794,466,咱们都是不到20小时发生了多少次,咱们都是不到二十四小时，发生了多
469795,467,更神秘的事我就不用多说了吧,更神秘的事儿我就不用多说了吧
469796,468,西藏的一位朋友,西藏的一位朋友
469797,469,现在在的是那已经是星期五,现在在DC呢，已经是一星期
469798,470,她说她这么多年她从来没有见过holiness达赖喇嘛,他说他这么多年，他从来也没见过达赖喇嘛
469799,471,他也没见过打沙拉的任何牛人,他也没见过达兰萨拉的任何牛人，这
469800,472,这一次他说他到了华盛顿,这次，他说他到了华盛顿
469801,473,他是前所未有的受到了美国监察的官员的尊敬,他是前所未有的受到了见他的美国官员的尊敬
469802,474,说破去关元件到没有超过20分钟的,说过去官员见他，没有超过二十分钟
469803,475,都是什么1元加10分钟我太了解了华盛顿华盛顿就是卖卖政治关系的地方,"都是什么议员见二十分钟。


我太了解华盛顿了，华盛顿就是卖政治关系的地方"
469804,476,最高的城市,脏的城市
469805,477,骗子最多的地方,骗子最多的地方
469806,478,都在卖这个玩意卖时间见你20分钟那你读者要中间人的介绍个几千美金色,都在卖政治关系、卖时间。见你二十分钟，那你都得要……中间人介绍费都得花几千
469807,479,这花几百美金的,至花几万美金的，公
469808,480,公开的,公开的
469809,481,他说原来都是见识不是20分钟,他说原来都是见十分钟或二十
469810,482,而且都是表示一下问一问就走了然后就就就就拉倒了,"而且就是表示一下，问一问就走了，然后就拉倒了。


但"
469811,483,但是他这次来的话就对他感受最深的事情人家在认证不限时间你说吧,但是，他这次来到华盛顿，他感受最深的事情，人家在认真。不限时间
469812,484,在洗澡发生了什么事情,在西藏发生了什么事情
469813,485,而且只有一个团队在问他,而且是一个团队在问他
469814,486,有懂这个行真的有懂这个中国文化的有懂西藏文化的有懂佛教的,有懂刑侦的，有懂中国文化的，有懂西藏文化的，有懂佛教
469815,487,还有脚部分的这个汉语的然后有很棒的汉语翻译,还有讲部分汉语的，然后有很棒的汉语翻译。他本
469816,488,很好,很好
469817,489,他说现在的华盛顿可不过去看看中国问题西藏问题完全不一样,他说现在的华盛顿跟过去比，看待中国问题、西藏问题，完全不一样
469818,490,宗教问题也是完全不一样,宗教问题也是完全不一样
469819,491,所以说战友们你们能感受到这个世界变成什么世界上这些人不是说像做,所以说战友们！你们能感受到，这个世界变成了什么？世界上的这些人不是像
469820,492,没事找你关打的麻烦你和找中国人的麻烦完全不是,共产党的麻烦去，或者找中国人的麻烦，完全不是
469821,493,谁耍流氓谁背信弃义神月在自己的国民谁威胁,谁耍流氓、谁背信弃义、谁虐待自己的国民、谁威胁国
469822,494,这个国民的安全谁互相威胁香港的安全,胁国民的安全、谁威胁香港人民的安
469823,495,有基本的判断好不好,有基本的判断好不好
469824,496,就像我们的战友留言,就像我们的战友留言
469825,497,我这个字昨天咱这个这个是不在里面的啊,我们的战友留言，这个是不在昨天留言里边的
469826,498,由战友留言,友留言，他捐
469827,499,他捐了60000美元,他捐了六万美元
469828,500,为什么选了60000美元,为什么捐了六万美
469829,501,非常重要就是听了爆料革命,非常重要！就是听了“爆料革命
469830,502,看了一期录得先生结婚,看了一期路德先生的节目
469831,503,立马把房子卖了把房间换成美元了,立马把房子卖了，把卖房子钱换成美元了
469832,504,他说他现在周围的房子那个别了大家了关键是卖不出去的你也花不是美元呢,他说现在他周围的房子跌了大价了，关键是卖不出去，卖出去你也换不成美元
469833,505,他说爆料怎么真就命了,他说“爆料革命”真救命
469834,506,还有一个就是法轮功,还有一个，就是『法轮功
469835,507,他说原来法轮功说是个坏习惯他呀这不相信他觉得反正不足神经病都变,他说原来『法轮功』说这个换器官，他压根儿不相信，他觉得『法轮功』都是神经病、都是
