id,index,content,proofed
469836,508,他是从看了我们节目爆料开始他真的相信法轮功能被换机关的侦有然后他在,他说自从看了我们的爆料节目开始，他真的相信『法轮功』的人被换器官了，他说真
469837,509,在生活中她开始了解我不知道在说反正暴露了,在生活中，才开始了解，我不能再说了，不然把
469838,510,在他的领域里他发奖原来真的是法轮功是被环境外,在他的领域里他发现了，原来真的是『法轮功』人员被换
469839,511,而且是法轮功被幻境管理没法没你会讲理一下,而且『法轮功』被换器官的人没地方讲理去。所以，他
469840,512,所以他捡钱,所以，他捐钱
469841,513,他说你闺蜜,换器官
469842,514,张有为你去想想,战友们，你去
469843,515,你去想想当你念这些学生感受我告诉你在干发之际的每分开支都会公布的,你去想想……当你念这些的时候，你什么感受？我告诉大家——『法治基金』每一分的开支都会公布
469844,516,昨天下午,昨天下午
469845,517,有一个关于调查的案子,有一个关于调查的案子
469846,518,法治基金要进行开董事会,法治基金』要进行开董事会
469847,519,已经是这个月前的事了,已经是三个月以前的事儿了
469848,520,关于王建的调查,关于王健的调查
469849,521,最后,最后
469850,522,我说你们别弄了不是这个钱太大了,我说你们别弄了，我说这个钱太大啦
469851,523,少说10万到28美元,少说十万到二十万
469852,524,单反射互动就两三百万美圆柱形,但凡一折腾两三百万美元就出
469853,525,法治基金你的钱够吗,法治基金』的钱够吗
469854,526,你们别以为那么多人赚钱的数量真没那么大,你们别以为那么多人捐钱呢，那数量真没那么大
469855,527,特别是法治社会的法律性质分开法治基金捐款是法治社会,特别是『法治社会』和『法治基金』的分开，『法治基金』捐款是『法治社
469856,528,大概两倍多,大概两倍多
469857,529,而且反法治经济是没有调查权力的c30有法治社会有,而且，C3的『法治基金』是没有调查权利的，只有『法治社会』有
469858,530,就是半都想当主席那个,就是班农先生当主席的
469859,531,所以我说,所以我说
469860,532,不要脸,不要这样
469861,533,我来借钱,我来借钱
469862,534,我来支付这个律师费用,我来支付这个律师费用
469863,535,因为一下就7000000美元出去了我不忍心让你们捐款人付这个钱,因为一下子几百万美元就出去了，我不忍心让你们捐款的人付这
469864,536,我再一次重生,我再次重申
469865,537,法治社会的账圈未来都会公布,法治社会』的账未来都会公布。如
469866,538,如果有一份年花的喝茶了阿宝跟就装腐败了喝茶了,如果有一分钱花在喝茶了，包括我跟John庄腐败了、喝茶了
469867,539,那我承担一切法律,那我承担一切法律
469868,540,这个,这的
469869,541,我说的这是我要想说呀我在想怎么说啊这对别把这我说的说说高兴了就把人给,到这的时候，我想说一下，我得想想怎么说噢！我别说著说著说高兴了，就把人
469870,542,给露了我就很发了好多好多错误啊,家给露了，我这犯了好多好多错误
469871,543,跟着说话就聊了聊了旧中国的电子现在这个摄像头面加了,跟战友说话，聊著聊著就忘了是在摄像头面前了
469872,544,老蛤蟆江下的鱼那它一定下雨很快,"老蛤蟆将下地狱！(战友留言)


那他一"
469873,545,文由北美平板充值网我哥大陆娱乐圈大部分人都是暗地里制胜,"留言)


中国娱乐圈啊，我觉得这个说法是很不准确的，因为娱乐圈"
469874,546,那你吃饭大家以后从生完之后开始吃饭都是刚刚开始,"是演艺界。


中国人的文化和饮食，真到了……大家真是一定要顶"
469875,547,还有娱乐圈中国娱乐圈啊我觉得说法是很不准确因为中,化和饮食，真到了……大家真是一定要顶礼膜拜的程度。我走过全
469876,548,中国太多与这条路的朋友了,中国人的文化和饮
469877,549,也就理解了,"了，就是演艺界。

"
469878,550,中国的,中国人
469879,551,中国人的文化,中国人的文化
469880,552,喝饮食真到了这个大家纷时一定要顶礼膜拜的成功,和饮食，真到了……大家真是一定要顶礼膜拜的程
469881,553,我走过全世界,我走过全世界
469882,554,我可以说我看了太多的各种民族文化,我可以说是看了太多的各种民族文化
469883,555,中国人的饮食文化天下无双,中国人的饮食文化天下无双
469884,556,我们家不同的法国主食日本厨师中国厨师,我们家有不同的法国厨师、日本厨师、中国厨师
469885,557,但是我们中国人现在这个饮食文化里的化学食品到了一种天怒人怨,但是，我们中国人现在这个饮食文化里的化学食品到了一个天怒人怨
469886,558,我们日本厨师弄了两句子说这东西不见了你碰都不能碰,我们的日本厨师弄了两兜子，说这东西——郭先生妳碰都不能
469887,559,衣服这全都是有化学物品,因为这全都是化学食品
469888,560,不能吃,不能吃
469889,561,这个你都不吃,这全都是
469890,562,法国厨师在船上过夜这个你爱吃的你不能吃,法国厨师在船上，郭先生——这是妳爱吃的，你不
469891,563,我的儿子啊,我给你化
469892,564,然后说的话,然后说我给
469893,565,不能只,不能吃
469894,566,第1条吧,第一条
469895,567,民以食为天的中国文化当中的最核心基础饮食文化太伟大了,民以食为天的中国文化当中最核心的，记住——饮食文化太伟大啦
469896,568,被共产党那么全是化学式,被共产党弄的全是化学食
469897,569,第2,第
469898,570,中国的建筑文化,中国的建筑文化
469899,571,所有中国的建筑,所有中国的建筑
469900,572,建筑语言,建筑语言
469901,573,大概看看除了高铁帽子童帽子的帽子,大家看看，除了搞铁帽子、铜帽子、铝帽子
469902,574,啊然后把中国的毒蛊,子。然后，把中国的斗
469903,575,中国的沙棘,中国的煞气
469904,576,中国的东西中国的斗拱,中国的斗拱、中国的煞气、中
469905,577,中国的缺席,中国的雀喜
469906,578,选给变成了共产党一样变党建筑,全给变成了共产党的语言，变成了党建
469907,579,你看看整个关哪间隔阂近什么北京上海,你看看！整个共产党的建筑的核心是什么？北京
469908,580,就是抄美国吗,就是抄美国嘛
469909,581,完全超吗,完全抄嘛
469910,582,叫我买的文化全是美女互相不喜欢自己的很多中国人,"叫“买爹文化”！全是没爹、不喜欢自己的爹。


很多中国人啊，过"
469911,583,过去是以父母为荣的,过去是以父母为荣的
469912,584,作为原来讲话,子，我娘就是一
469913,585,我到时我带着我我的我娘满手是剪子我娘这就是呀,我当时带著我爹我娘，满手是茧子，我娘就是一个家
469914,586,家庭妇女,家庭妇女
469915,587,这除了再见这些人的时候你不想了有时候丢人呐你父母你看看,这些人的时候，都说文贵你不感觉……有些丢人呐？你看看你父母穿
469916,588,穿了也没那么好这个也没说的油光水滑的你母亲还非常手的工作的时候,穿的也没那么好，也不是油光水滑的，你母亲那双手都是工作的手
469917,589,我,我
469918,590,大陆,大怒
469919,591,反正我这个翻脸就是因为我长的父母我不会我才感觉得我我真的,翻脸，我说就是因为我有这样的父母，我郭文贵才感觉到我真的
469920,592,我有丈夫,我有这样
469921,593,郭文贵没有一个说我不是是生死我没有当官的人也没有钱也没有用,郭文贵没有一个……我不是私生子，我没有当官儿的爹，也没有有钱的爹，也没有
469922,594,有名的点,有名儿的爹
469923,595,这是我最大的荣幸,这是我最大的荣幸
469924,596,是我一生最大的荣耀我有这样的贫苦的穷的爹娘,是我一生最大的荣耀！——我有这样贫苦的、穷的爹娘
469925,597,没被污染的电脑,没被污染的爹娘
469926,598,那么文化当中建筑文化和所有的饮食法的什么事首先一定要为主,那么文化当中，建筑文化和所有的饮食文化、历史文化，是首先以爹
469927,599,中国现在共产党多少官员带着父母出来呀一束的玩艺农民,中国现在是共产党有多少官员带著父母出来呀？一说爹妈
469928,600,你不要把那个完了我有日式淡化了我说我就看看老人家,"妳不要管他们，不用管他们！


我认识一个当官儿的，我说去看看家里"
469929,601,我都说过就妈妈妈亲妈,有的我说过，就是骂妈、骂亲妈
469930,602,直接我看到政法委的安全部的2不敌人把自己的亲妈就是三个字,直接被我看到，政法委的、安全部的、二部的人，骂自己的亲妈，就是三个字
469931,603,一直麻麻的傻子都是红了,一直骂……骂到脖子都是红的
469932,604,这就是共产党,这就是共产党
469933,605,然后在过哪个会上再在开会说,然后，在共产党的会议上，在开会时
469934,606,爹死了我不回去妈病了8年我不回去,爹死了我不回去，妈病了八年我不回去
469935,607,然后在党内要开会,然后在党内要开会
469936,608,然后自己还有苦你说这么不要脸的共产党的就是,然后自己还要哭。你说这些不要脸的共产党，爹不
469937,609,爹不要娘不要害你爹娘为止,爹不要，娘不要，还以爹娘为耻
469938,610,然后你再反应是什么反应就见着我的话,然后你在反映是什么，反映就是建筑
469939,611,和你的所有的核心文化价值观就是你讲什么的语言,和你的所有的核心文化价值观，就是你讲什么样的语
469940,612,所有建筑全美的太子天天说那美帝国主义拳超人就美国潮州一个,所有建筑全买爹，还天天说人家美帝国主义，全抄人家美国，抄欧洲，一个
469941,613,一个照搬,一个照搬
469942,614,然后,然后
469943,615,服装自己的一双大为朝美味之风是不是个大胖子这个当年太,服装，自己的一说我大魏朝，我北魏之风，是不是，我大唐当年开放
469944,616,开放东路兄了,开放都露胸了
469945,617,但是你不能穿西装吗,但是你不都穿西装么
469946,618,都打了领带吗都提前打好的原来伊拉克现在都赚了钱了保姆你把我给打好,都打著领带么，都提前打好的，原来一拉得，现在弄那挂那墙上，保姆，女保姆给
469947,619,然后,然后
469948,620,你咋地软的头发既不是来自日本的吗,"一拉，你染的头发剂不是来自日本么。

所"
469949,621,所有的东西虚假的买的文化,所有的虚假的，买爹文化，电
469950,622,这是一枚了吧,不是来自日本么。
469951,623,电影,电影
469952,624,电影大家教娱乐圈电视剧,电影大家叫娱乐圈。电视剧
469953,625,电影电视剧大家看看,电影电视剧大家看看
469954,626,说好了500分说的一文不值,说好莱坞把人家说的一文
469955,627,所有一切都照相机摄像机拍摄方式场面一切,所有一切都抄，相机摄像机拍摄方式，场面，一切
469956,628,都是以好莱坞为他是超的四不像,都是以好莱坞为准，而且抄的四不像
469957,629,又是买的文化,又是买爹文化
469958,630,现代的现代的所谓娱乐圈,现代的所谓娱乐圈，再看
469959,631,再看了中国的现代文学中文化追随者写作,再看看现在中国文学中，文学最核心写作
469960,632,文学哲学,文学，哲学
469961,633,历史,历史
469962,634,大家看一看,大家看一看
469963,635,有几样东西是中国的,有几样东西是中国的
469964,636,全是重物重创美国的,全是抄欧洲抄美国的
469965,637,中国领导人一出去读书有几个读中国书四书五经的,中国领导人一出去读书，有几个读中国四书五经的
469966,638,有几个数独了他们崇拜的鲁迅的,有几个读说他们崇拜的鲁迅的
469967,639,有几个读了中国是大清的还是大堂堂大宋的,有几个读了中国是大清，还是大唐，还是大宋的
469968,640,有几个意图都是人家什么,有几个一读都是人家俄
469969,641,这个俄罗斯的说法国的是英国的时候美国的主,人家俄罗斯的书，法国的书，英国的书，美国的书。又是
469970,642,又是买地方,又是买爹文
469971,643,这个加在一起成为北京教育娱乐圈和文学圈,这个加在一起，称为北京叫娱乐圈和文学圈
469972,644,知识圈,知识圈
469973,645,这些圈里面人他没有尊严,这些圈里面的人没有尊严，他
469974,646,他没有任何吃饭的,他没有任何吃饭的
469975,647,维哥吃饭的权利,吃饭的权利，没
469976,648,没给他自由,没给他自由
469977,649,把嘴给封上了甚至没有去和外面交流的这种文学的基本的要素,把嘴封上了，甚至没有去外面交流的文学的基本的要素，甚至知
469978,650,甚至知道,甚至知道
469979,651,中国历史和文学的真相,中国历史文学的真相
469980,652,怎么可能有一个有娱乐圈有文学圈有知识群,怎么可能有娱乐圈，有文学圈，有知识圈呢
469981,653,这就能看到茶叶量那个畜生就在那个庭上,这就看到夏业良那个畜生，就在那个庭上
469982,654,每被人家那个法官就是闭嘴闭嘴闭嘴,就在那个庭上，叫人家法官，闭嘴，闭嘴
469983,655,喂你在哪我找了那个,宽，江涛，张维，这
469984,656,为11名决定明确定名单排名,叶宁，撅腚宁，咬耳朵宁，郭
469985,657,波宝诗歌牧之李洪宽,郭宝胜，李洪宽
469986,658,姜涛,江涛
469987,659,张伟,张维
469988,660,你这帮畜生女孩休息是不是熊宪民,维，这帮畜生，你说还有熊宪民，垃圾
469989,661,垃圾这就是中国所谓的知识界,垃圾，这就是中国所谓的知识界
469990,662,再一看我们像演一件什么现在,再看我们演艺界，走到全世界的演
469991,663,受到全世界的眼睛杀人,走到全世界的演艺界
469992,664,靠啥呀,靠什
469993,665,靠中国人的市场,靠中国人的市场
469994,666,被垄断的市场,被垄断的市场
469995,667,靠和共产党的关系勾兑,靠和共产党的关系和勾兑
469996,668,你你真的是是是又尊敬你吗,你真的试试有人尊敬你吗
469997,669,好莱坞的你告诉我哪个导演哪个明星我不认识有几个我不认识的,好莱坞的你告诉我哪个导演，哪个明星我不认识，有几个我不认识的
469998,670,有多少人不认识郭文贵的,有多少人不认识郭文贵的
469999,671,我胖不酒店盘古四合院,我盘古酒店，盘古四合院
470000,672,和我的历史上被人投诉了中国好几个民族别忘了是来自郭文贵最少的公司,和我的历史上本人投资的中国好几个明星别忘了是来自郭文贵最早的
470001,673,我现在不想出好多眼上最早制作公司签约,我现在不想说，好多演员最早是跟我公司签
470002,674,我和老公说,我后来把公司
470003,675,我有几个不认识的,我有几个不认识的
470004,676,这些人多少人要需要给我认识,这些人多少人要跟我认识
470005,677,我刚没有人去尊重他们,"我认识？

没有人去尊重他们"
470006,678,没有人真容都是专业的基本都把你当,没有人真认为他们是专业的，基本都把你当
470007,679,演艺界的济南进一队的,演艺界的妓女妓男对待
470008,680,不管你什么表达了有多有钱多有关系最后人家背后都是看不起你的,"不管你向人家表达了你多有钱，多有关系，最后人家背后都是看不起你的。

所"
470009,681,所以说占有了,所以说战友
470010,682,我们要说的这个时候再说到就是昨天晚上,我们要说到这的时候，再说到就是昨天晚上
470011,683,香港的最新,香港的这些
470012,684,在大街上这些学生孩子太美了,在大街上这些学生孩子太伟大了
470013,685,他们的所有的行动这才是,他们的所有的行动，这才是
470014,686,中国人应该有的武器,中国人应该有的骨气
470015,687,中国人应该有的权利,中国人应该有的权利
470016,688,中国人应该有的让全世界展示的我们这个种族,中国人应该有的，向全世界展示的，我们这个族
470017,689,这个族类起码有的尊严,这个族类起码有的尊严
470018,690,我渴了亲密教说中国人种绝对没问题,我和亲密战友说，中国人种绝对没问题，为
470019,691,为什么从香港看到我昨天跟他们直接孩子其中一个女孩子我问她,为什么，从香港看到，我昨天跟他们这些孩子，其中一个女孩子我问他
470020,692,我说你现在最大的感触是什么我不再相信经常了,我说你最大的感受是什么。「哦，我不再相信警察了
470021,693,哭笑不得,哭笑不得
470022,694,然后,然后
470023,695,我600个孩子太搞笑了说哎呀,一个孩子才搞笑呢，「哎呀，我
470024,696,他是我觉得香港很快会得到自由的,，我认为香港会很快会得到自由的
470025,697,我哭笑不得,我哭笑不得
470026,698,就是,就是
470027,699,背,被
470028,700,真正的中国人在这种,真正的中国人，在这种
470029,701,英国英国法律这种影响下中国人是很单纯很善良的,英国法律影响下，中国人是很单纯很善良的，非常善
470030,702,非常善良非常善良,"非常善良。

所以说亲爱的战"
470031,703,所以说亲爱的战友们,所以说亲爱的战友们
470032,704,这个感触良多呀,们，感触良多的呀
470033,705,这个感触良多,们，感触良多
470034,706,这个官员1000年爆料涉及到任何的人和事特别是海航,"战友们，感触良多的呀。

由于前天爆料，涉及到任何的人和事，特别"
470035,707,姚依林的师生孙,姚依林的私生孙
470036,708,姚依林的是生存的事情引起了巨大的反响,姚依林的私生孙子的事情，引起了巨大的反响
470037,709,有这个不是质感很多人是吧,有不适之感，很多人。但是
470038,710,但是我告诉大家,但是我告诉大家
470039,711,这还没开始呢,这还没开始呢
470040,712,一切都是刚刚开始,一切都是刚刚开始
470041,713,他们会有,他们会有
470042,714,他们会有反击的,他们会有反击的
470043,715,他不反击再没机会,他们不反击咱没机会
470044,716,就像海洋,就像海航
470045,717,还好的是病句,海航将继续
470046,718,还要继续壮大最后呀,航将继续壮大。」 最后咋
470047,719,等他说话,等他说话
470048,720,等他行动队等他反击,等他行动，得等他反
470049,721,就像png太萌这个太无就是2号的还好,就像PAG太盟，这个PAG就是二号的海
470050,722,你不让他在纽约起诉,你不让他在纽约起诉
470051,723,你不让他把书中进行下去,你不让他把诉状进行下去
470052,724,那不就完了吗那就一定是是让他自己,"那不就完了吗？那跑了就，

一定要让"
470053,725,用他的谎言用他的虚假证据用他的,用它的谎言，用它的虚假证据，用它的
470054,726,不可撤销的法庭的所有的文件来把它干掉,不可撤销的法庭的所有的文件把它干掉
470055,727,就像马上要被抓的几个人一样都有这种两年了,就像马上被抓的几个人一样，叫他折腾两年啦， 我
470056,728,我就要忍住,我就要忍住
470057,729,战友们忍不住,战友们，忍不住
470058,730,我们就有大麻烦,我们就有大麻烦
470059,731,必须要忍住当你忍住的时候,必须要忍住！当你忍住的时候
470060,732,你真的就是海阔天空,你真的就是海阔天空
470061,733,忍什么你不要动怒不要冲动,忍什么？你不要动怒，不要冲动
470062,734,一定要让敌人先出手,一定要让敌人先出手
470063,735,一定要倒过谁和器皿先出手,一定要盗国贼和欺民贼先出手
470064,736,一定要拿由这些人所谓的互相欺骗开始,一定要让他这些人所谓的互相欺骗开始
470065,737,就像眼睛一样我保证你赢,就像叶宁一样，我保证你赢
470066,738,夏业良你赢了490万,夏业良你赢了490万
470067,739,加多宝是欺骗照颜照延期待夜年夜年七班赵延波保证,郭宝胜欺骗赵岩，赵岩欺骗叶宁，叶宁欺骗赵岩郭宝
470068,740,让我几千万美元然后完了,然后来骗我几千万美元，结
470069,741,现在好了打过法国起诉,相咬完了，砸锅，砸锅
470070,742,他这个必然的结局,他这个必然的结局
470071,743,就像那个,就像成
470072,744,怎么成这样还有什么一个叫马可的孙子,像成水炎，还有什么叫马可的孙子，还有
470073,745,还有那什么袁建斌在哪现在让他们互相互相,还有什么袁建斌在哪呢，让他们互相咬互相弄，走向
470074,746,走向法庭,走向法庭
470075,747,把所有的钱给历史权上,了，所有的钱，底，历史，全让
470076,748,咱们就用针一个计划就是用针把它明,咱们就用真，一句话，就用真把他们
470077,749,真实用他都是假的,真实。因为他们都是假
470078,750,香港所有的脸书的被屏蔽了,香港所有的脸书都被屏蔽
470079,751,我在很早以前说我香港会把网络给你关掉,我在很早以前说过，香港会把网络给你关掉
470080,752,会把你网络都已关掉,会把网络都给你关掉
470081,753,哎呀我跟你说这个谁这个赵炎那我本来我给他留些面子我给他做那个因为他,冯琦，刘延东他们恨死我了，在北大屡屡施压来残害我们。就是赵岩找我，给魏京生
470082,754,叫这个冯其留言都能吓死我了在北大吕吕是压在残害我们,京生先生捐了5万美元，捐完钱以后再也没出现过，不知道
470083,755,就是赵岩找我,不知道赵岩
470084,756,给这个魏京生先生捐了50000美元捐了50000美元给魏京生先生,给魏京生先生捐了5万美元，捐完钱以后再也没出现过，不知
470085,757,交完钱以后再会出现了我不知道赚钱有没有拿回复只是上,捐完钱以后再也没出现过，不知道赵岩先生有没有拿回扣这事
470086,758,从来没出现过,从来没出现过
470087,759,魏京生先生所说的,魏京生先生所说的
470088,760,这个微博文贵在这个什么这个宏空那还折腾的是那个钟完全不存在,折腾的事，完全不存在，他是为整个中国的私人企业家是对的，但是我捐款，跟这个
470089,761,他是为整个中国的,他是为整个中国的
470090,762,剩下只是对的,生先生直接
470091,763,但是我捐款跟这个没关系是微晶石先生直接要求,但是我捐款，跟这个没关系，是魏京生先生直接要求
470092,764,和赵岩直接要求,和赵岩直接要求
470093,765,捐60000美元给魏京生先生,五万美元给魏京生先生
470094,766,Google会不会被美国开当你干啥不过的是天堂只是担心,歌会不会被美国开到，你担心啥谷歌的事啊，担心啥谷歌啊，亲爱的兄
470095,767,亲爱的兄弟呀是大香港同胞啊,亲爱的兄弟，担心咱共产党，香
470096,768,人民币会变成废纸吗子一定会的,人****民币会变成废纸吗？一定会的
470097,769,一定会的港币会变成废纸,一定会的，港币也会变成废纸
470098,770,我刚才说一下我贴出去那个王金山的梦想那个啊,我说一下，我刚刚贴出去的王岐山的梦想那个
470099,771,是一个战友发给我的私信,是一个战友私信发给我的
470100,772,我说实在话我不相信啊因为现在我每天都能收到什么这个比原来好,我说实在话，我不相信。因为现在我每天都能收到这信息那信息，都是
470101,773,我每天都能收到啊这个什么这个有人这个新一代信息总是为,我每天都能收到这信息那信息，都是喂假料的。你见我用过
470102,774,会讲要的,喂假料的
470103,775,你叫我用过吗,你见我用过吗
470104,776,为当我采用的是英文解说,我采用的信息，我一定说：这是真的
470105,777,这是真的吗,这是真的吗
470106,778,然后我都我都说着这事如果是真的会怎么样怎么样,然后我就说，如果是真的会怎么样怎么样。我
470107,779,我从来不会,我从来不会
470108,780,在我没有任何,在我没有任何
470109,781,调查,调查
470110,782,何时请换下我说这个信息是真的从来不会,核实的情况下，我说这信息是真的，从来不会
470111,783,Oculus Touch有时候问我一些关于中国信息或者我不知道,有时候问我一些关于中国的信息，我说我不知道
470112,784,Compass,从来
470113,785,还有美国的金融家每天很多顾问我这种问题你可以问他们99.95的,还有美国的金融界，每天很多人问我问题，你可以问他们
470114,786,不知道,不知道
470115,787,我不确定我都不知道,我不确定我就说不知道
470116,788,我不是我不知道我不能为了,我不确定我就说不知道，我不
470117,789,还有人为我昨天说文会呀这个吧来了吧香港这个做工港币人民币,还有人昨天问我说，文贵啊，香港这回做空港币、人民币，这回发大财了吧
470118,790,我再次向天发誓,我在此向天发誓
470119,791,如果光为在,如果郭文贵在
470120,792,这次爆料革命老人会包括香港的港币和人民币的,这次爆料革命当中，包括香港的港币和人民币
