id,index,content,proofed
469329,1,Closer,
469330,2,已经开始了第一个站又来了南越南语,
469331,3,南越的一个是南越啊杀猪的是第2杀猪的,
469332,4,第三是冠军的亲爹,
469333,5,大是大非不糊涂啊是第4东湾仔,
469334,6,来第5中安仔是第5,
469335,7,我觉得就特别累太亮了就状态量,
469336,8,When文鸟的六股长的73个学前奏的吧,
469337,9,锐界超然的酒跟谁七哥的10,
469338,10,愚人79亚当中然,
469339,11,战神战报厨房孙在哪,
469340,12,潘玮柏记,
469341,13,高俊,
469342,14,我觉得就装了是不是你觉得太亮了我给你的灯太亮了,
469343,15,18我就你那采光太亮了,
469344,16,是83233弹我我我,
469345,17,为了喜马拉雅的是为了下来的肉夹馍专用中山,
469346,18,是不是,
469347,19,很多事吧,
469348,20,但是呢这个就是你们就我就应该稍微浓和才有融合了太你再稍微慢一点然后,
469349,21,我里面的话不是我说你把这个灯稍微暗一点,
469350,22,就是啊,就是
469351,23,电影代购验,你还很高兴
469352,24,店里面配的阿根里面配的,当你给别人的时候，你还很开
469353,25,今天礼拜不是太红和小皮匠出了小比较复杂,"是感受到，就是说我被她感染。

她说，现在"
469354,26,叫法一个小皮匠买个销售的调整下没有没有,呆在美国纽约，你有自由。 哎哟，我这心里感触太深了。 我说没想
469355,27,Windows能帮我帮马上帮帮帮,万，3000万捐给学生。 她给我讲述
469356,28,愚人节目兰传奇拿了我最近不出现了听说,0万捐给学生。 她给我讲述了这些孩子们
469357,29,这个最近木兰传奇交上新男朋友了,这个领带是她当年的生意，爱
469358,30,听说你男朋友逛澳大利亚呢,去年爱马仕领带给我弄了
469359,31,七个小白和草根啊,我给它戴上了。这
469360,32,哎呀,爱马
469361,33,现在都市之后新男朋友心里朋友只有就装和我在这辛苦的工作,意。 她今年大概60多岁。是一个在香港经常读中国的文学，哲学的人，在
469362,34,作者,学，哲
469363,35,昨天晚上工作了一夜大家都看见我了这工作了一样,最近她的感受太深了。她说她每次看我直播的时候，感同
469364,36,昨天跟香港的联络最多跟香港的,同身受。她也看那个大纪元的直播和香港苹果的
469365,37,连线连线感触特别多感触特别多我至今天上午出去,的直播和香港苹果的直播，然后她又在现场。她说你知
469366,38,开会啊,在现
469367,39,这个回来和一位我非常这个亲密的战友这个,这些孩子上街，如果大规模地上街一
469368,40,这个聊天我说昨天晚上的感受了,后她又在现场。她说你知道这个
469369,41,这个,这个
469370,42,1921 199,感
469371,43,一年年底,近她的感
469372,44,第一次我从看守所出来到香港的时候,她说她每次看我直播的时候，感同身受
469373,45,啊,她也
469374,46,这个,直播的
469375,47,当时在一个桌子上的,大纪元的直播和香港
469376,48,一个桌子吃饭的人一位女士现在你想想这都太可怕了这次这座20,又在现场。她说你知道这个香港一天这些孩子上街，如果
469377,49,这几年快30年了,这个香港一天这
469378,50,当时啊他问我文贵啊,现场。她说你
469379,51,你在香港,香港一天
469380,52,最开心的是什么,些孩子上街
469381,53,最喜欢的是什么,天这些孩子上街
469382,54,我当时说,场。她说
469383,55,我羡慕你们的自由,香港苹果的直
469384,56,因为他当时根本不知道对面这个人角度的障碍留任选手博的男孩缠着布,也看那个大纪元的直播和香港苹果的直播，然后她又在现场。她说你知道这个香
469385,57,身上还很多伤啊他完全不知道我们对这个自由她看了他们的性,说你知道这个香港一天这些孩子上街，如果大规模地上街一天得
469386,58,幸福的感受他完全不知道,现场。她说你知道
469387,59,昨天晚上啊他告诉我说他把他的房子卖了1.81,播，然后她又在现场。她说你知道这个香港
469388,60,三千万捐给了学,看那个大纪元的
469389,61,而且那个叫王款的那种骄傲,看那个大纪元的直播和香港
469390,62,那种开心,道这个香
469391,63,真的是这个世界的最伟大的事情就是当你给别人的时候,天这些孩子上街，如果大规模地上街一天得多少钱消耗？大
469392,64,你也很开心当你捐了钱的时候你还很高兴这次真的是了不起,你知道这个香港一天这些孩子上街，如果大规模地上街一
469393,65,谁说我真是感受到就是说让我被他感染,这些孩子上街，如果大规模地上街一天得多少钱消耗
469394,66,可是他说现在不想死我特解雇你,香港一天这些孩子上街，如果
469395,67,我是你下午我什么相比待在美国纽约,说你知道这个香港一天这些孩子
469396,68,你有自由的心灵感触太深了我说没想到几10年后现在,你知道这个香港一天这些孩子上街，如果大规模地上
469397,69,轮到你羡慕我,果大规模地上
469398,70,卡30003000碗强的学生,港一天这些孩子上街，如
469399,71,他给我讲述了这些孩子们在大街上的故事,天这些孩子上街，如果大规模地上街
469400,72,真的是让他当然他一直独身啊他都未婚未婚未婚,这些孩子上街，如果大规模地上街一天得多少钱
469401,73,这个领带是他当年的生意爱马仕领带是他的声音,这个香港一天这些孩子上街，如果大规模地上街一天得多
469402,74,这是去年爱马仕领带,这些孩子上街，如果大规模地上
469403,75,给给我这个是弄了20多条,这个香港一天这些
469404,76,20多条我没没带今天早上我很少来往是明白这就是,大规模地上街一天得多少钱消耗？大家算一算，水、口罩、雨伞、黑
469405,77,过去式了我今天怎么带上了,上街，如果大规模地上街一天
469406,78,这是他的生意,这些孩子上街
469407,79,他是今年,她说你知道
469408,80,今年大概,看那个大纪
469409,81,60多岁,果大规
469410,82,人是一个在香港很少经常读中国的,个香港一天这些孩子上街，如果大规模地上
469411,83,文学,这些
469412,84,哲学的,这些
469413,85,最近她的感受太深了,在现场。她说你
469414,86,他说他每次看我直播什么感同身受,候，感同身受。她也看那个大纪元的直播和
469415,87,他也看那个大纪元的直播和香港苹果的直播,她也看那个大纪元的直播和香港苹果的直播
469416,88,然后又在现场,然后她又在现场
469417,89,他说你知道这香港一天这个孩子上街如果大规模上建的多少钱小豪,她说你知道这个香港一天这些孩子上街，如果大规模地上街一天得多少钱消耗
469418,90,大家算一算,大家算一算
469419,91,水,水
469420,92,口罩,口罩
469421,93,雨伞,雨伞
469422,94,黑衣服,黑衣服
469423,95,特别是医疗的一切给一些提前预定的一些药还有一些给那些孩子,特别是医疗的一些器材预定的，一些药，还有给那些孩子们的保护，还有一些
469424,96,怎么保护,子们的保护
469425,97,还有一些一些基本的大家分享的齿轮大家算上这成本每一次都是11港币以上,还有一些基本的大家分享的吃的。大家算算这成本，每一次都10亿港币以上，每次
469426,98,每次都11港币上都是谁去全是自发掘的,每次都10亿港币以上。都谁捐的呀？ 全是自
469427,99,他不是哪个组织还没有组织,它不是哪个组织，它没有组织
469428,100,然后给我讲是说他的一个好闺蜜,然后给我讲述说，她的一个好闺蜜
469429,101,跟他同龄的原来经常给我们做做鲍鱼吃这个人结过婚后来离婚了,跟她同龄的，原来也经常给我们做鲍鱼吃。这个结过婚，后来离婚了
469430,102,也是房地产开发商那也是个几百亿的身家经常跳舞,也是个房地产开发商，那也是几百亿的身价，经常跳舞
469431,103,他跟我说把我也给吓一大跳他说你知道他赚多少钱他捐了两个亿,她给我说，把我也下一大跳。她说你知道她捐多少钱？ 她说捐了2个亿
469432,104,经常在香港说经常给我送鲍鱼吃他经常冒充包鱼还有,经常给我送鲍鱼吃，经常给我送鲍鱼，还有广东的橄榄菜，她自
469433,105,还有广东的橄榄菜,还有广东的橄榄菜
469434,106,他自己做了,她自己做的
469435,107,给我送去,给我送去
469436,108,他叫了两个,她捐了2个
469437,109,说每次他们都上街,说每次她们都上街
469438,110,大家想想这些人可真是有钱的人可这些人少年一战一天是真的过得收的,大家想想这些人可真是有钱的人，可这些人上街一站一天可真是够她受的，但
469439,111,但他们都坚持,但是他们都坚持
469440,112,他说他特别欣赏我妈的这次不要脸的事我可不是我们都不知道是不是要脸的,她说她特别欣赏我骂的那个四不要脸。她说我可不是，我们都不是那四不要脸的
469441,113,唉我感触特别深是昨天大家看到了我跟群里上有一直在联系啊着急,我感触特别深。虽然昨天大家看到了我跟群里战友一直在联系，几个小
469442,114,几个小时工作但是我特别的幸福睡了不到三个小时早上起来就去开会但是我就觉得,几个小时工作，但是我特别地幸福。睡了不到3个小时，早晨起来就得开会。但是我就觉得神
469443,115,精神清气爽,就觉得神清气爽
469444,116,还有一个就是昨天的暴烈好这个引起了强烈的震撼哟,还有一个就是咱们的昨天的爆料，又引起了强烈的震
469445,117,好久没有这样了,好久没有这样了
469446,118,在中在中南海中南坑长安街,在中南海中南坑，长安街，北戴
469447,119,Baseadapter引起了巨大的震撼,北戴河引起了巨大的震撼
469448,120,有些所谓的老领导给我打电话文贵这个是误会,有些所谓的老领导给我打电话，文贵，这个是误会
469449,121,周围的好了这就证实物别谈这个是人家的不是一个月,这叫误会，这个是误会。别谈这个事，人家菲利浦是个越
469450,122,你太人在干啥,你谈人家干啥
469451,123,Internet马修港香港爱情谢谢我爱香港,港说这些干嘛啊？香港人谁记得你啊？香港
469452,124,我说爱情打的时候我还是给大家说,友说我代表香港人代表我自己
469453,125,老领导说你问那个香港说的干吗,港朋友说我代表香港人代表我
469454,126,香港人谁记得你呀香港人是谁谁敢给你呀,香港人谁记得你啊？香港人谁感激你啊
469455,127,包括香港朋友说这个我代表香港人特别我自己感谢你我发誓,包括香港朋友说我代表香港人代表我自己感谢你。 我发自内
469456,128,现在说,心地说
469457,129,我最讨厌的就是这个是吧做完以后得等那地方有什么回应,我最讨厌就是这个事做完以后吧，等待对方有点什么回应
469458,130,等待的回报,等待著回报
469459,131,他所谓的感谢我不需要任何人的感谢,和所谓的感谢。 我不需要任何人的感谢
469460,132,为什么要说感谢谁没必要感谢我我光为从看守所出来的最大的帮我的就是,为什么需要感谢？ 谁都没必要感谢我。我郭文贵从看守所出来最大的帮我的就
469461,133,香港和台湾,香港和台湾
469462,134,我敢跟香港,我感恩香港
469463,135,我应该的,我应该的
469464,136,如果上天有公平的话我应该为香港做这行不做得太少了我不需要任何人,如果上天有公平的话，我应该为香港做这些，我做的太少了。我不需要任何人
469465,137,客人的赞美我不需要任何人的感激这老廖说为了啥我为了啥你不明白,美，我不需要任何人的感激。这老领导说，为了啥？ 我说为了啥你不明白
469466,138,还是你的可怜,才是你的可怜
469467,139,北戴河就那么好玩吗在美国任何一个海岸,北戴河就那么好玩吗？在美国任何一个海岸
469468,140,逗逼你北戴河漂亮那叫海水吗,都比你北戴河漂亮。那叫海水吗
469469,141,你们家的孩子用是不让老百姓在家把一个成立健全人类最流氓的纠正,你们在海里游泳的时候不让老百姓参加。把一个城给戒严。全人类最流氓
469470,142,把一个城市给戒严了让你们这些同志们胆子会啊抠女呀,把一个城市给戒严了，让你们这些同志们在那块扣女
469471,143,啊扣女啊,扣女呀
469472,144,昨天,昨天
469473,145,这个,这些
469474,146,有警察给我说说要抓某人这个让我签字,有警察给我说，说要抓某人，让我签字
469475,147,我说可以我这人抓了也不去哪呀,我说可以。这人抓了以后去哪呀
469476,148,说在纽约的一个什么最有名的什么叫肉可什么监狱他那里98%的,说在纽约的什么最有名的叫什么ROAK监狱。他说那里98%的
469477,149,大多数都是非主体很强壮,的都是非洲裔，很强壮
469478,150,他说咯这个被抓以后他一辈子不会翻小回那里了,他说如果这个人被抓以后，他一辈子不会再想回
469479,151,哎我说这个人我说他要经济会发生什么事啊,哎，我说这个人他要进去以后会发生什么事呀
469480,152,他说,他说
469481,153,我们看过一个中空的中共的一个原来一个内部的一个片,我们看过一个中共的原来一个内部的一个片子，视频，几个干
469482,154,先的视频,想想
469483,155,几个干部,个监狱
469484,156,虐待一个女孩,虐待一个女孩
469485,157,他说在那个监狱里就会发这种事他都是男的你想想那个就被套上了,他说在那个监狱里就会发生这种事。都是男的，你想想那个，被掏肛啦，就
469486,158,就被套干了行了但愿这位长期威胁,就被掏肛了。 把我笑的快不行了。 但愿这位
469487,159,写我啊威胁要杀死我了还在这个DC开听的还有在这个,胁我，威胁要杀死我的，还在这个DC开庭的，还有威胁
469488,160,这个威胁完一瓶要杀得完全停了,这个DC开庭的，还有威胁王雁平
469489,161,这个家伙尽快能到了就报道的享受一下北戴河大雨,这个家伙，尽快到那去报道去，享受一下北戴河待遇
469490,162,北戴河就是什么偷人的小姑娘的刚,北戴河就是什么？掏人家小姑娘的肛
469491,163,操中国老百姓的钱袋子,掏中国老百姓的钱袋子
469492,164,决定下一步要谁的命,决定下一步要谁的命
469493,165,灭谁的门,灭谁的门
469494,166,这个把私生子私生女安排打过去跟谁结婚跟谁说的,一个把私生子私生女安排哪国去，跟谁结婚，跟谁生
469495,167,孩子,孩子
469496,168,Ketika纽约这个结局啊不一样指头钢指头钢,"纽约的这个监狱呀不一样，只掏肛，只掏肛。

最"
469497,169,最近很流行啊因为这个潘女士这个有一个美丽的照片,最近很流行啊，一位潘女士有一个美丽的照片，撅著腚
469498,170,天啊这个这个接着这个定的决定照这个还白晋宁率是多给你脚,士有一个美丽的照片，撅著腚的，撅腚照，还把叶宁律师的耳朵给
469499,171,现在想与海内外了,现在享誉海内外
469500,172,这个相当出名,这个相当出名
469501,173,估计啊有任何一部人要要到那里边每天去决定找去了,估计有人，要有人到那里面每天去撅腚照去了，要撅腚
469502,174,那么究竟这啊我这是见过见过世面啊,我这人是见过市面啊，闯过江湖，没见
469503,175,那幢不教你没见过发Twitter发那么性感的推文的,啊，闯过江湖，没见过发推特发那么性感的推文的
469504,176,连那个假设都出来了我的娘来真是受不了这个原来也有这个爱好啊,连那俩字都出来了，我滴娘来，真是受不了。原来叶宁有这个爱好，这
469505,177,这个这么不健康的爱好所以说我很纳闷啊看看照片就会对你,这个爱好，这么不健康的爱好。所以说我很纳闷啊，看照片
469506,178,你是很漂亮啊,位女士很漂亮啊
469507,179,怎么能嫁给一名著长的证人那么这个长相和这个形象和这个骂人,怎么能嫁给叶宁这样长相的人呢？叶宁这个长相和这个形象和
469508,180,和那个感觉它怎么能嫁给他呢,和那个感觉，她怎么嫁给他呢？而
469509,181,而且好像是是爹和闺蜜的年龄的差距呀这个是有问题现在离开了,而且好像是爹和闺女的年龄的差距呀。这个是有问题，现在离开了
469510,182,这个月你还搞他,这个是有问题
469511,183,这是挺搞笑的估计呀业年同志啊黑大律师还有很多人会摇,这是挺搞笑的。 估计呀，叶宁同志，叶大律师，还有很多人会要
469512,184,要去纽约那个交易日报道了记住我两年前说的话有些人是16监狱的,"要去纽约那个监狱里去报到去了。

记住我两年前说的话，有些人是一定要"
469513,185,为什么月经监狱的熊宪民视,韦石他是一定要进监狱的。熊宪民
469514,186,郭宝胜你的护照即便离婚,郭宝胜你的护照，欺骗。李洪
469515,187,还有那梁冠军郑琦周晓,还有那梁冠军，郑祺，走著瞧
469516,188,还有的乱民标乱林彪这个骗子律师骗子真是骗子,还有这个乱伦彪，乱伦彪这个骗子，律师骗子，政治骗子
469517,189,招摇撞骗胡说八道什么搞人权乱*啊乱*这个乱*脸乱,招摇撞骗，胡说八道，什么搞人权。乱伦啊乱伦了，这个乱
469518,190,乱扔掉这个说我这个讲这个准确所以说是聊天就咱们老了,"乱伦彪。

所以我再给你们讲，这个昨天咱们老领导说"
469519,191,领导刷牙在香港你就不要管了现在你看到,领导说，哎呀香港你就不要管了，你管这干嘛啊？现
469520,192,先玩转了好多,香港乱得一塌糊
469521,193,香港是自作自受啊,香港是自作自受啊
469522,194,放的好日子不过,放的好日子不过
469523,195,竟然是现在在打着玩乱七八糟数美应控制,竟然是现在在这块乱七八糟，受美英控制
469524,196,说实在话现在占用了,说实在话，亲爱的战友
469525,197,你们听了这话你觉得他是胡说八道吗,你们听这话你们觉得他是胡说八道吗
469526,198,我告诉你有些真不是胡说八道他们真的闷响,我告诉你有些真不是胡说八道，他们真这么想
469527,199,因为他们根本没有想到香港人士,因为他们根本没有想到，香港人是
469528,200,要不,要被
469529,201,赋予共产党随时抓随时杀的权力而且合法,赋予共产党随时抓随时杀的权利，而且
469530,202,当一个城市,当一个城市
469531,203,可以让别人合法的随时抓谁是傻子说他提起了抗议,可以让别人合法的随时抓随时杀的时候，他提起来抗议
469532,204,他要的是自由,他要的是自由
469533,205,他要的是尊严就像我刚才跟我那个亲密的战友在聊天,"他要的是尊严。

就像刚才我跟我那亲密的战友聊天"
469534,206,他说他看了留言大陆的有人在这个房间里流也在留言说你看我不在家里吃了西瓜,他说他看到留言，大陆的有人在房间里留言，在留言说，你看我们在家里吃著西瓜
469535,207,看着电视看着香港的什么这些愤青在大街上赛的和喇叭的车灯,看著电视，看了香港什么这些愤青在大街上晒的呼啦啦的，在这
469536,208,他很愤他很愤怒,儿折腾。他很愤怒
469537,209,我告诉他我说这就是共产党,我告诉他，我说这就是共产党
469538,210,这个流氓这个政权最可怕的地方他本人洗了脑让你害我,这个流氓，这个政权最可怕的地方。他把人洗了脑，让你还无
469539,211,无知无觉,无知无觉
469540,212,这个孩子不二谁留言啊你吃那个西瓜绝大多数都是有毒的,这个孩子我不知道是谁，留言了，你吃那个西瓜，绝大多数都
469541,213,你在那个房子那个房子不是你的50年和70年产权,你在那个房子，那个房子不是你的，50年和70的产权，还
469542,214,他随时可以让你收拾收掉,产权，还随时可以收掉你
469543,215,你那个房子里住的老婆或者你住的是女儿会你住的妈妈你住的姐妹随时观察有权,你那个房子里住的老婆或你的女儿或你的妈妈或你的姐妹，随时共产党有权
469544,216,查理合法地玩弄她跟她上床可以跟他拍决定照,产党有权利合法的玩弄，可以和她上床，可以给她拍厥
469545,217,为我旁边还要配上,照，旁边还要给配上「文贵牌
469546,218,文贵牌商照,文贵牌香皂
469547,219,啊,皂」。
469548,220,你跟人家的差距你就没有全日上街上去说为了决赛去人家是有去,你跟人家的差距是，你就没有权利上街上去所谓的去晒去，人家是有
469549,221,权力上街去晒去你交波动,权利上街去晒去，你叫暴动
469550,222,奔驰在这了你可以吃西瓜你可以说话就西瓜你可以住这个不属于你的房子你可以做,"本质在这呢！

你可以吃西瓜呀，你可以吃花街西瓜呀，你可以住不属于你的房子，你可以住"
469551,223,你的不属于你的女人,一个不属于你的女人
469552,224,偷偷在厕所里哭的女人可是你敢上街吗,偷偷在厕所里哭的女人，可是你敢上街吗
469553,225,你不敢上街,你不敢上街
469554,226,悲剧呀,悲剧呀
469555,227,老领导一说图啥呀干什么都要涂什么吗这就是滚,老领导一说，图啥呀，干什么都要图什么吗？这就是共
469556,228,都有土猫,都有图谋
469557,229,我再告诉你我坐在给那位老领导说我你都侨美国会对你的关税不是,我再告诉你，我昨天给那位老领导说，你走著瞧，美国国会对你的关税不是
469558,230,我也不是25会更快的,也不是25%，会更夸
469559,231,我昨天说了21条了美国接下来的行动对你一系列的企业,我昨天说了那21条了，美国接下来的行动对你一系列的企业
469560,232,一切的官员,一切的官员
469561,233,到那里的为什么出台,到那时候你再问为什么
469562,234,前所未有发生的事情都会发生我两年前说的我一年前说的,前所未有发生的事情都会发生！我两年前说的，我一年前说的
469563,235,不是我预测,不是我预测
469564,236,2018年8月份的时候货币创造过一个数它是一个必然我有可靠,2018年8月份的时候说了，货币操纵国一定是你的，它是一个必然。我
469565,237,美国人早就受不了了,美国早就受不了了
469566,238,昨天差不多讲了一个非常好的话共产党就像在美国人身上,昨天川普总统讲了个非常好的话，共产党就像在美国人身上
469567,239,泡了个毛你往哪儿跑步都觉得你赚反正我就点了,抛了个锚，你往那儿跑，我都跟你转，反正我就吃定你了
469568,240,香港的事情让美国和欧洲感到真正的感到了威胁,香港的事情让美国和欧洲感到了真正的威胁
469569,241,害怕,害怕
469570,242,当然了现在还没有彻底台湾台湾有太多大陆人去的这种文化和学同乐,当然了现在还没有彻底台湾，台湾有太多大陆人去的这种文化和血统了
469571,243,太多诺夫角行了追很多不要脸的国民党是被突然打给消灭了给给弄成,太多懦夫侥幸了。所以很多不要脸的国民党，是被共产党给消灭了，给
469572,244,我说那个性得到了台湾去杠杆行为是把钱要回大陆过去了,行的，到了台湾去刚刚醒过来神儿，把钱又送回大陆给共产
469573,245,然后现在又开始人就在台湾了,然后现在又开始虐待台湾了
469574,246,台湾有发生明白过来的时候才更加不同但是美国人物受人明白了,台湾要发声明白过来的时候，才更加不同。但是美国人欧洲人明白了
469575,247,搞明白了这个事太可怕了,搞明白了，这个事太可怕了
469576,248,所以说,所以说
469577,249,川普都一直讲的话一切结束了,川普总统第一次讲这句话，一切结束了
469578,250,但是没注意到大家好好看看最近他在这几个演讲的是什么共产主义和社会,但是没注意到，大家好好看看最近他的这几个演讲，都说什么了，共产主义和社
469579,251,你对西方的威胁和资本主义价值观的不同和信仰的不同和意识形态的不同,义对西方的威胁，和资本主义价值观的不同，和信仰的不同，和意识形态的不
469580,252,共产党错误也分分别在不同的情况灭报小组和政法委和,共产党从5月份，分别在不同的情况，灭爆小组和政法委和
469581,253,和统战部,和统战部
469582,254,在欧洲美国英国见了很多人,在欧洲、美国、英国见了很多的
469583,255,不了巨大的局,布了巨大的局
469584,256,回去,回去
469585,257,跳博郭文贵和半农的关系,挑拨郭文贵和班农的关系
469586,258,1000万美元做它的分裂1000年,万美元，只要他俩分裂
469587,259,挑拨空为何你还能调的关系,挑拨郭文贵和班农的关系一千
469588,260,1000000美元,万美元
469589,261,小哲光贵调和工会和杨建利的关系什么美元贬义,"系一百万美元，

挑拨郭文贵和杨建利的关系十万美元"
469590,262,杨佳丽同志的价格现在降价了好久没签约奖励眼了,杨建利同志价格降价了，好久没见杨建利先生了
