id,index,content,proofed
572268,733,觉得这个力量就得使不完的感觉,人的智慧面前，这个时候不斗争
572269,734,祝你得看的共产党,最大的斗争。他们会非常
572270,735,正在思想努力的,争，暂时的停止就
572271,736,走向他的死亡的目标,外交上，他们将输的
572272,737,高兴得不行,港的同
572273,738,行啊然后听到咱们国内的账有过保证他这么组织了那么组织了哎呀我就我就兴奋的就,现在，花了几个小时给这个香港的同胞们战友们，这些说的话，我再说了一遍，这是我本人愚
572274,739,教导处,我再说
572275,740,老人都兴奋得不行,做梦梦来的信息和观
572276,741,杂乱,完全
572277,742,还要老想这个条子拌跟什么的啊,给这个香港的同胞们战友们，这
572278,743,因为他们正在疯狂,愚蠢无知的，完全是做梦梦来的
572279,744,疯狂是魔鬼死亡的必然要数,息和观点，你完全可以不听
572280,745,他们在王美国派大量的间谍和杀手,的，完全是做梦梦来的信息和观点，你完
572281,746,他往香港拍大量的间谍和杀手,点，你完全可以不听，但是你要觉得
572282,747,What网香港娱乐大量的机构尽管武器,的，完全是做梦梦来的信息和观点，你完全
572283,748,往台湾大量的备战,完全可以不听，但是
572284,749,然后到全世界大量的撒钱,无知的，完全是做梦梦来的信息
572285,750,那然后国内的经济,你要觉得我有用你就听
572286,751,处在崩溃的边缘现在别说吃猪猪蠢了出猪猪竟都吃不了,"觉得我有用你就听。好不好？



再说一句话，只要需要我们的法治基金，只"
572287,752,朱令的受不了,再说一句话
572288,753,现在,金，只
572289,754,国内综述吃牛肉了,用你就听。好不好
572290,755,你是假如的受不了,你就听。好不好
572291,756,而且国内的银行业务都一触即发,可以不听，但是你要觉得我有
572292,757,金融市场完全靠电脑,观点，你完全可以不听，但
572293,758,那你去想想,点，你完全
572294,759,美国这边区周信芳,全是做梦梦来的信息和
572295,760,各种围剿,再说了一遍
572296,761,你能听到那种,香港的同胞们战
572297,762,公公公的脚步声,给这个香港的同胞们
572298,763,你说他现在疯狂,息和观点，你完全可
572299,764,咱得跟他疯狂玩不能跟他疯狂,梦梦来的信息和观点，你完全可以不听，但
572300,765,香港的勇士们,信息和观点，你
572301,766,你们已经做到了顶天立地,但是你要觉得我有用你就听
572302,767,所有的美国欧洲朋友说香港的这些人一定要保护自己的安全,是做梦梦来的信息和观点，你完全可以不听，但是你要觉得我有用
572303,768,每个朋友我刚刚的,梦梦来的信息和观
572304,769,我这个这个只会前咱美国的几个朋友给我发了信息,我再说了一遍，这是我本人愚蠢无知的，完全是做梦梦来的信息和
572305,770,他说我在南卡罗纳州,话，我再说了一遍，这
572306,771,和基辛格先生机场战斗中,几个小时给这个香港的同胞们战
572307,772,但是说你能不能转达所有的香港同胞,全是做梦梦来的信息和观点，你完全可以不听
572308,773,让他们一定要注意安全,听，但是你要觉得我有用你
572309,774,我有个东西,我有用你
572310,775,信息和情报,信息和观
572311,776,各种行不行吧,是做梦梦来的信
572312,777,估量和香港只要这几天,息和观点，你完全可以不听，但
572313,778,非常的疯狂,梦来的信息和观
572314,779,让他们注意安全,和观点，你完全可以
572315,780,这个美国一定会出手但是那种网站是的出手那是不可能的,这是我本人愚蠢无知的，完全是做梦梦来的信息和观点
572316,781,那要等待一定的情况下,观点，你完全可以不听，但
572317,782,现在还是政治,需要我们的法治基金，只
572318,783,和外教程,还是那句
572319,784,下一步,力以赴
572320,785,等到他再次疯狂非常的疯狂疯狂,友们，千万啊，国内这几天已经全面开
572321,786,美国才有更多的,料革命的所有
572322,787,近距离的,信息了
572323,788,这个所谓的政治行,赵克志明确的在公
572324,789,和甚至是主任武装事情,部说，现在是一场网络战
572325,790,大家一定要记住,一场网络战
572326,791,这是美国欧洲关心香港同胞书,争绝对不能输。要求公检法所有人，包
572327,792,所有人的心愿,所有人，包括
572328,793,这是,争
572329,794,文贵第1次第1次向香港同胞们拜托了,个大陆现在武警部队、警察、公检法内，已
572330,795,保护勇士,包括武警
572331,796,让勇士们安全让他们休息,察、公检法内，已经全面进入
572332,797,给共产党在香港住了点当点时间,个大陆现在武警部队、警察、公检法内，已经全面
572333,798,然后等到国际上一起,万在国内的，文贵要求
572334,799,大踏步地走了1980年开始打结,的手机，在最近的这一段时
572335,800,大家过节了老鼠,再用国外的手
572336,801,你看这个华到了伦敦啥都不是,的这一段时间内，不要传播
572337,802,Topology场,不要传
572338,803,保利地产多狼狈,不要传播香港的
572339,804,我相信这对他一生的心灵的摧残,播香港的真相，你就不要碰你的
572340,805,你刚才干啥呀你好好说,战争，国内的战友、最好
572341,806,当耶律师外,党得意一段时
572342,807,你给我打完啥呀是不是,给他打太极吧，是不是
572343,808,接下来,击A，咱
572344,809,大陆,打
572345,810,大陆将有大事,就这当勇士
572346,811,对卡有大动作,点帮助都
572347,812,香港建有大人的灾难,加班加点，用用你的手指
572348,813,美国欧洲强大行动,用你的手指头，传播香
572349,814,一切都是刚刚开始,相，非常之关键
572350,815,亲爱的大,且大量
572351,816,现在为香港同胞14同胞,香港危机真相
572352,817,新疆台湾,信息战，我们
572353,818,西藏同胞祈福,息战，我们不
572354,819,阿弥陀佛,们所有
572355,820,啊,咱们
572356,821,爱你,外，希
572357,822,风行打老村小百合,非常之关键。这
572358,823,占的文法,战，我们
572359,824,文军玫瑰阿飞的,危机真相，非
572360,825,清凉法喜天气,相，而且大量
572361,826,Bad News这韩国的韩文吧应该是七雄啊,班加点，用用你的手指头，传播香港
572362,827,笑笑啊,而要加班
572363,828,这没有木兰传奇业绩能不能进来没来凤丸子矮围房四宝,真相，而且大量的传播英文的香港危机真相，非
572364,829,微信有也没骚扰了骚乱现在,海外，希望所有的郭媒体和咱们所
572365,830,听说杀了谈恋爱了,能输。在海外
572366,831,就说现在爱上了一个前官员骚扰现在,交战、信息战，我们不能输。在海外，希望所有
572367,832,部落穿起来了问题啊,量传播英文的信
572368,833,回来听说他来谈恋爱,加点在国外大量传播，来
572369,834,特别火现在,内战友们暂
572370,835,Sorry每天换装换两三次,大量传播，来弥补国内战友们暂时
572371,836,人家又要新婚了,亲爱的国内战友
572372,837,你说这饺子了么香港水深火热之中都想见你,你的使命，还有香港人民未来都会知道的。你现在最好
572373,838,小香老画画和光,现在俩手都上，越
572374,839,这是吗,这个眼
572375,840,火光都是好,都上，越多越好
572376,841,到火光东石林郑月娥,多手机，我要不戴那个防蓝光
572377,842,然后现在撒了再谈恋爱你说的战友,在那个法庭上，法官喜欢我的眼镜，哎呦
572378,843,战友之声听说要改成战友施加了这个好这个好,这眼镜太好了，从哪弄得？我说世界上独一无二，就这一个
572379,844,在有支撑啥时候能把这个变成所有的反共的战友之家,这样的眼镜，这眼镜太好了，从哪弄得？我说世界上独一无
572380,845,来了你这个人越快成长越好越快独立了好,来没有看到过这样的眼镜，这眼镜太好了
572381,846,这就是杀人要起到的,这一个，是我自己改造的。然
572382,847,报料还没到最关键的,官，我说你知道这个眼镜是
572383,848,爆料革命的黄埔军校,法官，我说你知道这个眼镜
572384,849,你要是起了69你要创造历史,法官，我说你知道这个眼镜是
572385,850,你谈恋爱不行,工，强奸犯
572386,851,哎呀现在就管他现在不敢动,笑坏了啊！他说你这样的人就要多见面
572387,852,现在把这个气泡式的过媒体的老问题交给他发了一跤连累了不能用了,强奸犯的马蕊，当时给我买的，太搞笑了，把他笑坏了啊！他说你这样的人就要
572388,853,没了这是发了干的谈恋爱的结果,了啊！他说你这样的人就要多见
572389,854,然后进入市现在天天吹就死了,啊！他说你这样的人就要多见面，他说
572390,855,在就业压力还没有机票是吧,！他说你这样的人就要多见面，他
572391,856,但是天天谈恋爱你咋弄你说,当时给我买的，太搞笑了，把他笑坏
572392,857,小刘文辉先生好战友登录服务分析牛,说你这样的人就要多见面，他说让我很
572393,858,王者,你这
572394,859,小皮家玫瑰啊,笑坏了啊
572395,860,紫微对老板说一下,笑坏了啊！他说你
572396,861,这几天爆料革命最大的收获,这样的人就要多见面，他说让我
572397,862,我在说咱们的新队长,松的、愉快的、享受着、战
572398,863,应先生,享受着
572399,864,他说不能因为这两年我没看我没时间,得使不完的感觉。就是你能看到共产
572400,865,他头几天抱着凉,内的战友给我爆料
572401,866,我可以上的担保,的死亡的目标
572402,867,下载,向他
572403,868,绝对是真的,觉得使不完的感
572404,869,因为这个我跟着人打交开场了一说话真牛绝对是真的绝对是真的,呦！现在我就觉得，觉得这个力量，觉得使不完的感觉。就是你能看到共产党正在
572405,870,这个一开始那个了不得了,这个力量，觉得使不完的
572406,871,引一开始,力量，觉得使
572407,872,李先生一上来爆料,向，努力的走向他的死亡的目标
572408,873,对党内的影响是,的感觉。就是你能看
572409,874,巨大的,觉得
572410,875,啊巨大了,觉得
572411,876,这绿江南六安堂六安钢厂,感觉。就是你能看到共产党
572412,877,这一上来开启了国内,这个力量，觉得使
572413,878,体制内的人,就是你能
572414,879,直接参给爆料这个是非常重要的而且是非常的专业,觉得这个力量，觉得使不完的感觉。就是你能看到共产党正在飞
572415,880,而且我觉得你先生说话非常可观,量，觉得使不完的感觉。就是你能看到
572416,881,非常真实,飞向，努力的
572417,882,我可以跟背书他讲的绝对是真实的,个力量，觉得使不完的感觉。就是你
572418,883,把这不是开玩笑,了，哎呦！现在我
572419,884,另外,量
572420,885,咱们就看到吧,亡的目标。哎呀！我
572421,886,从路德江这个坎开始马上到老将出来,共产党正在飞向，努力的走向他的死亡的
572422,887,不简单,不完的感
572423,888,论王红遍了一个人,不完的感觉。就是你能
572424,889,然后出去钢铁侠吧几又来一路桂英,力的走向他的死亡的目标。哎呀！我高兴
572425,890,如果应该没有听话啊,兴得不行，然后我听到咱
572426,891,我还没有听完,哎呦！我就兴奋
572427,892,这个这个我听了一部分但是我就有些部分他说的是,这么组织了，那么组织了，哎呦！我就兴奋的就
572428,893,非常非常准确,出汗，老是兴奋得
572429,894,把那不是我真不知道啊我要在学习上完说,老出汗，老是兴奋得不行。就觉得咋弄啊！哎呀！老
572430,895,但是不管如何入得先生还有所有的出来的人,奋的就，哎呦！脚老出汗，老是兴奋得不行。就觉得
572431,896,一定要学习应先生,想跳点探戈什
572432,897,爆料革命微真不错绝对是一个死,在往美国派大量的间谍和杀手
572433,898,你不要露得相信没那么火,量的备战，然后到全
572434,899,他只要感,大量的高
572435,900,只要改动一两次假的路灯下他消失了,港派大量的间谍和杀手，往香
572436,901,想要就然后70小时,"量的撒钱。



然后国"
572437,902,叙述小说的节目形态,"
然后国内的经济处在"
572438,903,突然间和段时间有点微米又被封了有啥子,国内的经济处在崩溃的边缘，现在别说
572439,904,但是吧,大量
572440,905,来了一个数据小哥还真像小哥是吧,量的间谍和杀手，往香港
572441,906,抱一个这几个视频的感觉太和了然后又有几个,们在往美国派大量的间谍和杀手，他往
572442,907,不同的战友上给他打电话给司觉得这个一下就火起来了非常非常的棒,"备战，然后到全世界大量的撒钱。



然后国内的经济处在崩溃的"
572443,908,然后现在该国媒体的近义词,然后国内的经济处在崩溃
572444,909,现在在西方影响太大了,济处在崩溃的边缘，现在别
572445,910,现在,现在
572446,911,我现在,现在
572447,912,你是真的发现,内的银行
572448,913,今日子在外国人看影响太大了这希望的欧洲的,"金融市场完全靠电脑，你去想想。



美国这"
572449,914,美国的政要都看了genius,美国这边，欧洲、西方，各
572450,915,我最担心的事搞的英文不行,欧洲、西方，各种围剿，你能
572451,916,给我一个英文不错,各种围剿，你能
572452,917,还能看得懂吧当然不是完美能看得懂得非常好,脚步声。你说他现在疯狂，咱能跟他疯狂吗
572453,918,味道,的脚
572454,919,没事说非常好非常好,的脚步声。你说他现在疯
572455,920,虽然现在还没有正式一点过没几个进入的,"
香港的勇士们，你们已经做到了顶天立地。所有的"
572456,921,金有什么网页现在就是撒上了原来保证好了啊,说，香港的这些人一定要保护自己的安全，每
572457,922,所以星期行2000进行就再也不行老师谈恋爱你这晚上没办法,播前，在美国的几个朋友给我发了信息，他说，我在南卡罗纳州和基辛格先
572458,923,所以说,是说
572459,924,至今日子虽然也像个半拖拉机把首付日变成了自动手拖拉机,在美国的几个朋友给我发了信息，他说，我在南卡罗纳州和基辛格先生一
572460,925,但是得到了国际上更多的影响,但是说，你能不能转达所有的香
572461,926,但是这个爆料革命现在进行真的是全民爆料,党在香港接下来这几天将非常的疯
572462,927,咱们这个入江潭路干潭路鞍钢缆,天将非常的疯狂，让他们注意安全
572463,928,然后是这个这个老隐隐潭然后呢是老尹一上了瘾先生之一,让他们注意安全，美国一定会出手。但是那种火战似的出手那是不可能的，那要等待
572464,929,都有上映movie,国才有更多的近
572465,930,然后呢我们迅思想跟他有几个专业数据和真相小说,让他疯狂疯狂，美国才有更多的近距离的，所谓的政治行
572466,931,天津大姐帮帮忙的一上来,面，下一步等到他再次疯狂。所以让
572467,932,还有我现在看到了,面，下一步等到他再
572468,933,特别特别的你看看,是不可能的，那要
572469,934,几个独立的媒体全起来了包括新加的我们应提的媒体呀,外交层面，下一步等到他再次疯狂。所以
572470,935,卡利息的先的访问,的情况下，现
572471,936,卡莉秀访问白页的那个节目做得太好了啊,治和外交层面，下一步等到他再
572472,937,还好这就看一下执着执着的精神用在了现实法当中赢了,还在政治和外交层面，下一步等到他再次疯狂。所以让
572473,938,我觉得白也讲得非常非常好,外交层面，下一步等到他再次疯
572474,939,不是一般的好,下一步等到
572475,940,然后呢我们现在这个面具先生面具我是面具先生,更多的近距离的，所谓的政治行动甚至是武装行
572476,941,啊这个讲得太好了,他再次疯狂。所
572477,942,这个面具,层面
572478,943,这个非常非常,政治和外交层
572479,944,所以形成了全面的,交层面，下一步等
572480,945,真实的爆料革命得到了全世界的关注,政治和外交层面，下一步等到
572481,946,这个区是太棒了玫瑰啊,政治和外交层面
572482,947,Tony接受你大声啊,是那种火战似的
572483,948,小皮匠,下，现在
572484,949,小皮的北京姑娘北京姑娘举手了吗子非常好我这跟他做这期节目以后谢,现在还在政治和外交层面，下一步等到他再次疯狂。所以让他疯狂疯狂，美国
572485,950,现在了,下一
572486,951,关入住多了几倍多了几倍,国才有更多的近距离的，所谓
572487,952,但是呢,动甚
572488,953,节目还要做什么亮点出来现在非常好很稳定,近距离的，所谓的政治行动甚至是武装行
572489,954,这个,政
572490,955,现在爆料革命在西方的影响我相信大家已经打没有人说反对意见了,心香港同胞所有人的心愿，这是文贵第一次向香港同胞们，拜
572491,956,是现在唤醒了西方列供的,士们安全，让他们休息。给共
572492,957,手臂的力量,贵第一次向
572493,958,唯一的力量,文贵第一次向
572494,959,我可以说自己天,们点时间
572495,960,我们开的各种秘密的会议,们点时间，然后等着国际
572496,961,各种领域每天都影响了最牛叉的人,给共产党在香港作恶给他们点时
572497,962,改变思路彻底灭苦,作恶给他们点时
572498,963,大家会不会看到,大街上，把这些过街
572499,964,你要这个,你看郑
572500,965,开会的时候我说你们家来,狈，我相信对她一生都是
572501,966,认识我的说9000的关注度,到了伦敦，她啥都不是
572502,967,现在你是吹得上11万,相信对她一生都是心
572503,968,另外的几个人不是你是5000现在都达到了8万到12万,在地上，倒在地上，多狼狈，我相信对她
572504,969,都以为你们的开始灭工吗对吧,在地上，多狼狈，我相信对
572505,970,这就是最真实的,生都是心灵的
572506,971,不要看我的关注度看你们的,有大事，对台湾有大动
572507,972,我接收这个,你的律师呗，你跟
572508,973,Recent releases这个采访,都是心灵的摧残，你干那
572509,974,郭文贵豆荚的英文说法,狈，我相信对她一生都
572510,975,1800000的,当你的
572511,976,关注度,干啥
572512,977,还有这不包含国内的给转发的不包含国外的这个这个复制转发的,大事，对台湾有大动作，香港将有大人道灾难，美国欧洲
572513,978,到现在我是那个,道灾难，美国
572514,979,儿子b.o.y.s那个访问最高访问量,香港将有大人道灾难，美国
572515,980,下次来还要改还要采访,下来大陆将有大事，对台湾有
572516,981,这个还要再做我没心情没时间,"始，



亲爱的战友们，现在为香"
572517,982,那没时间,亲爱的战
572518,983,大家就注意到,欧洲将有大
572519,984,是我们幻想的世界和西方列共的力量,的战友们，现在为香港14亿同胞，新疆
572520,985,他说不是黑手那我们就当黑手吧,"阿弥陀佛！



听说Sara谈恋爱了啊！听说"
572521,986,战友们,官员
572522,987,太阳已经从这边升起,听说现在爱上了一个前官
572523,988,哈哈正在同志们生气,听说现在爱上了一个前
572524,989,新中国的时代即将到来,听说现在爱上了
572525,990,谁都挡不住,说现在
572526,991,一切刚刚开始,一个前官员，听
572527,992,爱转角,火，现在Sa
572528,993,关机了,官
572529,994,我得赶快去开会,个前官员，听说
572530,995,说着说着人家说,水深火热
572531,996,我在这讲半老师你说这这多长时间,"ra在谈恋爱，你说这战友。



战友之声听说"
