id,index,content,proofed
571905,370,完全们来了也不是那种做梦也不是葡萄做梦,完全梦来的，也不是妈祖托梦，也不是菩萨托梦
571906,371,我这是,我这是
571907,372,稀里糊涂的做春梦,稀里糊涂的，做的春梦
571908,373,春分,春梦
571909,374,但是没梦想钥匙来啊,但是没梦见钥匙澜
571910,375,要是牙,钥匙杨
571911,376,梦绕的,梦！但
571912,377,啊大家中胡说八道,就当我胡说八道
571913,378,最后,最后
571914,379,迅速的把香港法借助快速的,迅速都把香港法进入快速
571915,380,这几乎是别人人都说我没想到这事能成,这几乎是，连他本人都说：“哎呀！我没想到这事儿能成
571916,381,没想到盛,没想到这
571917,382,那我先行一段时间但是这几个答应,在还得一段时间。但是这是一个大赢！”然
571918,383,然后赶快最近怕再有变数,然后，赶快推进怕再有变数
571919,384,马上睡觉,马上推进
571920,385,这对香港是,这对香港是
571921,386,革命性的变,革命性的变
571922,387,然后我现在在南卡罗纳州,然后，现在在南卡罗莱纳州
571923,388,在洛杉矶,在洛杉矶
571924,389,在旧金山,在旧金山
571925,390,昨天,昨天
571926,391,今天明天,今天、明天
571927,392,都有不同级别的高层的智库政治家,都有不同级别的高层的智库、政治家
571928,393,这样的论坛,这样的论坛
571929,394,所谓的知共派,所谓的“支共派
571930,395,叶红牌,共派
571931,396,反正在校媒体上的较量精力上的较量正在进行中,派”，正在参与媒体上的较量，经济上的较量正在进行中
571932,397,可以说过去两天,可以说过去两天
571933,398,这是一个最大的变化,这是一个最大的变化
571934,399,这是第2,这是第
571935,400,第3个香港,个，香港
571936,401,香港从过去的这个三四天,香港从过去的这个三四天
571937,402,本质性变化大家的中文大学能看到,本质性变化。大家在中文大学能看到
571938,403,支持中文大学的大家看到百家里程李嘉诚的百家,支持中文大学的，大家看到百佳，李嘉诚的百佳，李嘉诚
571939,404,李嘉诚的百家送你姐最起码19和车的视频,李嘉诚的百佳送进去最起码十几货车的
571940,405,二话不说来了,二话不说，来了
571941,406,最好吃的,最好吃的
571942,407,最好用的这个送给你,最好用的全给学生
571943,408,现今大马的吧,现金，大把大
571944,409,人的人送你根本用不完,人，那人送出去根本用不完
571945,410,这还有当年八九六四的时候只要是学生到任何地方,这很有当年八九六四的时候，只要是学生到任何地方，捐
571946,411,捐钱捐物打车酒店吃饭一点,捐钱、捐物、打车、酒店吃饭，一律免
571947,412,那是中国人最无会网最伟大的十个想起的人沸腾,那时中国最辉煌，最伟大的时候，想起都让人沸腾
571948,413,Doc,都
571949,414,你在柱北京你到河南在,你在北京，你到河南，在
571950,415,哈尔滨到这个北京的路上,哈尔滨到北京的路上
571951,416,你那时候只要是只是学生的里面费,你这是，只要是支持学生的，一律免费
571952,417,就连乐购方的手机店那如这么牛的说,就连那“沟帮子烧鸡店”那时候这么牛的
571953,418,把一个车开过来了直到北京支持这个学生来拿老,看这车开过来了，是到北京支持学生的，免费，拿
571954,419,但是读的时候你说,烧鸡店那时候多
571955,420,所以说现在香港达成是什么全民皆兵,所以说，现在香港达成了什么？——全民皆兵
571956,421,而且,而且
571957,422,四大不要脸,四大不要脸
571958,423,现在有本事了,现在有本质
571959,424,你不要看到张柏芝啥,你不要看那张柏芝推啥
571960,425,四大不要脸,四大不要脸
571961,426,圈钱的,，捐钱的
571962,427,唉你要支持了那是比原来多得多,暗底下支持的，那时比原来多得多
571963,428,某些家族也正真的开始来,某些家族也认真地开始来
571964,429,哈哈真正的明白的,真正地明白到
571965,430,还有一个大家看到郑若骅,还有一个大家看到，郑若骅
571966,431,在英国伦敦,在英国伦敦
571967,432,招收的当上就飞到了,遭受的，当场就摔倒了。
571968,433,郑若骅郑人你们可不知道,郑若骅这个人你们可不知道
571969,434,那是香港大律师,那是香港大律师
571970,435,师傅你看的长相,师出身，你看那长
571971,436,你看到time,你看那态
571972,437,你看他这里加收的都是英国不少啊,你看她，她和李家超那都是英国护照
571973,438,在,在
571974,439,他们认为自己交了在英国讲一口流利英文4226,他们认为自己骄傲的，在英国讲一口流利的英文
571975,440,饺子,骄傲
571976,441,英国英,英国讲
571977,442,啊段落伞吗,态度，你看她，她
571978,443,牛啊,你看
571979,444,讲个地道的英国应当是不是润物的奥夫的楼,伦敦遭受的，当场就摔倒了。郑若骅
571980,445,一说说话给唱歌的,受的，当场就摔倒了。郑
571981,446,特别角,可不知道
571982,447,大大雨中才会,当场就摔
571983,448,国际,国伦
571984,449,中海委员会,郑若骅在英
571985,450,是用我的,还有一个
571986,451,那个一向导分享了一点,你们可不知道，那是香港大律
571987,452,一点太差,李家超那
571988,453,把他请来了香港律政司长,港大律师出身，你看那长相
571989,454,结果是香港人民的愤怒发整个英国的下场,就摔倒了。郑若骅这个人你们可不知道，那是香港
571990,455,这个,这个
571991,456,英国就是咱们过媒体的顾问,英国伦敦遭受的，当
571992,457,还有我的下一个手续,还有一个大家看到，郑若
571993,458,给我打电话说boss,场就摔倒
571994,459,他说简直太不可思议了,态度，你看她，她和李家超
571995,460,他如果英国任何就领导人,傲的，在英国讲一口流利的英
571996,461,找到这样的围着这个愤怒,超那都是英国护照啊。在他们
571997,462,他说他140%,她和李家
571998,463,他没有脸在这,态度，你看她，她和李
571999,464,他是我很纳闷,师出身，你看
572000,465,这个,长
572001,466,特别像英国的香港的政策划,这个人你们可不知道，那是香港大
572002,467,他脸皮咋这么厚呢,她和李家超那都
572003,468,他还继续待在那,她，她和李家超那
572004,469,他说这种傲慢他私下里问真了吧,她和李家超那都是英国护照啊。在他们认为
572005,470,是香港人是怎么样,师出身，你看那长
572006,471,针对不同,郑若
572007,472,完全密闭式学生,们可不知道，那是香
572008,473,的是学生当然了他也迎来了英国的极大的反感,伦敦遭受的，当场就摔倒了。郑若骅这个人你
572009,474,他不是被共产党太可怕了,可不知道，那是香港大律
572010,475,他让我们原来认识症状啊呀,。郑若骅这个人你们可不知道，那是香
572011,476,跟现在的中华简直判若两人,个人你们可不知道，那是香港大律师出身
572012,477,他说着,骅这
572013,478,极为小张的疯狂,知道，那是香港
572014,479,而且对这个所谓的什么,骅这个人你们可不知道
572015,480,法制他是真的不在乎,摔倒了。郑若骅这个
572016,481,他认为共产党就是天下一切,态度，你看她，她和李家超那都是英
572017,482,权力是一切,讲一口流利的
572018,483,法制不重要,是英国护照
572019,484,大家可以看到从郑若骅,都是英国护照啊。在他们认
572020,485,以及美国加拿大澳大利亚,自己骄傲的，在英
572021,486,欧洲的所有的现在,超那都是英国护照啊
572022,487,行动公开声明,香港大律师出身，你看
572023,488,已经变成了全世界挺香港的,个人你们可不知道，那是香港大律师出身
572024,489,这个在一个程度的,郑若骅这个人你们
572025,490,一个村官方的,在英国伦敦遭
572026,491,这一个新的大好形势,真正地明白到。还
572027,492,所以说,敦遭受
572028,493,现在能看到啊,相，你看那态度
572029,494,共产党已经正式发包厢店,港大律师出身，你看那长相，你
572030,495,这是,和李
572031,496,第2,你
572032,497,整个美国现在是国家间的较量已经形成的向了绝对是官方支持,郑若骅这个人你们可不知道，那是香港大律师出身，你看那长相，你
572033,498,第3个,英
572034,499,整个香港这个官已经成了行程在全世界人人喊打的过街的老鼠,香港大律师出身，你看那长相，你看那态度，你看她，她和李家超那都是英国
572035,500,还是过节的母老鼠然后全世界,和李家超那都是英国护照
572036,501,这个公开的是挺香港四大不要脸也公开挺香港的,长相，你看那态度，你看她，她和李家超那都是英国
572037,502,这三个大火鸡,知道，那是
572038,503,但是我现在要给,大家看到，郑若
572039,504,香港的同胞战友们啊,香港大律师出身，你看那
572040,505,我发信息你们收到了那就收到了收到了5点10分我费点话,就摔倒了。郑若骅这个人你们可不知道，那是香港大律
572041,506,上我们胡说八道了,受的，当场就摔倒了
572042,507,我告诉大家,有一个大家看
572043,508,我本人建议,某些家族也
572044,509,香港中文大学你们已经往回撤了,当场就摔倒了。郑若骅这个人你们可
572045,510,我叫你所有的学校的学生,就摔倒了。郑若骅这个人你
572046,511,赶快爽,你看那长
572047,512,赶快说,港大律师
572048,513,能撤多远走多远能消食多安全多少钱,郑若骅在英国伦敦遭受的，当场就摔倒
572049,514,千万记住啊你离开学校你还是不完全,那长相，你看那态度，你看她，她和李家超
572050,515,共产党对你的脸,香港大律师出身，你看
572051,516,和你的手机和中文大学里面所有的人信息找我的本行,的，当场就摔倒了。郑若骅这个人你们可不知道，那是香
572052,517,这是一个国家的一个,都是英国护照
572053,518,国家权力呀,国讲一口
572054,519,你要一定要,英国讲一
572055,520,避免被摄像头取掉信息,们认为自己骄傲的，在英
572056,521,还有手机和家联络,和李家超那都是英国
572057,522,一定要长大安卫生纸,英国护照啊。在他们认为
572058,523,长的20支出比你这还重要,超那都是英国护照啊。在
572059,524,就是如何隐藏起来,家超那都是英
572060,525,不要被现在共产党的心理已经发动了,"傲的，在英国讲一口流利的英文，“Sir, h"
572061,526,就是提前的叫游击战,己骄傲的，在英国讲
572062,527,就是各个击破就是我说点抓3万人,"讲一口流利的英文，“Sir, how are you？Uh，wha"
572063,528,补充过去的5000到10000就要抓3万人,道的英国音啊，是不是啊？Rule of law，一说
572064,529,说现在3万人士,嗓子，“嗷”，牛啊，讲着
572065,530,必须要抓的否则香港子赢不了,ou？”她讲这英国音，端着嗓子，“嗷
572066,531,所以说在大陆新的又派了一批批的技术不对信息不对,啊，讲着那地道的英国音啊，是不是啊？Rule of law，一
572067,532,还有特殊的这个这个侦察部队,aw，一说这话跟唱歌似的，特别
572068,533,这是要包括可能啊,这话跟唱
572069,534,已经到达各种先进武器,讲着那地道的英国音
572070,535,就是要靠你啊,别骄傲，大
572071,536,Cold你个个拿掉,唱歌似的，特别骄
572072,537,然后,员会
572073,538,第2个香港的战友们建议,跟香港分享那一点儿
572074,539,为啥我说一下你没有车呢,委员会是英国唯
572075,540,你跟他挺你是挺不了的,会是英国唯一能跟香
572076,541,故长期下来收大楼收人烧车都会带着你身上,law，一说这话跟唱歌似的，特别骄傲，大律师，仲裁会。仲
572077,542,稍微缓一会让他尽情表演表演,享那一点儿，一点儿菜渣，把她请
572078,543,香港毕竟是香港人的相,香港分享那一点儿，一点儿
572079,544,你长得生活很正常,是香港人民的愤怒把整
572080,545,他打电话这种高压下危险一下,点儿，一点儿菜渣，把她请来了，香
572081,546,他会出更多的披露让敌人犯错,会是英国唯一能跟香港分
572082,547,是最高的精神境界最高的战斗战略和战术,说这话跟唱歌似的，特别骄傲，大律师，仲裁会
572083,548,让老板多因为转换做,不是啊？Rule of law，一说这话
572084,549,香港人会看到全世界会看到,香港分享那一点儿，一点儿菜
572085,550,在香港有更多的国际媒体,这个英国就是咱们郭媒体
572086,551,所以我第1次,说，“简直太
572087,552,我拜托了所有战友们,了！”他说，”如果英国任
572088,553,你们和老师我们所有的型号,果英国任何一位领导人，遭到
572089,554,你们健康,，他没有脸
572090,555,自有什么希望,英国的，香
572091,556,而且全世界的政治压力随之会跟上,国的，香港的郑若骅，她脸皮咋这么厚呢？她还继
572092,557,说你不想出了一个躲一躲,说，私下里问郑若骅，说
572093,558,安全的藏起来,完全蔑（视
572094,559,这是我有点意,这都是暴
572095,560,另外一个建议,迎来了英
572096,561,所有香港四大不要脸,视学生！当然啦，她也迎来
572097,562,四大不要脸你们要开始行动,我们原来认识的郑若骅呀，跟现
572098,563,能帮着孩子长大了就长大的力量起来,的郑若骅呀，跟现在的郑若骅简直判
572099,564,啊,在的
572100,565,常用于民,张和疯狂
572101,566,把这些勇士们藏在民间,认为共产党就是天下的一
572102,567,有些王八蛋开酒店的老板昨天跟我说,以及美国、加拿大、澳大利亚，欧洲的所有的现在行
572103,568,他是我的酒店都有都有摄像头都被警察给连接走了,郑若骅，以及美国、加拿大、澳大利亚，欧洲的所有的现在行
572104,569,我是唐不了,世界挺香
572105,570,我把它主动的那一顿,拿大、澳大利亚，欧洲的
572106,571,无论你就不能想办法,了全世界挺香
572107,572,稍后那边消防通道,说，现在能看到啊，共
572108,573,我又不是不懂是不是啊,"大好形势。



所以说，现"
572109,574,你用你的后勤电梯,已经形成了对香
572110,575,你把这个孩子送到某个房间,整个美国，现在是国家间的较
572111,576,完了吗房子在哪了,产党已经正
572112,577,他们找找你们家,正式拔刀相见
572113,578,关火,在是国
572114,579,这个这个,整个美
572115,580,像那个那个大屿山对不对呀,香港，绝对是官方
572116,581,海上那农村,还是过
572117,582,啊,老鼠
572118,583,那个那个旁边的地方,现在挺香港，四大不
572119,584,乡村把孩子们藏起来,香港，四大不要脸也
572120,585,老房子共产党,香港了。这三个大
572121,586,大象鸡蛋节车站,公开地现在挺
572122,587,把你们个个拿掉,港，四大不要脸也
572123,588,防止黑社会,全世界，这
572124,589,大彭国人老外门槛了,大不要脸也公开
572125,590,这是四大不要脸要充电这是我,"这三个大好局面。



但是，我现在要给"
572126,591,拜托了你们都不要脸东西,胞战友们，我发信息你们收到
572127,592,希望有认明星吃的香港人犯,香港的同胞战友们，我发信息你们
572128,593,和香港人的人找点良心,是，我现在要给香港的
572129,594,最后一个建议,在要给香
572130,595,香港的所有勇士的孩子们,香港的同胞战友们
572131,596,这个时候能撤离香港,公开挺香港了。这
572132,597,你也处理,你们收
572133,598,有任何需要的更跟我们房子给您跟我们联系,要给香港的同胞战友们，我发信息你们
572134,599,跟我们所有的你们知道的战友和我本人联系,给香港的同胞战友们，我发信息你们收到的
572135,600,我们能帮助的权利服,港的同胞战友们，我发信
572136,601,大全礼服,到的，那就
572137,602,全力以赴,战友
572138,603,现在要和共产党,现在要给香港
572139,604,打一回家,大好局面
572140,605,大,大
572141,606,大时间长,但是，我现在
572142,607,要打游击战,大不要脸
572143,608,最后,大好局
572144,609,政府在哪里,们，我发信息
572145,610,香港的楼上,香港的同胞
572146,611,香港的楼上,香港的同胞
572147,612,香港的路上,香港了。这三个
572148,613,一定是老百姓,四大不要脸也公开
572149,614,就是男要还能帮帮王八蛋的坦克打死了,"局面。



但是，我现在要给香港的同胞战"
572150,615,砸烂了,这三个
572151,616,选香港截屏都反应过来说,挺香港，四大不要脸也公开
572152,617,当大家的生命都遇到危险的时候,的同胞战友们，我发信息你们收到的，那就
572153,618,我告诉大家,我告诉大家
572154,619,当这个,港中
572155,620,最自己最久的疲劳是反过来的说,已经往回撤了，我建议所有学
572156,621,从此楼上扔下的尿盆怎么打死了,赶快撤！能撤多远撤多远，能消失得
572157,622,他拿导弹也没有东风41东风400都没用,能撤多远撤多远，能消失得多安
572158,623,啊,啊
572159,624,全部上的往来大家了,不安全。共产党对你的脸和
572160,625,而且当他们到处咋,产党对你的脸和
572161,626,点火的时候,脸和你的手
572162,627,全是一个香港大就没有没有所谓的暴徒,权力啊！一定要避免被摄像头取
572163,628,没有勇士拿自己玩的时候,你撤还重要，就是如何隐
572164,629,我告诉你,我说
572165,630,让她手淫死,人。说现在
572166,631,自语自娱自乐视,在又派了一批
572167,632,这帮人我告诉你,这是要包括可能已经
572168,633,到了香港啥东西,到达、各种先进
572169,634,什么都不是都是工具,殊的侦查部队，这是要包括可能已经
572170,635,在香港人的智慧面前,经到达、各种先进武器，就是
572171,636,这本书不读正,侦查部队，这
572172,637,暂时的停止就是最大的斗争,队、信息部队、还有特殊的侦
572173,638,他不会是会晤,息部队、还有特殊
572174,639,非常差,的侦查
572175,640,政治上,侦查部队，这是
572176,641,经济上,经到
572177,642,句容上,种先
572178,643,外交上,武器，就是要
572179,644,他们将输得一塌糊涂,友们建议：为啥我说
572180,645,所以说,啥我说
572181,646,我给昨天到现在这个只花了几个小时给你这个香港的同胞们战友们,我要跟香港的战友们建议：为啥我说要你们要撤呢，你跟他挺，你是挺不了的
572182,647,这些说的话我再说了一遍这是我本人,接下来，烧大楼、烧人、烧车，都会栽
572183,648,愚蠢无知的,缓一缓
572184,649,这个完全是梦做梦梦来的信息和观点,人的香港。你在那儿生活很正
572185,650,你完全可以不听啊,微缓一缓，让他尽
572186,651,但你要觉得我有一个问题究竟好不好,，都会栽赃到你身上，稍微
572187,652,再说一句话只要需要我们法治基金只要需要和媒体,烧车，都会栽赃到你身上，稍微缓一缓
572188,653,只要需要我们爆料革命支持的,高压下、危险下，他会出更多的
572189,654,请你们命令我们全力以赴之,香港。你在那儿生活很正
572190,655,还是那句话不好料革命的所有战友们,会出更多的纰漏。让敌人犯错是最高
572191,656,千万啊,险下，他
572192,657,这国内这几天已经全面开始,正常，他在那块儿高压下、危险下，他会
572193,658,我已经说过了我跟什么战友都发布信息了,出更多的纰漏。让敌人犯错是最
572194,659,国内现在,错香港
572195,660,新网,香
572196,661,闭嘴,界会
572197,662,网络控制网络搜索,我拜托了所有战友
572198,663,这个据说据我所知啊,们活着是我们所有
572199,664,赵克志明明确的在官不那么说现在是一场网络战争,政治压力随之会跟上去，所以你们先撤一撤、躲一躲，安全
572200,665,大在国内这场网络战争绝对不能输,，全世界的政治压力随之会跟上去，所以你们先
572201,666,要求公检法所有人包括武警部队全面的备战,上去，所以你们先撤一撤、躲一躲，安全的藏起来，这
572202,667,现在整个大陆现在不仅不利警察公检法律已经全面进入备战状态,香港四大不要脸，四大不要脸你们要开始行动，能帮这些孩子藏在哪儿的就
572203,668,首先第1个,始行动，能
572204,669,就是国内的网络控制,建议：所有香港四
572205,670,战友们你们千万条的国家文国要求你家是在国内你就不要再用国外的手,"这是我的一个建议。



另外一个建议：所有香港四大不要脸，四大不要脸你们"
572206,671,在最近的一段时间内不要传播香港的真相,在哪儿。把这些力量给藏起来，藏勇于民，把这些勇
572207,672,你就不要把你的所有手机关于海外的,板昨天给我说，他说我这酒店都有
572208,673,啊,他说
572209,674,一定要注意这是一场,于民，把这些勇士们藏
572210,675,准战争,说，他说我这
572211,676,国内的战友最好的战友真是的战友别说话,的老板昨天给我说，他说我这酒店都有摄
572212,677,雪沉默了一段时间,些勇士们藏在
572213,678,让共产党,些力量给藏
572214,679,得一段时间,蛋开酒店
572215,680,那,八
572216,681,对敌人麻痹敌人也是最高的战略之一,这酒店都有摄像头，都被警察给链接
572217,682,咱们经常也是得打太极吧是不是啊,开酒店的老板昨天给我说，他说我这酒
572218,683,指东打西,这酒店
572219,684,指东打西,这酒店
572220,685,这个这个说是是是攻击毙,把这些勇士们藏在民间
572221,686,说B的共节咱也得玩这个,都被警察给链接走了，我这
572222,687,你个傻乎乎的真的是在救治当勇士去了没用,店都有摄像头，都被警察给链接走了，我这藏
572223,688,一点帮助都没有,一顿，我说你就
572224,689,而且会大厦上海,把这些孩子送到
572225,690,这个数海外的战友们,这些孩子送到某个房
572226,691,反而要,哪儿找
572227,692,加班加点都用用你的手指的拥有手纸用手指头,包括像那个大屿山，对不对呀，还有像那个农
572228,693,船舶香港的危机真相,村、旁边的那些地方、乡
572229,694,而且大量的船舶英文的英文的香港B级真相,个农村、旁边的那些地方、乡村。把孩子们
572230,695,非常直观点,防止黑社会帮
572231,696,治肠胃有毒,这时候四大不
572232,697,信息但我们不能输在海外,巷击战、截击战，把你们
572233,698,希望所有的官媒体和咱们所有战友们,要出面，这是我拜托了啊！你们这不要脸的东
572234,699,加班加点,建议：香
572235,700,大量传播英文比英文文的这个信息有香港媒体,离香港你也撤离，你有任何需要的，跟我们法治基金，跟我们联系
572236,701,加班加点在国外大量传播来弥补国内战友们暂时休战,"全力以赴。



现在要和共产党打迂回战、打时间战、要打游击"
572237,702,休息的这个空空缺,在要和共产党打迂
572238,703,亲爱的国内战友们,联系，我们能帮助的全
572239,704,你们的应用把你的良心上天和你的使命,你们知道的战友和我本人联系，我们能帮
572240,705,还有香港人的未来都会知道的,战友和我本人联系，我们能帮助的全力
572241,706,你现在最好的办法就是停手,时间战、要打游击战。最后胜负
572242,707,求求你们了停手,就是拿尿盆能
572243,708,所有海外的干扰,过来的时候，当大家
572244,709,希望有限的拉手都是,险的时候，我告诉大家
572245,710,阅读要保护眼睛,拿导弹也没有，东
572246,711,我现在就根本不敢,下来的尿盆儿能把
572247,712,这个眼睛啊我每天都看看多少就我要不带那个防蓝光眼镜但绝对不行必须带,这几个疲劳劲儿反过来的时候。从楼上扔下来的尿盆儿能把他砸死了，他拿导弹也没有，东
572248,713,那必须的,点火的
572249,714,昨天在这个法庭上法官喜欢我的眼睛我从来没看了眼睛了眼睛太好了,"在大街上。



而且，当他们到处炸、点火的时候，让全世界看看，香港大街上"
572250,715,我世界上独一无二,己玩儿的时候，我告诉你，让
572251,716,注意可是我自己改造的,自娱自乐死。这帮人，我告诉你
572252,717,然后,让
572253,718,我告诉法官你知道我的眼睛是谁购买的吗,我告诉你，到了香港啥都不是，什么都
572254,719,这谁呀我说吗,这个时候不斗
572255,720,他妈的是谁呀,他们会非常
572256,721,不然就告诉我的员工强奸犯的马蕊当时给我买了,"金融上、外交上，他们将输的一塌糊涂。



所以说我给"
572257,722,太搞笑把他笑话了,天到现在，花了
572258,723,他说你这样的人他说,他们将输的一塌糊
572259,724,就要多见面他说让我很清楚,金融上、外交上，他们将输
572260,725,拥抱拥抱,同胞们战
572261,726,雍瓦,同胞
572262,727,谁说菜,这些说
572263,728,快乐了,花了几个
572264,729,轻松的,将输的
572265,730,愉快的享受的战斗,就是最大的斗争
572266,731,太快了,他们会非
572267,732,我现在我就觉得,停止就是最大
