id,index,content,proofed
6737,326,现在我就看到这个我的手机这么热泵得信息这个路过的信息,现在我就看到我的手机在那里蹦出这个信息，这个录播的信息
6738,327,你说重要信息我通话我不是什么信息要马上更换,是有重要信息！要我通话啊？我不知道什么信息要马上通话？这
6739,328,这是可能信号不好开个越来越厉害因为我在家用的不是微信玩翻微信WiFi的,边可能信号不好，骇客越来越厉害，因为我在家用的不是卫星Wi-Fi，卫星Wi-Fi的后
6740,329,有个机器我做完用的不是微信玩法,有个机器，我这回用的不是卫星Wi-F
6741,330,微软翻译的没有所以战友们,"点问题都没有。


所以战友们"
6742,331,这是一个伟大的女人,这是一个伟大的日
6743,332,玩别忘记小夏东方还有的所有的团队我们的付出,忘记小夏、东方和这个所有的团队为我们的付出
6744,333,我没更加冷静的要看看,我们更加冷静的要看看
6745,334,从2017年的419到2019年的419两年的时间,从2017年的4/19到2019年的4/19两年的时间
6746,335,我们改变了什么我们做到是什么,我们改变了什么？我们做到了什
6747,336,今天共产党最最恐惧的力量就是我们报了革命,今天共产党最最恐惧的力量就是我们爆料革命
6748,337,在西方最相信的,在西方最相信的
6749,338,最认为可能实现,最认为可能实现
6750,339,最烦恼的就是我们保留给面,惧的力量就是我们爆料革命！在西
6751,340,现在能和西方人也国家能让这人尊重和信任何愿意和作能谈合作了,现在能和西方这些国家能让这些人尊重和信任，还愿意合作，能谈合
6752,341,只用不了东西,只有我们爆料革
6753,342,无论过去两年发生了什么这就是事实,无论过去两年发生了什么，这就是事实
6754,343,真的假不了假的真不了要坚持我们的真上很一真打,真的假不了，假的真不了。要坚持我们的真善狠，以真打
6755,344,一单打字,以善打
6756,345,对待敌人一定要坚定要狠下心来决不妥协,对待敌人一定要坚定 ，要狠下心来，绝不妥协
6757,346,要有智慧要有勇气,要有智慧，要有勇气
6758,347,要有信仰般的信仰版的,要有信仰般的，信仰般的
6759,348,去实现我们的喜马拉雅,去实现我们的喜马拉雅
6760,349,让中国人,让中国人
6761,350,真正的独立了依法治国,真正的独立地依法治国
6762,351,一法性教信仰自由的这么一个,依法信教，信仰自由的这么一
6763,352,人人都能过上人的日子,人人都能过上人的日子
6764,353,成为世界的和平力量,成为世界的和平力量
6765,354,而不是像猪狗的过的日子,而不是像猪狗那个过的日子
6766,355,而不是让我们的父母都变成了杨改了,而不是让我们的父母都变成了杨改
6767,356,不能让一个个的律师被抓起了被小时,不能让一个个的律师被抓起来，被消失
6768,357,不能让一个个的有良心的知识分子呢,不能让一个个的有良心的知识分子
6769,358,都让他闭嘴,都让他闭嘴
6770,359,不能让新疆这200万人就这么关心了就拉倒,不能让新疆这200万人就这么关起来就拉倒；也
6771,360,也不能让洗澡下班以后这个天的事让人不知道,也不能让西藏人被杀完以后遮天蔽日，让人不知道
6772,361,我们的战友,我们的战友
6773,362,我们这些战友,我们这些战友
6774,363,是极少的一部分,是极少的一部分
6775,364,但已经创造了辉煌和历史,但已经创造了辉煌和历史
6776,365,已经开始了前所未有的伟大的,已经开始了前所未有的伟大的
6777,366,让中国人有了法治自由的革命,让中国人有了法治自由的革命
6778,367,无论发生什么,无论发生什么
6779,368,我们都不会听,我们都不会停
6780,369,我们停了也会有人上去,我们停了也会有人上去
6781,370,这是个,这是个
6782,371,大趋势不可逆转,大趋势，不可逆转
6783,372,今天,今天
6784,373,揭开中共的以黑治国,揭开中共的以黑治国
6785,374,已经治国,以警治国
6786,375,你看反弹,国、以贪反贪
6787,376,你太适合这个以贾志国,以贪治国、以假治国
6788,377,这个已经成了,这个已经成了
6789,378,世界上最伟大的最重要的这么一个运动,世界上最伟大的，最重要的一个运动
6790,379,我们所做的事情的这个事实和结果,我们所做的事情的事实和结果
6791,380,已经在影响着世界,已经在影响着世界
6792,381,我希望我的战友们,我希望我们的战友
6793,382,在自己安全,在自己安全
6794,383,不影响正常生活下,不影响正常生活下
6795,384,传国国宝亮,传播郭爆料，但
6796,385,但一定让你一定要让自己安全,但一定要在让自己安全和不影响
6797,386,可不要生我的情况下,响生活的情况下
6798,387,我们很多战友在过去的两年,我们很多战友在过去的两年
6799,388,被喝茶,被喝茶
6800,389,被判刑被抓被威胁被打,被判刑、被抓、被威胁、被打
6801,390,我在这不能一的说我说了我怕更加加剧你们的痛苦,我在这儿不能一一地说，我说了我怕这更加剧你们的痛苦
6802,391,但是我们,但是我们
6803,392,2020年灭共之后,2020年灭共之后
6804,393,一定是不会忘记一个账就不会抛弃一个战友,一定是不会忘记一个战友！不会抛弃一个战
6805,394,不会放弃一个端游,不会放弃一个战友
6806,395,爆料革命正在进入了关键关键的器,爆料革命正在进入了关键关键
6807,396,我们未来将用法治基金,我们未来将用法治基金
6808,397,和西方,和西方
6809,398,所有的政府以及各种设备机构进行全面的合作,所有的政府，以及各种社会机构进行全面的合作
6810,399,得到格雷的财富,盗国贼的财富
6811,400,好倒过来西方长一的财富,和盗国贼在西方藏匿的财富
6812,401,进行依法追缴还给中国人民,进行依法追缴，还给中国人民
6813,402,对到过女孩子的私生子女们,对盗国贼海外的私生子女们
6814,403,他们的犯罪行为但有一法检查重复,他们的犯罪行为咱要依法进行惩处
6815,404,揭发这些到过嘴海外藏有资产还有这些黑暗的力量,揭发这些盗国贼海外藏匿的资产，还有这些黑暗的力量
6816,405,要让中国人在得到实际上更多人的尊重和信任成为一个重要的和平力量,要让中国人得到世界上更多人的尊重和信任，成为一个重要的和平力量
6817,406,一定要推翻的极少数的极端人,一定要推翻这个极少数的极端人
6818,407,绑架式控制中国八千多万共产党,绑架和控制中国8000多万共产党员
6819,408,坚定的相信,坚定地相信
6820,409,绝大多数共产党都是好人都是为了生活,绝大多数共产党都是好人，都是为了生活
6821,410,推翻几个极端人士,推翻几个极端人士
6822,411,让中国在和平稳定非暴力的情况下有一个依法治,让中国在和平稳定非暴力的情况下，有一个依法治
6823,412,治国的真正的未来和现在,治国的真正的未来和现在
6824,413,让中国的孩子们不来打假疫苗而中国人民不再吃,让中国的孩子们不再打假疫苗，让中国人民不再吃
6825,414,化学食品家饰品,化学食品、假食品
6826,415,让这个社会不能堕落的,让这个社会不能堕落
6827,416,没有人的底线,没有人的底线
6828,417,All药革命,料革命
6829,418,在两年前,在两年前
6830,419,和今天的成就,和今天的成就
6831,420,相比之下结果就不用我说了,相比之下结果就不用我说了
6832,421,这是上天给我们的使命,这是上天给我们的使命
6833,422,在这里就必须是我,在这里就必须是无
6834,423,必须是无语你才能坚持到最后,必须是无欲， 你才能坚持到最后
6835,424,这里面,这里边
6836,425,可以让你发财可以算你升官,可以让你发财，可以让你升官
6837,426,但前提是这不能是目的,但前提是，这不能是目的
6838,427,那是在中国解放以后通过依法的渠道,那是在中国解放以后，通过依法的渠道
6839,428,作为中国公民你可以参与到那个伟大的政治进程中去,作为中国公民，你可以参与到那个伟大的政治进程中去
6840,429,郭文贵,郭文贵
6841,430,完成这人生的使命将消失的,完成这人生的使命后将消失
6842,431,人们的视野中,人们的视野中
6843,432,隐居深山与战友们,隐居深山，与战友们
6844,433,我没有,我们要
6845,434,听琴啊,听琴
6846,435,唱歌喝酒聊天散步,唱歌、喝酒、聊天、散步
6847,436,但愿为天能够更多的所有今天在视频中在看我什面战友们能,但愿这一天能够和更多的及所有今天在看视频的战友们能够一
6848,437,西乡店,起相见
6849,438,把酒言欢,把酒言欢
6850,439,我们一定会赢,我们一定会赢
6851,440,谁也挡不住,谁也挡不住
6852,441,没有人可以挡得住,没有人可以挡得住
6853,442,文贵的潘多拉盒子打开之日,文贵的潘多拉盒子打开之日
6854,443,就是他们灭亡之时,就是他们灭亡之时
6855,444,我最重要的事情就希望减少,我最重要的事情就希望减少
6856,445,对老百姓的伤害,对老百姓的伤害
6857,446,很间接的伤害,和间接的伤害
6858,447,尽可能的让中国创造一个人类上,尽可能的让中国创造一个人类上
6859,448,最重要的一个非暴力的革命,最重要的一个非暴力的革命
6860,449,就是饭,就是反
6861,450,共产党极少数绑架中国人民的,共产党的极少数，绑架中国人民的
6862,451,这些期权,这些集权
6863,452,和豆腐家族,和盗国家族
6864,453,这是我们唯一的目标,这是我们唯一的目标
6865,454,争取回国家的正当权利人民的正当权利,争取为国家的正当权利，人民的正当
6866,455,和依法治国的真实的自由,和依法治国的真实的自由
6867,456,这就是我们要的,这就是我们要的
6868,457,所有的今天我没有收到的,所有的、今天我没有说到的
6869,458,过去在这个两年理知识文贵爆料的战友们,过去在这两年里支持文贵爆料的战友们
6870,459,衷心的感谢,衷心地感谢
6871,460,一切都是刚刚开始,一切都是刚刚开始
6872,461,好了战友再见,好了，战友们，再见
